start,end,text
936.4000000000001,940.6400000000001," So basically with the last patch, it signifies a victory for one of the camps in the community"
940.6400000000001,945.6400000000001," where you've got these two factions that both expect different, each expects different things"
945.6400000000001,949.5600000000001, from how the game's supposed to play and basically one of them won the ones that wanted
949.5600000000001,953.84," really accurate weapons, they wanted their sick of air superiority and whatnot."
953.84,958.12," So they reversed all these things and it's interesting to see, you know, one group get their"
958.12,959.6800000000001, day and then the other deal with it now.
959.6800000000001,962.12, But so you can't please everybody.
962.12,963.12, You definitely can't.
963.12,964.12, You never can.
964.2,967.36," You know, I just just jumped them back on one thing though because I don't know."
967.36,972.88, I feel like I have to get props at least to epic and you'll be soft because they release
972.88,974.8, free expansion still.
974.8,980.24, I mean for Rainbow Six 3 and for Unreal 2004 we're still seeing mega packs all the time
980.24,984.36," come out or you know, a couple free maps and weapons and levels and whatnot."
984.36,986.88," Now, Phoebe Safka just loses Star Force though."
986.88,988.2," Well, they're working on it."
988.2,989.2, I hope.
989.2,991.0," An epic spin, just huge with them."
991.0,995.72," I mean, the size of the content you get, this just for an animal with their games."
995.72,1000.0, The other thing that's hard on Battlefield 2 is that you can complain about is that unlike
1000.0,1005.4," say, you know, a game based on an epic engine or valve source engine where users are creating"
1005.4,1007.16, tons of maps.
1007.16,1010.88," With Battlefield, users can, the assets are there and I mean, there are a number of good"
1010.88,1013.16, maps there but there's no way they distribute them.
1013.16,1017.04," Since they're not, they're not distributed on the EA download or you can't just join"
1017.04,1020.48, a server and have it auto load like you would with a Half Life 2 game.
1020.48,1024.48, So what happens is essentially these maps are there but there's no way no one will get
1024.48,1028.84, them because most people don't go Google searching new Battlefield 2 maps and then go through
1028.84,1030.04, the trouble of finding a server.
1030.04,1033.24, So I bet you got a locked in the buying their booster packs for new.
1033.24,1037.4," Well, I bet if you go to filefront.com, you could find all the or Battlefield 2 needs."
1037.4,1038.4, You could.
1038.4,1040.88, And then start making some servers to host a host man.
1040.88,1043.1200000000001, I am such a whore.
1043.1200000000001,1045.3600000000001," You are, but you're, we're, we're, we're cheap one."
1045.3600000000001,1046.3600000000001, That's right.
1046.7199999999998,1051.32," Ah, and how much time we have left to get into the, to the other topic for is that four"
1051.32,1052.32, minutes.
1052.32,1053.9599999999998," Wow, that's not a long time."
1053.9599999999998,1059.04," Oof, do we want to hold off on this other topic or so we mentioned it briefly?"
1059.04,1062.08," Let's just, let's just, let's try to tackle it and see what we can do."
1062.08,1063.08," Well, let's mention this briefly."
1063.08,1068.1599999999999," The other, the other topic is related to our opinions on games and it's the fact that the"
1068.1599999999999,1074.24," April issue just shipped with our, with our bold new direction, which is no stars on the"
1074.24,1075.24, ratings.
1075.24,1079.52, This was a conscious decision that we thought about a lot that were pretty serious about
1079.52,1087.2, and that were still pretty gung-ho on despite a small avalanche of mail and like I did last
1087.2,1088.2, week.
1088.2,1092.0, I'm going to read a letter because it's so fun to do.
1092.0,1093.8, Here we go.
1093.8,1095.8, Cloth.
1095.8,1101.1200000000001," I buy your magazine and PC gamer for one thing, the reviews."
1101.1200000000001,1103.76, I don't read the previous or the features.
1103.76,1104.76, That's great to hear.
1105.0,1109.52," I don't have a lot of spare time in my life, so reviews scores allow me to skip the"
1109.52,1114.08," trash and read only the reviews of good games, which then allows me to further whittle down"
1114.08,1117.0, the small number of games I have time to play.
1117.0,1122.24, Please refund my April issue as it is worthless to me without reviews scores.
1122.24,1127.36," If you plan to continue this in the future, cancel and refund the balance of my subscription."
1127.36,1130.0, Okay.
1130.0,1134.64, So he feels betrayed and so do a lot of other readers.
1134.64,1137.24, Be betrayed or disappointed or upset.
1137.24,1138.24, They want their score.
1138.24,1143.56," They want to still tell them that this game is, you know, I mean, our reviews still are"
1143.56,1144.56, reviews.
1144.56,1150.68," We still have opinions, but somehow a lot of readers are feeling their less useful without"
1150.68,1152.96, a number attached.
1152.96,1155.72, Because that would mean that I should have read the review.
1155.72,1156.72, God forbid.
1156.72,1157.72," Well, I think there's a lot more."
1157.72,1158.72," I mean, it's not like that."
1158.72,1164.16," And as a review said, it would take the past the duty to grind on the left hand side,"
1164.16,1165.16, even.
1165.16,1169.0," Well, with the April issue, it's kind of actually kind of misleading because we're"
1169.0,1173.64," building the no scores, being as sort of an April Fool's joke, but it's not really"
1173.64,1174.64, April Fool's joke.
1174.64,1175.64, We're going to keep doing it.
1175.64,1176.64, That was the joke.
1176.64,1178.64, That wasn't a joke.
1178.64,1179.64, Aren't weak leverage.
1179.64,1180.88, It's a thinker.
1180.88,1185.08, So you're going to start seeing a lot more changes with the May issue.
1185.08,1190.8799999999999, We're going to start doing sort of longer in-depth reviews on fewer games.
1190.8799999999999,1198.56, And what we're kind of trying to do is to encourage people to go to 1up.com to read
1198.56,1203.36, the score reviews on games and then come to CGW for a sort of bigger picture look at the
1203.36,1205.0, games they're covering there.
1205.0,1211.28," Also, you know, by saying that we want people to go to 1up.com, we're not saying we're"
1211.28,1212.28, passing the buck.
1212.28,1218.16, The fact is that the 1up.com review with a score is still our review.
1218.16,1219.16, It can be a lot of our writers.
1219.16,1222.6, It's going to be a lot of CGW writers and sometimes even us ourselves.
1222.6,1226.08, And we're just working really closely with them so that on day one when the game comes
1226.08,1229.12," out, you're going to see a timely review as opposed to waiting two or three months."
1229.12,1230.12, You want your score?
1230.12,1231.12, It'll be there for you.
1231.12,1232.12, Right.
1232.12,1236.92," Something else I'd point out to Rex, who wrote this, is that for someone like him who has"
1236.92,1240.36," so little time, this new system should work fine for him and that we're still giving"
1240.36,1245.4399999999998, editors choice awards when applicable.
1245.4399999999998,1251.08," So just by, if he's only got the time to read the very best game, it's in the play,"
1251.08,1252.08, the very best game.
1252.08,1255.9199999999998, That can be a guide right there in terms of us giving by.
1255.9199999999998,1260.6, We're still going to have those awards logos on the games that we really recommend.
1260.6,1264.52, I think basically a lot of people are complaining right now without knowing the whole picture.
1264.52,1266.8799999999999," Once they see the May issue, it's going to totally click with them and they're going"
1266.8799999999999,1267.8799999999999, to get it.
1268.0400000000002,1270.64," I mean, there's a lot more to it than just no score."
1270.64,1271.64, Right.
1271.64,1275.16," I mean, it's easy to latch on that because it's obviously a big deal."
1275.16,1280.5200000000002, But we are doing this in the context of a larger picture of how a monthly magazine can
1280.5200000000002,1285.64," work, you know, how, you know, if you're listening and you don't know this, we're basically"
1285.64,1290.88, writing these issues six to eight weeks before you see them.
1290.88,1297.0," So if we get a blivion today, for example, on March 19th, you're not going to be reading"
1297.08,1303.24," about it and reading our score until, you know, the June issue with this point."
1303.24,1304.24, Yeah.
1304.24,1310.12," And at this point with the internet, we have to ask ourselves what exactly is the point"
1310.12,1311.92, of doing that.
1311.92,1313.92, Amen.
1313.92,1321.32," And, you know, obviously we're not, we're not advocating the notion, you know, it's just"
1321.32,1328.56," that we have to think in terms of, okay, in by June, all the internet reviews are going"
1328.56,1329.56, to have been out.
1329.56,1334.56," You, the gamers have probably bought the game, played the game, and possibly even sold"
1334.56,1336.2, the game back already.
1336.2,1343.56, So we can't pretend that you've seen no opinions on it and don't have an opinion
1343.56,1344.96, yourself.
1344.96,1350.8799999999999," So the idea that we're trying to propagate with our may issue is, as Ryan said, is to"
1350.88,1356.68," sort of look take a big picture of it, that we're not going to just give you a review"
1356.68,1359.8400000000001, and pretend that this is in a vacuum.
1359.8400000000001,1363.92," We're trying to look at what is everybody saying about the game, what are the developers"
1363.92,1368.16," saying about the game that they've made, you know, in, as opposed more to them sort of"
1368.16,1373.68," way, what has happened to the game since it was released in terms of patches?"
1373.68,1375.0800000000002," I think that's the bottom only, too."
1375.0800000000002,1379.68," Instead of seeing it as you're getting less as, and you're not getting a score, really,"
1379.68,1382.76," you're getting so much more because you're not only getting our perspective, which"
1382.76,1386.44," will definitely still be there, but we're situating that perspective and the context"
1386.44,1391.2," of, you know, it's your saying Jeff, what the developers have to say after the fact,"
1391.2,1394.8," and not only what the other reviewers and, you know, review aggregate sites say, but what"
1394.8,1395.8, the community say.
1395.8,1396.8, Right.
1396.8,1399.2," So if it's a game like, you know, about to go back to that, since, you know, that's what's"
1399.2,1403.3200000000002," on my mind right now, you know, I'm able to look at all the key communities, you know,"
1403.3200000000002,1406.8400000000001," talk to people as I play with them, so ideally, you know, the reader, your voice is coming"
1406.84,1407.84, into play as well.
1407.84,1412.52," All right, we're hearing you and acknowledging that, you know, whatever we say about this,"
1412.52,1416.56," we can't get around the fact that, you know, that these things are there and that they're,"
1416.56,1418.48," you know, shaping the experience for people in different ways."
1418.48,1421.1999999999998," So I think that, you know, ideally, when you come away from this reading it, you're going"
1421.1999999999998,1427.28," to have a sense for just huge discussion that's still evolving around a game, and you'll,"
1427.28,1431.3999999999999," you'll have a much more well-developed perspective on it, and you're purchasing decision"
1431.3999999999999,1433.12, will be much better informed as well.
1433.12,1434.6," Well, or maybe we're just full of crap."
1435.52,1436.52, I don't know.
1436.52,1440.32," I mean, I, I, I talked to guys all the time and all walks of the industry and even like"
1440.32,1443.3999999999999," guys at competing magazines are saying that they're, they're wishing that they did the"
1443.3999999999999,1444.9599999999998, take the steps that we are.
1444.9599999999998,1445.9599999999998," So we're, I don't know."
1445.9599999999998,1446.9599999999998, We'll see.
1446.9599999999998,1449.9599999999998," We'll definitely see, you know, it's funny."
1449.9599999999998,1455.6799999999998," I had an email exchange with, with Johnny Wilson, who's some of you may know, as the,"
1455.6799999999998,1459.6399999999999," the former editor in chief of this magazine, way back in the day, he's the one who hired"
1459.6399999999999,1460.6399999999999, me.
1460.64,1468.96, And he was the editor in chief at the time in 1994 when C.G.W. added ratings in the old days
1468.96,1477.1200000000001," for, you know, the first, you know, in 1910, 12 years of this magazine, they were not scores"
1477.1200000000001,1478.4, on the reviews.
1478.4,1484.64," And after Zif Davis bought the magazine in around 94, they decided to add scores because"
1484.64,1487.2800000000002, that's what other competing publications were doing.
1487.28,1494.48," And there was a firestorm of, of a protest over regular mail and compia serve and other"
1494.48,1501.24," things back in, in those days because C.G.W. was perceived to selling out now for adding"
1501.24,1504.44, scores and for dumbing down the reviews by adding scores.
1504.44,1506.56, So now you didn't have to read it.
1506.56,1509.0, You could just look at that stupid number.
1509.0,1515.04, So now the initial email we're seeing back is that people want the scores.
1515.04,1521.6, So kind of an irony there in terms of what readers want or think they want.
1521.6,1526.2," Or possibly maybe the audience is just changing, you know?"
1526.2,1531.8799999999999," Maybe back then in 94, it was a different kind of crowd that could deal with out scores"
1531.8799999999999,1533.76, and now people need them.
1533.76,1535.32, Maybe it's just what people are used to.
1535.32,1538.08," Well, I think the critics are always the most vocal too."
1538.08,1541.8799999999999, Like I'm sure right now that PC gamers getting a still-brother getting low to mail about
1541.88,1545.8400000000001," their recent redesign in the same way that when I worked with Electronic Gaming Monthly,"
1545.8400000000001,1550.72," their redesign is a two years ago just brought in a deluge of just complaints, bitter"
1550.72,1555.16," angry, angry people and their forms, you know, same thing."
1555.16,1556.72, Maybe it's just that haters hate.
1556.72,1557.72, They're the old fates.
1557.72,1558.72, Exactly.
1558.72,1561.96, How are people writing when they're inspired because they're happy?
1561.96,1564.6000000000001," No, they just enjoy what they're reading."
1564.6000000000001,1569.2800000000002, Have you guys ever written a letter to the editor of any magazine like gaming or otherwise?
1569.2800000000002,1570.72, Usually when I'm angry.
1570.8,1571.72, Yeah.
1571.72,1572.72, No.
1572.72,1575.72, I always try to imagine what it takes to do that.
1575.72,1578.28, But what did Johnny say though?
1578.28,1579.28, His people?
1579.28,1581.6000000000001," Well, Johnny was laughing."
1581.6000000000001,1582.96, He was laughing at me.
1582.96,1584.6000000000001, It was basically that sort of Nelson.
1584.6000000000001,1585.6000000000001, Yeah.
1585.6000000000001,1587.04, Good luck with all that.
1587.04,1592.16," I mean, you know, and also interestingly, you know, he said that in a publication that"
1592.16,1598.3600000000001," he's working on, which I think is online, they are going to have a rating system because"
1598.36,1602.24, he just feels like it's kind of death to these days to not have one.
1602.24,1604.9599999999998," And he said, you know, thanks for proving my point."
1604.9599999999998,1609.4799999999998, So there you have it.
1609.4799999999998,1615.0," And we're getting a spinning finger from our, you know, same stop hammering."
1615.0,1616.9199999999998, The wrap it up box has been hit.
1616.9199999999998,1619.7199999999998, Do we have any final words?
1619.7199999999998,1621.9599999999998," Ryan, oh, Yoda won over there."
1621.9599999999998,1622.9599999999998, What?
1622.9599999999998,1623.9599999999998, The deadly silence.
1623.9599999999998,1624.9599999999998, I got nothing.
1624.9599999999998,1625.9599999999998, He's got nothing.
1626.04,1629.92, He's busy making the magazine folks.
1629.92,1632.76," If you like the, the May issues, I will work on it."
1632.76,1633.76, Yep.
1633.76,1634.76, You can get thank Ryan Scott.
1634.76,1636.32, Does he want to who wrote the whole thing up here?
1636.32,1637.32, Right.
1637.32,1639.32," Because we've all been playing sweet, sweet oblivion."
1639.32,1640.32, That's great.
1640.32,1643.04, We will see you again next week.
1643.04,1644.3600000000001, Thank you gentlemen.
1644.3600000000001,1648.52, And thank you for listening and we'll see you soon.
1648.52,1649.52, Bye.
1649.52,1650.52, Peace out.
