start,end,text
1228.72,1234.3999999999999," So your favorite game of all time yeah, it's up there. It's like a little sundog the frozen"
1235.76,1238.24, That's great got the mud that and X come
1239.68,1245.28," You know, don't forget X come you know what the thing is it like it's very hard dance of this question really"
1245.28,1249.04, It's like it kind of changes all it's like saying what you feel like having for breakfast this morning or whatever
1249.44,1254.32," Right, then whatever it is like in my case, which I think I'll decide along team fortress"
1254.96,1260.56, For this there's always gonna be tons and tons of stuff about it that you hate in the case of team fortress the big flaw
1260.96,1266.1599999999999, Is grenades spamming or basically that every class has so many types of grenades both primary and alternate
1266.6399999999999,1272.48, That you get these cases where everyone just runs out into the field and empties all their their resources and everyone just blows up and dies
1272.48,1277.36, But that aside in terms of I just spent years and years playing it
1277.84,1283.76, Just really learning the engine inside and out and and to the point where you know
1283.76,1289.04, Aside from the various modes that it introduced to multiplayer shooting in general even the side things like
1289.04,1292.0, Conk mapping which is essentially a platforming type
1292.4799999999998,1297.4399999999998, Activity where a medic takes his concussion grenade and performs leaps with that
1297.4399999999998,1301.28, But so map designers would make these big skill tests that are all based on that
1301.28,1303.36," I mean, there's just so much to that game so much variety"
1303.52,1305.52, There's versions of football within it
1305.84,1311.36," Basketball, you know all these different things so for my money is when it was free for me"
1311.36,1313.36, So definitely a team fortress
1314.4,1318.72," Yeah, it's a great game and at genre to go out and to the genre question there yeah, it's a"
1319.28,1326.96," Type I mean like there and I like you know stuff in all directions, but I'd be lying if I didn't say that the shooter single player multiplayer my forte my favorites"
1328.8,1334.0, I guess for me it's probably a fantasy RPG stuff the most but also shooters
1334.16,1337.68, I've played a lot of shooters favorite game of all time in fact might be doom
1338.4,1343.2," Might be because that was the first game that really just completely scared the bejeeza set of me, you know"
1343.2,1345.2, I had the headphones on late at night
1346.16,1351.28, You know just played that was the first time I really got lost in a game completely
1351.84,1360.0, You know which other people have experienced another 3D game since but that was the first one where I was really in the environment and when things would come at me from around the corner
1360.0,1362.0, It just scared me to death
1362.8,1366.88," I am easily scared, but that's that's another problem my second favorite game of all time"
1366.88,1368.48, I think is probably a
1368.48,1370.48, CSI
1370.8,1372.16, Three dimensions of murder
1373.52,1376.88, Because you know what it has all new 3D game play. I'm sorry
1377.44,1378.8, I'm making fun of that game
1378.8,1382.24," But no, seriously, I could answer that question differently in a matter"
1382.8,1384.8, Different week I might say
1384.8,1391.68, Warcraft 2 or heroes of might in magic 2 that was that was a brilliant game the old fantasy general is one of my all-time
1391.76,1396.88, Pavrets going way back that was a spin-off of Panzer general from
1397.76,1403.28," SSI I think it was that was their fantasy version so instead of tanks you had you know, I don't know"
1403.8400000000001,1405.8400000000001, Giant armadillos. I don't I don't remember now
1406.5600000000002,1409.44, I think they also had a really cool like road warrior one as well
1410.3200000000002,1413.6000000000001," SSI yeah, I can't remember what it was called but I ever played that one too"
1413.6000000000001,1419.44," All right, let us know out there if you remember the road warrior version of I year on crack. I am not a crack"
1419.68,1421.68," Well, I am a crack, but"
1422.0,1425.6000000000001, So I hope we answered your question Danish Viking throw in five before we get to you
1426.16,1433.04," For a second container and have like Battlefield 1942 probably I love that too. Yeah, that's a great game. That might be in my top 10"
1433.76,1438.16," Top 10 would be easier than best of all. Yeah, that's the problem with the number one"
1439.04,1441.04, Yeah
1441.04,1445.04," When you ask well the Warcraft that I've to put in my top 10 now. Yeah, I'm sorry"
1445.12,1452.3999999999999, I think we just we're more more skeptical about the stuff we're still playing sure daily basis now because we just want to let us stand up like I'm close
1453.44,1455.44, 400 hours in Battlefield 2 now and it's like a
1456.56,1462.0," Theoretically I'm sure you know down the road that'll definitely be 400 hours. Yeah, that's kind of scary"
1462.0,1465.36," I'm sure that's the fraction of your world of work hours, but I mean to give you that"
1466.32,1467.28, How much
1467.28,1472.32," Replay value you get out of some shooters, you know, it's definitely up there and I don't all get out side each month"
1472.56,1479.52, We do we do we do we all do that actually that does kind of segue nicely into the other question that we were gonna read today
1480.08,1482.48, Which comes from Jason who asked us
1483.2,1488.8799999999999, I wanted to know if any of you guys ever get into a retro mood and play past favorite games again or
1489.04,1493.2, Try out games you might have missed from years past or do you just stick with the latest titles
1494.0,1499.2, That was a good question. I mean a lot of the times we are stuck with the latest titles because we're reviewing them
1499.52,1503.3600000000001, And we and we want to stay current even if we're not reviewing them ourselves
1503.52,1507.1200000000001, We sort of need to know it's happening to be oh cool haul
1508.0800000000002,1513.68," Yeah, they say but do you guys ever like to fire up yield games for fun?"
1514.24,1515.2, Well
1515.2,1521.1200000000001, So long as they so long as they work in XP I guess a lot of tweaking it goes on with the event they work on the macOS
1521.1200000000001,1523.1200000000001, I bet
1523.1200000000001,1528.0800000000002," My my even old game is recent your guys books, but yeah still play team forters will play"
1528.6399999999999,1530.6399999999999, Or crap to
1530.6399999999999,1539.84, Go on and make it because of course the few people that still play are all gods so we'll just rig up some cheap cheap ass map and tell them that it's like massive gold and instead
1539.84,1541.84, We'll put like a dollar in each mine and
1542.6399999999999,1544.6399999999999, Get them pissed off real quick
1544.8799999999999,1546.1599999999999, We want something else
1546.1599999999999,1548.3999999999999, I find that some games just don't age at all
1548.56,1551.12, You know if they're not like shooter first person stuff
1551.4399999999998,1556.72, Where the where that 3D graphics were like the key thing to me it doesn't matter like when you're playing a
1556.8,1561.44, Siv sort of game you know I just reinstalled heroes of might magic three which is
1562.32,1566.96, What five years old or something and that is just as good to me as it was when it came out
1567.3600000000001,1569.92, Did you get a chance to play around the new command and conquer boxet?
1570.16,1572.4, I didn't know how is it?
1572.4,1578.48, I mean it did it kind of stands up. I mean it's not like because there's some full motion video in there isn't there the cutscene
1578.48,1583.28," I mean it's just the cutscenes. This is true. Yeah, just so we can see uh car you were again in action"
1583.92,1585.92, Oh
1586.0800000000002,1588.88, Made that all right Ryan you just played all right
1589.44,1594.0," You just played ultimate like a last month. Oh tomorrow online. Yeah, I still played that"
1594.5600000000002,1595.92," Yeah, that's not old"
1595.92,1600.16," That's series. Oh, it's still current though, right? I mean it's still live"
1600.88,1604.72," Well, are you playing a run-a-run uo server or I'm playing on a fan today? Yeah"
1604.72,1610.0, EA servers and there's nobody playing on those anymore and I reinstalled the oblo 2
1610.24,1613.04, Scott's favorite game and that completely held up
1613.52,1618.32," Yeah, actually I had a conversation with Robert Haren our HD TV analyst for PC mag and"
1618.8799999999999,1621.28, That's one of the things we brought up. I'm like oh
1622.3999999999999,1627.6, Battle battle nets still up and running and there's 100s and hundreds of hundreds of people still playing that game
1627.6,1633.12," They still have tournaments. Yeah, all the time my 13 year old nephew recently asked me for a copy of"
1634.3999999999999,1641.36," Of Starcraft. Oh my god, you know, he's 13. Yeah, I would have thought he would have had no interest or he maybe even no gonna was"
1642.24,1645.84," I love the concept of that game, but I am just horrible at that"
1647.6799999999998,1650.08, Management of it and I always get trumped
1650.8799999999999,1655.1999999999998," Yeah, you definitely got to bring your friends to that one yeah, yeah, I'll play against yeah, otherwise"
1655.1999999999998,1658.8, I mean it's like how much of what percentage of South Korea's economy is based on that
1660.1599999999999,1665.4399999999998," You know, you know, try to try to very carefully online when you look for competition that game and you vaguely Korean name"
1665.6,1668.8799999999999," Donn in two seconds. Yeah, that's how I win. I just changed my name"
1668.88,1671.7600000000002, No Korean sounding name and it just intimidates them in the quitting
1674.0800000000002,1677.1200000000001, It's like you do you see you do some really stupid move and like they think oh
1677.1200000000001,1681.1200000000001," There's you know some kind of secret exactly. Yeah, some you know secret Korean tactic"
1682.16,1684.16," Okay, that didn't sound too racist"
1684.72,1686.72, The Kobe Ashima rule well
1687.2800000000002,1692.0," Oh, she is so I think we're dancing to the question. Yes, huh? We all like playing old games"
1692.16,1695.5200000000002," You know, I actually and this is inspiring. I think I want to go like try to download a try to"
1695.76,1702.0," Download rather reinstall interstate 76. Oh, yeah, I totally want to get back into that. Okay, so that's it what what would be the one retro game?"
1702.0,1705.92, The old game you'd like to play right now if you had time we didn't have to finish this issue
1706.72,1710.8, Just something you haven't played or you've been meaning to play again. Sim city
1711.68,1715.92," Seems like the original original yeah, wow none of the sequels were any better"
1716.48,1720.72," That's always the best one. Yeah, I think I agree. They mess it up with the water"
1721.52,1723.52, The pipes the pipes the pipes under the ground
1724.4,1728.72," I need to play system shock to middle offend some people, but I still haven't played it. Oh, oh"
1728.72,1730.96," Man, that was a good. I was a great game. Yeah"
1732.08,1734.96," Damn well, I'm gonna stick with i76 only because I haven't played it"
1735.28,1738.6399999999999, Graphically it might have probably won't stand up but still I got it. I want to just check it out again
1739.12,1744.32," Scott, what would you go play right now if you have all the time in the world if I had all the time in the world"
1744.32,1746.32, I'd go play fear and actually finish it
1747.04,1752.32, I think I can get past like the first to act of it if I ever get back to it
1752.8799999999999,1759.4399999999998," Geez, you know at jokingly I first came that just popped into my head because I remember what going over your buddy's house"
1759.4399999999998,1761.4399999999998, And this was like in the mid 80s and
1762.1599999999999,1767.04, He he had leisure suit Larry and passionate patty up there and I was just I
1767.6799999999998,1771.84, I saw like three or four scenes of that and I just thought I was the funniest thing ever
1771.84,1774.72," Yeah, you know they have porn for free online now. Yeah, I know"
1777.28,1779.28, Just saying yeah
1779.84,1784.24, But I just I don't know it just hit me and just like oh man that was demanded stuff
1784.72,1788.3999999999999," I'd like to go back and see it. I don't know why okay, we're gonna leave Scott alone"
1788.8,1790.8," No, you know now that's over. That's a bad idea"
1791.36,1793.04, Mine might might be uh
1793.04,1796.32, Ultimately four maybe have it meaning to play one of those old ultimate again
1796.32,1802.8, Was that the one that's done introduced the whole conversation parcer like you'd like say keywords and I think so unless that was three
1803.2,1808.0," But now we'll find out from some angry reader sure well, maybe fall out again"
1808.96,1811.2, That was a great game that was a good game
1812.72,1816.96, So there you have it that's us that's CGW today
1820.16,1826.56, What's with us in the silence this late because this silence because I think you guys are still trying to feel out the whole process and
1826.56,1830.64, You know be able to fill in the gaps of each other and feel about the internet well
1831.44,1835.2, Don't ever send that picture out ever again. That's all I have to do readers. Yeah
1835.2,1840.32, Everyone do Google search for Google Google search for internet that's I and TER and a
1841.28,1843.04, UT he'll be our mascot
1843.04,1847.52, We're gonna get some language parent emails. Yeah if you're under 18 don't search for this safe
1847.52,1850.32," No, you can have you can have safe filter running. You'll still pick up the internet"
1851.2,1855.28," With the safe filter that photo still shows up. Yeah, he defies all okay"
1856.48,1861.92, There's kind of so because I just before the game down here for this I searched it to send the link around and it came up
1861.92,1863.92, And I've got safe search on one of my work
1864.4,1869.76," Okay, I'm just saying that photo had I believe it had hints of reproductive organs on there. Yeah, that's not"
1871.04,1877.28," Oh, I my brain painted those in yeah, he's a fly stick. I want it. He lights stick"
1878.24,1880.24, I'm gonna have my hair as forever
1880.88,1886.64," Okay, let's wrap it up. We're wrapping it up. We're hitting the flight stick jokes and now I don't let him know longer on group dinner"
1887.92,1891.76, Thanks for listening once again and we will see you next week. Bye
1892.3200000000002,1893.8400000000001, Love you
1893.92,1895.92, you
