start,end,text
0.0,7.0, Hello again this is Jeff Green the editor and chief of CGW.
7.0,11.0, I'm going to keep trying to come up with a different way of not doing that.
11.0,12.0, Hello.
12.0,14.0, But every time it comes up the same.
14.0,19.0, Anyway we're here for our first post E3 podcast.
19.0,24.0, And I'm here with the usual gang which starting to my left are.
24.0,25.0, Ryan Scott.
25.0,26.0, Sean Elliott.
26.0,28.0, Darreglesto Scott has no the engineer.
28.0,32.0, You know what I think we need is we need to theme song to this podcast totally.
32.0,36.0, Don't you think then I don't have to go hello and welcome every time.
36.0,39.0, Well actually you know you still will because you know the shoot.
39.0,43.0, Music will fade out and then you're going to be like nothing.
43.0,44.0, You're right.
44.0,45.0, Well how will we throw it out to the audience?
45.0,47.0, We can have them do a remake of you saying hello.
47.0,49.0," First of all,"
49.0,52.0, you should have a kind of like whoever like our listeners all three of them.
52.0,55.0, Then we'll like just pop up with the best like.
55.0,56.0, You got another one?
56.0,57.0, Exactly.
57.0,58.0, My mom's listening now.
58.0,59.0, Oh cool.
59.0,61.0, Hey we're up to the thousands now.
61.0,62.0, Swanard.
62.0,63.0, It's readers.
63.0,64.0, For listeners.
64.0,65.0, Aren't we?
65.0,66.0, Yeah we are.
66.0,67.0, Okay.
67.0,71.0, Yeah I got I think tonight at home I'm going to practice in the mirror some new like.
71.0,72.0, Hi.
72.0,73.0, No.
73.0,74.0, Different.
74.0,77.0, Or you know what what I tell other people is you know right out your open.
77.0,80.0, Yeah right out your clothes and actually like read it.
80.0,81.0, But you have to say hello.
81.0,82.0, I can't just start out.
82.0,84.0, We can write hello and then read it.
84.0,86.0, Alright John is saying move on.
86.0,90.0, We're going to talk about the podcast.
90.0,92.0, Alright we're going to start off.
92.0,100.0, We had the whole E3 thing gotten away of all of our gaming so now we're back was a normal week and I assume for many of us that meant playing games.
100.0,102.0, So what have we been playing?
102.0,103.0, Anyone?
103.0,105.0, Well I know what Ryan's been playing though.
105.0,107.0, Let him talk about it anyway.
107.0,108.0, Go ahead.
108.0,109.0, Get it over with.
109.0,110.0, Guild Wars factions.
110.0,112.0, You're wearing the T-shirt even though.
113.0,115.0, Oh God.
115.0,119.0, He has well aren't you the people playing the game he's wearing the shirt.
119.0,121.0, He killed the horses awesome.
121.0,122.0, I'm not doubting that.
122.0,124.0, This is a podcast paid for by NC so.
124.0,128.0, No it's still I'm about halfway through the factions campaign.
128.0,130.0, It's still really good.
130.0,136.0, I'm getting to the point where the two player factions can compete over control of an area.
136.0,140.0, So that's the next thing I got to get into NCL that works.
140.0,143.0, Can I see something about the scheme?
143.0,145.0, Because I started playing it and I was liking it.
145.0,153.0," But I noticed now that at the town exits like to go into the instances, there's all these like NPC dudes standing around that you can hire."
153.0,154.0, Right?
154.0,158.0, So does that mean I basically don't ever have to play it with other humans if I don't want to?
158.0,161.0, There are places in the game that you cannot get through in NPCs.
161.0,162.0, Damn it.
162.0,165.0, I mean there's I see humans.
165.0,167.0, Some of the some of the like the story missions.
167.0,168.0, Yeah.
168.0,173.0, Once you reach the mainland or just I mean maybe you could get through with NPCs if you're really good.
173.0,174.0, I am.
174.0,179.0, Well yeah I think you need the because I'm still playing the old one.
179.0,184.0, You yeah exactly you need this like okay do this do this because I don't really the NPCs just run in and just.
184.0,186.0, Sure you have no control over what those guys.
186.0,187.0, Right.
187.0,188.0, So yeah.
188.0,192.0, Okay so they're just to kind of help you out at the beginning part.
192.0,200.0, I mean anything that isn't like one of the big like heavy story missions you can generally kind of get through it in PCs.
200.0,201.0, Yeah.
201.0,204.0, But yeah you're going to you're going to need to make friends at some point.
204.0,205.0, Yeah.
205.0,207.0, Also can we officially stop calling this an MMO.
207.0,208.0, It's not.
208.0,210.0, How is this an MMO?
210.0,212.0, It's just Diablo basically.
212.0,213.0, Right.
213.0,214.0, But you walk through the chat room.
214.0,219.0, That's the different of MMOs that aren't in and see soft promotional hour.
219.0,221.0, It's been playing auto assault.
221.0,222.0, Yeah.
222.0,224.0, So first they want to be an MMO.
224.0,226.0, It's an MMO in structure and everything.
226.0,228.0, It's just not in player base.
228.0,234.0, So I think during peak hours they're hitting on the server and I'm on the most populated server which is called breakdown.
234.0,239.0, And I think it was like 240 players or something in 240 players.
239.0,240.0, Right.
240.0,241.0, And that was the three zeros at the end there.
241.0,242.0, No.
242.0,245.0, So you know we're going through this this world this ghost town.
245.0,246.0, We're shouting.
246.0,247.0, It's like a big pocket lineman.
247.0,248.0, We're not at all.
248.0,250.0, And we get like five different people.
250.0,252.0, Sometimes we'll be playing for hours and we'll run into a person.
252.0,253.0, It's crazy.
253.0,254.0, So we expect to find you here.
254.0,257.0, It's like all of a sudden you're playing Mario Brothers and someone pops up.
257.0,258.0, Does that add to like it?
258.0,261.0, Does that add to sort of like the post-capacaleptic feel?
261.0,263.0, You know that there's no one there.
263.0,264.0, It definitely does.
264.0,265.0," So I'm like, I can't see."
265.0,266.0, Like they do.
266.0,270.0, They decided to act and talk like they're living in a doomed world.
270.0,275.0," I mean, they're already talking about acting for pro rates for type of the rossum when that comes out."
275.0,279.0," But with the bottom line is, I kind of predicted that."
279.0,284.0, But now I feel I've kind of honed out that I did do that because I liked the game.
284.0,285.0, It's a fun MM.
285.0,287.0," Well, it's not your fault that people are."
287.0,288.0, It's all your fault.
288.0,289.0, It's not.
289.0,290.0," I mean, I just, yeah, I just saw it coming."
290.0,295.0, But it's actually a fun game because you know all the boring stuff that you associate with
295.0,299.0, MM was the walking here and there and the grinding and stuff because it plays like an action game.
299.0,303.0, It's actually entertaining and you can cross such a huge distance is so quickly in your car.
303.0,305.0, Randomly run over things.
305.0,307.0, It's a lot of fun.
307.0,309.0," I mean, the craftings a little broken though."
309.0,311.0, And I'm acting.
311.0,315.0," Yeah, there is some crafting that you build car parts and you do all this kind of like tweaking up your car."
315.0,316.0, I pretty much ignore all that.
316.0,317.0," I mean, I'm with Sean."
317.0,319.0, I'm on the breakdown server as well.
319.0,322.0, Maybe we should try to like have some kind of like massive fire flight at some point.
322.0,324.0," Yeah, see if you're playing, look us up on there."
324.0,332.0," We've, we're our, our clan is Mingo's Marauders named after Mingo, a random NPC wants us to go wipe out the"
332.0,336.0, populist of this canyon village and you go in there and it's nothing but a canyon filled with crates.
336.0,338.0, That's like some crazy crates that.
338.0,339.0, Yeah.
339.0,341.0," So we, we're like we're doing it."
341.0,344.0," We realize we probably killed a good, you know, five thousand these things these people."
344.0,346.0," And the kids are like, why are we doing this?"
346.0,347.0, Mingo said it.
347.0,349.0," Mingo just, let's a random guy out in the desert."
349.0,350.0," So we just were like, all right."
350.0,352.0," Well, but you guys really do like the game right?"
352.0,353.0, You're not.
353.0,354.0," It's, it's a lot of fun."
354.0,357.0," It's, it kind of has, it's just a straight up action game."
357.0,360.0," You, you, you, you, you take in jobs, you're shooting at things."
360.0,361.0," I, I, I'm serious."
361.0,363.0," I, I like, I mean, it's fun."
363.0,364.0, Have to fun.
364.0,367.0, I guess is kind of talking crap when you're playing and it's buggy.
367.0,369.0," It's, you know, a lot of stuff like that."
369.0,374.0," But also, sort of in its favor because they're so, maybe it's because there's so few players"
374.0,377.0, or NCSoft's custom or service is just really effective.
377.0,380.0," Anytime I've had a problem and I've, I've sent it into GM."
380.0,382.0, They've been there to help me right away.
382.0,384.0, They're probably just glad someone's helped.
384.0,385.0," Yeah, you did that extra attention."
385.0,387.0," But like I'm saying, yeah, it's a fun game."
387.0,391.0," I, I, I don't play so many, you know, straight MMOs because I, you know, I quickly"
391.0,394.0, tire of the grinding for the next thing.
394.0,398.0," But it's one where I'm still playing it, you know, week later and, and definitely enjoying"
398.0,399.0, it.
399.0,400.0, It's wish more people were there.
400.0,402.0," Now, I play with the gamepad or keyboard I'm else."
402.0,403.0, I play with keyboard mouse.
403.0,404.0, Yeah.
404.0,405.0, I do both.
405.0,406.0," It's actually, it actually works either way."
406.0,408.0, I feel bad for this game.
408.0,410.0, I think it's been hard to categorize.
410.0,413.0," And, and also it seems like it might be one of those games with benefit from a,"
413.0,415.0, a no monthly fee thing.
415.0,416.0, That's a huge part of it.
416.0,417.0," I think so yeah, like you lived there."
417.0,420.0, That's been the one main thing that's kept me out of D&D online.
420.0,422.0, This kept me out of World of Warcraft.
422.0,425.0," And all those are, it's like an extra 10 to 15 bucks a month."
425.0,426.0, Probably another thing.
426.0,427.0, Right.
427.0,429.0, You got a D&D online as a fact that it's crap.
429.0,432.0," But, well, that's not a small point."
432.0,438.0," Well, the one, the one trial time that I, that I did playing it, and the group that I was with"
438.0,440.0," is actually, you know, it's Lloyd's Friday night."
440.0,441.0, Follies.
441.0,442.0, Yeah.
442.0,443.0, That's a hip group.
443.0,444.0, Yeah.
444.0,447.0," So we're a bit, so I'll just mr."
447.0,448.0, I love you Lloyd.
448.0,449.0, Yeah.
449.0,450.0, I will explain that later.
450.0,452.0," But I mean, it was fun."
452.0,454.0, The interface was okay.
454.0,457.0, But it's not worth the extra 15 bucks a month to me.
457.0,458.0, It's really not.
458.0,459.0," Well, it's a big thing."
459.0,462.0," You're only going to be most people are going to be playing one, you know,"
462.0,464.0, MMO when it comes to that pay one monthly fee.
464.0,465.0, Yeah.
465.0,466.0," I think you had you in a mince, everybody."
466.0,469.0, You're the one that should get the 15 bucks.
469.0,471.0," You know, I should have done gun that route with it."
471.0,472.0," You know, the free."
472.0,473.0, Yeah.
473.0,476.0," And it's an instant and look, it wouldn't have mattered anyway, too,"
476.0,481.0," because anytime you're playing, you only run into five people anyway, which is still a good one."
481.0,483.0, Three shy of a guild or as party.
483.0,484.0, No.
484.0,490.0," But another thing about it, but others means that it's one of those MMOs that was trying something different."
490.0,491.0, We've called it before.
491.0,492.0, We've tried to make a mouse.
492.0,493.0, Yeah.
493.0,494.0, That's exactly what you know.
494.0,495.0, And CGW for the past months.
495.0,498.0," And we looked at, you know, what are some other options to get us out of the"
498.0,499.0, house?
499.0,500.0," You know, paradigm."
500.0,503.0," And it's a good example that, hey, it is possible."
503.0,505.0, But I don't know if it's going to prove physically possible.
505.0,508.0, Maybe people don't want out of the Gulf Goblin troll paradigm.
508.0,509.0, I don't know.
509.0,510.0, Are people ready for it?
510.0,512.0," I mean, how city of heroes doing?"
512.0,515.0," I mean, that was totally outside of the, that whole paradigm."
515.0,518.0," Well, that, but the city of heroes and silly, silly,"
518.0,521.0, city of villains is more still along the fantasy line.
521.0,522.0, That's true.
522.0,524.0, But it is different though.
524.0,526.0," I mean, because I mean, they're all when you look at it."
526.0,529.0," Like, uh, auto salt is essentially, you know,"
529.0,531.0, guild wars or whatever on wheels.
531.0,534.0," I mean, you have to put an engineer is your, is your major,"
534.0,535.0, your monk.
535.0,539.0," Your, your tank is an actual tank, you know, and it's like,"
539.0,543.0," basically, it follows the same, you know, the same format."
543.0,544.0, Yeah.
544.0,547.0," Well, maybe more people play."
547.0,549.0, What's the name of that server again?
549.0,550.0, Breakdown.
550.0,551.0, It's one of four.
551.0,553.0, It's the one that's low populated.
553.0,554.0," Right, right."
554.0,555.0, Very low.
555.0,556.0, That's very low.
556.0,557.0, Yeah.
557.0,559.0, It's actually tumble leads across the main screen as you're trying to
559.0,561.0," like, something, it was something like that."
561.0,564.0," If they want to pull people into the game, they should just make,"
564.0,565.0," make it, make it gratis."
565.0,566.0, Yeah.
566.0,569.0, Pay for this software and just let people go for it.
569.0,570.0, Right.
570.0,571.0," Well, they're probably, well, head that way, right."
571.0,574.0," Or at this point, all those four servers and collapse them in the"
574.0,575.0, ones.
575.0,579.0," So then we can, you know, have real battles running into people known then."
579.0,580.0, Yeah.
580.0,581.0," Well, I hope they'll stick around."
581.0,582.0, That's a fun game.
582.0,583.0, I like to see it grow.
583.0,584.0, That's for sure.
584.0,585.0, So we've also been playing the sin.
585.0,586.0, Definitely.
586.0,587.0, I've been playing a lot of sin.
587.0,588.0, How far do you help hard you get?
588.0,591.0, I guess I've passed the mutant boss battle.
591.0,595.0, The sin get better after the first minute that first opening cuts seeing what
595.0,598.0, the woman's breast is using your face there.
598.0,600.0," Oh, is it, it's, it's a little more subtle after that."
600.0,601.0, Yeah.
601.0,602.0, It is.
602.0,603.0, Okay.
603.0,604.0, It's just those first two moments.
604.0,605.0," You're like, yeah."
605.0,606.0, It was so much of an explain.
606.0,607.0," Like, my fiance is watching me play this game."
607.0,608.0, Yeah.
608.0,610.0," And like, of course, as the game starting and it's so hard to explain."
610.0,611.0," You see, this digitized woman in a bikini."
611.0,612.0," Like, just like, yeah."
612.0,617.0," I'm like, it's like the image comics, but you know, during the early 90s, image is changed"
617.0,619.0," and said, but it's definitely like of shooters."
619.0,620.0, It's the image comics of shooters.
620.0,632.0," You start off with the TNA and then the first thing you're carrying, the female character says is you're driving in a car to a guard is like, you know, hey, we're going to, you know, meet us at the corner of F and you or something like that."
632.0,633.0," Oh, yeah."
633.0,634.0," But, you know, that's edge."
634.0,635.0," Said, yeah."
635.0,636.0, Straight man.
636.0,637.0, It's kind of.
637.0,639.0, But it gets better after that.
640.0,642.0," But interestingly, there's a lot less story after that."
642.0,650.0," And this is one of my concerns with the game is that when, you know, we kept talking about is, is this a viable model, you know, episodic real, episodic content, right?"
650.0,652.0," And they, what are you paying for next?"
652.0,654.0," They needed, it was $20."
654.0,660.0," But of course, I think they needed to come out of the gate really strong with this because they need you to say, I have to come back and see what's next."
660.0,664.0," And you can't, you can't have any people there like, oh, I still haven't even finished the first episode."
664.0,665.0, Should I get the second one?
665.0,667.0, It has to get it to work.
667.0,668.0, You've got to be addicted.
668.0,673.0," And I think story is, and narrative is a great way to get people coming back, you know, leaving unanswered questions or what not."
673.0,682.0," But then as you start playing the game, the really isn't much there, you know, I mean, there's, there's stuff on the wall, there's cutscenes now and then."
682.0,685.0," But there's not really much of, you know, of a plot that I see."
685.0,690.0," It's a lot of shoes, you guys that come out that wear the same yellow and black jumpsuit."
690.0,693.0," Yeah, there's, there's different, you know, I agree with you."
693.0,697.0," I think it's a lot, a lot of the similar monster, you know, and bad guys you're going up against."
697.0,705.0," And the, and what's the story is kind of slow going, if you make it to the, the syn, the syn tech headquarters or whatever it is one of the places."
705.0,708.0," It's, it's so disposable to plot right now."
708.0,710.0, But there is a story there.
710.0,713.0," It's just, they're kind of stringing it out so far between."
713.0,714.0, Right.
714.0,717.0," And the thing is, I'm actually going through the trouble of exploring every nook and cranny of the game."
717.0,720.0, So I'm actually like stretching out the experience longer than most people.
720.0,727.0, I think I've been to I've been calling every single phone number looking in the controller and I'm not finding all I'm finding or one off gags.
727.0,728.0, Exactly.
728.0,736.0," I'm not finding any, you know, I'm not rifle, you know, if someone's cabinets and finding some backstory or file that lets me into the process like I was lead to believe what happened."
736.0,742.0," Or talking or calling my radio to talk to, to Jessica and other, you know, the other NPCs instead."
742.0,747.0," It's a lot of really funny gags like in one case, there's the one about extension x graphics tension expert right."
747.0,751.0," And you want to fill that in and what's the, you know, you know, you don't fill the joke though."
751.0,752.0, Okay.
752.0,753.0, All right.
753.0,754.0, We'll look for the number.
754.0,755.0, It's one 999.
755.0,758.0, What is the general synopsis for this game though?
758.0,760.0," You know, shoot stuff."
760.0,762.0," That's basically a three weapons, you shoot stuff."
762.0,763.0, Okay.
763.0,766.0, There's kind of an original take for a game.
766.0,769.0," It's some decent, you know, it's some decent AI and level design."
769.0,770.0, I like it.
770.0,772.0," Yeah, actually, I like the layout and it's good start."
772.0,774.0, But just I feel like there was more of a story that could have been there.
774.0,776.0," It's not phenomenal, you know."
776.0,777.0, Right.
777.0,780.0," What you said before about, you know, the needing the hooks to keep going to the next one."
780.0,784.0," I mean, that they need to learn from things like 24 or lost, right?"
784.0,787.0, Where you where it ends and you just can't wait to get to that next piece.
787.0,790.0," I mean, there's probably just like good enough writers on this game."
790.0,791.0, Yeah.
791.0,794.0," And it's what it's why I think I'm coming at it a little more skeptical than usual, you know,"
794.0,799.0, just because it's like I need to be that phenomenal to get us to come back.
799.0,800.0," The back, the back story is there."
800.0,802.0," I mean, it's not like they haven't done their homework."
802.0,804.0, It's just the thing is they didn't like put two and two together.
804.0,808.0," If you remember from like Doom 3 or half life 2, you can go anywhere in the world."
808.0,810.0, You can find these little elements.
810.0,814.0, Doom 3 was the PDA and they all this backstory stuff that filled in some blanks.
814.0,817.0," And then in half life 2 was like, you know, little,"
817.0,818.0, Q was in the world.
818.0,819.0, You can interact with.
819.0,821.0," And they just needed, they need more of that in this game."
821.0,822.0, Right.
822.0,826.0," And what what half life 2 is guy going for it when the episode comes out is it's got such a big,"
826.0,831.0," well known, it clearly defined over our question that's lingering."
831.0,833.0, Not only what happened since the last one.
833.0,839.0," They've already got us there, but also it's just, you know, you were still asking who the hell is this guy pulling the strings behind it."
839.0,841.0," And so I mean, I think that'll be a big help for them."
841.0,843.0," And if they play that off the right way,"
843.0,847.0," and you see, you know, you want to know what happened to dog and all these other characters from it."
847.0,850.0," And these are things that, sin at least, if you weren't, you know,"
850.0,854.0, die hard into the original game that came out back when it's not going to be with.
854.0,855.0, We was right.
855.0,856.0, 12 people.
856.0,858.0," I mean, who even remembers that game."
858.0,861.0," I remember the game, but I don't remember getting that hooked on it,"
861.0,865.0," but still, I don't want, I'm not going to put it on any spoilers out there."
865.0,868.0," And I'm, I think I'm getting close to the end of the first episode."
868.0,872.0," There is one point that could be a cool jump off for the next episode,"
872.0,874.0, just a matter of how they end this one.
874.0,878.0, Because it was already like the mutant boss you're talking about.
878.0,879.0, You fight him again.
879.0,880.0," Oh, great."
880.0,882.0," So it's like, let's rehash the same as that."
882.0,887.0," On the good side for it, I like jumping into it knowing that it wasn't going to be very long."
887.0,888.0," We talked about, right, the length."
888.0,891.0," And it was cool to say, like, I've got one day here."
891.0,894.0," I've got an afternoon and I don't have to jump into this and like, you know,"
894.0,895.0, like a oblivion.
895.0,897.0, I hear you about all this time to it.
897.0,901.0, Another thing quickly on that is the dynamic difficulty adjustment.
901.0,905.0, We're basically the game is looking at how well you're playing and ramping itself up according to that's nice.
905.0,909.0," At first, it was a little too steep because if you did a few head shots,"
909.0,911.0, it would come at you immediately.
911.0,912.0, And it was being possible.
912.0,914.0," They'd be pissed of sniping you from, you know,"
914.0,917.0," a thousand yards, but they patched it since then."
917.0,920.0, And I think it's really as one of the stronger features of the game.
920.0,921.0, How long is it?
921.0,923.0, I think people are saying that it's anywhere between six.
923.0,925.0," Yeah, six hours roughly."
925.0,927.0, Here here for shorter games.
927.0,928.0, But cheaper games too.
928.0,931.0," But yes, it's a price appropriately."
931.0,932.0, Yeah.
932.0,936.0, So I've been playing heroes five a week and here's a mitematic five.
936.0,940.0," And I'm liking it a lot better than four, which I thought was terrible."
940.0,944.0," But now I'm getting a little sourd, I have to say,"
944.0,946.0, because it's just not done.
946.0,948.0, This game needs a pillage.
948.0,949.0, Pretty bad.
949.0,950.0, Yeah.
950.0,956.0, Our contributing editor Matt Pekom was mentioning that it took him about seven hours before he was really getting into it.
956.0,959.0," Yeah, which seems like a, I don't know, I'm not used to that."
959.0,961.0," It seems like almost backwards, you know."
961.0,962.0, It's pretty steep.
962.0,965.0," And I got stuck at one mission that took me,"
966.0,971.0, I swear probably 15 to 20 hours to finish this one mission.
971.0,973.0, The map was huge.
973.0,976.0, That it was impossibly difficult on the normal setting.
976.0,979.0," And I thought maybe I'm just stupid or something, but actually went to the first form."
979.0,980.0, And that's the one mission.
980.0,984.0," You know how some games have a mission where everyone's just like, how the hell do I beat this mission?"
984.0,985.0, Right.
985.0,987.0, That's the one where I was glad that that was there.
987.0,993.0," But, but there's a like totally random, totally random stupid bugs."
993.0,996.0," Like, you know, you're, you're looking at your army."
996.0,1001.0," And this is like hard game to describe if you haven't played it, but you know, you have an army of characters."
1001.0,1005.0," And they're listed by number of units, you know, literally a number."
1005.0,1008.0, Like you have 84 goblins.
1008.0,1012.0," Well, there's a bug so that the numbers are off."
1012.0,1014.0, Once you start fighting.
1014.0,1016.0," But that's, that's key to the whole strategy."
1016.0,1017.0, Right.
1017.0,1021.0, Because I need to know I have 84 goblins going against whatever 64 steel.
1021.0,1023.0," But if you're like, you're right now."
1023.0,1025.0, I need to know how many goblins I have.
1025.0,1026.0, But you really do.
1026.0,1028.0," I mean, it kind of messes with the whole game."
1028.0,1031.0," If the numbers are wrong, it's all about the numbers."
1031.0,1033.0," So, I don't know."
1033.0,1034.0," Kind of, kind of unhappy there."
