start,end,text
1034.0,1037.0," I mean, was it pretty obvious that it was rushed out the doors and something like that?"
1037.0,1038.0," Well, that's what it makes you feel."
1038.0,1041.0," I mean, there's a post on the official form that the header is like,"
1041.0,1044.0, So what exactly did the play testers test?
1044.0,1046.0," You know, and that's exactly how I felt."
1046.0,1049.0," I mean, it was such a basic thing that's wrong."
1049.0,1051.0, It just makes you wonder.
1051.0,1053.0," Say, say, that's patch tomorrow."
1053.0,1055.0, What's your take on the game then?
1055.0,1057.0," If it's patched, I'm completely happy."
1057.0,1060.0," I mean, because I like it even with these annoyances."
1060.0,1063.0," You know, I can sort of remember in my head how many goblins I have."
1063.0,1065.0," You know, it's goblins."
1065.0,1066.0, But last night.
1066.0,1069.0, He actually has a goblin count.
1069.0,1071.0, I click so I'll be talking.
1071.0,1073.0, I just lost another 20.
1073.0,1074.0, Ready?
1074.0,1076.0," It's pretty, pretty."
1077.0,1079.0," Okay, so let's move on from that."
1079.0,1082.0, I know Ryan wants to talk about lost.
1082.0,1084.0, We got the official announcement today.
1084.0,1085.0, Was it?
1085.0,1086.0, Yep.
1086.0,1091.0, That Ubisoft's snatched up the license for a lost video game.
1091.0,1094.0, And we know how many people are watching that show right now.
1094.0,1096.0, Have the world this?
1096.0,1097.0, Have the world.
1097.0,1101.0," So not a bad move on their part, but will the game be any good?"
1101.0,1104.0, I have a lot of people watching the game.
1104.0,1107.0, I think they got the CSI three three dimensions of murder.
1107.0,1110.0," Okay, can we think of one TV show that turned into a good game?"
1110.0,1112.0, Desperate housewives.
1112.0,1114.0," No, it's enough."
1114.0,1115.0, And that's not out yet.
1115.0,1116.0, Don't laugh.
1116.0,1117.0, It could be good.
1117.0,1118.0, That's true.
1118.0,1120.0, I don't know if there's any precedent for a good.
1120.0,1121.0," Well, 24."
1121.0,1122.0, 24.
1122.0,1123.0, Good reviews.
1123.0,1124.0, I think it's getting like seven.
1124.0,1125.0, It's pretty average kind of stuff.
1125.0,1126.0, It was all right.
1126.0,1128.0, What do you think Ryan?
1128.0,1129.0, I don't know.
1129.0,1132.0, I'm having terrible visions of the ER game.
1132.0,1135.0," Well, the only saving grace for me here is that it's you be Montreal."
1135.0,1136.0, They don't make crap.
1136.0,1137.0, At least not generally.
1137.0,1138.0, Not usually.
1138.0,1139.0," So what would you, yeah?"
1139.0,1142.0, I want to know there's so many questions about the game in tail.
1142.0,1143.0, Right.
1143.0,1147.0, If it's not getting the duct tape in the cat hair to rub together and do this or
1147.0,1148.0, Right.
1148.0,1149.0," You know, to get through the gate."
1149.0,1150.0," Oh, so you play Gabriel might as well."
1150.0,1151.0, Yeah.
1151.0,1153.0, That was a great night.
1153.0,1154.0, Three wasn't it?
1154.0,1155.0, It's a tape.
1155.0,1156.0, It's a tape.
1156.0,1157.0," No, to lose."
1157.0,1158.0, You had to make glue to make the fake.
1158.0,1159.0, It makes it a fun.
1159.0,1161.0, I thought you used syrup syrup.
1161.0,1162.0, That's what it was.
1162.0,1163.0, It's a hair.
1163.0,1164.0, It's gone.
1164.0,1169.0," But why I was talking with one of one of one of the guys earlier today and he was like,"
1169.0,1170.0," You know, what are you going to do?"
1170.0,1173.0, Just like see something weird and then not tell one of the NPCs about it.
1173.0,1176.0," Well, you want to the regular like sweat hogs."
1176.0,1180.0," You know, one of the main characters or you like the bat one of those background guys."
1180.0,1181.0, I think it'd be cool.
1181.0,1182.0," Yeah, if you were just like plainly."
1182.0,1183.0, I don't know.
1183.0,1184.0, Maybe I survived.
1184.0,1185.0, Yeah.
1185.0,1186.0," Dude, I would be hurley."
1186.0,1187.0, Who would you want to be?
1187.0,1188.0, If you got to be one of those guys.
1188.0,1189.0, That's how you guys are.
1189.0,1190.0, Hurley.
1190.0,1191.0, Hurley.
1191.0,1192.0, You'd want to be hurley.
1192.0,1193.0, That's who they all think we are.
1193.0,1195.0, I mean gamers are all right.
1195.0,1197.0, I probably want to be lock.
1197.0,1198.0, You want to be what's her name?
1198.0,1199.0, The DUI girl.
1199.0,1201.0, I got a red riggas.
1201.0,1203.0, Big big killed her on the show.
1203.0,1204.0," Oh, wait."
1204.0,1205.0, This is boy.
1205.0,1206.0," Dude, come on."
1206.0,1207.0," Okay, that was two weeks ago."
1207.0,1208.0," I guess it's, I guess it's fair."
1208.0,1209.0, Yeah.
1209.0,1210.0, Yeah.
1210.0,1211.0, I'd want to go echo.
1211.0,1214.0," You know, tap your inner soul man."
1214.0,1215.0, Mm-hmm.
1215.0,1216.0," Yes, it were."
1216.0,1217.0, Or lock.
1217.0,1221.0," I mean, I mean, I'd be like, you guys, you guys, some additional, you know,"
1221.0,1222.0, peats to the puzzle that can get.
1222.0,1225.0, Probably what everybody's going to be hoping for.
1225.0,1226.0, But they won't.
1226.0,1228.0," Complaining at the same time, too."
1228.0,1231.0," I mean, because it's just like you've got to buy, yeah."
1231.0,1234.0, Infinite crisis tie at number 47.
1234.0,1235.0, They won't do that.
1235.0,1237.0," The last people, I don't know if you guys are reading"
1237.0,1240.0, the last ones of the people who watch the show are pretty obsessed.
1240.0,1242.0," Well, they're selling something novel."
1242.0,1243.0, That's a tie in and it's right.
1243.0,1244.0, Yeah.
1244.0,1245.0, They have to read the name.
1245.0,1248.0," I mean, is it called or, but evil twin, I forget what it's called."
1248.0,1250.0," Yeah, but how does that tie in those?"
1250.0,1253.0," Like, are you missing something if you don't read the book?"
1253.0,1254.0, Apparently not.
1254.0,1258.0," So, I mean, hopefully they followed the same kind of theory with the, with the, with the game."
1258.0,1263.0," The novel, it's something that was like, that it's a manuscript that's found on the plane"
1263.0,1265.0, on in the TV show.
1265.0,1266.0, And hurley's reading the manuscript.
1266.0,1270.0, And so now they're selling that book as a novel in real life.
1270.0,1274.0," And apparently in that novel, they have these sort of like cutesy references"
1274.0,1278.0," like one of the characters, Manson's John Locke, the philosopher, which is of course,"
1278.0,1280.0, an email into the main characters on the show.
1280.0,1282.0," So they sort of have these, ah ha!"
1282.0,1284.0, That's just like on the TV show moments.
1284.0,1286.0, For those who are stupid enough to buy the book.
1286.0,1290.0," When they're using their goblin counter, they're a lot of other books in the show"
1290.0,1294.0," that like, they'll show them in the show and people will go out and buy them"
1294.0,1297.0, just because they're hoping they can get a clue by reading the book that was
1297.0,1298.0, mentioned in the show.
1298.0,1299.0, Right.
1299.0,1302.0," I had to the precedent here, probably not good."
1302.0,1306.0," I mean, just if you look at the history here of TV shows as games."
1306.0,1308.0, But maybe this one will be different.
1308.0,1310.0," I don't know, Ryan will buy it."
1310.0,1316.0," By the way, can we mention the fact that because Ryan sitting here, I didn't actually shoot Ryan."
1316.0,1319.0, Because I'm really needing to be said.
1319.0,1325.0," Because we did that as a sort of joke promo piece for other podcasts, and I guess a few people"
1325.0,1326.0, out there were offended.
1326.0,1328.0," Yeah, to the guy that sent us that email, it's okay."
1328.0,1330.0, I'm still alive.
1331.0,1332.0, Help him.
1332.0,1334.0," What do you say, Scott?"
1334.0,1336.0, I'm just shocked.
1336.0,1338.0, I'm honestly shocked.
1338.0,1339.0, Yeah.
1339.0,1341.0, Was it one person was just that one dude?
1341.0,1343.0," As far as I know it's just that one dude, you never know."
1343.0,1346.0," I mean, it could be like, oh, I'm never going to listen to this again."
1346.0,1347.0, Because they're going to kill people.
1347.0,1349.0," And it's like, oh, please, people get over it."
1349.0,1351.0, It's a gag.
1353.0,1354.0, Okay.
1354.0,1356.0," So, I was a bit of art for that."
1356.0,1360.0," Yeah, we've got all sorts of cool, fun gadgets at CGW lately."
1360.0,1362.0," That's always, that's always a good time."
1362.0,1364.0, What little toys have you guys been getting?
1364.0,1367.0," Well, it's kind of offshoots from being at E3."
1367.0,1370.0, We got a chance to sneak in through Kenshin Hall.
1370.0,1371.0, You always see some cool stuff.
1371.0,1375.0," Now, I know Sean was hooked on the, was it the gaming mouse too?"
1375.0,1377.0, And with not the frag pedals that came with it.
1377.0,1378.0, It's the gaming mouse.
1378.0,1379.0, The gaming mouse.
1379.0,1382.0," And then, first off, I'm going to talk about it."
1382.0,1383.0, I thought we were going to talk about it.
1383.0,1385.0," No, I was going to say the best for that."
1385.0,1387.0," So, the game that no one felt about it."
1387.0,1388.0, That's the how to control it.
1388.0,1391.0," So, the gaming mouse, to mouse, design for gaming."
1391.0,1397.0," But, I know, it's basically rather than, you know, the usual way that a mouse works where you're moving your wrist and your arm."
1397.0,1399.0, All you're moving are your fingers.
1399.0,1400.0, It's a small round thing.
1400.0,1402.0, You hold between your thumb and forefinger.
1402.0,1404.0," And so, it's very sensitive."
1404.0,1405.0, The slightest movement.
1405.0,1407.0," It's like a hockey puck size, right?"
1407.0,1408.0, Just really.
1408.0,1409.0, That makes it sound bad.
1409.0,1410.0," That makes it, no, it's smaller than that."
1410.0,1413.0," That makes it sound like the Mac mouse, which is horrible."
1413.0,1415.0," The hockey puck, hockey puck thing."
1415.0,1416.0," So, it's really sensitive."
1416.0,1420.0, It has buttons on the side where you're thumb and pointer finger touch.
1420.0,1424.0," But, just because of it, what I liked about it was that, you know, small movements were very precise."
1424.0,1432.0," It was easy to aim at, but then, for a game like a battle field where you're switching between on-foot play to a jet or something."
1432.0,1436.0," And a lot of people ordinarily there, what's switched over to a controller or a flight stick."
1436.0,1440.0," So, you can, you know, do e-mails and more complicated maneuvers."
1440.0,1446.0," You can just do it with a mouse because you just move it a little bit further on the desk and, you know, just like a few millimeters."
1446.0,1453.0," And that's the equivalent of like, moving, picking your mouse up several times off the pad and swinging to the left and then putting them back down and continuing that."
1453.0,1457.0," So, I just thought that was pretty neat for that reason in terms of being effective."
1457.0,1460.0," And it comes with some, if you want to buy them, it comes with some foot pedals."
1460.0,1462.0, Which I don't know about those.
1462.0,1465.0," I mean, I guess for jumping or something, if you really need to touch it."
1465.0,1467.0," Or if you're a drummer and a duff leopard, you're just right."
1467.0,1477.0," But pedals, I mean, like, what, like accelerating and a racing game, those different pedals are jumping fire in, in a unreal tournament."
1477.0,1478.0, Really? Yeah.
1478.0,1480.0, But I don't know. I don't know.
1480.0,1483.0, And that's kind of when it's time to go outside.
1483.0,1487.0," I think it's 80 bucks for that thing, too."
1487.0,1488.0, That's really rough.
1488.0,1490.0, But you don't have to get the foot pedal.
1490.0,1491.0," Oh, no, no."
1491.0,1495.0," I thought, you know, when I told people that the gaming mouse is cool, all they could think about were the foot pedals and were laughing."
1495.0,1496.0," I mean, what?"
1496.0,1499.0," Well, there are push-ups and foot pedals if you're in a relationship."
1499.0,1501.0, You just can't. You can't bring that home.
1501.0,1503.0," But at this time, it's really hard."
1503.0,1505.0," So, a haptic device that we're about to go out and crazy for."
1505.0,1509.0," That is, it looks even worse. It looks like some dental cleaner that sits on your lap."
1509.0,1512.0," Seriously, it looks like something like out of a torch, it looks like a torture device."
1512.0,1518.0," But it is, by far, the coolest thing I saw at the show, like way revolutionary controller, forget the we remote control."
1518.0,1520.0, This is the shit.
1520.0,1522.0, You can't say that.
1522.0,1523.0," Oh, yeah, you can."
1523.0,1524.0, I don't want you to say that.
1524.0,1525.0, It's just stuff.
1525.0,1526.0, It is.
1526.0,1527.0, It is.
1527.0,1528.0," It's just, it's just, it's just, it's just, it's just shit."
1528.0,1529.0, Yeah.
1529.0,1530.0, Okay.
1530.0,1531.0, Word dog.
1531.0,1535.0," Anyway, no, but it's like, it's meant as a mouse replacement."
1535.0,1538.0," And it operates in like, it's a haptic device where operates in free space."
1538.0,1542.0," So, basically, you push in, you move out, moving out all directions."
1542.0,1543.0, It can convey weight.
1543.0,1545.0," Wait, so you don't, you hold it."
1545.0,1546.0, You hold it.
1546.0,1547.0, It doesn't sit on the desk.
1547.0,1551.0," No, no, it's a haptic real quick, just means of or pertaining to the sense of touch."
1551.0,1552.0, Thank you.
1552.0,1553.0, Dr. Ali.
1553.0,1554.0, I wear our Webster moment.
1554.0,1555.0, Yeah.
1555.0,1558.0," Hey, well, a lot of people are going to be like, have what?"
1558.0,1559.0, Half-lo.
1559.0,1560.0," So, go on."
1560.0,1562.0," No, it's, it was kind of crazy."
1562.0,1563.0," So, they had some base."
1563.0,1566.0," I'll just, you know, the best way to describe it is with tech depth, with demos that I played."
1566.0,1569.0," So, they have one, like, it's like a basketball, like a tech demo."
1569.0,1573.0," And actually, you can feel the ball in your hand as you're lifting up the knob and just,"
1573.0,1575.0," and you hit a, you know, hold on, like, you know, left-right mouse buttons."
1575.0,1576.0, And you release the mouse button.
1576.0,1578.0, And you can feel the ball leaving your hand.
1578.0,1579.0," Like, as if you're taking the shot."
1579.0,1581.0, It does sound a little like the Wii controller.
1581.0,1582.0, It is not.
1582.0,1583.0," No, it's not."
1583.0,1585.0, It's attached to your desk.
1585.0,1586.0, It sits on your desk.
1586.0,1588.0, And there's a little arms that come off of it.
1588.0,1590.0," So, you just kind of moving it around."
1590.0,1593.0," And then when you're, go to, jump to a first-person shooter."
1593.0,1594.0, That's a lot better example.
1594.0,1597.0," So, they had a half-life tomb on it with it."
1597.0,1600.0," And now you're, you're, you should have 357 mag them."
1600.0,1602.0, And you feel the kick back on the gun.
1602.0,1605.0," But again, you have to say, I mean, people are probably thinking, you know, they're making"
1605.0,1608.0, the inevitable analogy to a rumble pad in a controller.
1608.0,1609.0," No, it's not like that at all."
1610.0,1614.0," I mean, you feel basically what it is is a little ball attached to three arms."
1614.0,1617.0, And then there's a servo motor behind each of those arms.
1617.0,1619.0, And they're running in different degrees of resistance.
1619.0,1622.0," So, because of that, without having any weights or inside there, they're able to create"
1622.0,1623.0, that resistance.
1623.0,1625.0," So, it's your holding a gun or a crowbar."
1625.0,1627.0, You feel the different weights in your hand.
1627.0,1630.0," You know, obviously it's not exact one for one because you're going to charge, you know,"
1630.0,1632.0, fatigued in a second.
1632.0,1636.0," But so, if you're hitting a crowbar against a chain like fence, it, it, it resists"
1636.0,1640.0, the different feeling that if you're hitting mortar or something or shooting a shot.
1640.0,1641.0, It's less.
1641.0,1642.0, Right.
1642.0,1643.0, It's a smitty finish.
1643.0,1645.0," And then when you use the physics in there, just have to have straight objects."
1645.0,1649.0," You can feel them, you know, and the neat thing is it's not just a uniform weight."
1649.0,1653.0," All of a sudden it becomes heavier, but it becomes heavy in relation to a full"
1653.0,1654.0, crum.
1654.0,1658.0," So, if you say if you grabbed a ball on a rope and you swung it around, you can feel this"
1658.0,1661.0," and tributal force pulling it has the ball passes around, you know, pass it around."
1661.0,1662.0, That's right.
1662.0,1663.0, I just want someone else playing that demo.
1663.0,1664.0, I didn't get a chance.
1664.0,1666.0," I just want to say, how much is this contraption?"
1666.0,1669.0," Well, that's the thing is they're targeting, having to go for a hundred bucks when it comes"
1669.0,1670.0, out into it.
1670.0,1671.0, Okay.
1671.0,1674.0," And so, it's trying to, like, it's going to have an initial run for a hundred fifty,"
1674.0,1677.0," probably by the end of this year, then, then, when it goes into full mass production,"
1677.0,1679.0," hundred bucks by, like, early 2007."
1679.0,1683.0," The other neat thing about is that it totally, you get that sense of texture."
1683.0,1686.0," You do the demo where you run your, like, we're going to running your hand over balls of"
1686.0,1687.0, various services.
1687.0,1691.0," So, it could be corrugated, it could be sandpaper, it could be ice, and you definitely"
1691.0,1693.0," feel, as if you'd run it."
1693.0,1694.0," It would be like, probably across the end of cool."
1694.0,1698.0," So, in a game, I mean, just take splinter cell right off the bat, like, you know, the lock"
1698.0,1701.0," picking or something, and it could feel or hot wearing a car or something we saw in a"
1701.0,1702.0, loan in the dark.
1702.0,1706.0," I mean, it would feel like you could feel the texture is naturally match it up that way,"
1706.0,1710.0," and it would be entirely, it would be a whole little layer of touch rather than, you know,"
1710.0,1712.0, any correlating anything on screen.
1712.0,1715.0," And they sort of like, when they modded the Half Life 2 for the show,"
1715.0,1719.0," it only took one programmer, like, it can maybe, like, I think, like, a week or two."
1719.0,1720.0, Right.
1720.0,1723.0," So, I mean, like, that's just one guy doing it, but if you had, like, a whole, you know,"
1723.0,1728.0," a whole team of guys dedicated, creating the algorithm for the different, it's a problem."
1728.0,1732.0," I mean, when we just did our interface story with PC is that we can't ever have someone, you know,"
1732.0,1735.0, outside of Microsoft uniformly and foreign to interface.
1735.0,1736.0, That's the thing.
1736.0,1740.0," And because of it, it's like, it has to reach critical mass somehow, but how is it going to do it?"
1740.0,1744.0," Unless it's attached to, you know, in less, you know, Christech says, hey,"
1744.0,1746.0," Christ's 3 is made for this thing, right?"
1746.0,1748.0, And you can get it when you pre-order.
1748.0,1752.0," And if there's some way like that to get into it, I guess consoles do that a little better, huh?"
1752.0,1756.0," I mean, you can't make it, you buy the, you know, the music, whatever it is."
1756.0,1757.0, The arachas or the.
1757.0,1758.0, Right.
1758.0,1762.0," And a developer, you know, and it's kind of like that symbiosis where you've got to get a good"
1762.0,1765.0," developer who says, let's look at this and, like, like, the very best, you know,"
1765.0,1769.0," Nintendo DS games or the Wii games that really stand out, are the ones where the developers"
1769.0,1772.0, program specifically for that interface.
1772.0,1777.0," Now, of course, that's, you know, you can on suicide for any program to do a for a device that, like,"
1777.0,1778.0, ten people have.
1778.0,1781.0," Right. And maybe, maybe just too much of an uphill battle."
1781.0,1784.0," I mean, look at the whole history of PC gaming in the scenes, so, like, practically every"
1784.0,1789.0," controller, other than keyboard mouse fails, even when Microsoft puts it out."
1789.0,1791.0," You know, they couldn't make their sidewinder's work."
1791.0,1793.0," I mean, do they even make controllers anymore?"
1793.0,1796.0," Other than the Xbox 360, you see, they can't even, they can't even, they can't even"
1796.0,1799.0," Yeah, they can sell it into the game, but, you know, I think one way they could do it is if they"
1800.0,1805.0," make a reasonably priced product, like, you know, if you look at how much people are paying for these high end gaming mice,"
1805.0,1807.0," I mean, they're going for as much as 70, 80 bucks."
1807.0,1808.0, Yeah.
1808.0,1811.0," If you could justify giving somebody that, and that's just a gaming mouse."
1811.0,1812.0, That's it.
1812.0,1813.0, Yeah.
1813.0,1817.0," If you can hit give a really unique experience and not make it that much more than, you pay for a gaming mouse."
1817.0,1820.0, I could see some people who wanted to get into it.
1820.0,1821.0, Yeah.
1821.0,1823.0," The best case scenario is when this thing comes out at the end of the year,"
1823.0,1827.0, don't have it coded so that it will work with a wide variety of games.
1827.0,1832.0," People already have an ill-enhanced of the fives on those, and then in dream land, you sell enough of them,"
1832.0,1837.0," so that someone, you know, warrants, petrists, someone can come out and say, hey, or like the guys that like Mark's"
1837.0,1841.0," Healy who did, right, dog kung fu on steam will come out and say, hey, let's make a game for this."
1841.0,1842.0, Right.
1842.0,1843.0, You need to get the killer app.
1843.0,1844.0, Absolutely.
1844.0,1850.0," You need like a bio-shock or something or crisis or something to say, to use it completely, right, organically."
1850.0,1855.0," When I talk to people at the show, they said that they do, that they are looking to provide this,"
1855.0,1858.0," you know, code based to help people out, just throw it into their games."
1858.0,1859.0, Right.
1859.0,1862.0," And it wasn't just, there was actually a lot of buzz about that device at the show."
1862.0,1864.0," I mean, if you look around, it was on like, you know,"
1864.0,1869.0," API picked an AP picked it up, bunch of places, and can you send me the info?"
1869.0,1870.0, I want to pitch it for DLTV.
1870.0,1871.0, Sure.
1871.0,1872.0, Yeah.
1872.0,1873.0, It's one of those things.
1873.0,1874.0, It's totally my check it out.
1874.0,1878.0," You know, as soon as you try it, it's what you just kind of like marvel at technology, and it's just"
1878.0,1879.0, fun and it's gearing.
1879.0,1881.0, And you want to go tell someone about it.
1881.0,1884.0," And it was especially that way because it was in Ketchahol, just known for being the place."
1884.0,1888.0," Where, you know, but I guess you throw enough sticks together to make a spark down there once"
1888.0,1891.0," in the wall, and they did, you know, actually, you just have, I mean, at least one or two"
1891.0,1893.0, good things come out of there every year.
1893.0,1894.0, Yeah.
1894.0,1895.0, All right.
1895.0,1898.0," Well, Scott, the engineer is giving me the little wrap-up sign."
1898.0,1899.0," Well, I was just going move on."
1899.0,1901.0, I'll move on from this boring topic.
1901.0,1904.0," Oh, not from the boring topic, but you don't you have some emails and stuff?"
1904.0,1905.0, Do we?
1905.0,1906.0, We have one.
1906.0,1907.0, How long are we?
1907.0,1908.0, How much better to talk to us?
1908.0,1910.0," You got about, you're up around 30."
1910.0,1912.0, We're up at 30 minutes.
1913.0,1915.0," Okay. Well, we'll address one question."
1915.0,1919.0, We have a few and folks keep asking even if we don't answer them all.
1919.0,1921.0," We just, you know, we'll get to them eventually."
1921.0,1923.0," Oh, and one other order of business."
1923.0,1928.0," Those who responded to my requests for the tarot cards, the hero's five tarot cards."
1928.0,1932.0," We have our winners and as I told you guys, it's just going to take a little time post."
1932.0,1933.0, You three to get the mail down.
1933.0,1934.0, It went.
1934.0,1935.0, What are coming?
1935.0,1938.0," We'll have to come up with the contest for all those guilders, the boards."
1938.0,1941.0," We have the, uh, the, uh, the, the sticks around."
1941.0,1942.0, Right.
1942.0,1944.0," We're going to have a giveaway not this week, but stay tuned."
1944.0,1947.0," We're going to give away some, uh, what are they called e-boards?"
1947.0,1948.0, As e-boards?
1948.0,1950.0," We bought the, with the guilders factions overlays as well."
1950.0,1955.0," So I'll, I'll send one to anybody who volunteers me to run, run, run me through"
1955.0,1958.0, The last missions in the original campaign.
1958.0,1960.0, We're trying to get my right through.
1960.0,1961.0, There you have it.
1961.0,1964.0," We've got shirts and, uh, premigides to go with us to, right?"
1964.0,1967.0, We've got all sorts of guilders loot to give away.
1967.0,1968.0," And I'm sure by next week, why does more shots?"
1968.0,1969.0, We've got shirts.
1969.0,1970.0, The one that's on the right.
1970.0,1972.0, You don't get to where the shirt that we donated.
1972.0,1977.0," And, and mind you guys, the, the, the extra that we decided the rest of us were like, you know what?"
1977.0,1978.0, Let's give this back to the readers.
