start,end,text
1116.72,1120.88, actually first we should see who reviews it but then we got to like verify that they've got the
1120.88,1127.84, Dick Cheney joke in there too right of course yeah yeah yeah so I'll read we're probably not
1127.84,1132.48, gonna review that or da Vinci code or X-Men well actually I want to okay we're probably not going
1132.48,1137.1999999999998, to it's a really good answer he says no I do have to throw out one thing only because uh
1137.1999999999998,1142.24, my fiance Amy she is a sucker for da Vinci code so she wanted to play the game and
1142.24,1146.24, but it's all about puzzles and she seems to love it so yeah if you like puzzle games
1146.24,1149.12, and you can forgive a little bit like the game
1149.12,1154.8, it's a lot of uh it's a lot of uh it's a lot of it's a lot of it's a lot of it's a lot of it's a lot of
1154.8,1157.6799999999998, it's a lot of it's a lot of it's a lot of it's a lot of people like it so that's not they know
1157.6799999999998,1161.84, all right so Amy says check out the Da Vinci cake exact the rest of us who don't know anything
1161.84,1166.3999999999999, about it say don't bother or if you don't know anything I listen to it an audio book for
1166.3999999999999,1171.84, he did the X-Men one unfortunately we might want to just not we might want to not dismiss it I
1171.84,1176.9599999999998, heard that the Ice Man can shoot ice in the Wolverine applause really does he say it
1177.04,1181.52, wow that's that's fantastic it's a night crawler I can tell a word so awesome I thought
1181.52,1186.16, night crawlers and in the new movie he's not but he's in the game he's got to be having games
1186.16,1191.1200000000001, two maximum blue characters because they had mystique and beast so yeah the whole thing
1191.1200000000001,1195.92, he's the Smurfs yeah yeah yeah yeah yeah yeah
1196.96,1201.1200000000001, the Beast night crawler and mystique he could make up that role shonder was that there
1201.1200000000001,1204.32, that's it you nuts in the book really you can only have real blue characters
1204.32,1211.28, that's great wow I got to show with that me well that me Kelsey growing playing with the
1211.28,1218.72, cookie monster in them which Jesus it was there the monsters ink yeah okay well we are going to
1218.72,1223.84, take a slight break here and we'll be back with more exciting podcast fun
1226.0,1230.08, one up network radio is being brought to you by and one streetball the only authentic streetball
1230.1599999999999,1234.48, game featuring the full roster of and one mix tape to her players that's guys like hot sauce
1234.48,1240.08, helicopter and the professor it's available for PlayStation 2 and Xbox for 39 99 on Tuesday
1240.08,1245.36, June 6th at your favorite online in real world stores and when streetball is rated E10 for everyone
1245.36,1252.08, 10 and up hi this is garnetly host of one up years every week in the month of June one
1252.08,1256.8799999999999, up radio along with and one streetball is giving away $100 iTunes music store gift cards
1256.96,1260.8000000000002, all you have to do is listen to one up years is Friday afternoon to learn how to win or you can
1260.8000000000002,1267.7600000000002, find the contest rules at our message boards that's boards.1up.com $100 iTunes goodness courtesy of
1267.7600000000002,1272.5600000000002, and one streetball and the one up radio network so any computer entertainment takes no responsibility
1272.5600000000002,1279.5200000000002, for this offer and we're back that was kind of weird like well just came in the room where we
1279.5200000000002,1286.3200000000002, got us podcasts yeah hold on okay open the window make sure we get the smoke out yeah we have a
1286.32,1291.12, sponsor now kind of weird that's a good thing I guess it's a good thing don't get us or
1291.12,1299.84, so it's in trouble let's move on now I want to make fun of a sponsor yet shopping at the bit won't
1299.84,1306.8799999999999, do it the Gary's mod we didn't well you talked about the Gary's mod going on it's Gary's mod
1306.8799999999999,1312.1599999999999, tennis coming up pretty soon right yeah it's coming out on a steam when we last talked to him for
1312.24,1317.8400000000001, our story and the more magazine for the mod so yeah this is the steam ocean yeah but so much is coming
1317.8400000000001,1323.68, out on there but anyway yet Gary newman of Gary's mod last told us that he had no interest
1323.68,1330.72, of cars fan eight makes his game retail that Gary newman yeah but so anyway he is in fact now making his
1330.72,1336.64, game retail for $5 over over steam that's Jen with valves blessing and you can get all the previous
1336.64,1342.0, versions for free still and it's just if you want number 10 and he's adding a quite a few new
1342.0,1347.44, features to it and so it's can you get the older ones for free still yeah oh you can okay so it's a
1347.44,1352.72, real player and then another quick note on Gary is he's got this new game coming out called face one
1354.64,1359.92, deliciously named but it's because his his two years ago called face punch duty so it's kind of
1359.92,1367.76, you know like crytac crisis type thing and it's it's this wow what he's looking uh two these
1367.76,1373.12, sites will it's like a suit of you know pseudo 3d sites growing shooter game with weird
1373.12,1377.68, floating brains and stuff and all kinds of internet in jokes and memes going on in the background
1377.68,1383.12, and it just looks completely chaotic and it no offense to to Gary but what was your reaction
1383.12,1390.56, when you watch the movie Darren uh Jesus it's just like Gary is for it's hard like I think
1390.56,1394.72, I think I'm in a good way he was like yeah I think he taught it in a good way yeah as in let's get
1394.72,1400.24, retarded in here oh yeah so you're watching it so we've started to crap on the screen it's like
1400.24,1404.64, don't send us angry letters we mean it in the black eyed piece way right we're very straight
1404.64,1408.8, and yeah it's like if you took the something on before and send me a game out of it so
1409.92,1415.44, what did they mean anyway let's get retarded in here what did that we can we can we can
1415.44,1420.08, dissect the lyrics for next time but be stupid so I would that meant like they may instead of saying
1420.1599999999999,1426.8, girl we couldn't get much hard to say girl things couldn't get much better okay didn't that get
1426.8,1438.8799999999999, changed so let's get started yeah yeah yeah I hate the man okay so other than steam do we have
1438.8799999999999,1443.12, anything to talk about this month you're still playing out of the legends right just like
1443.12,1448.08, I think I'm going to do it and it's still good it's all up now yeah it has yet to piss me off which
1448.08,1453.1999999999998, is pretty good for an RTS yeah are you still blowing through the single player campaign going
1453.1999999999998,1458.08, yeah just about at the end of the second of the three legs okay so you're in the outland you're in
1458.08,1462.2399999999998, the alem campaign right yeah right at the end of that one about this start the quadril over you
1462.2399999999998,1466.08, pronounce that how is that though I mean like I've only had a chance to play through the bench
1466.08,1470.32, he part so far so it's just very steam punky I mean does it the game change it's feel as you're
1470.8,1474.8799999999999, yeah it was a little nervous when I started the alem campaign because you still have the same
1474.8799999999999,1478.56, units right at the beginning so I'm like I thought I was going to play as some other group but then
1479.28,1483.84, plot stuff happens and you're suddenly playing as the other group so you do get it is a pretty distinct
1483.84,1488.32, and a pretty different to aren't they yeah they're very like kind of a raving and theme and
1488.32,1492.56, had lots of desert things and they're more magicy so it doesn't have a different feel kind of like
1492.56,1496.1599999999999, how when you play the starcraft for that first time through the campaign there's no good yeah you know
1496.1599999999999,1499.6, the human's ergon that's not bad yeah I was hoping they would do that and they kind of did I
1499.9199999999998,1505.4399999999998, they're not so different at this point that it's like mind-blowing but because like I think the
1505.4399999999998,1510.0, zerg were like way different than the terrens so I think it's more of like a protoss terren kind of
1510.0,1515.6799999999998, compa okay okay but maybe the third I haven't even seen this third fact can yet so they could
1515.6799999999998,1522.3999999999999, be completely crazy every game should just add zerg links all about the zerg rush yeah what about
1522.3999999999999,1528.1599999999999, hitman anyone playing that just started as very basic now but I mean I like the idea behind it
1528.5600000000002,1532.96, I only did it I only had time for the tutorial mission this weekend just it's a good start I
1532.96,1537.44, will be able to report back next week all right I'm still protesting those ads
1539.6000000000001,1545.28, and like they're just too gross I don't want to play that game sorry the thing I want to know
1545.28,1550.0800000000002, about this hitman is the problem I had with the previous ones is uh you know there's supposed to be
1550.0800000000002,1554.8000000000002, all these open ended options and all these you know married ways that you can can take out your
1554.8799999999999,1560.32, mark but sometimes it's really they're only a few and they're very carefully planning it's
1560.32,1564.6399999999999, a matter of you figuring out what they are it's sometimes they're counter intuitive and it's punishing
1564.6399999999999,1567.76, you for like not getting them and that's been the frustrating part for me to do you know I
1567.76,1573.12, exactly like puzzle oriented and a way or right right I mean well that they they addressed that I
1573.12,1576.3999999999999, mean I asked them I early on in the pre-imbing they were previewing the game we first time around
1576.3999999999999,1580.6399999999999, and there they said that that's a big part of is leaving many different ways for you to set up the
1581.5200000000002,1585.5200000000002, ideas to make it look like an accident right if you can make it look like an accident and yeah it's a
1585.5200000000002,1590.72, little bit of puzzle solving in that respect but it's not like the uh get the cat hair and the
1590.72,1595.2800000000002, snow head then the syrup to make me up the most at but it wasn't always like that back it's the
1595.2800000000002,1598.96, difference between say a GTA mission where you're supposed to take out some guy when he leaves a movie
1598.96,1603.76, theater and then it really is literally up to you what you want to do if you want to block and then
1603.76,1607.68, by parking a million cars and there that you're not going to blow off by the fire through a
1607.76,1612.5600000000002, all-time cocktail into him if you want to snipe whatever whereas in his hand there might be like
1612.5600000000002,1616.96, to get in to satisfy the conditions where you can get close enough to this guy or whatever you've
1616.96,1621.92, got to do a few things like you've got to find one very specific costume but to get that costume you
1621.92,1626.3200000000002, got to like kill him in a very specific way or find over the very specific moment right and so it's
1626.3200000000002,1631.92, finding all those rules that it's like you know FAQ territory and yeah I mean like I said I haven't
1631.92,1635.76, gotten too deep into it but I do like I do like the fact that they're saying they're going to leave
1635.84,1641.92, it open ended and they're saying that too well I like them saying and I hope they're actually doing it
1642.48,1646.72, but this one you also kind of cool and incentivizing is that you actually want to go through each of
1646.72,1652.0, these missions without being seen because actually a newspaper reports are getting generated
1652.0,1658.8799999999999, depending on how you perform any commission so if you leave witnesses or access suspicious around
1658.8799999999999,1663.44, people they'll actually be like at the end of each mission there's like a fake newspaper and like
1663.52,1666.0, they can be a police artist catch of you so that the next one loading screen
1667.04,1671.28, pretty much but in the next episode and the next mission rather they'll be looking for you
1671.28,1674.3200000000002, from the get go so it makes it like it scales up a difficulty
1675.2,1678.88, but that could be the bad thing imagine if you keep getting noticed by the fifth mission you've
1678.88,1683.04, got half the world looking for you so then you got to reload mission well so then it turns into a
1683.04,1687.8400000000001, shooting game as a part of it is a part of it is to a stealth game uh tool I guess that's I guess a lot
1687.8400000000001,1692.0, of those games are kind of like that yeah I mean like I mean it's a little bit different one here
1692.08,1696.88, back for you next week because it's like I've close to this close to getting that game and playing it
1697.52,1701.68, I just need a little more convincing yeah I mean like I like I said I haven't gotten too deep in but
1701.68,1708.8, potential so and yet again we're very game-head of this week oh that's really but I also saw
1708.8,1713.2, some of the podcast that's true yeah that's true we do what we work we draw that talk about
1713.2,1717.76, desperate house works we can talk I've never seen that show ever good for you do you know what I
1717.76,1723.6, did this week and I tended to wedding in World Warcraft oh wow we were the best man
1723.6,1728.32, actually wasn't invited but my daughter was it was it was for her so you you just he was
1728.32,1733.44, a right three loaded yeah I went on the same terms I was sort of like hanging around the
1733.44,1738.4, outskirts there now you feel but at that moment it's like describe your feeling pretty stupid
1740.4,1746.24, is it was she was making cookies and stuff for your talk no that's for uh this coming uh holiday season
1746.24,1750.48, that's not till like Halloween and Christmas that they're making no they have a big sale or they
1750.48,1754.96, actually uh not they're given away the cookies all these over the spirit of the season all this is an
1754.96,1760.96, angle what what a couple of other players be closed and just riding through all there was nothing
1760.96,1767.44, preventing them no the wedding was in uh we're not darnasses I guess it is and uh there was a level
1767.44,1774.64, 16 night off priest who was performing ceremony and those are dwarf male character and a female
1775.44,1780.3200000000002, human I think and he's too to I know that she's interbreeding she's only after her first
1780.3200000000002,1786.96, man I was really against it yeah personally um and so they had the ceremony they had bride
1786.96,1790.88, grooms and brides made the line up and they were all kneeling you know they had the kneel
1790.88,1795.3600000000001, they were like roleplaying in the dialogue too kind of yeah the priest was speaking and like you know
1795.4399999999998,1799.1999999999998, and he was yelling across the zone too so everybody in the in the zone could hear at the
1799.1999999999998,1805.28, side you know do you are saying take another people I know idea was going on we're just like
1805.28,1812.6399999999999, riding back and if you know WTF so we're like your cut reaction so that we're there any objections
1812.6399999999999,1816.9599999999998, under the circle yeah people were just objecting to them hogging the server chat everything
1816.9599999999998,1821.6, huh it was your gut reaction like this is amazing stuff that this kind of thing can happen in a
1821.6,1829.28, virtual world or was it like oh yeah it was a little bit above yeah I mean because what was cool
1829.28,1834.6399999999999, cool isn't cool it's but like right when they said I do like all the all the people in the wedding
1834.6399999999999,1839.9199999999998, party who were like engineers had made a bunch of fireworks so they shot up all these fireworks into
1839.9199999999998,1845.04, the air and people were dancing to shot them again more and more scared to talk and then for the
1845.04,1850.48, party they out when and they rated the crossroads that was our party they rated another zone it's good yeah
1851.6799999999998,1857.04, no I didn't look at Brian well I would just needed to be a video podcast that's the
1857.04,1862.32, skier looking at it this doesn't have to get to her on the kill and ten of these and collecting five
1862.32,1866.3999999999999, of those that was doing that with this weekend a little bit a little while yeah but eating
1866.3999999999999,1871.52, common also wedding though no probably a difference you're hanging out in unguoro with the dinosaur
1871.52,1876.7199999999998, unguoro that's a good zone I like that one that's what my favorites yeah high level oh
1876.72,1881.52, gotta be good to get there you know there's there has been kind of a game drought and like
1881.52,1886.16, the people I play games with online there's repeatedly over the past few weeks we've been like
1886.16,1890.48, should we just get well should we just give it to you and then we're always like we think we kind of
1890.48,1894.56, debate it and we're like something comes along and we like you put this up because you know we
1894.56,1898.32, played we played out of a salt for a little bit and then like our counts right now and it's like I'm
1898.32,1904.72, just not sure I want to pay a monthly fee for a game mma with five people in it and uh hello
1904.8,1908.08, you know I mean it's just an old battlefield the armored fury's coming out and that's going to
1908.08,1912.72, suck up our time but in between that you know we got to mix it up some and there we go yeah I got
1912.72,1920.16, up to uh I check my played time right before I came down here I'm up to 425 hours on my main character
1920.16,1925.1200000000001, in loud which isn't uh which I thought was a lot and then I went around and I asked other people
1925.1200000000001,1929.28, on the floor and I'm like a new because uh something well how much is Bryce in for?
1929.28,1934.24, I didn't ask him but Ryan Volk who's the art director at a official PlayStation magazine is up to
1934.56,1944.64, um 260 days to finally 11 oh we 116-24 hour days spent well in Final Fantasy 11
1945.2,1951.84, wow that's a long freaking time yeah I thought I was a loser I think that you're the loser
1951.84,1955.2, you know people you're definitely getting as many as worth that's for sure well yeah she's
1956.72,1963.28, yeah I'm up to um I check my Guild Wars time before we came up here and over the past 30 days
1963.6,1967.28, I've played this one character for 143 hours and 52 minutes
1968.32,1972.6399999999999, infections yes and the game just yeah character that I just created for factions
1973.84,1978.8799999999999, wow congratulations then we should have some kind of little tracker in our letter section where we
1978.8799999999999,1983.36, get someone to give us proof that they've spent like some ridiculous amount of time in their game
1983.92,1989.44, yeah so it can give us like like over a thousand hours and some I'll let you know if those
1989.52,1993.8400000000001, companies do that like Netflix does you know how like Netflix furnishes you for like renting and
1993.8400000000001,1999.92, returning fast you know like you're you're not as economical for them what they like the people
1999.92,2004.64, Netflix likes the folks who like get three movies and then take two months to watch them
2004.64,2009.44, right and we're starting there $20 a month crash we're sitting in my television for literally six
2009.44,2014.4, months and they love you but it's the people who return them over and over and over that they
2014.4,2018.64, end up losing money on because of the postage so I wonder if Emma most feel that way like a
2018.72,2023.6000000000001, frying's logged in 24 seven are they got damage getting a login up our freaking server space
2026.8000000000002,2032.0800000000002, log out you loser we should we should do that for our mailbikes this month we should have people email
2032.0800000000002,2035.76, in or go to the forum and tell us the how I'm going to go actually on there actually like
2035.76,2039.0400000000002, we can be kind of funny for like you know like letter section it like it took a screenshot of like the
2039.0400000000002,2043.92, number hours or something and the one okay yeah if you're listening and you think you have a
2043.92,2049.52, particularly long playing time take a screenshot to prove how long it's been I can it be
2049.52,2055.84, not Emma I was a way to say I've got 450 in battle so you can prove it though yeah you just go to
2055.84,2060.64, the ft stats dot com and we're okay whoever whoever can prove they have the least amount of life outside
2060.64,2064.64, of gaming we'll actually get that actually we have so much of you have some swag in the office
2064.64,2069.52, like yeah those them guild wars e-boards we need to give it to go and I do this or they're going to
2069.52,2075.36, like the some do down on the street yeah the right or right man on the corner yeah so here that
2075.36,2078.16, you can win something that we're about to give away to a street person
2080.16,2086.32, I think we can come up with something a little more actually a surprise I got a couple
2086.32,2093.04, a couple random shaggies for whoever can like provide the provide the the proof the all right man
2093.04,2097.52, by the way is our local homeless guy he's a real ass guy he just but he says all right all right
2098.0,2103.04, right pretty much to exclusion of any other words but uh we've hooked them up I've given them you know
2103.04,2108.24, metal varnish leather real leather jackets and did you really yeah I give them all those all the free
2108.24,2113.44, shirts and stuff we gave in respect as we go to the all right man but I never saw where idiom he was
2113.44,2117.52, wearing that one time but hey whatever he does it and so on too he's got our afternoon more
2117.52,2121.84, where he goes I hope he just moved to another block yeah we once in a while I'll be like driving
2121.84,2126.88, to Berkeley or something and I'll see like you know a construction worker you know undocumented worker
2126.96,2134.48, wearing like a system shock shirt and like that's got to be one of us there are the three
2135.28,2140.56, there were the three okay yeah we're getting their wind it down you you
2141.12,2145.6, long talkers we got to the point where we're construction workers and systems just shots shirts
2145.6,2150.2400000000002, in the home of dudes leather metal of water bombers jackets that's a wrap that's we hit the wrap
2150.2400000000002,2155.28, it up okay but we kept on topic almost a whole time back well how we do it our props to us
2155.6800000000003,2161.76, 30 minutes oh so that's a long time we'll never get to our reader questions oh yeah we had a reader
2161.76,2166.8, question but we'll we'll hold that out for next week or will we you'll have to listen next week
2166.8,2170.6400000000003, it's fine doubt consider that episode of cliffhanger right there but but remember it you will
2170.6400000000003,2175.52, consider that gauntlet thrown down there sending your screen shot proving how long you've played
2175.52,2180.6400000000003, your game if you think you've played like you know a you know severe butt load of time and we'll have
2180.6400000000003,2184.7200000000003, some kind of gift for you whoever's played the longest and there's a few factors like if you've
2184.72,2189.04, gotten married and game we'll give you another free 10 hours like whatever there's a whole
2189.04,2191.9199999999996, way to get a little bit of a little bit of a little bit of a little bit of a little bit of a little bit
2191.9199999999996,2196.72, yeah well we'll wait it okay depending on how big you're in a role playing server too you automatically
2196.72,2201.4399999999996, like that if there's like a double to play it by a third and have only spoken in role playing
2201.4399999999996,2207.04, right okay thank y'all for listening and we'll catch you again next Monday
2214.72,2216.72, you
