start,end,text
2139.0,2141.0, we should get up and stop doing this.
2141.0,2142.0," Oh, yeah."
2142.0,2143.0, That kind of thing.
2143.0,2144.0," We actually think, you know, we do that though."
2144.0,2146.0, We make a point like this weekend was just beautiful.
2146.0,2147.0," Oh, yeah, you can't do that."
2147.0,2150.0, I don't think we maybe be playing an hour of games.
2150.0,2152.0, I think the fundamental difference between your situation and ours is that
2152.0,2157.0," like, we can, we'd all, or, I mean, all of us in a room are aware of just like,"
2157.0,2160.0, how completely geeked out this stuff gets.
2160.0,2163.0," And I mean, and it's like, for us, I'm assuming there's places you don't go."
2163.0,2166.0, You don't even start to try to explain it joke because you realize how much
2166.0,2168.0," context is like, yeah, to take me all day to set this up,"
2168.0,2170.0, my stomach gets to the punch line.
2170.0,2172.0," Should be like, why is that funny?"
2172.0,2173.0, Yeah.
2173.0,2176.0," But both of you are like, what we're laughing at this."
2176.0,2178.0, And we know why it's funny.
2178.0,2179.0," Like, but is it really funny?"
2179.0,2180.0, I don't know.
2180.0,2183.0," I just imagine you think like, it would be weird."
2183.0,2184.0, Yeah.
2184.0,2189.0," I mean, you guys are both, it's really aware of how far you're going down the rabbit hole."
2189.0,2190.0, When you guys are really happy.
2190.0,2191.0, I'm jealous of you.
2191.0,2193.0," I was like, playing it off to..."
2193.0,2194.0, I am jealous.
2194.0,2198.0," I would like once in a while to be able to have, I mean, I do have that experience with my kid."
2198.0,2202.0," But it's rough when you got someone in the house who's just like, what you're doing is a waste of time."
2202.0,2204.0," You know, 20% of your money."
2204.0,2205.0, Right.
2205.0,2207.0," I'm not trying to, I'm dissing my wife in public."
2207.0,2208.0, This is bad.
2208.0,2209.0," Oh, I love you, honey."
2209.0,2210.0," That's going to be rough, though."
2210.0,2212.0," No matter what, I mean, because I've had that tune in."
2212.0,2215.0," It's like, it's similar to that like, what you do is not work."
2215.0,2220.0," And I'm thinking not so much of what we're playing in, but say when we're, you know, we have a rough week, a deadline,"
2220.0,2226.0," and we're basically, you know, writing it home, writing over the weekend, editing, preparing stuff for the next issue at the same time."
2226.0,2228.0," And those days, you'll least, it's still very nice."
2228.0,2229.0, Love it.
2229.0,2231.0," Rather be doing it than, you know, so many other things."
2231.0,2234.0," But at the same time, it's kind of in line too."
2234.0,2238.0," It's just so, anytime someone you love, it's just so merely dismisses a big chunk of what you're investing in."
2238.0,2247.0," Yeah, it's like, you know, it's just my career here, you know, and, you know, to put it into some context, I mean, first of all, she's European."
2247.0,2250.0, So she wants to play Raymond.
2250.0,2253.0," No, but also that's, that's nothing."
2253.0,2254.0, That's nothing.
2254.0,2257.0," Yeah, that's what I was really going to say was she's a teacher."
2257.0,2259.0," Okay, she's a high school teacher."
2259.0,2260.0, So she's got to deal with.
2260.0,2263.0, She's not using DDR to teach the kids to lose weight.
2263.0,2267.0," Yeah, what I'm doing, what I do is like the enemy of what she does."
2267.0,2269.0," You know, this was like why they don't fight in kids."
2269.0,2271.0, Don't do their homework.
2271.0,2273.0, It's quite a dynamic relationship together.
2273.0,2277.0," Yeah, we always say that, you know, she smartened some up and I dumb them down."
2277.0,2281.0," It would be a really talented way to send the NELCIFT it wasn't the games, you know?"
2281.0,2282.0," Yeah, I don't know."
2282.0,2286.0," But what bugs me too is like, you know, everyone's in a while."
2286.0,2289.0," There is a game that I really think I'm like, this is the one."
2289.0,2294.0," Like, Catamaria, I think was one where I was like, this is so innovative and it's so cute and it's so friendly."
2294.0,2295.0, I knew better than that.
2295.0,2297.0, I just glaze it to a lot of interest.
2297.0,2302.0," Play it, just watch me play it to acknowledge that there's something interesting happening here."
2302.0,2309.0," I mean, the last thing she saw me play was half-life episode two and episode one and I was playing it and I was really into it."
2309.0,2314.0," And she, it was like a good part of the story and she walked by and like right then on the screen."
2314.0,2317.0," There was of course, you know, something like horrible happening."
2317.0,2321.0," Like I was using the gravity gun to like throw bricks at zombie hits, right?"
2321.0,2322.0," Well, this wasn't a student."
2322.0,2325.0," So she walked by that and she's like, what is that?"
2325.0,2327.0, Like in the most dismissive time.
2327.0,2328.0, Why you're not playing it?
2328.0,2333.0, All you see is nothing but violence upon violence upon violence and you don't see.
2333.0,2335.0," I mean, now I got to go into Finn."
2335.0,2336.0, What?
2336.0,2337.0, It's not just violence.
2337.0,2339.0," But in the way that you're responding, you're like, what do you see how that happened?"
2339.0,2342.0," Or like, I got to figure out using the tools available to me."
2342.0,2343.0, Yeah.
2343.0,2344.0, How to get out of the situation.
2344.0,2348.0, All they see is that if you're like watching a movie and it was like an endless clip of like highlights.
2348.0,2353.0," Like, like, cresty old, you know, like puppet master films and whatever, you know,"
2353.0,2354.0, trauma of the show.
2354.0,2355.0, But studios.
2355.0,2359.0, What does actually the scene was that it was the part of the game where the
2359.0,2361.0, Ant Lions are spawning and they'll see.
2361.0,2365.0, So you have to use the gravity card to move the cars over to move the gravity gun.
2365.0,2367.0, The cars are there to spoil one of the puzzles.
2367.0,2368.0, Sorry.
2368.0,2372.0," But anyway, Alex is the one that says it like two seconds."
2372.0,2373.0," Oh, she does."
2373.0,2374.0, I guess that was the deal.
2374.0,2375.0, I don't know if she says that.
2375.0,2376.0, Yeah.
2376.0,2377.0, I didn't even hear it.
2377.0,2378.0, I missed it.
2378.0,2379.0, I thought I had to figure it out.
2379.0,2384.0," But you know, so my wife was like, dicing the game because the zombies are attacking you."
2384.0,2387.0, And I was actually trying to mount this defense over it.
2387.0,2389.0, So it's kind of a logic puzzle.
2389.0,2391.0," Oh, it's all over the heads."
2391.0,2392.0, Yeah.
2392.0,2393.0," All the time, I tried to sit there into a fan."
2393.0,2395.0," Like, you know, gaming is evolving as an art form."
2395.0,2396.0, And I was sitting there playing syneposites for the review.
2396.0,2397.0, And the first opening scene.
2397.0,2398.0, I'm staring at some digital boobs.
2398.0,2399.0," Yeah, that is."
2399.0,2400.0, That's it.
2400.0,2401.0, There you go.
2401.0,2402.0, Yeah.
2402.0,2403.0, That would have been harsh.
2403.0,2404.0, Yeah.
2404.0,2405.0, She's going to have a team.
2405.0,2406.0, She can't drop the F bomb on here.
2406.0,2408.0," But anyway, as soon as that part, you get in the car."
2408.0,2409.0, I've been in the corner F F F F.
2409.0,2411.0, The quarter of F and you.
2411.0,2412.0, Yeah.
2412.0,2414.0," Actually, that and the team A together would just be a."
2414.0,2415.0, Yeah.
2415.0,2418.0," She said, like, he's a time to have a negative like shoot themselves in the foot."
2418.0,2420.0," Where you're just like, see, this is really cool."
2420.0,2421.0," Oh, yeah."
2421.0,2424.0," I mean, I actually tried to like sort of take."
2424.0,2430.0," I mean, I do feel this way that like if it's if the game you're playing is stupid or whatever."
2430.0,2431.0," Like, that's actually okay."
2432.0,2434.0," You know, just say the way we want to do it."
2434.0,2438.0, If you have a exactly what you got to stupid movies or read stupid books.
2438.0,2440.0," Like, if this is just how you want to spend your time."
2440.0,2441.0, I think that's.
2441.0,2446.0," I think if you had someone come up to you, if your wife can't have team was trying to tell you that like,"
2446.0,2450.0," I don't know, Miss Congeniality was just, it's just amazing."
2450.0,2452.0," I mean, it's just completely high art."
2452.0,2453.0, Yeah.
2453.0,2454.0, And it's you.
2454.0,2455.0, Absolutely sincere.
2455.0,2456.0, And you had to listen to it.
2456.0,2458.0, And she ran it movies like it.
2458.0,2459.0, And it's sequels like every week.
2459.0,2460.0, We get a week out.
2460.0,2464.0, And then that's kind of probably her perspective on what we do.
2464.0,2470.0," You know, it's like, that is if you're not telling your hey, this is a dumb like this is a guilty pleasure."
2470.0,2473.0," I'm sorry, but like, well, it's not the reality."
2473.0,2479.0," I'd you know, I'll do about sometimes I really do try to defend it because there are games you can defend."
2479.0,2486.0," As, you know, strategy games or things like that, you can say this is actually using a a significant part of my brain."
2486.0,2491.0," You know, there's other times where clearly you're just goofing off and wasting time."
2491.0,2496.0," Maybe you need to start simple with her, start her on some flash games like torture or some or something."
2496.0,2498.0, I always think it's a good thing.
2498.0,2500.0," This seriously, like, elf bowling or something."
2500.0,2501.0, I don't know.
2501.0,2503.0, Maybe something from a French perspective since she's friend.
2503.0,2506.0," Get her into, I don't know."
2506.0,2507.0, I give up.
2507.0,2515.0," Yeah, but all takes is one like the fact that like if they play just one game, then even if the game content itself is completely different than what you're doing."
2515.0,2527.0," The, the concept of like wanting to keep playing something, you know, in the same medium like saying, hey, you know, I know that feeling where I want to go back and keep playing this and just do it again, even though I've done it the day before in the day before that, you know."
2527.0,2529.0, Bookworm and Bonnie's book show might be a good thing.
2529.0,2531.0, So maybe it doesn't matter.
2531.0,2532.0, Maybe it's okay.
2532.0,2534.0," You know, yeah, there's sweat and if or none."
2534.0,2538.0," Does she watch Oprah or anything like that, you can bring and shoot back."
2538.0,2539.0, She definitely watch to some dumb TV.
2539.0,2540.0, There you go.
2540.0,2541.0, That's it.
2541.0,2545.0," And, and her, you know, the way she'll say it is, well, you know, I've been teaching all day."
2545.0,2548.0, I've been working hard all day and now I just want to turn my brain off and chill out.
2548.0,2549.0," Yeah, there you go."
2549.0,2550.0, And there you go.
2550.0,2551.0, There's the argument.
2551.0,2552.0, Right.
2552.0,2553.0, Yeah.
2553.0,2554.0, Okay.
2554.0,2555.0, That's the end of it then.
2555.0,2556.0, Amen.
2556.0,2558.0," Well, why did the habit of turning to a therapy session?"
2558.0,2559.0, Okay.
2559.0,2561.0, And you just thought I was asking you guys a question.
2561.0,2562.0," Well, you part of it."
2562.0,2563.0, We want to know.
2563.0,2565.0," Yeah, but that I feel bad."
2565.0,2566.0, We're in for you.
2566.0,2568.0, We think what you're doing is worthwhile.
2568.0,2569.0, We're behind the.
2569.0,2570.0, We said it.
2570.0,2571.0, We're here in the delights.
2571.0,2572.0, We're here in the delights.
2572.0,2575.0, We're here in the delights.
2575.0,2577.0," I have a good job, because of it."
2577.0,2580.0, So what would she say if she heard this podcast?
2580.0,2583.0, It wouldn't be good.
2583.0,2586.0," Matter of fact, something that he makes it good right now."
2586.0,2587.0," Yeah, about five seconds."
2587.0,2588.0, I love you.
2588.0,2590.0, Love you honey.
2590.0,2591.0, Yeah.
2591.0,2592.0, Are we done?
2592.0,2593.0, That's it.
2593.0,2594.0, We're done.
2594.0,2596.0, You just want to throw out two quick things?
2596.0,2597.0, No.
2597.0,2598.0, Yes.
2598.0,2600.0, They see you W podcast theme.
2600.0,2601.0, Yeah.
2601.0,2603.0, So we got we got to throw a shout out.
2603.0,2605.0, We got an interest admission from George Teal.
2605.0,2606.0, Yes.
2606.0,2607.0, And thank you George.
2607.0,2608.0, Thank you George.
2608.0,2610.0, While we can't use the theme.
2610.0,2611.0, Yeah.
2611.0,2612.0, What were you saying earlier?
2612.0,2613.0, Don't say it.
2613.0,2614.0, Don't judge mental.
2614.0,2615.0, I thought it was in the cool.
2615.0,2616.0, All right.
2616.0,2618.0, I think that you need to hook up.
2618.0,2620.0," I mean, for being the first and so far,"
2620.0,2621.0," only submission, right?"
2621.0,2622.0, Yeah.
2622.0,2623.0, George is actually.
2623.0,2624.0, We should say it.
2624.0,2627.0, It's the guy who did the one that Ryan called Columbia and drug dealer.
2627.0,2628.0, And he's a glass week.
2628.0,2632.0, And we thought a little bad because he actually did take the time to do this for us.
2632.0,2634.0, Unlike the rest of you.
2634.0,2637.0, And so I heard that he sent us a new one today.
2637.0,2638.0, And this new one is nice.
2638.0,2639.0, Thank you George.
2639.0,2641.0," So George, you'll be getting any email from you soon."
2641.0,2642.0, I'll hook you up with some stuff.
2642.0,2643.0, Thanks.
2643.0,2646.0, Thanks for for throwing some songs away.
2646.0,2650.0," And one other thing, the get a life contest for."
2650.0,2653.0, That's this play.
2653.0,2654.0, So I'll make you laugh.
2654.0,2655.0, That's okay.
2656.0,2658.0, You don't know how you've made it face.
2658.0,2663.0," And also, I know that we had this two weeks ago."
2663.0,2664.0, The get out.
2664.0,2666.0, You can see how pathetic your life is from playing to play games.
2666.0,2667.0, Yeah.
2667.0,2668.0, So I know there are a couple entries.
2668.0,2669.0, And I was out of it down last week.
2669.0,2671.0, But quite a few you just see them on your phones.
2671.0,2672.0, I saw a couple of them.
2672.0,2674.0, So I'm just going to give it one more week if you have any more entries.
2674.0,2678.0, They take a screenshot and how many hours you've logged in any game.
2678.0,2680.0," And the winner, I'm just going to send some hardware to."
2680.0,2684.0, So are you going to pick a winner based on just pure hour input?
2684.0,2687.0, Or like combine that with like you should have some.
2687.0,2689.0, I'm thinking you should give it a good question.
2689.0,2692.0, A curve based on like help pathetic the game is.
2692.0,2693.0, Okay.
2693.0,2694.0, You know.
2694.0,2695.0, That's what you're thinking.
2695.0,2697.0," If it's 800 hours and hours, galaxies."
2697.0,2698.0, Yeah.
2698.0,2699.0, You get bonus points for it.
2699.0,2700.0, Exactly.
2700.0,2702.0," So it's like, wow, you know, 300 or 400 hours."
2702.0,2705.0, Like that's pretty much a normal American.
2705.0,2706.0, Okay.
2706.0,2707.0, So we'll do eight hours.
2707.0,2708.0, Okay.
2708.0,2709.0, Okay.
2709.0,2711.0, I say two scales.
2711.0,2713.0, One for most pathetic and one.
2713.0,2714.0, Okay.
2714.0,2715.0, So two awards.
2715.0,2716.0, Two awards.
2716.0,2717.0, One for the most pathetic game.
2717.0,2718.0, And then another one.
2718.0,2719.0, And then another one.
2719.0,2720.0, The hardest.
2720.0,2721.0, Russian.
2721.0,2722.0, Sure.
2722.0,2723.0, Fucking.
2723.0,2724.0, Whoa.
2724.0,2725.0," Oh, shit."
2725.0,2727.0, Beep that one out.
2727.0,2728.0, Sure.
2728.0,2729.0, Volume.
2729.0,2732.0, I guess Sean's going to have to learn how to do the beat.
2732.0,2734.0, I guess post production is a new post production for this one.
2734.0,2735.0," Thanks, Darren."
2735.0,2736.0, Sorry.
2736.0,2738.0, It's at the very end of least.
2738.0,2739.0, This one that's getting lively.
2739.0,2740.0, We got to just keep going.
2740.0,2741.0, We got to keep going.
2742.0,2743.0," Yeah, let's start the podcast now."
2743.0,2744.0, Get out of the Daren drop that.
2744.0,2745.0, Yeah.
2745.0,2746.0, Yeah.
2746.0,2747.0, We're ready to rock.
2747.0,2749.0, Actually we're ready to stop.
2749.0,2750.0, Okay.
2750.0,2751.0, You can stop there.
2751.0,2752.0, Yeah.
2752.0,2753.0, We got a roll.
2753.0,2756.0, But thank you all for joining again and thank everybody out there for listening.
2756.0,2758.0, And we will see you again next week.
2758.0,2759.0, Bye.
