start,end,text
0.0,16.0," Hello and welcome once again to the CGW radio podcast. This is Jeff Green, the editor and chief of computer gaming world magazine and I have three CGW editors with me today and they include the following."
16.0,26.0, Sean Elliott. Darren Gladstone. Sean Maloy. And kids were it's a little scary here today because we are flying without a net. There's no.
26.0,34.0, The guys who have produced our podcasts in the past are not in the room. Instead taking the soundboard is our own Sean Maloy over there.
34.0,38.0," Yep. I can go to the Sean. It's a little nervous, a little nervous. A little bit."
38.0,42.0, I will carry it. There's some light. And we're also flying without a Ryan Scott today. Oh and no Ryan Scott.
42.0,45.0, Yeah. Right. So should we bring up to we get it out of the way? Okay.
45.0,50.0, We bring up Guild Wars. There's actually a lot of spec and I just hit level 20. I mean for the 30th time.
50.0,54.0, Yeah. Think you hear that and they have two million subscribers now.
54.0,62.0, How's that? Okay. So it's as if he was here. So Ryan good luck on the Rookanel. See you next week.
62.0,66.0, Oh yeah. We should make fun of Ryan. He's getting yet another route canal. Yeah.
66.0,72.0, This one's been rough. I heard that sucks. Ouch. Yeah. I think the lesson to all you out there is brush your teeth.
72.0,77.0," In fact, it's a floss. Plossless 20. Pepsident. It's going to help. Yeah."
77.0,84.0," If you're listening to this, if you're listening now and you haven't flossed in the last 24 hours go ahead and get a piece of floss up right now."
84.0,91.0," Why you listen on the bus doesn't matter. That's what I'm saying. Sean, are you nervous? Are you okay over there?"
91.0,97.0, I think I'm fine. All right. I can handle this. All right. He's got a little bit of a deer in the headlight. Sort of look.
97.0,103.0," Well, I'm watching all of these lights flashing. So pretty scary. Yep. Not like. Oh, so it's kind of like I want to go to color organs from the set."
103.0,114.0, Put on some pink Floyd for you over there. Okay. So we've had a bit of a not weak because Sean and and Sean and Elliot. That's great.
114.0,122.0, Sean Elliott and Darren were were at a town. I was actually at a town this weekend. So does that mean we've been playing any games?
122.0,128.0, A lot of golden tea golf golden tea golf. The game for all vacationers. Yes.
128.0,134.0," I guess joking. Yeah. I was playing a besides good brother. See my sister get married. Congratulations, Kerry."
134.0,146.0," Yeah. I also was playing a tight and quest. I played like the first level of that. Yeah. I'm kind of like, I mean, I'm still like, I basically got to Sparta. Is that how far you got? Yeah."
147.0,153.0," I don't know. I got one of those, you know, you know, your mom says if you got nothing nice to say sort of things going on."
153.0,158.0," But it's early yet. It's early yet. Yeah. One day I kept thinking as I mean, the game looks pretty. Looks very pretty."
158.0,161.0, And it's he and I guess what I'm playing it. I'm thinking.
161.0,173.0," Age of what age of empires did to, you know, warcraft. This is kind of what Titan Quest is doing to like, the obliques. Okay. So it's kind of right now. All I was seeing is just way too much Diablo."
174.0,180.0," You know, it was like a scene for Diablo. You know, I mean, you had 3D."
180.0,191.0," The one thing I think it could be a strong selling point could be the map the map making tool. I haven't played around yet, but I mean, does it do random dungeons or is it?"
191.0,195.0," Gosh, I haven't even played enough to know there. My opinion. I don't think so. Yeah."
195.0,202.0," That's one of the only things that you know, to criticize Diablo. The only things I didn't like about it is the randomness because there's really no it's not they're not ran."
202.0,207.0," Wow, you didn't like in this or from our not random from the last preview I edited."
207.0,211.0," So I said, okay, but it's no."
211.0,224.0," Because on how can you didn't like the randomness? I like level design. I like when people can intentionally put a room in a spot and like it, you know, has it's there for reason because this is where they want to ramp up the challenge."
224.0,229.0," I mean, I understand that Diablo is all about it. I love Diablo. I just that was the only thing."
229.0,234.0," Right. Oh, I wish they had actually, you know, designed a few of these levels instead of just kind of have, you know, the algorithm and make them."
234.0,238.0, And the algorithm was really good at making them. Right. But I'm going to be real downscadding.
238.0,249.0," I read about Helgate, you know, just because it's just in the most general way in that like in my experience, the randomly generated content is usually boring content, you know, it's not it doesn't have the polish of design words."
249.0,261.0," It's constructed very carefully and deliberately to create, you know, different paths of, you know, progress and action and this and that and I think the last experience I had with the randomly generated content was horrible."
261.0,266.0, And that was that PSP game which was the one it was like champions and aura.
266.0,269.0," No, it was the one where you're inside. It was supposed to as a Konami first person."
269.0,276.0," Oh, you're putting on coated arms. Yeah. And it was just like, I mean, basically hello dead ends and back and forth."
276.0,282.0, I would think a shooter wouldn't wouldn't play itself out as well though as a deablo style game.
282.0,289.0," Right. Well, I understand some of the concerns and I think Helgate actually, I mean, like obviously it's not out yet. It has a lot of time before it's ready."
289.0,296.0," But I think there's some, like they are looking to address those problems and when I was, you know, doing the cover story a couple months back, they were saying how,"
296.0,301.0," when they were, when they're putting the game together, they're actually creating algorithms that are actually,"
301.0,306.0," you know, putting a lot of elements together inside the inside each room in each environment, you're playing in it."
306.0,310.0," Like it's like, like, haphazardly, you know, slapped together, it makes some kind of sense."
310.0,317.0," Right. I guess in Diablo, I mean, the agarith of Smasa bin such that, you know, certain things had to happen, right?"
317.0,324.0," I mean, obviously, like the butcher is put there, you know, like you know, no matter what on level three, the boss is going to be there."
324.0,327.0, Right. That's just kind of constructs a maze a little differently around getting there.
327.0,331.0," I think in terms of the visual experience, expectations were a lot lower than two."
331.0,335.0," Yeah. Yeah. I was like, if you see that same, I don't know, what would it be in Titan Quest?"
335.0,339.0, You see that same scorpion cave a thousand times in a row.
339.0,341.0, Right. I don't know. Maybe not.
341.0,343.0," Well, I'm definitely willing to give it another question."
343.0,345.0," Well, it has been a scorpion. It's been mostly say to so far."
345.0,346.0, Yeah. Nice.
346.0,350.0, Yeah. I still want to play more of it. I'm not ready to judge it yet.
350.0,355.0," I just was expecting something a little different than Diablo and it plays for, I mean,"
355.0,363.0," as you go through the tutorial mission, you know, everything that they show you, you know, the one of the towns people, you know, and here's the place where you'll resurrect."
363.0,367.0," Everything was like, oh, yeah, that's a Diablo feature. Oh, yeah, that's a Diablo feature."
367.0,369.0," Oh, there's the town portal. Exactly."
369.0,371.0, Yeah. I don't know.
371.0,379.0," Yeah. Well, there was one thing kind of bummed me out. I mean, maybe it'll be addressed later on, but you pick that one kind of direction your character class is going to go."
379.0,383.0," Or rather, I should say the skill sets you're going to choose, and you can't go back."
383.0,387.0," Yeah, the decision. It's all over. And you just kind of go, it seems like you just go forward from there."
387.0,391.0, So which Diablo cones have kind of like out Diablo Diablo?
391.0,394.0, I can't remember. I say none.
394.0,395.0, Yeah. I'll probably pop into my money.
395.0,400.0," Well, I remember actually before this, I was actually like looking back over a couple older games I remember playing."
400.0,403.0," Like, you remember, you remember, remember, knocks?"
403.0,407.0, Yep. I thought that was pretty good. That was pretty good Diablo clone did a decent job.
407.0,411.0," But see, that's all you can ever say. That was like, it's a decent Diablo clone."
411.0,415.0," There's never one that made you say, okay, this is better."
415.0,418.0," Yeah. You know, like we most of us still have Diablo on our heart."
418.0,421.0, That's pretty interesting for a gaming genre.
421.0,424.0," You know, well, it seems like everything else."
424.0,427.0," It's like, you know, it's something's going to trump it in five years."
427.0,431.0," And it has or at least there's like, at least there's a debate to be had about something."
431.0,440.0," If you're saying, hey, what's, you know, it's not like there's just one shooter that's the only one that people will say is the big granddaddy and still by far the best."
440.0,443.0," Right. I mean, in real time strategies."
443.0,446.0," Yeah. I mean, Blizzard almost did it, but not quite, right?"
446.0,451.0," I mean, because you could argue that Starcraft kind of supplanted warcraft."
451.0,457.0," Hmm. But there's plenty of people who would take age of empire, so over Starcraft or Rise of Legends now."
457.0,460.0," I mean, there's all sorts of the Commander Conquer series."
460.0,465.0," And they've all definitely done something to, you know, to it and changed it and so on."
465.0,469.0," Yeah. Well, it's an interesting genre because it, you could argue that it's more complicated."
469.0,474.0," It gets if you start adding these layers and something you're going away for what makes it, you know, the opposite."
474.0,478.0," Right. It whereas like an RTS, you kind of want these extra strategic layers."
478.0,480.0," Yeah, I was just killing and shopping."
480.0,483.0," Yeah. And there's not, there's not even that much interface streamlining to be done."
483.0,488.0," Whereas like an RTS is there was, you know, since Starcraft has been a lot of changes just in how interfaces were."
488.0,491.0," I mean, it was just perfect."
491.0,498.0," I almost feel like, in order to make a game that's going to supplant a Diablo instead of trying to focus on, like, basically doing the same thing."
498.0,501.0, And I did a little better. Just try to take it in a different offshoot direction.
501.0,505.0, Make it more like action based. What about guild wars? Isn't guild wars?
505.0,508.0," Well, guild wars is kind of kind of is kind of is."
508.0,510.0, Right. And would not do that.
510.0,511.0, Ryan Woods hit him back here.
511.0,513.0," Oh, from a million people could."
513.0,515.0, The new great success.
515.0,516.0," Oh, who?"
516.0,518.0, He doesn't even need to be here.
518.0,520.0, We're actually doing all the talking for us.
520.0,525.0," Speaking of, I've played a few mods when I got back in while the levels were not randomly generated."
525.0,531.0," In some cases, they might as well have been one of them is Troy divine playground image."
531.0,532.0," Oh, for that."
532.0,539.0," And it's a university project. And I felt bad as like when I first came out, you know, the beta first came out quite a few servers up."
539.0,543.0, And then now when I went on to play there are two servers. One was occupied.
543.0,549.0," And then unfortunate thing for this game. I mean, again, the recap is, well, it's basically, you know,"
550.0,557.0," Trojans versus Greeks. And it's a cool idea that you have a bunch of AI controlled bots on your side and you're able as you as you're the one you're controlling dies,"
557.0,559.0, or able to take over the other ones.
559.0,564.0," But they're all brain dead, which is a big problem, but they're able to aim really well."
564.0,570.0," So it's like you'll see a guy standing in a corner somewhere, but spear sniping you across the entire map through wall."
570.0,571.0," Oh, yes."
571.0,576.0," And then other few, I'm getting to the real messed up part of the game, but other funny things are that you have this growl."
576.0,580.0, It's like this godly growl and it's supposed to whip up the enemy into fear and submission.
580.0,583.0, But basically what happens is they do this little dance like they have to go pee.
583.0,586.0, So you run up through a whole mob of the enemy defenses.
586.0,591.0," They run and the growl is more like a constipated like groaning, you know."
591.0,597.0," And so you run through them and you're like, and then all of a sudden, their whole army is just standing."
597.0,598.0, Just dancing.
598.0,599.0, I'm being afraid.
599.0,600.0, That's kind of cool.
600.0,602.0, We hear at a darren's office once a day.
603.0,604.0, Yeah.
604.0,611.0, The messed up thing in terms of the level design is that you really appreciate about the published games is that you're not participating in the beta process.
611.0,616.0," And that basically with the pods, you're doing it, but you realize just what work it really is."
616.0,623.0," Because I mean, I think in the first, you know, the first day of playing it, we found all these ways to exploit it where you're supposed to get over this castle wall and you have these ladders."
623.0,629.0," So within minutes, we're like, okay, let's wait for our teammates to get up the ladder and just pull the ladder out from under him and laugh at him."
629.0,630.0, And we kept doing that.
630.0,639.0," And then after that, take climb the wall, take the ladder myself and then go and run and get it and climb up buildings that they clearly hadn't intended me for you to climb right."
639.0,642.0, Take the ladder back up there with me and then just drop bombs on everyone.
642.0,644.0, That's how you game it well being untouchable.
644.0,649.0, But doesn't like if you knew respect for games where where the exploits are all gone.
649.0,650.0," Yeah, no, they're readable."
650.0,655.0," It's like, yeah, I mean, it's like for us editing like in its cycle, PDF series or something, you know, right."
655.0,656.0, I mean single handedly.
657.0,660.0," And then another cool model is playing, well, a cool model is playing."
660.0,662.0, It was a zombie strike.
662.0,664.0," It's a, yeah, it's a counter strike."
664.0,665.0, It's really simple.
665.0,666.0, There are two iterations of it.
666.0,673.0," One is basically you and, you know, your friends, your actual players face off waves of zombies blast them."
673.0,678.0," Then another version once you're, you know, it's competitive and once you're killed by a zombie, you become one then."
678.0,679.0, But pretty fun.
679.0,682.0," Nice, you know, simple, simple diversion from the usual counter strike."
682.0,686.0," And the down point on that, the on the versus mode is that the maps again weren't designed for it."
686.0,691.0, So the exploits now are that everyone with the guns goes and find some ledge to camp.
691.0,693.0, And you'll see like everyone on each other's shoulders.
693.0,697.0, And you'll see a mountain of like 10 dudes blasting anything that's forced to funnel down one.
697.0,698.0, One route like zombies.
698.0,702.0," No, those are those are the human versus on the five."
702.0,706.0," Yeah, and then so you see the zombies, a board of Lee rushing at you and he's keep blessing them."
706.0,707.0, That's a zombie skins cool.
707.0,708.0, They're all from half life.
708.0,710.0," Yeah, they're a couple of half life too."
710.0,712.0, So it's all like the head crabs are on the head crab do.
712.0,716.0," Yeah, and there's other basically, you know, the ones that rush really quickly at you."
716.0,718.0, The ones from Ravenholm.
718.0,722.0," If you took off the head on them, they're like, these emaciated wasted little things."
722.0,724.0, So that's that's their benefit. They're really hard to hit.
724.0,726.0, Their heads are like these little pins.
726.0,727.0, And that's certainly weak point.
727.0,729.0, So it's pretty cool.
729.0,731.0, I definitely recommend zombies are always cool.
731.0,733.0, Like a guy for zombies.
733.0,735.0, They can rescue practically any game.
735.0,739.0," You know, that reminds me actually like that one feature that you talk about from zombies strike is the one thing I wish they had in games."
739.0,742.0," Like for stubs, um, stubs the zombie."
742.0,746.0, That had been so cool if you had like a multiplayer mode where you could just like create a whole zombie hoard.
746.0,748.0, And like if you get in the head of humans versus zombies.
748.0,750.0, I could not get into stubs the zombie.
750.0,751.0, I know.
751.0,752.0, I wanted to.
752.0,753.0, I wanted to.
753.0,755.0, I was giving it the minute for the doubt.
755.0,757.0, I wanted to be scary or in less tongue and cheek.
757.0,761.0," I wanted scary zombies, not like farting zombies."
761.0,762.0, Right.
762.0,763.0, I think I'm going into it.
763.0,765.0," You're getting farting zombies, though."
765.0,766.0, I know.
766.0,768.0, You know.
769.0,770.0, Sorry.
770.0,771.0, Yes.
771.0,773.0," I mean, I'm sure zombies probably really do fart."
773.0,775.0," You know, real life."
775.0,776.0, Real zombies.
776.0,778.0, That was over the top.
778.0,779.0, Like that was on the top.
779.0,780.0, It was a little over the top.
780.0,782.0, Not necessarily.
782.0,783.0, Yeah.
783.0,785.0," A lot of full, full on total conversions."
785.0,787.0, Zombie mods for sorcerers still in the military now.
787.0,788.0, She didn't check.
788.0,789.0, Yeah.
789.0,791.0," And then I was and well, it's on be watch next week."
791.0,792.0, But it also stuff.
792.0,796.0, It also kind of like laid out the fact that zombies are really slow.
796.0,799.0, And that's not necessarily all that fun to control and play.
799.0,802.0," Because also we know from 28 days later, they're actually fast."
802.0,803.0, That's true.
803.0,804.0," Man, that's been proven now."
804.0,806.0, I think that's a special period.
806.0,807.0, It goes.
807.0,809.0, It's not be fast on the debate.
809.0,810.0," Oh, yeah."
810.0,812.0, You always come up with this week's special podcast.
812.0,815.0," Oh, in that case, keeps tuned for Dead Island."
815.0,816.0, It's from Techland.
816.0,817.0, It's a Polish developer.
817.0,818.0, They're working on it.
818.0,821.0, It's kind of like a survival horror game on a desert island.
821.0,822.0, So it's.
822.0,823.0, Are they slower fast?
823.0,824.0, Both.
824.0,825.0, Oh.
825.0,826.0, Oh.
826.0,827.0," Oh, oh."
827.0,828.0, That's a separate.
828.0,829.0, It's a separate.
829.0,830.0, It's a separate.
830.0,831.0, It's a separate.
831.0,832.0, Wow.
832.0,833.0, Wow.
833.0,834.0, We had to pull that one.
834.0,835.0, Wow.
835.0,836.0, We did.
836.0,838.0, Did we all play corpse killer here in this room?
838.0,839.0, Yep.
839.0,840.0, We did.
840.0,841.0, Damn.
841.0,843.0, That was one awful game.
843.0,844.0, What was it?
844.0,846.0, Like creepy actors named from that game?
846.0,847.0, Ball dude.
847.0,849.0," He's like, I've seen like a billion movies."
849.0,851.0, Not telly's of all us.
851.0,852.0, Mr. Clean.
852.0,853.0, I don't know.
853.0,854.0, There are someone famous in here.
854.0,855.0," Well, not famous."
855.0,856.0, He's got to be in a Picard.
856.0,857.0, I'm going to look this up later.
857.0,858.0, He's got B.A.
858.0,859.0, I've seen him in a bunch of things.
859.0,860.0, Got a mustache.
860.0,863.0," He's like like, kind of like a go-to-ish kind of thing."
863.0,864.0, I don't know.
864.0,865.0, Ricardo Montelbon.
865.0,866.0," Rich, could have the other."
866.0,867.0, Okay.
867.0,869.0, I'll speak in a.
869.0,870.0," No, that's not speaking of."
870.0,871.0, That was my name.
871.0,872.0, It happened.
872.0,873.0, That was a lesson.
873.0,874.0, I was going to listen.
874.0,876.0, Speaking of the wild movie.
876.0,877.0, Her.
877.0,879.0, I was going to bring up.
879.0,881.0," Well, we were talking about blizzard before."
881.0,884.0, So we know there's a wild-a-wark craft movie announced.
884.0,885.0, Which is already kind of scary.
885.0,886.0, It is.
886.0,889.0, But there's a rumor floating around on our very on-web site.
889.0,894.0, So it must be true that Stephen Spielberg is is pondering directing it.
894.0,895.0, I'm wondering.
895.0,898.0," So it'll be, will it be a call bullshit on that?"
898.0,900.0," Like that's, that's just the biggest fanboy."
900.0,902.0," Oh, you are, you are."
902.0,903.0, Stephen Spielberg.
903.0,904.0, David Rich is going to be.
904.0,905.0, Not.
905.0,906.0, Stephen Spielberg.
906.0,908.0, That's what wild-a-wark craft movie I can see.
908.0,909.0, Yeah.
909.0,911.0," What Stephen Spielberg will be, would be, would be the."
911.0,915.0," Jaws would it be the ET, the Schiller's List or the Munich."
915.0,919.0," Or AI or, or AI or what are some of the other bad ones?"
919.0,921.0, Saving private round is a good one.
921.0,922.0, 1942.
922.0,923.0, Yeah.
923.0,926.0, I can't possibly see that.
926.0,927.0," Oh, wow."
927.0,928.0, Absolutely.
928.0,929.0," How can we actually, how could a world."
929.0,930.0, I think we know immediately.
930.0,932.0," We did the hell, get it directed."
932.0,933.0," Yeah, I know."
933.0,934.0, We want to say.
934.0,935.0, Vey.
935.0,936.0, What was that?
936.0,937.0, What was that?
938.0,940.0, Why do people have to direct?
940.0,942.0, I don't know.
942.0,944.0, What the heck would the movie be about?
944.0,947.0," Why would, you know, I've put in a lot of hours in the world."
947.0,950.0," It's going to be like, no, remember that damn dungeon and dragons move."
950.0,952.0," Oh, God, it's a damn, they're trying to make it funny."
952.0,954.0," And there's going to be like some day, Joe,"
954.0,956.0, and so on is going to level up in the movie.
956.0,957.0, People will be dancing.
957.0,958.0," Oh, go."
958.0,959.0, Yeah.
959.0,960.0, Maybe it'll be about the Sunwell trailer.
960.0,961.0, You should be ashamed.
961.0,964.0, If you're not a scary shun.
965.0,966.0, If someone's listening.
966.0,967.0, Maybe you're right.
967.0,969.0," And heard, you say, you know,"
969.0,970.0, we're the workcraft movie.
970.0,971.0," And immediately, they were like,"
971.0,973.0," Whoa, you need to slow down."
973.0,974.0, I know.
974.0,976.0," You know, this step away from it."
976.0,977.0, The guys are blizzed.
977.0,980.0," It's actually, you're touched about the Sunwell trilogy."
980.0,983.0, But they actually did make a pretty good backstory to the workcraft.
983.0,985.0," Oh, I was at, when I was at Blizzcon,"
985.0,986.0," I said, I'm at Laura Panel."
986.0,987.0," Yeah, it was awesome."
987.0,988.0, Yeah.
988.0,991.0, He was just going off about all this stuff that they're thinking about.
991.0,994.0," And like, it's kind of in some of the quest text if you're paying attention."
994.0,995.0, Yeah.
995.0,996.0, Yeah.
996.0,997.0, Yeah.
997.0,998.0, Think about all this all the time.
998.0,1001.0," I mean, it's pretty close to all the fantasy genres."
1001.0,1002.0, Yeah.
1002.0,1006.0," And they could easily, a Lord of the Rings trilogy sort of thing."
1006.0,1007.0, Yeah.
1007.0,1010.0," I mean, there's a lot more to the game."
1010.0,1011.0, That's the thing.
1011.0,1015.0," Because it's what is the movie is about like a level one guy, you know?"
1015.0,1017.0, A rag to rich history.
1017.0,1019.0, It sounds like it would be more a little more a lot.
1019.0,1020.0," Yeah, more a lot of tales."
1020.0,1023.0," Yeah, more craft story rather than like a world of warcraft story."
1023.0,1024.0, Right.
1024.0,1025.0, Yeah.
1025.0,1027.0," It's like, if you collect five more lockfins,"
1027.0,1029.0, you're going to see like five minutes of the movie.
1029.0,1032.0," Or even like, you know, when they have like the the climatic battle with it,"
1032.0,1035.0, makes you hear something you see the characters are waiting in line for someone else.
1035.0,1036.0," You know,"
1036.0,1037.0, I love it.
1037.0,1038.0, It's going to make it.
1038.0,1039.0, Yeah.
1039.0,1041.0," And like you're, and the leader of your guild is going."
1041.0,1043.0, What the fuck?
1043.0,1045.0," Now, I put it there on your,"
1045.0,1047.0," Yeah, your heroic ending of the movie."
1047.0,1049.0, If there's nothing we're waiting for.
1049.0,1051.0, I think it's all on the wrist bonds at the end.
1051.0,1052.0, Okay.
1052.0,1054.0, So we're saying Spielberg's probably not going to direct us.
1054.0,1056.0, I don't know if people Jackson's doing halo.
1056.0,1057.0, He's not directing that necessarily.
1057.0,1061.0, He's going to make a lot of money no matter who directs it.
1061.0,1062.0," I mean, they don't need to attach."
1062.0,1065.0," So I'm like, I mean, if he's producing it,"
1065.0,1067.0," that's a whole later, different story."
1067.0,1069.0," Like that, that I, that I might buy,"
1069.0,1072.0, but I don't think he'd ever sit down and direct the thing.
1072.0,1075.0, I'd worry about he's Spielberg would cast in the world of warcraft.
1075.0,1077.0," Maybe too, you know."
1077.0,1078.0, The lies you would.
1078.0,1080.0," Yeah, Reese withers bonus."
1080.0,1081.0, Thrall.
1081.0,1083.0, That's what I'm not doing.
1083.0,1085.0, I didn't make any sense.
