start,end,text
1085.0,1086.0," McColley, coke in."
1086.0,1090.0, So I've been playing a lot of Half Life 2 episode one.
1090.0,1092.0, I finally jumped on that bandwagon.
1092.0,1095.0, Reinstall the steam on my machine.
1095.0,1098.0," Reluctantly, but then it actually worked really well."
1098.0,1101.0," I, I, I'm here to say."
1101.0,1104.0," I actually, I, I, I, I, I, I never thought I'd"
1104.0,1107.0, say it because boy did I hate it when it first came out.
1107.0,1110.0, But I see it worked pretty much like a dream as you said it would.
1110.0,1112.0, It was well.
1112.0,1113.0," Well, it's good."
1113.0,1117.0," You know, I think I took them after what the first six months after Half Life 2 launched,"
1117.0,1120.0," then it was kind of like, I got a lot of bugs iron out."
1120.0,1122.0," Did you get the box copy or did you buy the,"
1122.0,1124.0," No, I just thought I'd just bought it,"
1124.0,1126.0," essentially online, I bought it late at night."
1126.0,1129.0," And in the morning, it was, you know, installed on my machine."
1129.0,1133.0," So I've been actually having a lot of crashes in the game,"
1133.0,1135.0, but I'm not blaming steam.
1135.0,1137.0," I'm blaming my old video card, I think."
1137.0,1140.0," However, I do like to game a lot a lot."
1140.0,1143.0," And the thing I, I'm liking about it the most,"
1143.0,1147.0," and I think I'm it, I got to say I'm enjoying it more than Half Life 2 itself."
1147.0,1151.0," Is, I like the pacing a little better."
1151.0,1155.0," And I think that the, the puzzles are a bit more creative."
1155.0,1158.0, I've actually had to stop and think a few times.
1158.0,1159.0, Much more than half life.
1159.0,1162.0," I mean, everything ends up being kind of obvious."
1162.0,1164.0, But some of the stuff is really creative.
1164.0,1166.0, The elevator was was awesome.
1166.0,1170.0, The with the debris falling on you is you're going down stuff like that.
1170.0,1172.0," Yeah, and I'm just saying even though it's minimal,"
1172.0,1175.0," I just went back to, I think it's really cool how they"
1175.0,1178.0, develop the interacting between the different characters.
1178.0,1181.0," I mean, just, I don't know, I was just,"
1181.0,1185.0," this past week and I was doing a comparison contrast with the syneposodes and half life,"
1185.0,1187.0, because I'm doing the review first in.
1187.0,1191.0," And it just, it's, I'm reminded of how, like,"
1191.0,1194.0," good job, well, does storytelling."
1194.0,1196.0," Yeah, and I really do."
1196.0,1201.0," Yeah, they, they, I actually can't think of anybody else who really does it like that."
1201.0,1204.0," Who tells a story and a good story,"
1204.0,1208.0," actually in the game without the need to break away to a cutscene,"
1208.0,1211.0, without an overabundance of exposition.
1211.0,1214.0," Now, they're actually, like just hearing the,"
1214.0,1218.0," the stuff on the loudspeakers as you go by, like as you're gaming,"
1218.0,1223.0, really kind of fills in details in a way that I just don't see anybody else doing.
1223.0,1227.0," That definitely makes cutscenes just seem completely, you know,"
1227.0,1228.0, pass a no.
1228.0,1229.0," Well, I think most people, kind of removing the cutscenes,"
1229.0,1232.0," but you still have that, that I'm an operator who knows,"
1232.0,1234.0," who knows, you know, who with the handler back at home Bay,"
1234.0,1236.0," who is, or he's barking out commands and orders,"
1236.0,1238.0, or telling you what's up.
1238.0,1240.0," Do you guys, the first time you play a game,"
1240.0,1241.0, do you sit through the cutscenes?
1241.0,1242.0, I do.
1242.0,1243.0, I do.
1243.0,1244.0, You do.
1244.0,1245.0," Yeah, I end up skipping them."
1245.0,1247.0," Yeah, I have to get a feel for what the story's about."
1247.0,1250.0," I'm the kind of guys, yeah, I'm the kind of guy who, like,"
1250.0,1253.0," if everything's printed out on the screen that someone just said,"
1253.0,1256.0," and I already read it all, I'll still listen while they read it."
1256.0,1257.0, Wow.
1257.0,1259.0," So, one of your managing editor."
1259.0,1262.0, That's just a couple of typos.
1262.0,1264.0, And then in proper diction.
1264.0,1268.0," There's a lot of typos and the heroes of mine magic five cutscenes,"
1268.0,1271.0," you know, in the subtitles."
1271.0,1272.0, Less than translation.
1272.0,1273.0, Yeah.
1273.0,1276.0," Um, getting the cut line."
1276.0,1277.0," So, okay."
1277.0,1279.0," So, we're going to break for our sponsor."
1279.0,1282.0, And we'll be back in a minute.
1282.0,1284.0, One up now.
1284.0,1285.0, We're great.
1285.0,1289.0, He was being brought to you by Tom Clancy's Ghost Recon Advanced Warfighter Chapter 2 content.
1289.0,1294.0, That's an all new downloadable content package coming up for Tom Clancy's Ghost Recon Advanced Warfighter.
1294.0,1298.0," Chapter 2 includes four all new missions along with eight relic-gram apps, five new weapons,"
1298.0,1301.0, and new game types to extend the Xbox Live experience.
1301.0,1305.0, It's available for the Xbox 360 at the end of June on Xbox Live marketplace.
1305.0,1309.0," Hi, this is garnet Lee host of One Up Years."
1309.0,1313.0," Every week in the month of June, one up radio along with and one street ball is giving away"
1313.0,1315.0, $100 iTunes music store gift cards.
1315.0,1319.0, All you have to do is listen to one up years this Friday afternoon to learn how to win.
1319.0,1322.0, Or you can find the contest rules at our message boards.
1322.0,1324.0, That's boards.1up.com.
1324.0,1329.0," $100 in iTunes, goodness courtesy of and one street ball and the one up radio network."
1329.0,1333.0," So, any computer entertainment takes no responsibility for this offer."
1334.0,1336.0," And we're back, see?"
1336.0,1338.0, So fast through the magic of radio.
1338.0,1341.0, It's like we didn't even hear it.
1341.0,1345.0," But whatever that was, it's a fine sponsor."
1345.0,1349.0," You just, it's a wonderful, wonderful product."
1349.0,1351.0," I mean, we highly recommend you get it."
1351.0,1353.0, Whatever the heck it was.
1353.0,1355.0, So you just proved the magic.
1355.0,1357.0, I'll be from Activision Wrong.
1357.0,1358.0, Right there.
1358.0,1359.0, That's right.
1359.0,1364.0, I was going to read you guys a quote that showed up apparently in the New York Times this morning.
1364.0,1369.0," And if this quote is wrong and he didn't say this, then I blame one up.com."
1369.0,1373.0, Guess this is on there from page that I scribbled it down.
1373.0,1380.0, It says this is the CEO of Activision said this in an article about games.
1380.0,1388.0," He said, quote, the idea of full downloadable games is so far in the future that it's almost"
1388.0,1390.0, incomprehensible.
1390.0,1392.0," Boy, that's wackiness."
1392.0,1395.0, What would wild do without him?
1395.0,1398.0, It was the topic of a good interview.
1398.0,1407.0," The context of that was sales and video games and general, the client and the CD market and how we're going to pump things back up."
1407.0,1411.0," I don't think that was the point of the article, but I think that's something he said on."
1411.0,1420.0," I think he's not even just saying, you know, it's an idea who's to the who's time will come, but we don't know exactly when it will come across the board."
1420.0,1422.0, It's so comprehensible.
1422.0,1424.0, I think it's incomprehensible to him.
1424.0,1431.0, Maybe it's like we are sending him to valve.com or telltale games or how about how about how
1431.0,1435.0, how about he boots up that Xbox 360 and looks at all this stuff happening on live arcade.
1435.0,1449.0," Yeah, I think it goes on to say that, you know, he and some of the other folks who are still not completely solved are more into the idea of downloadable content of a game that you've already bought on a disk like that they can get behind."
1449.0,1450.0, Right.
1450.0,1457.0," The idea of fully being able to, of buying a full game online, he sees as apparently incomprehensible because it's so fun to future."
1457.0,1460.0, Is it referring just to consoles or PCs?
1460.0,1465.0," Obviously if he's referring to PC, there you can do that already, so I don't understand."
1465.0,1468.0," Yeah, I'm hoping he's just referring to console games."
1468.0,1472.0," I mean, in that respect, I mean, I could see some sense, but now let's say he's full of crap anyway."
1472.0,1473.0, All right.
1473.0,1474.0, Just kidding.
1474.0,1476.0, Hard drive on the PS3.
1476.0,1478.0, I know we're just kidding.
1478.0,1479.0, We love Activision.
1479.0,1483.0," Wait, I take a stand there."
1483.0,1488.0, Sorry.
1488.0,1494.0," Every month there's some publisher mad at us, so maybe it's active as mentioned this month."
1494.0,1496.0," Yeah, we eagerly await the phone calls."
1496.0,1497.0, Right.
1497.0,1498.0, It's not them.
1498.0,1505.0," I mean, but that's an, if that really is as perspective and it really is about PC games, that says a lot."
1505.0,1510.0," I think, I mean, that says it does huge perception humps to get over here."
1510.0,1511.0, Yeah.
1511.0,1513.0, That's a lot of a game company is really thinking that.
1513.0,1515.0, And even if it is about the console.
1515.0,1519.0," Well, I guess, the thing is like, you know, we're the early adopters."
1519.0,1520.0," Yeah, we are."
1520.0,1522.0, So we're the guys buying into this advanced technology.
1522.0,1526.0," It's the people that target and Walmart, the people that are making the major sales, the keep these companies a flow."
1526.0,1532.0," But does the same people that buy it, it games that target Walmart now are already used to downloading ring tones for their cell phones."
1532.0,1533.0, Very true.
1533.0,1534.0, Getting music that way.
1534.0,1537.0," I mean, I think they're all the cards are in place."
1537.0,1538.0, Right.
1538.0,1540.0, But it's a big difference when you're talking about like a two gigabyte game.
1540.0,1541.0, Right.
1541.0,1542.0, That's why that's a hard drive device.
1542.0,1548.0, That's why I point out like PS3 is going to have quite a enormous hard drive on by my console standards.
1548.0,1550.0," Yeah, but how big is that hard drive?"
1550.0,1553.0, And you can also swap mount on the Xbox.
1553.0,1557.0," So I mean, it's not it's definitely not incomprehensible on either of those."
1557.0,1561.0," I mean, that's to say if he's talking about that, that's based."
1561.0,1565.0," Yeah, I think it's the extreme of that quote is what's kind of surprising."
1565.0,1566.0, Right.
1566.0,1568.0," And all fairness though, you know how much journalists suck."
1568.0,1571.0, Sometimes they do have to go on one up.
1571.0,1572.0," Oh, I get it."
1572.0,1573.0," Oh, my goodness."
1573.0,1574.0," Hey, no."
1574.0,1576.0," No, but sometimes they have it."
1576.0,1580.0, They'll have it in a agenda and they'll like selectively pull that quote apart.
1580.0,1581.0, That's true.
1581.0,1584.0," So maybe he, you know, we would never do that."
1584.0,1585.0," No, never."
1585.0,1591.0, Because we're trying to like the boring Monday morning press release batch from Activision and scan through it and
1591.0,1595.0, found one slightly possibly incendiary comment.
1595.0,1598.0," Yeah, we know."
1598.0,1603.0, Maybe I'd like to read the comments to do a little more research before we actually discuss something on the podcast.
1603.0,1605.0, So now we just killed five minutes.
1605.0,1606.0, Yeah.
1606.0,1607.0, What funny actually say?
1607.0,1608.0, I don't know.
1608.0,1610.0, I'll say forgot to record that section.
1610.0,1611.0," Oh, yeah."
1611.0,1613.0," How's it going over there, in the matter?"
1613.0,1614.0, Pretty good.
1614.0,1615.0, Yeah.
1615.0,1617.0," Still lines moving, which is very encouraging."
1617.0,1619.0," Lots of beeping, lots of flanking dots."
1619.0,1622.0, The red light that's not supposed to go on has not gone on.
1622.0,1623.0, Excellent.
1624.0,1627.0," Well, you got time to talk about your gaming lovers."
1627.0,1628.0, Okay.
1628.0,1629.0, Okay.
1629.0,1631.0," Now, when we say our gaming lovers,"
1631.0,1633.0, we actually talked about.
1633.0,1634.0, We're talking about the game.
1634.0,1635.0, We'll let you always talk.
1635.0,1636.0, Yeah.
1636.0,1637.0, Yeah.
1637.0,1638.0, No.
1638.0,1641.0," We were talking about last week about, you know, online romance or whatever."
1641.0,1644.0, We figured we could do it with our YouTube and Nurem because it could actually be a mature discussion.
1644.0,1645.0," Oh, I see."
1645.0,1648.0, We had giant breaking down the sex talk.
1648.0,1649.0, Actually was Jane.
1649.0,1652.0, We had Jane from one up show.
1652.0,1653.0," Oh, that's right."
1653.0,1656.0, Who up to the maturity level quite a bit.
1656.0,1662.0," However, she is the one as somebody pointed out to me and my blog in a blog comment."
1662.0,1664.0, She said the word tits first.
1664.0,1665.0, She did that.
1665.0,1668.0, It was great because it totally opened it up to say it after she did.
1668.0,1670.0," It's like, all right, the girl said it first."
1670.0,1671.0, I'll let you have to set it.
1671.0,1673.0, And now I'll open it up to you.
1673.0,1676.0, I have to listen to podcast.
1676.0,1677.0, It was good.
1677.0,1678.0, We said the word tits.
1678.0,1680.0, Apparently.
1681.0,1688.0," No, but when you say gaming lovers, I was actually, I meant our real life partner of spouses."
1688.0,1692.0," What I know, I just said it because it sounds like goofy like adult beef swelling."
1692.0,1694.0," You're my, you're making me gaming love."
1694.0,1696.0," Because it's, uh, it's an issue."
1696.0,1697.0, We all face isn't it?
1697.0,1702.0," We're kind of all of us here in this room and even Ryan, believe it or not, this interrelationship."
1702.0,1704.0," And, uh, we have to, I should say it."
1704.0,1705.0, Ryan.
1706.0,1707.0, You're not here.
1707.0,1710.0," If you're, if you can't make the podcast, that's what you get, you know."
1710.0,1712.0, It's definitely your root canal for some other time.
1712.0,1713.0, You're probably already straight.
1713.0,1714.0," Yeah, it is."
1714.0,1715.0, It's a blessing.
1715.0,1728.0," Yeah, no, we all to some degree have to deal with this, like, you know, I mean, well, let me just ask Sean."
1728.0,1729.0, Elliott.
1729.0,1730.0, This is topic.
1730.0,1731.0, I like to talk about it.
1731.0,1734.0," Does that, does your, does your partner play games?"
1734.0,1735.0, Yes.
1735.0,1737.0," And, and or tolerate you playing games?"
1737.0,1748.0," She does, but, uh, yes, so basically, I mean, a long stereotypical line is almost where she's definitely in, she plays but jooled like crazy bunnies book store girls love that stuff."
1748.0,1749.0, Right.
1749.0,1754.0," All the, so all the pop cap games, big, fiend form and then, you know, Nintendo games with me, DS, warrior, where and that sort of thing."
1754.0,1755.0, Mm-hmm.
1755.0,1756.0, Definitely another shooter's.
1756.0,1761.0," And the problem then is that since I play all these damn shooters, is they all look like the same game to her."
1761.0,1762.0, Mm-hmm.
1762.0,1767.0," So I could be playing, you know, Red Ark is still one minute called to do the next thing in the course of an hour, literally go through it,"
1767.0,1771.0," Audink Count of Strike battlefield, and I'm always playing the same game."
1771.0,1776.0," And, right, and when I come, you know, when I bring home a game and I'm like, hey, this is for review."
1776.0,1778.0," Right, and the story on this, I have to play it."
1778.0,1780.0, And it's about field expansion.
1780.0,1783.0," It's like, she's, you know, she's like, don't quit lying to me."
1783.0,1784.0, I know what you're doing.
1784.0,1785.0, I know what you're doing.
1785.0,1786.0, I know what you're doing.
1786.0,1787.0, It's good for an off at the same bowl game.
1787.0,1791.0," So yeah, and it's tough because, uh, yeah, I mean, you definitely, I mean, there's kind of a,"
1791.0,1792.0, you sort of right.
1792.0,1793.0, Yeah.
1793.0,1795.0," So there, guys, again."
1795.0,1799.0," But the other thing is, too, is it's, I think that anyone that's, that's in a relationship has"
1799.0,1803.0," got to deal with it, that there's going to be some kind of disparity between the commitment to the gaming,"
1803.0,1808.0," you know, and it's like, they're definitely times when I want to come home and play and getting to you"
1808.0,1811.0, speak and just yell and goof off and clown.
1811.0,1814.0," And then she comes in for that room and it's like, what the hell are you doing?"
1814.0,1818.0," You know, even the whole notion are you embarrassed and how much I'm out of the room?"
1818.0,1819.0," Yeah, I don't know."
1819.0,1824.0," You know, me, I'm pretty like pretty, I mean, to bear a spent night like to embarrass myself."
1824.0,1829.0," So, but I'll just, you know, I'll be on there talking in insane voices and stuff and"
1829.0,1830.0, rest.
1830.0,1838.0," You actually hit on the one big outtow that we all have here, then your average gamer doesn't."
1838.0,1839.0, Right?
1839.0,1841.0," Which is, we're doing this for real."
1841.0,1847.0," But it's kind of, it's a double edge sort of because it's like when you definitely, there will be times when you really are working and,"
1847.0,1856.0," and, and, and, and, and, and, and, we're playing my girlfriend most just doesn't buy it. She's like, yeah, or it's just because what we do is so divorced from so many people's notions of work."
1856.0,1862.0," And because for one, a lot of people just assume all we do is sit around and play games and we know that we definitely don't do that."
1862.0,1863.0, That's a good idea.
1863.0,1867.0," But, but in the cases when we that the awesome part, you know, when we do get to play games,"
1867.0,1869.0, it doesn't seem like work to anyone.
1869.0,1873.0," And it really isn't at the same time, but, but the bottom of it is we have to do it."
1873.0,1877.0," I want by OPM today, official PlayStation Magazine. I walked by Joe Rubiky's obviously."
1877.0,1878.0, He's a tech developer.
1878.0,1881.0, He's sitting back in his chair with the guitar from Guitar Hero.
1881.0,1882.0, That's cool.
1882.0,1884.0," Playing it, I'm like, I can't believe this is some guy's job."
1884.0,1885.0, Yeah.
1885.0,1886.0, That's amazing.
1886.0,1888.0," Or it's like, you know, an episode one came out."
1888.0,1889.0, I just spent the day playing that.
1889.0,1891.0," Yeah, but that really was your job."
1891.0,1892.0," Yeah, and that's good."
1892.0,1896.0," But I mean, it's kind of the up, I mean, there's a million things I could say, but one thing just"
1896.0,1899.0, thing you saying about your girlfriend not buying it.
1899.0,1904.0," Sometimes what happens with my wife is the opposite, which is that if I tell her it's work,"
1904.0,1908.0, she's actually angry because she thinks I just work too much.
1908.0,1909.0, That's exactly how she is.
1909.0,1914.0," It's almost better if I say I'm just goofing off because then she doesn't feel like, you know,"
1914.0,1917.0, ziff the man and have the other thing too.
1917.0,1920.0, There's no one between because like our hobby is what we do.
1920.0,1922.0, What we love doing is also our job.
1922.0,1923.0, Right.
1923.0,1924.0, Yeah.
1924.0,1928.0," When you go home and you're like, you know, I've been at work all day and I'm feeling to play some"
1928.0,1931.0," games and I feel too and and she's like, what are you talking about?"
1931.0,1934.0," You just played games all day and I was like, no, I didn't have a play to game it"
1934.0,1935.0, work in like two weeks.
1935.0,1937.0, You can hear the total voice I'm used to doing it.
1937.0,1941.0," Actually, I could play the game at work."
1941.0,1942.0, The deal.
1942.0,1943.0, The deal.
1943.0,1947.0, I think you actually have Mike and my apartment because that's the same exact conversation
1947.0,1948.0, that I have at the time.
1948.0,1951.0," Yeah, actually, I can't do that anymore because we've had too many arguments."
1951.0,1954.0, I can't walk in the door and go to a game.
1954.0,1955.0," On by the way, this was,"
1955.0,1957.0, I have to pay attention to my wife and kid.
1957.0,1958.0, Sheesh.
1958.0,1959.0, Sheesh.
1959.0,1962.0," Yeah, this actually was going to be my column this month."
1962.0,1963.0, But now I'm not going to do it.
1963.0,1964.0, Thanks guys.
1964.0,1965.0," No, you could just do it."
1965.0,1967.0," I think the stoppicks pretty, pretty endless."
1967.0,1970.0," Yeah, this is so much good stuff to have me just thinking of it."
1970.0,1972.0," Well, the one thing I got to say that was like Amy,"
1972.0,1975.0," when we first started dating, she wasn't in the house."
1975.0,1977.0, She basically said that she's not a gamer at all.
1977.0,1978.0, She hated stuff.
1978.0,1980.0, She played the mist when she was younger and that was about it.
1980.0,1983.0," And then I introduced you to Grim fan Dango and you know,"
1983.0,1986.0," once I'm on the, I got my hands on a cool, like an adventure game that she might like."
1986.0,1987.0, And she starts playing it.
1987.0,1989.0, And I introduced her to guitar hero and she's hooked on that.
1989.0,1993.0, And so there is nothing I can do to get my wife into gaming.
1993.0,1994.0, That's the best.
1994.0,1996.0, The thing that I learned at least with nothing at all.
1996.0,1997.0, You've done everything.
1997.0,1998.0," I tried all the, all the gutheries."
1998.0,2001.0, Everything you could think of really throw at me.
2001.0,2004.0," Well, like even she's immune to be jeweled."
2004.0,2005.0, And you need to be jeweled.
2005.0,2006.0, Wow.
2006.0,2008.0," The unit book, where we're new to,"
2008.0,2009.0, the little brain age.
2009.0,2011.0," The, like I found that work for me was just like,"
2011.0,2013.0, basically I would have the controller on my hand.
2013.0,2015.0, We do a puzzle game or adventure game.
2015.0,2017.0," And I'm like, Amy, boss me around."
2017.0,2019.0, She knows how to do that.
2019.0,2021.0," So my daughter told me,"
2021.0,2023.0," She's, she's, she's actually really."
2023.0,2028.0," I thought, so my wife, I think you guys do role playing in her boss."
2028.0,2029.0, Being the boss.
2029.0,2030.0, That's what I got scared of.
2030.0,2031.0, Yeah.
2031.0,2033.0," Well, it's, oh shit."
2033.0,2035.0, The podcast six and nasty turn.
2035.0,2036.0, Wow.
2036.0,2037.0," Okay, back on track."
2037.0,2038.0, Yeah.
2038.0,2041.0, I'm looking because my boyfriend is as into it as I am.
2041.0,2043.0, If not more in one of the cases is very cool.
2043.0,2045.0," So I got, I got to, I got to go with a soul caliber."
2045.0,2048.0," But you have to, like, yeah, pretty much it's also dangerous."
2048.0,2051.0, You have to argue though over like the controller or the game or.
2051.0,2052.0," Sometimes, but you, I mean,"
2052.0,2055.0," Wow, it was kind of what we settled on as the default thing when we can't agree on."
2055.0,2057.0," Like, what did you want to play D away?"
2057.0,2058.0," And like, yeah."
2058.0,2059.0," You know, we play, you set up."
2059.0,2060.0," Hey, I like to."
2060.0,2061.0, So you guys play together.
2061.0,2062.0, He's at his desktop.
2062.0,2064.0, And I'm usually at the laptop on the couch.
2064.0,2065.0, And do you play together?
2065.0,2066.0," Yeah, I do."
2066.0,2067.0," Yeah, they're kind of good."
2067.0,2068.0, That's pretty cool.
2068.0,2069.0, Yeah.
2069.0,2070.0," And in fact, that's, that's awesome."
2070.0,2071.0," You know, I actually haven't tried that."
2071.0,2072.0, You haven't tried to get her on MMOs.
2072.0,2074.0," You know, I'm afraid I might create a monster."
2074.0,2076.0," Yeah, I've done it now with my daughter."
2076.0,2080.0," Um, in fact, just today, I got Eggbird, my character moved up into her server."
2080.0,2082.0," So now we're, I've really on the same side."
2082.0,2085.0," I've heard horror stories from friends because who, you know, we're,"
2085.0,2086.0, and then moving together.
2086.0,2089.0," And then like, they had different,"
2089.0,2091.0, They got in different guilds or something.
2091.0,2093.0," And then they like, it ended in divorce."
2093.0,2094.0, Yeah.
2094.0,2096.0," And then like, literally that is that was the conclusion."
2096.0,2097.0, That is.
2097.0,2098.0," I just like, I traced it backwards."
2098.0,2100.0," I'm just like, they got divorced over that."
2100.0,2101.0, Look at the story.
2101.0,2103.0, I love bites and our current.
2103.0,2104.0," Yeah, exactly."
2104.0,2107.0, Like they get to the point where you're looking over each other's shoulder.
2107.0,2108.0, At least that's some of the people in there.
2108.0,2110.0," You know, they're looking over each other's shoulder."
2110.0,2111.0," See, like, what were you talking to in game?"
2111.0,2112.0, Why are they pimming you?
2112.0,2115.0," Why don't they say, yeah, when I say, oh, you know,"
2115.0,2116.0," I'm like, if there's a danger too."
2116.0,2119.0," That's like, like, do you guys, like, what I would"
2119.0,2120.0, wonder about?
2120.0,2123.0," Cause in a way, you know, my wife and this is what she says."
2123.0,2126.0," I don't know if somebody's got to run the household, you know,"
2126.0,2127.0, and there's a little bit of tooth to that.
2127.0,2130.0," If I'm just sitting on my ass, I'll wake in front of the PC."
2130.0,2132.0," Working, I should say yes."
2132.0,2134.0, Working earn her money.
2134.0,2139.0," That if two people are, are, like, do you ever think like, man,"
