start,end,text
0.0,10.16," Hello and welcome once again to the GFW radio podcast this is Jeff Green, the editor and chief of games for Windows"
10.16,18.28, the official magazine this is our official podcast and it's officially December 6th.
18.28,19.28, How did this?
19.28,23.28," Yeah, I think your wife heard you not get the date right you've been troubled."
23.28,25.28, I know I think because I would be.
25.28,26.28, I'm sorry.
26.28,27.28, I don't know what date is.
27.28,28.28, But we're not our anniversary.
28.28,29.84, I need to let this out right now.
29.84,30.84, I'm so freaking tired.
30.84,31.840000000000003, We're all tired.
31.840000000000003,36.120000000000005," This is going to be the most brain dead podcast ever, I think."
36.120000000000005,38.36, It might take some more.
38.36,40.6, Point reader letters to wake us up.
40.6,42.08," Yeah, well, three of us have any."
42.08,46.400000000000006," Actually, I should say who's here today or you should say who you are here today."
46.400000000000006,47.400000000000006, Okay.
47.400000000000006,48.400000000000006, Who are you?
48.400000000000006,49.400000000000006, Ryan Scott.
49.400000000000006,50.400000000000006, Ryan Scott.
50.400000000000006,55.1," Sean Elliott and I'm back from a bit on some business trips, playing Quake Wars and"
55.1,56.1, prior to that.
56.1,58.1, I thought you couldn't talk about it.
58.1,61.06," I mean, I can't go in a details, but I can, you could say you saw it."
61.06,68.46000000000001, I'm sure they just don't want me to go into some prior to the story going to press
68.46000000000001,69.46000000000001, to print.
69.46000000000001,73.46000000000001, I'm tongue tied and got my turrets weird.
73.46000000000001,74.46000000000001, It's tired too.
74.46000000000001,75.46000000000001," Yeah, it's tired."
75.46000000000001,77.86," So Sean, I'm a lawyer and I'm also tired."
77.86,79.5, When do you get a bad child in the light?
79.5,80.5," 30, 30."
80.5,81.5, You were worth a win.
81.5,83.5, When do you get a bad child Elliot?
83.5,84.5, I think we could have a bad that way.
84.5,88.06," I'm just like, maybe two or something, but that's late."
88.06,89.06, Big baby.
89.06,90.06, You can't.
90.06,94.06," You can't make up the entire, we can make up the entire, but this is legit."
94.06,95.06, Yeah.
95.06,97.06," So I, so we just sit here."
97.06,98.82," No, let's launch right into the talk."
98.82,99.82," Okay, let's all right."
99.82,101.98, Let's get into the good times.
101.98,105.18," We're going to talk about, oh, I had a quote to read first."
105.18,106.18, That's right.
106.18,107.18, That's where we're going to start.
107.18,108.18, We're going to play a little game.
108.18,111.26," Yeah, now I'm going to start with this quote from a game developer."
111.26,115.9," And then we're going to see if you guys can get, if anyone out there can guess what game"
115.9,116.9, we're referring to.
116.9,118.9," Okay, here we go."
118.9,119.9, Quote.
119.9,125.14, I'm sorry that we have disappointed so many people on a certain project.
125.14,128.58, Please realize we did what we felt was best.
128.58,131.78, But the cards that were dealt to us in the situation we were in.
131.78,135.42000000000002, We have learned from the experience and we won't make the same mistakes twice.
135.42000000000002,139.14000000000001, The companies we dealt with were professional in every way and we enjoyed working with
139.14000000000001,140.58, them while we did.
140.58,143.46, And appreciated the opportunity to be presented to us.
143.46,147.02, You won't hear anything about our next game and tools almost on the shelves.
147.02,150.58," You lying, lying, liar."
150.58,153.34, So that's a sad quote.
153.34,155.34," Who read, who said was someone felt real bad."
155.34,156.34, What's that about?
156.34,157.34, First and second.
157.34,158.34, They felt real bad about their game.
158.34,160.34, What are they weeping over?
160.34,161.34, Should we just say?
161.34,164.02," That's how we'd wait till they enter the podcast, you know, the draw it out in like"
164.02,165.02, so smooth.
165.02,166.02, That's fine.
166.02,167.02, That's good.
167.02,168.02," People go like, oh, what is it?"
168.02,169.02, Right.
169.02,170.02," Remember, we'll remember."
170.02,171.02, We'll remember.
171.02,172.02, We'll remember.
172.02,173.02, Okay.
173.02,174.02, We'll do it next time.
174.02,175.74," And if you don't care about the rest of us, you can just hit your fast forward"
175.74,176.74, button.
176.74,177.74, Yeah.
177.74,178.74, Fized it.
178.74,179.74, Who said it?
179.74,180.74, But it is significant.
180.74,182.98000000000002," That's the fun part, I guess, because you're never going to guess."
182.98000000000002,189.10000000000002, And it could have a very significant impact on a game that you were hoping to be playing
189.10000000000002,190.10000000000002, sometimes soon.
190.10000000000002,193.10000000000002, And your life is general true.
193.10000000000002,194.10000000000002, Mm-hmm.
194.10000000000002,195.10000000000002, No.
195.10000000000002,196.10000000000002, What is it?
196.10000000000002,197.10000000000002, What could it be?
197.1,199.7, It's a little bit more abstractual from enjoying the rest of the podcast.
199.7,200.7, What do you think about it?
200.7,201.7, Yeah.
201.7,202.7, That's sure they're going to be all bug now.
202.7,203.7, They're going to be only half listening.
203.7,204.7, Which is great to say.
204.7,205.7, What does this mean?
205.7,206.7, This is going to be a shit to say.
206.7,207.7," Well, why is it?"
207.7,209.29999999999998, I've heard of this thing to get that other way.
209.29999999999998,210.85999999999999," It's like, I hate when we come on here."
210.85999999999999,216.54," And if it's a case of, we haven't played too many games recently that we could talk"
216.54,217.54, about or this for that.
217.54,218.54," But in my case, it's tough."
218.54,220.54," You know, we don't want to get on here."
220.54,222.82," Well, I play this, but I can't tell you."
222.82,223.82, But we're often the...
223.82,224.82, You'll have to read it in the magazine.
224.82,225.82, Yeah.
225.82,226.82, We're often the...
226.82,227.82, Right.
227.82,230.98," Part of being, you know, pre-use editor, whatnot, and because, you know, fewer PC games"
230.98,234.34," come out in a month, you know, on the shelves and they do a content one up."
234.34,236.78, But so many great games have been playing.
236.78,238.57999999999998, And that I'd love to talk about.
238.57999999999998,240.82, But I'm just not in position to do it here.
240.82,241.82, What can you tell me?
241.82,244.42, Can you tell anything about what you talk of Quakehorse?
244.42,245.42," Yeah, exactly."
245.42,248.14," I mean, I spent a great deal of time playing three maps."
248.14,249.14, And...
249.14,250.14, Of the fun?
250.14,251.14, Yeah.
251.14,252.14, It was completely fun.
252.14,256.14," I think it was a really good experience, too, because, instead of the usual dog and pony"
256.14,258.26," show, hey, here's this, and did you know you could do this?"
258.26,261.3," And that and the other thing, it was all about sitting down playing it."
261.3,266.09999999999997," I mean, really getting the no-the developers, Paul Wedgewood, lead designer, and just"
266.09999999999997,268.9, hatching it out over what we think make great online multiplayer games.
268.9,271.14, So you don't competitive multiplayer games.
271.14,274.18," Our history's playing these games, and then play the game, and then just sit and talk"
274.18,275.18, with them.
275.18,276.18, Here's what I'm thinking about this.
276.18,278.9," Just kind of concerns me, this is fantastic."
278.9,282.18," You know, I mean, sometimes it's as simple as just saying, hey, good going on that."
282.18,283.18, That's brilliant.
283.18,285.74," No, no other times looking at all the different possibilities."
285.74,288.78000000000003, Because there's so many dials in terms of balancing and introducing new.
288.78000000000003,291.42," Where you able to say, like, you know, but that really didn't work for me."
291.42,292.42," Yeah, I did."
292.42,296.62," I said that online three points, and it was cool because I'm hoping to, you know, I"
296.62,298.90000000000003," mean, I don't want to be so conceited that, again, it's subjective."
298.90000000000003,303.18," I mean, if there's one thing that I'm not too excited about, it could be that someone else"
303.18,306.42," is that it tickles them their fancy perfectly, you know."
306.42,310.3," But I do think, I mean, I do think it's cool to be in a position where at least there's"
310.3,311.3, some chance that...
311.3,313.3, Did you feel like you're being heard instead?
313.3,314.3," No, I'm just..."
314.3,316.18," I'm not prepared to rewrite a press release, you know."
316.18,319.82," I feel bad sometimes when I'm doing that because I feel like, what do I know?"
319.82,320.82, Right.
320.82,321.82," Like, well, I might have been telling them."
321.82,323.26," Yeah, in this case, though, it feels good."
323.26,324.26," I mean, it was a full more empowered."
324.26,327.62," I mean, partly because I've been doing this, like, I mean, I haven't been doing as long"
327.62,331.82," as you, but I feel more empowered than I did when I first started doing this."
331.82,335.5," And because that category of game, you know, Army versus Army Shooter along the lines"
335.5,337.74," of, you know, battlefield or whatnot."
337.74,341.94," Because I play that kind of game so extensively, and I do see myself as the core audience"
341.94,342.94, for that.
342.94,344.82, Very well versed in it.
344.82,348.02," And also not just myself, but in the community of players for that sort of game."
348.02,350.86, I know what things are going to be issues.
350.86,351.86," And I mean, it's great."
351.86,357.26," I felt to the point where, you know, one of my friends in the multiplayer, you know,"
357.26,358.86, community was watching one of the promo clips.
358.86,362.46, And he saw that the field operative was placing his artillery.
362.46,365.74, And he had to place apparently he had to place it in a very specific spot.
365.74,366.74, And he was bummed out.
366.74,368.1," He said, I want to be able to place this stuff anywhere."
368.1,370.98," But what kind of, like, the mice will just be there if you have to put it in a low"
370.98,371.98, box.
372.5,373.86, Look at that map right there.
373.86,379.70000000000005," And you can see that it was the GDF, the global defense forces main base."
379.70000000000005,382.82, And they also have this giant mobile command center that has to leave the gate.
382.82,385.5," And I said, if they let you put it anywhere in there, you could block the gate,"
385.5,387.70000000000005," which is exactly what, you know, him and I would do one."
387.70000000000005,389.58000000000004," You know, what were you trying to greet for some."
389.58000000000004,390.42, And so it was cool.
390.42,391.82," That, I mean, that was my hypothesis."
391.82,393.94," And I just, you know, casually mentioned that to them."
393.94,397.22," They're like, oh my god, that's exactly why you can only do it there."
397.22,399.14000000000004," But as soon as you're outside the gate, you put it anywhere."
399.14,400.14, Okay.
400.14,401.14, Yeah.
401.14,402.74," So it is completely, you know, free to do what you want with it."
402.74,403.74," But it, right."
403.74,404.74, But let me tell you.
404.74,405.74, Right.
405.74,408.58," But so I mean, those just an example of them and how quickly, I mean, how tuned"
408.58,412.5," into that sort of game you are, where you can, I guess, to with the multiplayer game,"
412.5,417.53999999999996," I mean, it makes more sense for them to solicit feedback from people like you and"
417.53999999999996,418.53999999999996," other, right."
418.53999999999996,419.53999999999996, You know.
419.53999999999996,422.02," And they're totally, I mean, they have people, they have some of the, you know, some"
422.02,426.53999999999996," of the best and most hardcore players of that category game, giving them feedback and talking"
426.53999999999996,427.53999999999996, to them.
427.54,431.34000000000003," In this case, this is the first time, you know, I, I constantly asked developers of"
431.34000000000003,432.34000000000003, this type of game.
432.34000000000003,437.14000000000004," If not only are they hiring, you know, Q&A that is not only trying to break the game or"
437.14000000000004,441.46000000000004," trying to exploit it, but people that are trying to play and they socially."
441.46000000000004,443.78000000000003, Because a lot of so many people just don't test for that.
443.78000000000003,448.42," The assumption is if, if there's an exploit, people will do it when it gives them game."
448.42,452.42," But we don't have to worry about people doing it just to be assholes or whatever, you know."
452.42,453.42, But that's not the case.
453.42,454.42, You know.
454.42,457.22," So I mean, they've actually got people testing it just for that too."
457.22,461.18," I mean, they go in and instead of trying to find ways to get out of the game, the way"
461.18,464.62," is to break it, not in and out of self with to break it for other people playing."
464.62,465.62, Right.
465.62,467.94000000000005," So that's, I mean, that's reassuring that they've got that on there."
467.94000000000005,472.70000000000005," And again, I mean, they, the, the, the, the other part of the story is that it's then delayed."
472.70000000000005,475.74, So that goes now with we do might mention later crisis is now in the late.
475.74,476.74, Yeah.
476.74,477.74, Yeah.
477.74,478.74, Team Fortress 2's been delayed.
478.74,479.74, Yeah.
479.74,484.98," All of them now are basically more or less in the same window as unreal term in 2007, sometimes"
484.98,486.38000000000005, around June or summer.
486.38,490.5," So for Quake Wars, what they said is you'll definitely, or you should definitely be playing"
490.5,491.98, it prior to the next Quake on.
491.98,492.98, Damn.
492.98,494.98, So do we not have any decent multiplayer shooters coming up?
494.98,495.98, That's not true.
495.98,496.98, It's not true.
496.98,499.26," That's why I've had played years of war on 360, you know."
499.26,503.5," And then for, you know, been playing company here as much stuff a lot on PC for multiplayer."
503.5,509.5," But yeah, I definitely wanted at least one of these games soon or rather than later."
509.5,511.02, Maybe there's something that might fill it.
511.02,515.26," I mean, now, Valve's just announced Left or Dead, which is cool."
515.26,519.7," It's kind of a cooperative, based, I mean, it's multiplayer."
519.7,523.18," It's competitive, but you work with two people or whatever in order to fight or two or"
523.18,525.9, four people in order to fight a number of infected.
525.9,526.9, Here's not a case.
526.9,529.7, I don't even know how much I should talk about this because I know if it's out.
529.7,530.7, Just say everything.
530.7,531.9," But anyway, we'll get into a later."
531.9,532.9, Yeah.
532.9,533.9, I think we'll get into a later.
533.9,537.78," How about a rainbow six Vegas, except you're not that hot on that are you?"
537.78,542.74," Well, the console version I've only played a little bit and, you know, contrary to the"
542.74,546.98," campaign and that game, which I think is supposed to be much different."
546.98,548.62, I haven't tried that.
548.62,551.9, A tactical shooter like that is really slow going.
551.9,552.9, Yeah.
552.9,558.1, And it's so much based on just the twitch ability to basically quickly and accurately put
558.1,561.78, your crosshairs on someone's head and get the first burst of shots off.
561.78,565.0600000000001," So whenever I play a game like that, I want it to be, you know, I'd rather just have"
565.0600000000001,566.0600000000001, to input be a mouse.
566.0600000000001,569.7," But then in addition, I mean, when you come off a gear's a war, something, it's just"
569.7,571.5, it's multiplayer's hideous looking to me.
571.5,574.46," I mean, some people will say it's gorgeous, but the character bottles look like the"
574.46,577.94," old, uh, 1970s, Jedi Joe dolls."
577.94,580.9," You know, just all kind of walked out and they're very exaggerated."
580.9,581.9, Gross.
581.9,583.54," Yeah, the environments are just bland."
583.54,584.54, They look like Xbox one.
584.54,585.54, Good looking Xbox one.
585.54,589.98," Yeah, I was playing gears or war last night and then those guys, what's with all the body"
589.98,590.98, types in that game?
590.98,593.82," Oh, just, you know, arms are like shoe."
593.82,594.82, Fracking tree trunks.
594.82,595.82, Yeah.
595.82,596.82, That's a steroid.
596.82,597.82, There's just some weird.
597.82,598.82, I don't know.
598.82,599.82, Shit.
599.82,600.82, Yeah.
600.82,608.3000000000001, I can't play that game when my wife is awake.
608.3000000000001,609.6600000000001," It just is like, why do you play?"
609.6600000000001,610.98, You play everything like that.
610.98,611.98, Yeah.
611.98,612.98, Yeah.
612.98,613.98, It's embarrassing.
613.98,616.34, And they walk around and nothing's happening and then let's go.
616.34,617.34, Shit.
617.34,618.34, Yeah.
618.34,621.1800000000001," Or if they're watching you play multiplayer and you spend all this time telling her, hey, we've"
621.1800000000001,622.1800000000001, got these great games.
622.1800000000001,626.86," We are a railroad magnet and doing all this stuff and she comes in and, like, there goes"
626.86,628.1800000000001, a guy getting something on the floor.
628.18,630.62, But it's spraying our cereal sprays on the screen.
630.62,632.26, And it doesn't help out your going.
632.26,633.26, Yeah.
633.26,634.26, I'm going to kill the monitor.
634.26,635.5799999999999," Yeah, and you can hear how this speaker's."
635.5799999999999,636.5799999999999, No.
636.5799999999999,639.2199999999999," Oh, hi, honey."
639.2199999999999,644.8199999999999," So yeah, especially in Burnley, that's not really."
644.8199999999999,646.02, Not that appropriate.
646.02,650.54," Yeah, I was wearing, I was wearing some t-shirt and Berkeley that some gaming"
650.54,653.78," swag t-shirt the other day because it was like green, long sleeve."
653.78,656.14, So it was warm because it's called out.
656.14,660.5," And the color of the shirt was, you know, I was like color coordinating with the flannel"
660.5,661.5, shirt I had over it.
661.5,663.06, But I took the flannel shirt off.
663.06,667.14," So I was walking around with the shirt on in downtown Berkeley and then in the back, I"
667.14,670.8199999999999," realized it was like, it said like, hands or something."
670.8199999999999,673.38," It was like some German, floor court shirt."
673.38,675.74, I'm walking around in downtown Berkeley.
675.74,678.66," You know, I just said, like, you know, Hitler rule."
678.66,681.46," Yeah, I just said, because like, oh my god, I got to go home and change."
681.46,682.46, You have to shut it up.
682.46,684.18, It had like an access tank on it.
684.26,686.78," Yeah, and it said like, you know, I'm cool or something."
686.78,690.9399999999999, I forget I'll have to remember when it was was a blatant like Nazi shred.
690.9399999999999,693.3399999999999," Well, it's a free shirt."
693.3399999999999,694.3399999999999, And that's all you're thinking.
694.3399999999999,695.3399999999999," It was like, right."
695.3399999999999,696.3399999999999, I could have this piece of shit.
696.3399999999999,697.3399999999999, I didn't even realize what it said on the back.
697.3399999999999,698.9799999999999," But then it was like, what are you wearing?"
698.9799999999999,701.9799999999999," You got to look at it if you're going to, it's rare that you get a shirt from a, you"
701.9799999999999,703.7399999999999," know, a game shirt that you want to put on your back."
703.7399999999999,707.62," But like, take a look at the front end of the back to make sure it's not it doesn't say"
707.62,709.74," every time it's just right, you know."
710.74,712.26, So a fake case.
712.26,712.58, Yeah.
714.98,717.78," I've got to stop wearing that as you'll notice, I stopped wearing."
717.78,720.86," Oh, yeah, I should mark hat just because I got and getting into many like"
720.86,722.86, conversation that didn't really want to really.
722.86,723.66, That's awkward.
723.66,726.1," Yeah, it's like because the people who recognize it as a world of work."
726.1,726.54, I've had it.
726.54,729.66," It's like, hey, I don't know what, oh, yeah, I didn't really want to talk to you."
729.66,732.54," Yeah, you know, I wore my, my world of workcraft hat, which is the"
732.54,737.5, exclamation point on that 10k run I did in San Francisco and not one person said anything.
737.5,737.86, Yeah.
737.94,739.94, But I'm taking property because your company you're keeping.
739.94,743.14, They were exactly the crossover of the running audience.
745.14,745.98, Right.
745.98,750.66," Well, the weirdest situation that involving a warcraft piece of a peril was my boyfriend"
750.66,752.42, and I read the airport going to security.
752.42,753.26, Yeah.
753.26,756.66," And we're going through and he gets pulled aside like the guys like, can you"
756.66,758.86, us make him step aside and we're a crap.
758.86,759.86, What's going on?
759.86,763.1," And then like he's like, what's server do you play all my god?"
763.1,765.66," And I just like, wow, they pulled you side to ask you this."
765.66,768.86," You pulled us out of the security line for the, that's a warcraft question."
768.86,771.06," And we're like, going, oh, did they find the gun?"
771.06,772.66," I'm like, you said."
772.66,775.4599999999999," Wow, got my belt and she's back."
775.4599999999999,777.86, Have you guys seen the World Warcraft TV commercial?
777.86,779.66," By the way, the office."
779.66,780.26, Was a conference?
780.26,781.26, Yeah.
781.26,781.86, I have.
781.86,784.86," So did they, this is going to be a super question."
784.86,788.26, Did they just like muck with office space?
788.26,788.86, Yeah.
788.86,789.4599999999999, Okay.
789.4599999999999,791.86, He was like playing Tetris in the movie and that's easy.
791.86,792.06, Okay.
792.06,793.4599999999999, I couldn't remember that exact scene.
793.4599999999999,795.4599999999999, They didn't like re-filmet with those two actors.
795.46,796.46, Yeah.
796.46,797.46, Like photo shot.
797.46,798.46, Wow.
798.46,799.46, Wild box undo his desk.
799.46,800.46, Okay.
800.46,801.46, Yeah.
801.46,802.46, On top of the monitor.
802.46,803.46, Okay.
803.46,804.46, It was funny.
804.46,805.46, It was highly laugh.
805.46,806.46, They can do that.
806.46,807.46, Yeah.
807.46,808.46, I knew it was a stupid question.
808.46,810.46, It was too much to help for to think that those guys.
810.46,811.46, Yeah.
811.46,812.46, Sure.
812.46,814.46, We'll re-filmen entire scene from the movie because we love wild so much.
814.46,819.46," I actually got close to role playing in, uh, cheers to war."
819.46,821.46, The last last week before I left.
821.46,824.46," We just decided that no, we that we were around the locust team so that we're going"
824.46,828.46," to just pretend that we were locusts and give them, give them flesh them out more than the,"
828.46,833.9000000000001," then the, but nine, uh, race of barrel carriers that they're depicted as the last cut"
833.9000000000001,834.9000000000001, scene of the game.
834.9000000000001,840.3000000000001," And so we were just talking about how, you know, we're all angry that we had to bring"
840.3000000000001,842.98," our, uh, share it hard."
842.98,846.34, But we had to bring our challenged little brothers along who tend to blow up when they
846.34,847.34, get shot.
847.34,851.94," But like mom made us, I mean, like if you played campaign, you know, there's a little"
851.94,854.0600000000001, like fiendish things that drop down to explode.
854.06,855.06, Yeah.
855.06,856.06, I know.
856.06,858.06, I guess I should have done it in the voice we were doing and it would have been funny.
858.06,861.06, But mom made us bring them along.
861.06,863.06, Locust role playing.
863.06,865.06, You must be desperate.
865.06,866.06, Yeah.
866.06,868.06, This fun.
868.06,872.06, So have we all been playing any piece of games?
872.06,877.06, Now that we have successfully avoided the watch a plane so far in the past.
877.06,881.06," That kind of similar situation is shown or like, yeah, but you can't talk about it."
881.06,882.06, Yeah.
882.06,883.06, You can't talk about it.
883.06,884.06, Yeah.
884.06,885.06, You can't talk about it.
885.06,886.06, Yeah.
886.06,889.06, You can't blow the whole reason on planet.
889.06,890.06, Right.
890.06,895.5, We'll say it is prompting a unique situation that I didn't expect.
895.5,899.5799999999999, And I wonder if other people will have the same reaction.
899.5799999999999,900.5799999999999, That is all I will say.
900.5799999999999,901.5799999999999, Great.
901.5799999999999,902.5799999999999, And that's a teaser.
902.5799999999999,904.5799999999999," See, this is where I, it's like, yeah."
904.5799999999999,905.5799999999999, Yeah.
905.5799999999999,906.5799999999999, It's like why do you even say it?
906.5799999999999,907.5799999999999, If you don't.
907.5799999999999,910.5799999999999," I'm really playing PC games, guys."
910.58,913.58, But I just can't talk about these PC games.
