start,end,text
1084.72,1087.0," And then so from your play, it's kind of different."
1087.0,1089.2," You're all, you know, using these buzz bobs."
1089.2,1092.28," And then the GTF guys, it's like playing duck con or something like there's another one."
1092.28,1093.8," There's another one, Chew and does."
1093.8,1095.16, And that's that's pretty cool.
1095.16,1099.8," Have we tried playing, I don't know if it was so stifling implement it when I was checking"
1099.8,1101.4," it out a while back, the infiltrator though."
1101.4,1103.64," And then like basically I want the one you can like, the same check."
1103.64,1104.64, You can just spy.
1104.64,1109.16, The one you can inject yourself into a GDI soldier and then kind of like mask yourself
1109.16,1110.16, as him.
1110.16,1112.64, I didn't do too much with that.
1112.64,1116.0, But it seemed pretty close in application to what we're used to.
1116.0,1120.24," Spides where you basically assume, you know, the physical appearance of another character"
1120.24,1122.24, and the opposing team.
1122.24,1123.24, Right.
1123.24,1126.92," And then you'll lose that disguise if you use heavy weapons, betrayal of the user,"
1126.92,1130.08, your melee weapons and stuff and retain your disguise.
1130.08,1131.08, That was cool.
1131.08,1132.64, What else I want to say about it?
1132.64,1137.68," There's I was really impressed with the balance of, you know, all the deployable structures."
1137.68,1139.04, I know those would be huge.
1139.04,1142.04, And that's what I thought that looked deep and good way back at E3.
1142.04,1143.04, Right.
1143.04,1144.04, And the sheer number of them.
1144.04,1145.04," So I thought, yeah."
1145.08,1149.04," I mean, so like in battle, you know, you've got the commander controls the artillery,"
1149.04,1154.32," commander controls the, you know, the UAV satellite track and all these things."
1154.32,1158.8799999999999, Here's how decentralized because they don't want anyone player to have that much power to
1158.8799999999999,1163.3999999999999," like ruin or basically, you know, guarantee the victory of a team."
1163.3999999999999,1167.52, So it's distributed to each individual players and then it's almost like it's automated
1167.52,1170.36, the way that it all connects works together.
1170.36,1174.8799999999999," But it's even more specific though instead of just artillery, you'd have three types"
1174.88,1176.8400000000001, of basically artillery things.
1176.8400000000001,1181.96," Now, one would be effective at if you're wiping out infantry."
1181.96,1186.6000000000001, One is great for vehicles and another is great for countering other deployables.
1186.6000000000001,1190.3600000000001," And then so not only that, so like I said, you go into and you're trying to take a bridge."
1190.3600000000001,1192.7600000000002, You're trying to secure a bridge head and build a bridge.
1192.7600000000002,1197.2800000000002," But the enemy is throwing up all sorts of like anti tank turrets, anti infantry turrets and"
1197.2800000000002,1198.2800000000002, stuff.
1198.2800000000002,1202.72," So then you have your guys and you go up on a hill, spot that and you can launch anti deployable"
1202.72,1203.72, missiles at it.
1203.8,1207.92," So you're dropping these big, you know, Megaton missiles into them on that and then they're"
1207.92,1210.68," like, okay, well, they're they're they get sick of you doing that."
1210.68,1214.96, So they put up a shield generator and that basically intercepts like active missile defense
1214.96,1217.2, thing and that will intercept what you're throwing in.
1217.2,1221.56," So then one of your technicians has to go and not take nations on your, forget the class,"
1221.56,1226.6000000000001," but one of your, the equivalent of a spec ops has to go in to can sabotage the shield generator"
1226.6000000000001,1230.44," and everything has got like a counter, like very specifically, a very cleanly has counter"
1230.44,1231.44, to it.
1231.44,1234.96," It's not like, you know, to and it just is cool like back and forth in the way that you"
1234.96,1240.04," would with RTS, you know, like just like helping heroes and they got an MG up and you're"
1240.04,1243.2," like, okay, shit, I need to get a sniper, but they're like, hey, that guy's going to bring"
1243.2,1244.2, a sniper.
1244.2,1247.52," So put a motorcycle out front, the motorcycle catch is sniper and so on and so forth."
1247.52,1250.3600000000001," It very much works, works in that fashion."
1250.3600000000001,1254.6000000000001," And I, I really appreciate the challenges to totally like, you know, asymmetrical forces and"
1254.6000000000001,1258.76, the fact that I able to balance these two to totally different disparate types of forces.
1258.92,1260.92," Well, you're right, it is like a strategy game."
1260.92,1262.84, Like any good strategy game can do that.
1262.84,1266.64," You know, that's the, Sean, listening to you talk about this."
1266.64,1271.52," Do you feel like, like, when I, when I hear all this and just the little I played back at"
1271.52,1278.0," E3, like, do you feel like random, newbie casual shooter types are going to be able to"
1278.0,1282.32," jump and play this kind of game or, or is it going to be prohibitive in the same way that"
1282.32,1285.36, battlefield kind of became prohibitive and certainly counter strike was.
1285.36,1286.36, Yeah.
1286.36,1287.84, I already know all the shit.
1287.84,1289.84, It just became impossible to just come on and go.
1289.84,1291.3999999999999," I want to shoot stuff, right."
1291.3999999999999,1293.36," You know, I know, just that I was actually playing."
1293.36,1297.8799999999999," I've been playing Battlefield 42 over the weekend, just because I wanted to fly some"
1297.8799999999999,1298.8799999999999, more of our two planes.
1298.8799999999999,1303.52," And it's just amazing me like, how is like, oh, God, like, I remember I tried to get"
1303.52,1306.8799999999999, like some people from Egypt into that when it came out 1942.
1306.8799999999999,1308.28," Yeah, they were just clueless."
1308.28,1311.6399999999999," They were like, and that's scary because that game was still pretty."
1311.6399999999999,1313.24," I mean, that was kind of low rent."
1313.24,1314.24, Like I played that a lot.
1314.32,1317.44, And I just played as an infantry dude and I could almost play that as a shooter.
1317.44,1318.44, Yeah.
1318.44,1321.76," I mean, I was just gone from capture point to capture point shooting guys."
1321.76,1323.24, And I did fine in that game.
1323.24,1324.24, Yeah.
1324.24,1329.68," I think they're definitely, they definitely want to make it more accessible and automated"
1329.68,1330.68, stuff helps.
1330.68,1337.6," So for example, if you picked, you know, like a soldier or something and or whatever class"
1337.6,1342.4," you pick, it's going to tell you, it's going to create a mission for you and say,"
1342.4,1347.48," and you know, hey, go and destroy this turret that the enemy put up."
1347.48,1348.48, Someone on your team.
1348.48,1352.64, So another new one your team is whatever class and he puts up a radar.
1352.64,1354.0400000000002, He doesn't need to know what to do.
1354.0400000000002,1356.48," The computer says, hey, go put a radar up."
1356.48,1357.48, So he does.
1357.48,1359.3200000000002, And that radar punch is through to the other new.
1359.3200000000002,1362.3600000000001," And says, hey, we just detected that there's a tank here in this."
1362.3600000000001,1364.3600000000001, You should go kill them in this order.
1364.3600000000001,1366.3200000000002, We're going to prioritize them for you.
1366.3200000000002,1370.1200000000001, And we'll highlight it on your map for you as because the radar is detecting it.
1370.1200000000001,1371.1200000000001, So it still makes sense.
1371.12,1373.7199999999998," And then, of course, the game, you go do that and you're going to get extra points."
1373.7199999999998,1377.6799999999998, So you're going to get more points for doing that than if you just go around and blow up
1377.6799999999998,1379.28, any old tank or something.
1379.28,1385.1999999999998," So it's still, and also too, like they, they even have it."
1385.1999999999998,1388.6399999999999," So I mean, if you're, if you're quick with the game and you want to go up and destroy this"
1388.6399999999999,1392.0," thing, what you would have to do is you pull out basically an explosive charge."
1392.0,1393.0, You stick it to it.
1393.0,1396.56, Then you pull out another tool and you have to activate the thing and then you run away.
1396.56,1397.56, But they have a button.
1397.56,1398.8799999999999, It just works a little slower.
1398.88,1402.92," If you're new, you just press one key and it will automatically do all those things for"
1402.92,1403.92, you.
1403.92,1406.8600000000001," But it's just not as fast as the pro who knows to like, weapon switch between those"
1406.8600000000001,1407.8600000000001, and hurry up and do it.
1407.8600000000001,1411.24," But you're still, and with, so you don't have to go up to it and say, well, what the"
1411.24,1414.3200000000002," house, an activator, what the house, the charge, you just press this button and it will"
1414.3200000000002,1416.7600000000002, do what you need to do on that area.
1416.7600000000002,1417.7600000000002, Just stick that.
1417.7600000000002,1422.1200000000001," I just worry about games like this sometimes, you know that, like, especially as they're"
1422.1200000000001,1425.5600000000002," getting more, like, as they get more sophisticated and better, like they're great for"
1425.6399999999999,1429.0," guys like you, right, or total veterans at doing this."
1429.0,1433.52," But like, I just wonder if they start getting prohibitive to people who just want to play"
1433.52,1435.9199999999998, this new game and have a good time.
1435.9199999999998,1438.28," They, they, they almost always are."
1438.28,1440.84," I mean, that's the whole, that's a big part of this game."
1440.84,1446.6799999999998," But interestingly, I say, like the most prohibitive in that sense are really simple."
1446.6799999999998,1448.24," Like, quick, three or something."
1448.24,1453.52," I think, or even like, four are super prohibitive because the people are so good at them."
1453.52,1455.08," That if you, yeah, you have no chance."
1455.08,1460.76," So what battlefield did was it gave you the ability to get a tank and blast, like, five"
1460.76,1465.04," dudes on foot and there's, say, there's only one AT guy with or something or one engineer"
1465.04,1466.04, lay in mind.
1466.04,1468.84," So even if you weren't that, even if you weren't the guy that can just run game and"
1468.84,1473.08," knows the timing on, like, the quad damage, yeah, bond and stuff, you can go in and"
1473.08,1477.28, get the tank or get the plane and drop a bomb on some dudes and get a kill.
1477.28,1482.72," But here, though, one thing is, it's almost got quite, I mean, they insisted that it was"
1482.72,1485.8, actually slower than quite three by significant margin.
1485.8,1490.4," But when you're used to playing like a battlefield or something, quick wars is faster than"
1490.4,1491.4, hell.
1491.4,1494.8, Guys running and there's a sprint button and there's no stamina whatsoever.
1494.8,1497.8, You just do what you just can't shoot when you're sprinting.
1497.8,1500.32," And they currently, these are all variables that they're worth."
1500.32,1501.32, And I made a big point.
1501.32,1502.32," I mean, I had three key things."
1502.32,1504.28," I was like, these are concerns to me."
1504.28,1505.52," You know, what do you guys think about them?"
1505.52,1506.52, Yep.
1506.52,1507.64," And they're like, you know, definitely you're here."
1507.64,1512.68," But, um, so you wouldn't even lose, like, you could, you could strafe sprint."
1512.68,1515.0800000000002, And you wouldn't even lose stamina or studied.
1515.0800000000002,1519.24," And so what happens is the game when you start projecting distances, you know, say,"
1519.24,1522.92," you can, you can be as fast as you want in the corridor in a rat's maze and quick format,"
1522.92,1524.8," you know, or space bounces and even that big."
1524.8,1528.48," But then we take this giant thing and say, you're looking at someone down, down your"
1528.48,1529.48, iron sights.
1529.48,1533.48," And once they get to a hundred yards away, that's be translates into like the movement of a"
1533.48,1536.72, net or a quick moving net or something in front of me.
1536.72,1538.5600000000002," You trying to, it's like trying to hit him with chopsticks."
1538.5600000000002,1539.72," Like, uh, credit."
1539.72,1540.72, It's on Ryan.
1540.72,1543.72, So that was curious to me.
1543.72,1545.96," I did get used to it, but it was on Ryan."
1545.96,1550.1200000000001, And they do counter it because the difference isn't like obviously the battlefield accuracy
1550.1200000000001,1554.92," is just completely, you know, depending on your gun, if you're not prone and firing in"
1554.92,1555.92," burst, right?"
1555.92,1559.32," You're going to be shooting across like this, you know, great, true size thing in your"
1559.32,1560.32, screen.
1560.32,1561.32, Whereas here it's pinpoint.
1561.32,1564.52," It's like, if you have a hyperblaster that dot in the center of the screen is where"
1564.52,1566.0, your shots will hit.
1566.0,1568.76," So because of that, it makes it easier to."
1568.76,1572.48," But I do think that if they tone the speed down a little bit, it would be."
1572.48,1573.48, I don't know.
1573.48,1577.4, But we have a beat as also a part of like what Quake's always been.
1577.4,1578.4, That's it.
1578.4,1579.4, That's what's tough.
1579.4,1580.4, That defines that game.
1580.4,1584.76," But I swear, once you, if you make a game that fast, you're making a game for those"
1584.76,1586.68," like 10 savants, right?"
1586.68,1589.4," But I want to want to be too realistic either, too, though."
1589.4,1590.4, Yeah.
1590.4,1591.4, Right.
1591.4,1592.84," I mean, it is the sci-fi Quake universe, too."
1592.84,1593.84, Watch us in need to be.
1593.84,1598.36," I, the last time I watched you play 2042, it was agonizing for me to see you try to turn"
1598.36,1601.1999999999998," around and shoot something and then he, yeah, slow."
1601.1999999999998,1603.9199999999998," That game is like, I haven't played a shooter at my legs."
1603.9199999999998,1604.9199999999998, It was so humiliating.
1604.9199999999998,1608.9199999999998," The standing, they're playing in Sean's standing behind me going like, oh man."
1608.9199999999998,1614.56," Like, yeah, I feel, well, it would be like if I got a workout and I go and start"
1614.56,1616.8," beat on the fire monster with the like five, five, five."
1616.8,1619.4399999999998," But like, I mean, no, but like, I will, you know, I, you know, I, you know, I, you know,"
1619.4399999999998,1620.4399999999998, I'm in that.
1620.4399999999998,1621.4399999999998, Do you have any energy?
1621.4399999999998,1622.4399999999998, You're healing a minute.
1622.4399999999998,1625.52," But like, I didn't even know the controls at that point."
1625.52,1627.0, I didn't even know what I was doing in there.
1627.0,1628.0, Yeah.
1628.0,1629.0, You're like me.
1629.0,1631.52," Don't be like, he's like, they're like arrow keys."
1631.52,1632.52, Yeah.
1632.52,1633.52, Yeah.
1633.52,1634.52, Funny.
1634.52,1635.52, Yeah.
1635.52,1642.8," So that's the speed of one thing that I don't know, but it's, it also makes it different."
1642.8,1646.36," It makes it, you know, not battlefield or something like that."
1646.36,1647.36, Yeah.
1647.36,1649.36," It was a, we're running out of time already."
1649.36,1650.36, I'm ready.
1650.36,1651.36," No, go on."
1651.36,1652.36, We can move on.
1652.36,1653.36," But, um, no."
1653.36,1655.36, Don't worry about it.
1655.36,1656.36, Okay.
1656.36,1659.12," Well, things about that game, I'm still waiting to see how it all works out, but they're"
1659.12,1663.1599999999999," going to have a whole bunch of unlocks, similar to battlefield."
1663.1599999999999,1669.6," Again, and that's, it's set, instead of having a persistent over time, because they don't"
1669.6,1671.3999999999999," want the good players getting better, right?"
1671.3999999999999,1677.12," Or having, uh, an automatic, you know, ability to just destroy news is you're insane."
1677.12,1679.84, You get them in the course of play on a single server.
1679.84,1682.8799999999999," So say if you do like four maps on the server, you're able to get them that way."
1682.8799999999999,1683.8799999999999, Right.
1683.8799999999999,1684.8799999999999, Lighting guns.
1685.64,1688.68," Um, and just tons and tons of specific attribute buffs."
1688.68,1692.16," But then that's far for them to go away when you like, you showed me a master list"
1692.16,1695.96, and they're far more like attribute buffs and stuff like that than there would be in
1695.96,1696.96, 2042.
1697.2,1701.1200000000001," And, but yeah, they're gone once you want to log off and you have to choose again the next"
1701.1200000000001,1701.8000000000002, time and play.
1702.2,1704.3200000000002," How you think it sounds like an RPD, right?"
1704.96,1705.4, Right.
1705.92,1707.3600000000001, It tracks a lot of stuff.
1707.3600000000001,1708.24, It game actually.
1708.24,1709.16, It works.
1709.16,1709.92, It's not getting any way.
1710.8000000000002,1711.5600000000002, The way you play.
1711.6399999999999,1717.08," So if you're playing, you know, aggressively and you were, you know, you're dealing a whole"
1717.08,1718.08, lot of damage.
1718.32,1722.08, It's going to count like it puts a certain spin on that in the way that it gives you HP
1722.08,1723.28," out of you, uh, XP."
1724.0,1727.36," And then if you're not only dealing a lot of damage, but you're also taking a lot of damage"
1727.36,1730.24, and you're still staying alive in between spawns and stuff.
1730.44,1734.9199999999998," I mean, it's going to give you even more like a multiplier on multiplayer on your XP."
1735.48,1736.84, So there's some cool stuff like that.
1736.84,1741.08," I mean, it's it's definitely people will be like trying to work out exactly how to"
1741.12,1746.0, maximize like their their XP flow and the side from killing things and doing
1746.0,1749.6," doing stuff on their on their mission, but yeah, that's pretty cool stuff."
1750.56,1752.6799999999998, And the bottom line is when I play the game.
1753.1999999999998,1756.4399999999998," I mean, that's always as I mean, you can go and explain and talk around a game and"
1756.4399999999998,1760.04," say here's what it does and how it works, but the bottom line is when I came away from"
1760.04,1763.36," I was like, God, why is it so long until this game comes out?"
1763.8,1764.6799999999998, And what are they?
1764.6799999999998,1765.8799999999999, Because I really wanted to play.
1765.8799999999999,1768.32," I was like, I can't just take this home and play this all night."
1768.32,1774.6399999999999," You know, and it's it's pushed back to usual for it."
1774.6399999999999,1779.04," It's a splash damage to the game, but for for the whole ensembles instead of done"
1779.04,1782.08," one is done, it's like you'll be playing it before Quake on."
1782.8799999999999,1786.6799999999998," So Sean, that was like a good like they can use that for the box quake."
1787.2,1788.72, What can I be playing this already?
1788.72,1789.48," Yeah, we shall."
1789.48,1790.3999999999999," Sally, you're in the fine."
1790.3999999999999,1793.56," I'm playing games tonight, guys."
1794.52,1795.3999999999999, I'm bootlegny.
1795.3999999999999,1796.3999999999999, Pointed.
1796.3999999999999,1797.12, I played it on.
1797.6,1798.8, It's quite common.
1798.8,1799.8, It's like July or August.
1800.3999999999999,1801.8799999999999, We need to I'm 2007.
1801.8799999999999,1803.96, We got to work on getting on more box codes.
1803.96,1805.8799999999999, We need more sort of horish on this box.
1805.8799999999999,1806.3999999999999, Horish.
1806.3999999999999,1807.52," Okay, so what are some of the rat?"
1807.52,1809.6399999999999, We need to this in the game that'll change everyone.
1809.6399999999999,1810.24, So here we go.
1810.24,1810.9199999999998, There we go.
1810.9199999999998,1811.24, Okay.
1811.24,1814.36," Well, we just had that one in Ryan."
1814.36,1817.1599999999999," Remember, I was like, point out it was like from some German game."
1817.72,1821.36, It was like this is a game that's gotten hack and slashing.
1821.52,1824.1999999999998, This is an RPG with the hack and slash variety.
1824.56,1826.12, Like that was like a review quote.
1826.6399999999999,1827.1599999999999, It was.
1827.1599999999999,1830.1999999999998," Yeah, this is an RPG of the hack and slash variety."
1830.1999999999998,1831.0," Wow, oops, sorry."
1831.0,1832.28, We're kind of hurting for a quote.
1832.28,1832.6399999999999, Yeah.
1832.6399999999999,1833.0, Yeah.
1833.0,1835.9199999999998, And it's like a movie review from wireless review or something.
1835.9199999999998,1836.36, Yeah.
1837.36,1838.36, So there's some.
1838.6,1840.84," Yeah, I think it's good to not be on."
1841.04,1843.1599999999999, We have no idea because I was thinking like more
1843.1599999999999,1844.1599999999999, or jealous.
1844.1599999999999,1845.6," 2007, you know, yeah."
1845.6,1846.7199999999998, That's going to be my motto.
1846.7199999999998,1848.52," So every podcast, he just picks a random game and he."
1848.52,1849.56," Yeah, and it's like cool."
1849.56,1850.3999999999999, Great things about it.
1850.4,1851.72, So we get on the box right.
1851.72,1852.96, We don't even have to play it.
1854.16,1857.8000000000002," You like, you know, the shooter of the shooter righty."
1859.92,1860.96, It's shooter Rific.
1862.2800000000002,1863.48, It's blast hashtag.
1864.64,1865.3200000000002, Let me see.
1865.5600000000002,1866.4, Now what can it.
1868.64,1870.0400000000002, I hear some quotes actually.
1870.0400000000002,1870.48," Yeah, look."
1870.48,1874.3600000000001," Yeah, Sean, but was a trade-out with some quotes before we broadcast it."
1874.4,1878.16," No, that these are like, actually, these are just for a loss"
1878.16,1880.5600000000002," of a plan for 360, but okay, gorgeous graphics."
1880.5600000000002,1881.96, I won't read who they're source to.
1881.96,1883.3200000000002," Okay, action pack."
1883.68,1883.96, All right.
1883.96,1886.0, I need to say some of the publications either side.
1886.0,1886.3600000000001," No, no."
1888.3600000000001,1889.76," I don't, we never on."
1889.96,1890.76," I know, we don't."
1890.76,1891.68, I'm just saying town.
1891.68,1891.88, Yeah.
1893.0400000000002,1894.6000000000001, Capcom has another winner on it.
1894.6000000000001,1895.16, Tans.
1895.96,1896.88, That's from Capcom.
1896.88,1898.88, Lee says a few shares to Ksh.
1898.88,1899.68, Mama Capcom.
1901.3200000000002,1902.8000000000002, It were eight simply rocks.
1903.64,1905.0800000000002, They need one that just says F.T.
1905.0800000000002,1905.52, W.
1906.64,1907.1200000000001, Yeah.
1907.1200000000001,1907.72, And then we.
1908.68,1912.52, I like the ones that say best game ever period period period
1912.52,1913.32, in between this one.
1913.32,1913.52, Yeah.
1914.76,1915.3600000000001, Because that's interesting.
1915.3600000000001,1916.72, So are you going to read us on a caption?
1916.72,1917.28, How old is that?
1917.28,1917.8, 10 years old?
1917.8,1918.08, No.
1918.08,1918.44, Yeah.
1918.44,1918.96, What?
1919.1200000000001,1919.88, The sims are saying.
1919.88,1920.24, Yeah.
1920.44,1921.72," Yeah, but it's comic book."
1922.32,1922.84, About him.
1922.84,1923.68," Yeah, you got a pause."
1923.68,1924.28, Mast.
1925.44,1926.2, Got my mark.
1926.2,1926.76, comic.
1928.04,1928.96, Never.
1929.1200000000001,1930.3600000000001, If we're going to do some flam.
1930.3600000000001,1931.4, I could do that for real.
1931.4,1932.92," You know, I fake it up there."
1933.92,1934.3600000000001, I don't know.
1934.3600000000001,1935.3600000000001, I'm not going to read you anything.
1935.3600000000001,1936.24, What did you want me to read you?
1936.24,1937.08, Katna.
1937.08,1938.76, That's the way that that's OK.
1938.76,1940.4399999999998, The box stuff is red.
1940.76,1941.24, Guess what?
1941.24,1942.72, Other game magazines stink.
1942.72,1944.4399999999998, That was our point.
1944.4399999999998,1945.72, That says Jeff Green.
1945.72,1946.72, Yeah.
1946.72,1948.36, I was just weird.
1948.36,1949.9199999999998, We'll put that quote in the front.
1949.9199999999998,1950.72, Next issue.
1951.72,1953.1599999999999, Our competition's lame.
1955.4399999999998,1955.8, Yeah.
1955.8,1957.24, Do we have anything else to talk about today?
1958.08,1958.6399999999999, Besides the line.
1958.6399999999999,1959.84, Your home soon and got a bed.
1959.84,1960.4399999999998, You do.
1960.4399999999998,1961.52, Back to bed for you.
1961.52,1962.08, Let the roar.
1962.08,1965.48, I know what the mind just sounds like from the special sick bed edition.
1965.48,1966.48, Yeah.
1966.56,1967.84, Spin is almost nasty.
1967.84,1968.84, What's an A fun?
1968.84,1969.84, I can't even play games.
1969.84,1970.84, I played one.
1971.16,1971.64, The S.
1971.64,1972.16, That's good.
1972.3600000000001,1973.44," Oh, it's my cell phone."
1973.44,1977.4," Well, it's vibrating on the on their cast table."
