start,end,text
1807.28,1808.28, 44 scale.
1808.28,1810.28, 140 something.
1810.28,1811.28, You know what?
1811.28,1812.28, You actually know a little bit more about that.
1812.68,1817.6399999999999," I think it's like, it's like a awkward country, but I don't treat."
1817.6399999999999,1819.52," Actually, I think it caught there."
1819.52,1820.52, It is not my all-train.
1820.52,1825.12," But I do, I've been in a collecting like diecast airplanes from World War II."
1825.12,1827.28," They have a cool, not proliferating on your desk there."
1827.28,1828.28, They have.
1828.28,1829.28, They usually go wild.
1829.28,1831.12, They might like nerd display case.
1831.12,1833.8," Everyone's like, that guy talks about nerds."
1833.8,1835.2, It's like an old man thing.
1835.2,1836.2, It's like dignified.
1836.2,1837.2," Like, it's going to grandpa."
1837.2,1838.54," He's got this cool, planes."
1838.54,1840.68," In the case, they'll beat your ass if you touch him."
1841.6000000000001,1842.6000000000001, So it's one of those things.
1842.6000000000001,1844.72," You get older, like, hey, I got something to say."
1844.72,1846.6000000000001," I waste my money on anything so I can just,"
1846.6000000000001,1848.04, all the go to saving on my K.
1848.04,1848.8400000000001, I need something to buy.
1848.8400000000001,1850.1200000000001, Don't you buy comics every week?
1850.1200000000001,1851.52, I'm totally as dare.
1851.52,1853.64, How many he's very select?
1853.64,1854.24, How many week?
1854.24,1855.0, Like one or two.
1855.0,1855.8400000000001, He buys like one or two.
1855.8400000000001,1856.64, How many?
1856.64,1858.24, Some weeks I go into my fuck this.
1858.24,1859.0, There's nothing around.
1859.0,1860.0, Yeah.
1860.0,1860.52, Sorry Jeff.
1860.52,1861.8400000000001, I didn't want any more F-bombs.
1861.8400000000001,1862.2," No, no."
1862.2,1864.04, When we needed one right there.
1864.04,1866.0, I think I dropped the F-bomber earlier.
1866.0,1867.3600000000001, I'm actually dropping the habit.
1867.3600000000001,1869.0, I'm actually officially going to start.
1869.0,1870.64," I was, I wasn't going to drop the habit."
1870.68,1871.64, I have fombs.
1871.64,1873.76," But sometimes when I see the comics there,"
1873.76,1876.96," that's what I'm, I'm okay with some profanity."
1876.96,1878.3600000000001, I just didn't want to stover do it.
1878.3600000000001,1879.3600000000001, Yeah.
1879.3600000000001,1882.0, It's all natural.
1882.0,1882.8400000000001," So wait, how much are you?"
1882.8400000000001,1883.8400000000001, What minor to ever?
1883.8400000000001,1886.0, How much are you spending on comics these days?
1886.0,1887.0," Okay, I'm weak."
1887.0,1890.1200000000001," Yeah, I'm probably the worst offender because I just soak up graphic novels"
1890.1200000000001,1891.1200000000001, and stuff.
1891.1200000000001,1892.48, I don't read as nearly as much a scooter you still probably.
1892.48,1893.48, Yeah.
1893.48,1896.0, I would say I spend probably 10 to 15 bucks a week.
1896.0,1897.2800000000002," All right, that's not that bad."
1897.2800000000002,1898.2800000000002, I bet it adds up.
1898.2800000000002,1899.2800000000002," You think, you know, over a month."
1899.2800000000002,1900.44, It does that up.
1900.44,1905.3600000000001," And but I was probably more of a $20, $25 at the point where I quit."
1905.3600000000001,1907.52," That's what you make any sense, though."
1907.52,1909.48, They're never that many good ones.
1909.48,1910.48, I know.
1910.48,1911.72, That's why I had to quit.
1911.72,1912.76, It was a week.
1912.76,1917.0, It's because I got completely sucked into it in every way.
1917.0,1919.88," Like, how would you suck the cross over the cross over the cross over the cross over the"
1919.88,1920.88, cross over the cross?
1920.88,1923.44," Because, yeah, exactly because I'd be reading Batman and then it'd be like,"
1923.44,1924.8, continued in the next weeks.
1924.8,1925.8, Robert.
1925.8,1926.8, But it's totally not a fucking fuck.
1926.8,1927.68, Now I got to read the video.
1927.68,1928.68, The nightfall.
1928.68,1929.68, It's the achievements.
1929.76,1930.68, It's the same thing.
1930.68,1932.68," It's just like, don't let it go."
1932.68,1935.3200000000002, Then they pull that all the freaking time in the comic world.
1935.3200000000002,1938.6000000000001, I would feel like I was missing a plot thread if I didn't go read Robin then.
1938.6000000000001,1941.72," You know, but you should like me and like do the plot sucks."
1941.72,1942.72, So I don't care.
1942.72,1944.44," Like the last one in hell, I could get more of it."
1944.44,1947.48," I couldn't help but you're not actually like, maybe you don't think it's going to be"
1947.48,1948.48, awesome.
1948.48,1949.48, And you have another thing about it.
1949.48,1955.04," So when you were spending 25 bucks a week or whatever it was, how long was it?"
1955.04,1957.96," Five, 10 years ago?"
1957.96,1958.96, That's 10.
1958.96,1959.96, It was more like five years ago.
1959.96,1962.52, Comic prices have gone up in that time.
1962.52,1964.96, So I'm going to imagine how much you drew how many bucks.
1964.96,1967.52, You can imagine how many stacks of comics you're walking out.
1967.52,1968.52," Yeah, think of that."
1968.52,1972.52," Like if even me, I had wait, it was ridiculous."
1972.52,1976.52," You know, it's like, I mean, in my era, like I was, when I started buying them, they were"
1976.52,1980.28, like 50 and I remember the jump on the one in 75 cents and that was pretty big for me.
1980.28,1982.08, You obviously remember a little earlier than that.
1982.08,1987.52," But they're like, hey, and now that the four bucks, I know like inflation all it's like,"
1987.52,1991.2," well, you could have bought a whole lot more for your 75 cents back then."
1991.2,1996.6," But like still, I'm just saying, there's only like, that's why there's probably like,"
1996.6,1998.44, and I don't like the superhero stuff so much.
1998.44,2000.96," Yeah, there's like four books a month that I'll read."
2000.96,2001.96, Why did that one as a kid?
2001.96,2002.96, And then I quit.
2002.96,2005.8799999999999," And then in the 80s, I came back and did the whole."
2005.8799999999999,2008.44," I started, I got back into it because of Watchman."
2008.44,2013.24," And then I would only buying like, oh, God, what was the very good stuff?"
2013.24,2017.48," The Peter baggy stuff, the, oh, hate, hate things like that."
2017.48,2019.04," And I was like, oh, I'm only reading this stuff."
2019.04,2020.1200000000001, Not that superhero stuff.
2020.1200000000001,2023.44," But then slowly, I got hardcore in this."
2023.44,2025.6," Slowly, I, I hear flash."
2025.6,2026.72, That's a good writer again.
2026.72,2027.72, Thank you.
2027.72,2031.88," He's guy gardener, guy gardener really died down the night over the green lantern."
2031.88,2034.52," Oh, man, that whole, this is all we got to do."
2034.52,2035.52, I'm on the bottom of that.
2035.52,2036.8," No, we're going to get off the comics track."
2036.8,2037.8, Yeah.
2037.8,2040.72," Actually, I actually watch, I pull it back."
2040.72,2041.72, Yeah.
2041.72,2046.0," So like this rule for comics, I use for games, but anything, any other obsession I have in life,"
2046.0,2047.0, I have a stack.
2047.0,2049.96," And if the stack gets above a certain, it's like a, it's like a watermark."
2049.96,2050.96, Yeah.
2050.96,2053.8," If that stack of comics is too high, I'm not buying anymore."
2053.8,2055.44, This is why I gave up that.
2055.44,2056.28, You throw them away.
2056.28,2060.56, That's why I quit was because the unread comics run my nightstand and the pile kept getting
2060.56,2061.56, higher and higher and higher.
2061.56,2064.76," And I was still buying new ones every week because I thought, I can't miss a week."
2064.76,2065.76, Yeah.
2065.76,2066.96, What if Robin sells out?
2066.96,2071.32," So the pile kept growing and then finally it's like, I'm done."
2071.32,2073.04, But I was doing the same thing with games too.
2073.04,2075.88," And like, like, because I have so many games to just try to sift through."
2075.88,2077.0," So after all, I'm just like, fuck it."
2077.0,2077.92, This one's just going.
2077.92,2078.92, Yeah.
2078.92,2082.1600000000003," And on that note, the GFW players are going to take a quick."
2082.1600000000003,2083.32, What was the question?
2083.32,2085.96," I was, there was a question."
2085.96,2089.6800000000003," I was trying to, he's a saint, not so, slightly into our break."
2089.6800000000003,2090.6800000000003, Really?
2090.6800000000003,2091.6800000000003, We have a break.
2091.6800000000003,2092.6800000000003, Yeah.
2092.6800000000003,2093.6800000000003, Let's do that.
2093.6800000000003,2094.6800000000003, Okay.
2094.6800000000003,2095.6800000000003, We'll have a break.
2095.6800000000003,2096.6800000000003, Okay.
2096.6800000000003,2097.6800000000003, We'll have a break.
2097.6800000000003,2099.6800000000003, We'll have a break today.
2099.6800000000003,2100.6800000000003, Okay.
2100.6800000000003,2101.6800000000003, We'll be back.
2101.6800000000003,2102.6800000000003, Attention.
2102.6800000000003,2103.6800000000003, Smart asses and dumb asses.
2103.6800000000003,2104.6800000000003, We'll rejoin you after the break.
2104.68,2105.68," Oh, hello."
2105.68,2106.68, I didn't see you there.
2106.68,2109.96," But as long as you're here, let me tell you about EGM Live, the weekly podcast from the"
2109.96,2116.8799999999997," editors of Electronic Gaming Monthly, along with the wonderful sounds of EGM Live comes"
2116.8799999999997,2120.8399999999997," action packed with special guests, late breaking news, fanboy baiting commentary, behind"
2120.8399999999997,2126.0," scenes, tales of office Tom Follery, and trivia contest with fan tabulous prizes."
2126.0,2130.16, Download it now at EGMlive.1up.com or subscribe to it through iTunes.
2130.56,2134.92," EGMlive is part of the one-up radio network, tape and the zip-tavis offices and San Francisco."
2134.92,2139.16, It is not actually live and conscious prizes are not guaranteed to be sent to AWS.
2139.16,2140.16, Hi.
2140.16,2141.16, We're back.
2141.16,2142.16, Hello.
2142.16,2145.16, Do we have another question?
2145.16,2146.16, We do.
2146.16,2147.16, This is the long one.
2147.16,2150.16," If anyone wants to read it, that's cool, or I can read it."
2150.16,2151.16, You're doing a fine job.
2151.16,2153.16," You're a fraud, but it's good."
2153.16,2154.16, It comes to a good point.
2154.16,2155.16, Okay.
2155.16,2156.16, Okay.
2156.16,2159.16, I'm just going to see if I need to read the first paragraph.
2159.16,2162.16, You have some pregnant paws.
2162.16,2163.16," Oh, I'm on the editing there."
2163.16,2164.16, Yeah.
2164.16,2165.16," Actually, there was one that I'm just going to edit as I read it."
2165.16,2166.16, Go ahead.
2166.16,2169.16, Just filling up blank from the last reader question.
2169.16,2170.16, Yeah.
2170.16,2174.16," There are asking about, okay, we're talking about how the G, the gaming age forms were picking"
2174.16,2179.16," up on our stuff and a lot of people who were, or even into PC games or checking our podcast."
2179.16,2183.16," Another added bonus, which I personally find really rewarding is the people who are actually"
2183.16,2184.16," saying, you know what?"
2184.16,2187.16," I want to go out and check out the magazine now because of it, even though I don't play"
2187.16,2190.16," PC games and stuff like that, it's in some small way."
2190.16,2192.16," I feel like, you know, then I'm doing my job."
2192.16,2196.16," If we're getting people excited about PC games and they never even thought about it before,"
2196.16,2197.16, then we do something right.
2197.16,2198.16, Goddamn right.
2198.16,2199.16, That's a good man.
2199.16,2200.16, There you go.
2200.16,2201.16, Okay.
2201.16,2202.16, Sorry.
2202.16,2203.16, So you're a caught up.
2203.16,2204.16, That's how I ended up with the model railroad.
2204.16,2205.16, That's what I'm saying.
2205.16,2206.16, Okay.
2206.16,2207.16, So here we go.
2207.16,2209.16," Veter AJ guys, 7-11, says."
2209.16,2213.16, Now I know there are always people on the cutting edge who have the newest hardware at all
2213.16,2216.16, times to run games such as crisis and Unreal tournament 3.
2216.16,2220.16, But it seemed to me that the majority of users will not have a machine powerful enough to run
2220.16,2221.16, these games.
2221.16,2223.16, At some point they will and maybe they'll buy these games.
2223.16,2226.16, I'll be at from a bargain bin instead of getting it for $50 on day one.
2226.16,2230.16," Now to my point, is it really worth it to develop for the bleeding edge?"
2230.16,2234.16, It seems to me that companies that do are cutting out potential customers.
2234.16,2238.16, It is not unlike the way people feel when a console game launches doomed to die.
2238.16,2242.16," Some feel about, like some feel about resistance on PS3."
2242.16,2245.16, I look at what happened with both their requests to when World of Warcraft launched.
2245.16,2246.16, Nearly the same time.
2246.16,2251.16, And I wonder if part of what I've success is attributed to the fact that it can run almost any PC
2251.16,2252.16, from the last four years.
2252.16,2253.16, Okay.
2253.16,2254.16, Now here's where I thought it gets cool.
2254.16,2258.16," I understand that this pressure, especially now for PC to look better than consoles."
2258.16,2264.16," However, it seems at this time with advances such as DX10 and Vista, the PC console battle is being"
2264.16,2268.16," a naturally forced ahead, whereas in the past it seemed that PC would just naturally catch up."
2268.16,2271.16, So are we doing this spending another 600-year on new graphics cards?
2271.16,2274.16, Are you thinking after seeing possible diminished returns on such a big game?
2274.16,2278.16, I think it's a long-term return on such bleeding edge games that developers would go a bit more low-tech.
2278.16,2282.16," So long question, but I think it was the last paragraph that I thought was cool."
2282.16,2285.16," I mean, especially the whole, I mean, in relation to console stuff."
2285.16,2286.16, Yeah.
2286.16,2287.16, In relation to keeping up with console.
2287.16,2293.16," And then also about actually sort of shying away from AAA, like bleeding edge tech-based games."
2293.16,2296.16," And that, like I'll just offer an answer, is like now we're seeing,"
2296.16,2303.16, it's like every day now we see some new group or some new outlet where you're able to get games that don't care
2303.16,2306.16, or don't really need to be cutting edge in terms of technology.
2306.16,2307.16," Yeah, it's simply about."
2307.16,2312.16," So between the ubiquitous live arcade to stuff available on Steam to the game-cott guys,"
2312.16,2315.16," it just announced their initiative, you know?"
2315.16,2318.16," Well, I think there's, it's kind of funny that I think about it."
2318.16,2323.16," And this is in no way a Ra Ra Microsoft sort of comment, but there are, in a way,"
2323.16,2325.16, they're kind of working on both ends of the spectrum.
2325.16,2329.16," So you have obviously DX10 pushing the bleeding edge stuff, right?"
2329.16,2333.16," There's, you know, got to, got to get in the high-end process, there's the graphics cards in one."
2333.16,2338.16," And then you have a game studio expressed just having people, they're giving a free design tool."
2338.16,2341.16," So if anyone wants to make a game, they can do it for free."
2341.16,2347.16," And they have a decent, you know, programming tool to actually create a free game online right now."
2347.16,2351.16," So I mean, it's, I think they're trying to help foster the market in some way."
2351.16,2354.16," I mean, I totally want to see more people getting into games."
2355.16,2360.16," And me personally, I follow, I follow the indie games and freeware and share where a lot closer than I do."
2360.16,2362.16, Some of the big budget title is in the series.
2362.16,2366.16," And I think that's, honestly, that's what I think a lot of the future PC gaming can be is that"
2366.16,2372.16," everyone has a chance to make a good, a quick, dirty little game or whatever."
2372.16,2377.16," The other thing is just dead on is that few developers, two publishers have,"
2377.16,2385.16, are in a position to finance a PC-only AAA game with the multimillion-dollar development budget.
2385.16,2390.16," And like I say like, like, right about now, it's just a teach queue is one of the few ones doing it, you know,"
2390.16,2391.16, a lizard of course.
2391.16,2392.16," And lizard, yeah."
2392.16,2397.16," And because I mean, I would say valve is well, but I mean, obviously they're all talk about going"
2397.16,2398.16, multiply.
2398.16,2400.16, It hasn't really materialized outside of X-bar.
2400.16,2401.16," I mean, half like two for X-bar, one."
2401.16,2402.16, Right now.
2402.16,2404.16," But all their plans are, yeah."
2404.16,2407.16," I mean, definitely appreciate that they, that consoles they're lead."
2407.16,2410.16," I mean, that, that PC is they're leading platform."
2410.16,2411.16, Right.
2411.16,2416.16," But in terms of like, I said, THQ because company heroes, straight PC, Supreme Commander, straight PC, stalker."
2416.16,2417.16, That question question.
2417.16,2418.16, In tight question.
2418.16,2419.16, Yeah.
2419.16,2427.16," I mean, they're one of the few publishers that said, like, okay, we're going to recoup some of the cost for these with the European market because, you know, we definitely, and we just didn't story about that."
2427.16,2429.16," And I'd, you know, go back and pivot so much."
2429.16,2433.16," But I think it's really interesting that we can't, and guys like,"
2434.16,2449.16," who wrote that AJ, I think, would appreciate it because it says that, like, you're right, that it is diminishing returns to such an extent that you need world markets in order to support and make possible, you know, that level of investment, you know, PC only game."
2449.16,2451.16," And I think he was dead, right?"
2451.16,2456.16," I mean, maybe you all agree this in a, it's not really an arguable point, but the difference in the success between."
2456.16,2458.16," Wow, an EQ too."
2458.16,2461.16," I mean, obviously one game was way better than the other frankly."
2461.16,2469.16," I mean, I mean, I mean, because it wasn't just any PC from the last two years, it was the Mac as well."
2469.16,2470.16, Right.
2470.16,2474.16," And I forget who I was talking to about this recently, but I think, you know, Vanguard suffers from a lot of the same problems."
2474.16,2475.16," Well, right."
2475.16,2482.16," I mean, I've been reading a foreign posts about people, you know, even with great systems having to run Vanguard at the absolutely dumbest settings."
2482.16,2483.16, Yeah.
2483.16,2490.16," You know, and how how frustrating and discouraging with that be if you have a fairly recent PC, right, you know, I mostly play a world of work on my laptop, which is no."
2490.16,2492.16, Where near my right.
2492.16,2493.16, But the process fine.
2493.16,2499.16," And the cool thing, I think we're all kind of saying it is like the art styles really what makes it with sets in a partner."
2499.16,2500.16, Yeah.
2500.16,2507.16," And a totally proves art direction is like I can run it at like 800 by 600 or like at some ridiculous jacket up to 25, 60 by 1600."
2507.16,2509.16, It's going to look beautiful either way.
2509.16,2511.16," Yeah, I put that 8800 in my machine family."
2511.16,2515.16, The smaller one would go ahead and not make that joke again this week.
2515.16,2518.16," But I put the smaller one in the box and seriously, wow."
2518.16,2520.16, It looks like a different game to me now.
2520.16,2522.16, It's kind of blown me away.
2522.16,2524.16, That because I could jack it up so high.
2524.16,2530.16," I'm like, oh my god, there's like all these textures on the creatures that I never saw before because I was always playing on my laptop too."
2530.16,2535.16," So, but the fact it got it, you got to have something to do when you're fighting in that game."
2535.16,2537.16, But I had the textures.
2537.16,2539.16, Cool textures.
2539.16,2540.16, Cool textures.
2540.16,2541.16, Like one.
2541.16,2542.16, One.
2542.16,2543.16, It's all right.
2543.16,2544.16, Playing it.
2545.16,2547.16, Hit him with your hit him with your minus 17 gun Ryan.
2547.16,2549.16, Keep hitting him with that minus 17 gun.
2549.16,2551.16, This is like whatever it is.
2551.16,2553.16, You're the solider left.
2553.16,2554.16, We'll get you one day.
2554.16,2555.16," No, I'm the last one."
2555.16,2556.16, He's the holdout.
2556.16,2558.16," On that note, too."
2558.16,2563.16, The other thing is that like so saying that you have company like teach queue this doing just piece the only.
2563.16,2567.16, Everyone else is recouping their cost by spreading it across all the platforms.
2567.16,2572.16," I mean, more and more, it's like even people even, even not, you know, between PS3 and 360."
2572.16,2575.16, What is that exactly is differentiating the two?
2575.16,2578.16," You know, what happens when metal gears available on 360?"
2578.16,2583.16, What happens when a final fantasy is available on it grant that dot was available on it.
2583.16,2588.16," But for us, it's like most cases, it's actually all three."
2588.16,2590.16, Do you know who he never hear from anymore?
2590.16,2591.16, Activision.
2591.16,2595.16, Where the hell did they go on the PC actually go on?
2595.16,2597.16, They went to with with it stuff.
2597.16,2599.16, So you got to a quick horse.
2599.16,2600.16, You're right.
2600.16,2601.16, Sorry.
2601.16,2602.16, But he's not an idiot.
2602.16,2603.16, Right.
2603.16,2604.16, I'm a good cook.
2604.16,2605.16, But he's the one.
2605.16,2612.16," Here's part of what I was getting at the whole duty for example because because console hardware is established this bar where you can do these things and he's asking you know,"
2612.16,2617.16, PC traditionally catches up with its own pace and then like overlaps it.
2617.16,2619.16, But now it's happening sooner than it's happened before.
2619.16,2621.16, It's like PS3's just out.
2621.16,2622.16, You think that's right.
2622.16,2628.16, I think it's right according according to Des the A 800 slotters like the graphics capabilities of PS3.
2628.16,2629.16, Instrict like geek terms.
2629.16,2630.16, That's what I've absolutely.
2630.16,2635.16," I mean, well, I mean, strictly like the PS3 like in the dev unit that's used to show off."
2635.16,2636.16, Right.
2636.16,2640.16," It was basically like, you know, a sli system from like last year."
2640.16,2642.16, And we will not see.
2642.16,2648.16, And as soon as crisis comes out is when we will see where we've actually like overlap them to some extent.
2648.16,2652.16, But here's what here's the point I was making those at because of that because everyone's developing for all three of these.
2652.16,2657.16, What happens when we're sitting here with the A 800 and all this power that goes above and beyond there.
2657.16,2665.16, How many of these developers or publishers are going to pressure the developers to make PC versions that take advantage of it will be right back to where we were.
2665.16,2671.16, Before the current the now the current gen formerly the next gen the consoles came out when everything we're like dude looks like a PS2 game.
2671.16,2678.16," Like yeah, I know my 7900 can do a hell of a lot more than that. Why does you know whatever the game may be it was a King Kong was that way."
2678.16,2679.16, And look like the expo.
2679.16,2680.16, I think we're going to.
2680.16,2682.16, We'll be right back at that point.
2682.16,2687.16," How many people are going to be you know, aside from the cry text."
2687.16,2688.16," Well, how many aside from cry."
2688.16,2693.16, Who is who is going to be saying in a way it's almost the same argument you were making about the physics card.
2693.16,2701.16," Well, actually I think in this case Microsoft is heading into bets on the fact that everyone who buys a new PC is going to have this to install on their system."
2701.16,2703.16, And that means dex tends in there.
2703.16,2711.16, It's also going to mean that they can have a min a min spec machine a min spec hardware inside that same machine where they can play direct x 10 games out of the box.
2711.16,2720.16," I think basically the whole idea is it's not so much going to like oh my god, where all these hardcore gamers going to come from it's like anyone who buys a new computer is going to have this in there."
2720.16,2728.16, Because because just even to run vista like on its main interface it needs to write the x just for the main interface.
2728.16,2733.16, So like so it requires a certain level requires a certain level of graphics card and it creates a base level.
2733.16,2734.16, That's great.
2734.16,2737.16, So when you think the minimum RAM levels going to be now.
2737.16,2740.16, You know what I'm I'm I'm getting like for a gamer.
2740.16,2742.16, Two gigs.
2742.16,2744.16," Yeah, yeah, I'd say it's a fair."
2744.16,2752.16," But you know, I think it's like, you know, RAM is so cheap so you can get but the point is like to answer your question."
2752.16,2758.16," I mean, I see where you're trying to go with that like you know are they looking for an audience that isn't there."
