start,end,text
1010.04,1012.4," Do you like, do you want to be the crap on the carpet?"
1012.4,1013.4, I don't know.
1013.4,1014.24, I don't know.
1014.24,1015.3199999999999, I like it in Dead Rising
1015.32,1017.0," because, because Dead Rising,"
1017.0,1020.96," I found a Times, the linear storyline itself would frustrate me."
1020.96,1022.12, And it would make me want to quit.
1022.12,1023.48," And then I would go, okay, well,"
1023.48,1026.0800000000002," instead, I'm just going to go kill the 20,"
1026.0800000000002,1028.48, I'm going to put funny hats on 20 of the guys
1028.48,1029.76, and get that achievement.
1029.76,1030.6000000000001, Do you get the money?
1030.6000000000001,1031.6000000000001, Do you get the money?
1031.6000000000001,1033.28, Of course I wouldn't do that otherwise.
1033.28,1034.1200000000001, No.
1034.1200000000001,1035.8, Do you any of you guys play multiplayer?
1035.8,1036.96, Games a lot on Xbox Live?
1036.96,1037.8, No.
1037.8,1041.64," What if, what if, like, you get a book, say for example,"
1041.64,1042.8, you just go get any book you want.
1042.8,1044.48," And then in the back page,"
1044.48,1045.52," there's like a section that says,"
1045.52,1049.24," go through the book in circle, like every other life."
1049.24,1052.8," You know, circle the word pandemonium, like 20 times."
1052.8,1054.64," And then you know, you get an achievement for that."
1054.64,1057.4," Or like go and find paragraphs that have,"
1057.4,1058.6," you know, 50 words."
1058.6,1059.6, I'll give you a good example.
1059.6,1061.04," There's a, there's a, yeah,"
1061.04,1063.92," young kid series or teen,"
1063.92,1066.4, Queen books called Artemis Fowl.
1066.4,1067.44," And then if you've heard of the series,"
1067.44,1069.08," it's like, sounds fiego."
1069.08,1071.24," No, no, it's a good series by this Irish writer."
1071.24,1073.56," And it, it got popular because a Harry Potter"
1073.6,1075.6399999999999, but it's totally not Harry Potter.
1075.6399999999999,1078.0," Anyway, he's, it's about this 12 year old"
1078.0,1079.12, criminal mastermind.
1079.12,1080.2, And it's a pretty great series.
1080.2,1081.84," But at the bottom of each book,"
1081.84,1086.1599999999999, he has a code that goes throughout the entire book.
1086.1599999999999,1088.24," Like, so the book starts from the cover."
1088.24,1089.56, And it goes all the way to the back.
1089.56,1091.28," Yeah, it's basically by more, you know,"
1091.28,1093.76, but by more Artemis Fowl books.
1093.76,1094.9199999999998, But by the serial.
1094.9199999999998,1096.8, But the code is there at the bottom.
1096.8,1099.6799999999998," And when I had pneumonia, I actually like spent one day"
1099.6799999999998,1101.12, like crack in that whole code.
1101.12,1102.96," So see, I don't have to have a moment."
1102.96,1104.6000000000001," Boy, G G F E."
1104.6000000000001,1106.16, You're actually really quite the code.
1106.16,1109.04," And I did, and I am we cheated on the internet."
1109.04,1111.6000000000001," Guys, well, that's the only code's better than the one."
1111.6000000000001,1112.24," Wait, wait, wait, wait."
1112.24,1113.32, You went on a new way.
1113.32,1115.32," Hey, I'm like a internet that gives it a hint."
1115.32,1118.92, Is there an Artemis Fowl wiki for the site for?
1118.92,1122.56," The trouble with trollbook.com, whatever they got."
1122.56,1123.1200000000001, That's what it was.
1123.1200000000001,1124.28, That's the last degree to go.
1124.28,1125.04, It's the last degree to go.
1125.04,1125.88, Yeah.
1125.88,1126.88, Trid carefully from my friend.
1126.88,1128.16," So yeah, so the answer is, yeah."
1128.16,1129.88," So if there was a fun thing to do in a book,"
1129.88,1130.72, I would do it.
1130.72,1131.8," You could just like, did do it."
1131.8,1134.1599999999999," You really were sick, Joe."
1134.1599999999999,1135.6, It was my fever.
1135.6,1136.04, I don't know.
1136.04,1137.2, It's what?
1137.2,1139.84, Am I the only defender of Xbox Live achievements
1139.84,1140.56, in this podcast?
1140.56,1142.36, Sean was going on the soccer.
1142.36,1143.9199999999998, I'm torn.
1143.9199999999998,1145.9199999999998, Psychologically torn.
1145.9199999999998,1146.2, I hear it.
1146.2,1148.52," It's artificial, but I guess it just doesn't bother"
1148.52,1150.6399999999999, that it slatter on hand whenever you start to fall off.
1150.6399999999999,1152.04, I'm like a completeist.
1152.04,1154.76," Like so if I don't get it, it does run me."
1154.76,1155.3999999999999," Oh, father."
1155.3999999999999,1157.84," So if you don't get them all, right?"
1157.84,1159.68," So that's why when I have to get this stuff,"
1159.68,1161.08, I don't see the key there.
1161.08,1162.8799999999999," So if you're gonna rent them, you resent them."
1162.8799999999999,1163.72, I do resent them.
1163.72,1166.0, So basically anyone that suffers from OCD should not bother playing
1166.0,1167.36, Xbox 360 games.
1167.36,1170.6799999999998," So if you beat the game, I like to pray because like"
1170.6799999999998,1172.84, I'm giving a achievement for like beating a level.
1172.84,1173.6799999999998, Right.
1173.6799999999998,1174.96, Of course I'm gonna do that anyway.
1174.96,1175.96, Those are good at you.
1175.96,1178.6799999999998," But okay, let's say you beat a game 100%."
1178.6799999999998,1180.12, They're actual real game.
1180.12,1182.36, And they didn't get any achievements with the completest
1182.36,1185.12, in you feel like you completed and beat the game.
1185.12,1186.4399999999998," Like it's like, it's a highlight."
1186.4399999999998,1187.84," Like the analogy to the book,"
1187.84,1190.8799999999999, like trying to underscore this fundamental difference
1190.88,1193.0400000000002, disparity between games and other media.
1193.0400000000002,1194.24, Like same thing if you're in the theater
1194.24,1196.6000000000001, and you're like a thing flashes on the screen.
1196.6000000000001,1199.0," You've successfully watched 20 minutes of,"
1199.0,1201.0," you know, I mean, I don't care"
1201.0,1202.68, because I'm not afraid to prove that I could sit
1202.68,1203.8400000000001, through this piece of shit.
1203.8400000000001,1205.0400000000002," I mean, that's really, she's like,"
1205.0400000000002,1208.0400000000002," yeah, to respond to a respond to the story,"
1208.0400000000002,1210.8000000000002," look at the performances, all the various reasons"
1210.8000000000002,1212.2800000000002, you look at whatever the media is.
1212.2800000000002,1213.64," I'll tell you, I would like to give you."
1213.64,1214.96," Like you need, you like, I mean,"
1214.96,1216.6000000000001," that's one of the key things,"
1216.6000000000001,1219.1200000000001, one of the key measures of success of a game
1219.12,1222.04, is like feeling like you accomplished something.
1222.04,1223.56, And like I guess it's not good enough.
1223.56,1226.04," The story, like it's not that the narrative is like,"
1226.04,1227.3999999999999," you know, you really did something"
1227.3999999999999,1228.84," or communicating that you,"
1228.84,1230.4799999999998, you caused some great change in the world.
1230.4799999999998,1233.0," But like, it's like breakout that little,"
1233.0,1235.76, you've finished that level.
1235.76,1237.44, You get five points.
1237.44,1238.8, Yeah.
1238.8,1239.64, Yeah.
1239.64,1241.04," Yeah, and you're right."
1241.04,1241.44, Yeah.
1241.44,1243.24," Like I said, I could really care less about the points."
1243.24,1245.08, And as long as like if the points actually had it
1245.08,1247.28," some kind of like use some real application,"
1247.28,1248.32," otherwise, you know, it's like,"
1248.32,1249.16, give me a freaking cookie.
1249.16,1249.84, I don't give a crap.
1249.84,1251.52, It means you just bad as much.
1251.52,1252.12, That's true.
1252.12,1253.64, I would like achievements
1253.64,1255.68," of for sitting through a movie, though,"
1255.68,1257.64, because I sat through two this weekend.
1257.64,1260.72, And both times were terrible experiences.
1260.72,1262.4," And I'm just like, why the fuck do I go to the movie,"
1262.4,1263.24, say anymore?
1263.24,1265.96," It's like I would like, no, the movies were fine."
1265.96,1267.68, But as I would like a 10 point achievement
1267.68,1269.92," for not breaking the skull of the guy in front of me,"
1269.92,1271.24, keep talking to his girlfriend.
1271.24,1272.24, Yeah.
1272.24,1274.24, I'd like another five points for the guy
1274.24,1276.52, not to in popcorn in my fucking ear behind me.
1276.52,1279.0800000000002, Or by the road popcorn and coming back to your seat
1279.0800000000002,1280.6000000000001, and having the first word out of your mouth
1280.6000000000001,1282.64, not be about how overpriced the popcorn.
1282.64,1284.96," Yeah, the $5 popcorn."
1284.96,1287.8400000000001," Yeah, I saw children in a man and a couple in front of me."
1287.8400000000001,1290.52, The guy with his wife who felt the need
1290.52,1293.08, to explain every scene as it was gone.
1293.08,1294.48, He just walked through the door.
1294.48,1295.52, Really?
1295.52,1296.72, Did he?
1296.72,1298.36, You're kidding.
1298.36,1299.52, That's my cocaine.
1299.52,1300.36," Oh, is it?"
1300.36,1301.36," What am I, ex-girl?"
1301.36,1303.36," Shut up, mother."
1303.36,1304.6399999999999, What's your movie with us?
1304.6399999999999,1306.48, And she was exactly like that.
1306.48,1308.04," We're like, they think that they can like,"
1308.04,1309.92, influence the outcome of the movie.
1309.92,1310.84," As if it hadn't already,"
1310.84,1311.76, but scripted or recorded.
1311.76,1312.76," Oh, no, no."
1312.76,1314.24," And it's a typical, when it's like,"
1314.24,1315.96," normally if I hear something like that in the theater,"
1315.96,1317.92," it's like, oh, God, this is like more on."
1317.92,1320.04, But it was like the girlfriend's mom.
1320.04,1321.8799999999999," So it was like, you just kind of had to sit there, you know,"
1321.8799999999999,1323.84, and even exactly what you're saying.
1323.84,1327.08," But yeah, anyway, yeah, I get a point if I can move"
1327.08,1328.44, to the discussion back to game.
1328.44,1330.04, We get to today.
1330.04,1331.08," Actually, if we get some of it, we get some of it."
1331.08,1331.92, We get some of it.
1331.92,1334.44, We'll hold the popcorn bag trick.
1334.44,1335.44, OK.
1335.44,1336.28," Yeah, I had to do it."
1336.28,1336.92, Sorry.
1336.92,1339.28," OK, so back to the subject."
1339.28,1340.0, We got more.
1340.0,1341.6, We got plenty more reader questions.
1341.6,1342.12, We do.
1342.12,1343.1599999999999, We done with those questions.
1343.1599999999999,1343.84, I think we're done.
1343.84,1345.8," We, the question, I think we're happy."
1345.8,1348.12, We all happy with the change.
1348.12,1350.0," Are we happy, personally?"
1350.0,1354.12, We definitely are starting to see more eyes on this.
1354.12,1356.12, We get a lot of feedback that people can now find
1356.12,1356.8, this in the store.
1356.8,1358.28, That's right.
1358.28,1362.0," So my mom said, yeah, I actually, and I like the design."
1362.0,1363.12, A lot better.
1363.12,1366.52," I'm happy with the kind of cleaner, wider space that we have now."
1366.52,1370.16," Which we might have done anyway, but the change over the game"
1370.16,1375.68, so when does sort of exacerbated the need to do a redesign.
1375.68,1377.0, So that was cool.
1377.0,1377.8, I'm pleased.
1377.84,1381.28," Yeah, if depending on how things have gone, it could have been a really"
1381.28,1382.56, frustrating time.
1382.56,1385.12, And I'd say I'm really happy the fact that yeah.
1385.12,1386.24," Yeah, it's a natural evolution."
1386.24,1387.12, I see every issue.
1387.12,1387.9199999999998, We're doing a lot more.
1387.9199999999998,1388.9199999999998, A lot of things better.
1388.9199999999998,1391.0," And we're gaining a steam, I think."
1391.0,1395.04, I think we're definitely doing a lot of natural evolution.
1395.04,1397.04, And we're not done yet.
1397.04,1398.1599999999999, So that's the move.
1398.1599999999999,1398.44, OK.
1398.44,1399.6, Next question.
1399.6,1402.28, We got reader all my wants to know.
1402.28,1403.36, How am I?
1403.36,1406.0, What were the initial feelings when you had to do a podcast?
1406.0,1408.44, And how do you feel about it now?
1408.44,1409.44, It surprises.
1409.44,1411.16, One sexy guy that I'll.
1411.16,1412.24," Oh, man."
1412.24,1414.64," He's got a nice, they get a bad signature in everyone."
1414.64,1415.96, Let's not bring it up.
1415.96,1417.4, It's part of part of the server.
1417.4,1418.84," In some jokes, they're message."
1418.84,1419.2, Right.
1419.2,1419.92, It's got to go.
1419.92,1421.76," So once we're done with this, we're going to go get rid of it"
1421.76,1423.44, for him.
1423.44,1425.24," Anyway, so I'll mind again."
1425.24,1428.24," Outside of whatever voice that was wants to know,"
1428.24,1430.24, what are taken on podcasting was when we started
1430.24,1431.76," question, how has it changed?"
1431.76,1435.12," I remember when we did our first one, we just kind of like, well,"
1435.12,1436.4799999999998," we got to do it, I guess."
1436.4799999999998,1437.9599999999998," Well, we definitely, it was one of those things."
1437.9599999999998,1439.8799999999999, It was like imposed upon us.
1439.8799999999999,1442.8799999999999, Like now your duties also include this.
1442.8799999999999,1444.6, They got this whole podcast and thing now.
1444.6,1445.08, Right.
1445.08,1446.04, It's crazy internet.
1446.04,1447.8799999999999, So my mind was usual skepticism.
1447.8799999999999,1450.1999999999998," It was like, why the hell would anyone want to listen to us?"
1450.1999999999998,1450.84, Yeah.
1450.84,1452.3999999999999," Like, that's what I'm shooting."
1452.3999999999999,1453.4799999999998, To a microphone.
1453.4799999999998,1453.76, There.
1453.76,1455.52, They might be wondering that this very second.
1455.52,1456.0, Yeah.
1456.0,1456.1999999999998, Right.
1456.1999999999998,1459.1999999999998," I learned to love that, though."
1459.1999999999998,1460.8, You're going to enjoy what I say.
1460.8,1461.52," Damn it, boy."
1461.52,1462.36, You're going to listen to me.
1462.36,1463.1999999999998, Sit down.
1463.1999999999998,1464.3999999999999, I got a funny voice for you.
1465.3600000000001,1466.2," Yeah, no."
1466.2,1468.8000000000002," No, I think we didn't want to do it."
1468.8000000000002,1471.8000000000002, We kind of resented it because we had a magazine to make.
1471.8000000000002,1474.0, So we had drag our asses down here.
1474.0,1474.76, And I don't know.
1474.76,1477.1200000000001," I actually, I personally like it a lot, too."
1477.1200000000001,1479.76," I mean, one thing it helps us focus during the week."
1479.76,1482.48, Like now I definitely think about things.
1482.48,1483.24, And we all do this.
1483.24,1485.5600000000002," I think, oh, we got to bring that up on the podcast, right?"
1485.5600000000002,1487.48, We'll be talking during the week and things will come out.
1487.48,1489.0800000000002," It's an extra space to, of course,"
1489.0800000000002,1491.0800000000002, and we come down here and just like make fun of the French.
1491.0800000000002,1492.6000000000001, So.
1493.56,1495.36, They get a little derailment on our list too.
1495.36,1495.7199999999998, Yeah.
1495.7199999999998,1496.24, How is it?
1496.24,1497.52, No.
1497.52,1498.84," When we started the whole thing, we also"
1498.84,1502.56," were sure, I mean, we're going to need a schedule that"
1502.56,1505.0," we're going to like operate from, you know, how tight"
1505.0,1506.4399999999998, was everything going to have to be when we
1506.4399999999998,1508.1599999999999, had subjected to anything afterward.
1508.1599999999999,1508.6399999999999, Right.
1508.6399999999999,1509.9599999999998," Oh, how is it just everybody?"
1509.9599999999998,1510.8, Because it's going to work.
1510.8,1511.32, Right.
1511.32,1513.9199999999998, And I think what happened is we just like talked and talked.
1513.9199999999998,1514.36, We don't care.
1514.36,1515.1999999999998, We never added it.
1515.1999999999998,1518.08, You don't care if we say something that sticks.
1518.08,1520.6399999999999, And that seemed like just to set its own rule.
1520.64,1523.24," But over time, I think that's what come like a strength."
1523.24,1523.6000000000001, Yeah.
1523.6000000000001,1524.76, I ended up liking it.
1524.76,1526.24," And there's no, I don't know."
1526.24,1528.24," I mean, compared to like, you can, it would be really easy"
1528.24,1531.24," for us to be overly concerned about every, what's"
1531.24,1534.2," happening on every, any given minute of airtime."
1534.2,1534.4, Yeah.
1534.4,1536.88," I just think like, how did it just be duller because of it?"
1536.88,1537.88, It's a little more sterile.
1537.88,1540.96," I've been on another podcast where I get stopped, like mid sentence"
1540.96,1542.0800000000002, because somebody blew something.
1542.0800000000002,1545.24," And I don't, I don't, I don't, I don't want to do it that way."
1545.24,1545.8000000000002, This is too.
1545.8000000000002,1546.2, Can't do it.
1546.2,1546.4, Yeah.
1546.4,1547.64, We had it at the time.
1547.64,1548.4, Let's add it that out.
1548.4,1548.76, Yeah.
1548.76,1549.6000000000001," It's like, here's a glaze."
1549.6,1551.28, We're just listening to Howard's here and show all the time
1551.28,1552.6799999999998, for that exact reason because it was just kind of like
1552.6799999999998,1554.36, extremely conscious and they just kept flowing.
1554.36,1556.4399999999998," And then, yeah, I think that's what it is for me too."
1556.4399999999998,1557.7199999999998, It's like all the radio I like.
1557.7199999999998,1560.52, It's just like people call it the point of it is.
1560.52,1563.48," And we edit the magazine is just like, you know, edit, edit,"
1563.48,1564.6799999999998, maybe that's it too.
1564.6799999999998,1566.8799999999999," So it's like, we don't want to edit anything else."
1566.8799999999999,1569.28, It's coming in like just refreshing.
1569.28,1570.4399999999998, You're right.
1570.4399999999998,1571.9599999999998, Right.
1571.9599999999998,1575.04, We have no advertisers to offend here on the podcast.
1575.04,1576.52," So, right."
1576.52,1579.56," And if we get to defend them, how is your perspective"
1579.56,1583.28, changed if it's changed about podcasting?
1583.28,1584.32, We've gotten a lot better.
1584.32,1590.36," I mean, we used to have a lot of dead silences and kind of awkward moments back"
1590.36,1591.52, when we first started.
1591.52,1593.52, I think we tried to be.
1593.52,1595.9199999999998, They typically were like more formal.
1595.9199999999998,1598.6, We tried to have a more formal structure.
1598.6,1599.6, Yeah.
1599.6,1601.12, And then we figured out that didn't work with us.
1601.12,1603.76," I kind of didn't carry us to go back to those first ones and listen,"
1603.76,1604.76, I'm afraid.
1604.76,1605.6, I so don't want to do that.
1605.6,1606.6, I think that bad.
1606.6,1607.6, Yeah.
1607.6,1608.6, I would be afraid to.
1609.04,1611.3999999999999," I didn't quite have that feeling, but you know, you take everyone's"
1611.3999999999999,1613.36, dreads taking like speech class and college.
1613.36,1616.28," Like a, and there's that one fool who gets up there to do a speech."
1616.28,1617.4399999999998, And he's kind of like box stepping.
1617.4399999999998,1619.1599999999999, You're just like waiting for him to pass out.
1619.1599999999999,1620.7199999999998, It was like this whole speech.
1620.7199999999998,1623.84," Get a five minute like how to speech and it's like how to like,"
1623.84,1625.36, I got to get specific with this analogy.
1625.36,1627.36, It's not going to be anything.
1627.36,1629.0, How to eat a hot pepper.
1629.0,1632.1599999999999, And his whole speech is about you just drink water after you're done.
1632.1599999999999,1634.28, And then like the one when they open it up to questions after the
1634.28,1637.1999999999998, dude's box step for five minutes and like almost passed out.
1637.2,1640.48, So it goes water actually sites the taste buds dumb ass.
1640.48,1641.32, You want to drink milk.
1641.32,1642.88, But it's whole speech.
1642.88,1644.28, That's this is actually a real story.
1644.28,1646.64," By the way, when I was called, I was going to say,"
1646.64,1648.3600000000001, so that was the guy's song and that it will milk you.
1648.3600000000001,1649.0800000000002, What a drink.
1649.0800000000002,1651.0," It's not just sitting out, dude."
1651.0,1652.8, It's stupid shit ever.
1652.8,1653.8, Oh man.
1653.8,1656.2," So anyway, yeah, I kind of felt like it had had a little of that by"
1656.2,1659.2," going, you know, where we're like, help us out here."
1659.2,1660.68," Like, they sit out."
1660.68,1661.68, They sit out.
1661.68,1662.88, Can I sit down yet?
1662.88,1663.88, Yeah.
1663.88,1664.88, We sit out.
1664.88,1665.88, Yeah.
1665.88,1666.88, Anyway.
1667.0400000000002,1667.92, We like the podcast.
1668.92,1673.0, It's the reason we've vanished every once in a while is because we
1673.0,1676.68," record on Mondays, which is like sometimes like the worst possible day"
1676.68,1677.64, for shipping a magazine.
1677.64,1678.0400000000002, Yeah.
1678.0400000000002,1680.5600000000002," So like there's that aspect for the build up to the podcast,"
1680.5600000000002,1683.88," at least for me, it's like, oh, God, I'm going to do a podcast today."
1683.88,1684.4, Right.
1684.64,1686.1200000000001, And then this is where we get down here.
1686.1200000000001,1686.8000000000002, I love it.
1686.8000000000002,1687.4, It's fun.
1687.4,1687.8400000000001, Yeah.
1687.8400000000001,1688.5200000000002, But right.
1688.5200000000002,1690.2800000000002, Like the last Monday was a perfect example.
1690.2800000000002,1692.4, We are literally shipping the magazine.
1692.4,1694.8000000000002," That means, you know, pages were being fed"
1694.8,1697.9199999999998, next to the printer on that day.
1698.12,1699.84, And we still had to come down here and do it.
1699.84,1703.36," And actually, I thought, I was glad we got good feedback on the last podcast"
1703.36,1705.84, because I thought it was really bad because I was so tense.
1705.84,1707.44, I know Sean was really tense.
1707.44,1708.08, No.
1708.08,1711.6," But actually, that fueled the special hate issue of the podcast."
1711.6,1712.08, Yeah.
1712.08,1713.08, It was fuel.
1713.08,1716.08, All of my rage against Sierra games was basically because we were shipping.
1716.08,1718.56, I think I think that's what you guys.
1718.56,1719.08, But we.
1719.08,1719.6, Yeah.
1719.6,1721.08, That positive feedback.
1721.08,1724.08," I think helps us, like, I don't know if it doesn't actually help us get"
1724.08,1725.08, better.
1725.08,1726.08, I have no idea.
1726.08,1727.8," But like, it helps us get a little more excited about it, though."
1727.8,1728.8, Yeah.
1728.8,1731.6399999999999, The fact that we knew that we now know that there's actually people that
1731.6399999999999,1735.4399999999998," profess to enjoy listening to it or looking forward to the next one, whether or not"
1735.4399999999998,1736.8," not to let it go to your head, Sean."
1736.8,1737.8," No, I'm not saying that."
1737.8,1741.12," I said rather than the fact that we know it's good, I'm not saying anything like that."
1741.12,1742.12, It could be total ship.
1742.12,1744.84, But the fact there are people that profess that those were my words.
1744.84,1745.84, We were fine to say yes.
1745.84,1746.84, Okay.
1746.84,1747.84, Let's edit that area.
1747.84,1748.84, I hear you.
1748.84,1749.84, The underscore.
1749.84,1750.84," Like, I think that's cool."
1750.84,1753.6399999999999," I mean, I think it makes us more like excited to go do it when we know,"
1753.64,1756.48," like, this is just like one more of our duties of, yeah."
1756.48,1757.48, So we do it.
1757.48,1758.48, Yeah.
1758.48,1759.48," All we heard is, how do you guys suck?"
1759.48,1760.48, Why are you even bothering?
1760.48,1761.48, I don't think we would probably be.
1761.48,1763.68," And we got all these people, which just really makes me happy."
1763.68,1765.68," I wanted, this is a shout out to you."
1765.68,1769.88, I'm honest to give training to some of the other people on the Neil gaming age forums
1769.88,1773.3600000000001, to shout out because usually it's a big pool of sharks over there.
1773.3600000000001,1776.76," They've been really kind to us, really cool."
1776.76,1781.1200000000001," And all these other people that we get like on our forums and elsewhere just that say,"
1781.1200000000001,1783.3600000000001," like, they don't, they're not peace of gamers."
1783.36,1784.36, They don't play PC games.
1784.36,1787.28," But like, we're one of their podcasts that they listen to."
1787.28,1788.28, And that's pretty cool.
1788.28,1793.04, Because I can imagine it would be like the last thing I'd want to hear about if I wasn't a PC gamer.
1793.04,1794.04," It's like, do you want it?"
1794.04,1797.28," Like, let's, hey, there's a red, my real road podcast on."
1797.28,1799.28, I listen to it from the first day.
1799.28,1800.28, They got off.
1800.28,1801.28, Try the trick.
1801.28,1802.28, It took a lot of time.
1802.28,1803.28," No trains, man."
1803.28,1807.28," I tell you the best way to best way to flock of fake trees when you're used to one,"
