start,end,text
0.0,10.0," It must yourself in the ultimate online fantasy world, Vanguard, Sucker of Heroes, a realm of freedom and glory, where the only limits are your own."
10.0,15.0, Discover the adventure today at joinvanguard.com available now.
15.0,21.0, This is the One Up Radio Network and now GFW Radio.
21.0,25.0, Hello and welcome!
25.0,27.0, Welcome to GFW Radio Podcast.
27.0,28.0, My voice cracked.
28.0,30.0, I'm going through Second Puberty.
30.0,32.0, Hello and welcome!
32.0,34.0, Welcome to GFW Radio.
34.0,36.0," Hey Mr. Collection, friends!"
36.0,37.0, Puberty.
37.0,42.0," This is Jeff Green, the editor and chief of Games horrendous magazine."
42.0,48.0, I'm here with the editorial staff of Games horrendous magazine who are as follows.
48.0,50.0," Ryan Scott, Derek Ladsdon?"
50.0,51.0, John Elliott.
51.0,52.0, John Elliott.
52.0,54.0, I'm going to do that much more manly this week.
54.0,55.0, You sure see?
55.0,58.0, I'm going to give you the Michael Winslow of our staff.
58.0,60.0, Everybody here is a special thing going on this week.
60.0,67.0," Sean's more manly, Darren has a dot on his nose that was bleeding at lunch for an hour straight."
67.0,68.0, That was awesome.
68.0,71.0," This is a great, brilliant ride at a pop-tart."
71.0,72.0, That's gone now.
72.0,75.0," Sean, what do you have to share this week?"
75.0,76.0, Keep it clean.
76.0,77.0, We got nothing.
77.0,78.0, He got nothing.
78.0,80.0, There's my wild talk.
80.0,81.0, A little 70.
81.0,82.0, All done.
82.0,83.0, Woo!
83.0,84.0, Seeing two years.
84.0,85.0, Okay.
85.0,94.0," So to get right into it this week, we are going to have a very special podcast all about you this week."
94.0,97.0, We have compiled over a bunch of months.
97.0,103.0," A lot of questions from youth folks listening and because we're the bastards we are, we never actually answer it."
103.0,106.0, They've been some great questions all along.
106.0,113.0, So we thought partially because we didn't prepare this week that we would spend the time answering your questions.
113.0,116.0, And hopefully get some good discussion out of that.
116.0,121.0," And if we know a good discussion, maybe we'll get some good, you know, fart noises and jokes and burps."
121.0,123.0," You get one or the other, but not both."
123.0,124.0, Not both.
124.0,126.0, Or maybe we'll try both at the same time.
126.0,127.0, We could try.
127.0,128.0, Yeah.
128.0,129.0, Let's see.
129.0,131.0, So we're getting ready.
131.0,133.0," We're already, we're all ready."
133.0,134.0, We're derailed.
134.0,136.0," Well, Sean, I think you're going to start us off."
136.0,141.0, I started off with the turret explosion like you can supply the rest.
141.0,144.0, We'll say that from when Robert is a guest.
144.0,146.0," Oh, so."
146.0,148.0," Okay, getting right into it first."
148.0,150.0, We said we're going to deal with questions.
150.0,155.0," Yes, but we lied just because we're going to deal with some comment that kind of speaks for itself and we can comment on the comment."
155.0,160.0," But are one of our favorite message board posters, Bally, Hi, Bally."
160.0,161.0, For the win.
161.0,162.0, There's a great comment.
163.0,175.0," He, someone asked about, you know, why don't we talk more about live achievements, live anywhere achievements up because as we know, Halo 2 for PC will be the first game to officially offer achievement points on live."
175.0,180.0," And delivering, you know, in true form he came in and suggested, you're like,"
180.0,182.0, And that will just give him the voice.
182.0,183.0, It just reads better that way.
183.0,185.0," Sorry, Bally, maybe you actually sound more like,"
186.0,193.0," Woo, woo, my favorite, but of course, in my world, Bally sounds like."
193.0,197.0, Can't wait for those PC achievements.
197.0,200.0," Number one, managed to install game."
200.0,203.0," Number two, it's updated the latest patch."
203.0,208.0," Number three, reach the frame rate higher than 20 for two full seconds."
208.0,213.0," Number four, all tapped and resume successfully."
213.0,216.0," Number five, no CTD on startup."
216.0,221.0," Number six, didn't have to reinstall video card drivers."
221.0,223.0," Number seven, you sound worked."
223.0,228.0," So thanks to the Bally, those are all future worthwhile."
228.0,229.0, You have to be very funny.
229.0,231.0," Okay, yeah, it was all this."
231.0,233.0," It didn't even, I could read them in a normal,"
233.0,238.0," Bally sit, reader Bally says, I'll be excited when I manage to install a game."
238.0,240.0, I'll be excited when I update.
241.0,245.0," Still be, no, we wouldn't be laughing, but yeah, good point."
245.0,248.0," So that out of the way, anyone else want to add any favorite."
248.0,250.0, What do you hope in the get in the achievement for?
250.0,254.0," Actually, should we open up to the do we actually give a rat to us about a cheap and points in PC gaming?"
254.0,259.0," Here's, here's, here's the perfect, let's just like tie it into the, to one of the main questions."
259.0,265.0," We have two chief questions for the day, and this will just sit, I'll read it and go right back to you."
265.0,266.0, Okay.
266.0,270.0, One reader wants to know Lily Iris.
270.0,273.0," Hey guys, recently I went back and listening to podcast."
273.0,275.0," Wow, every one of our readers is a key."
275.0,278.0," It's a Lily, I'm never going to write it again."
278.0,279.0," Okay, hold on."
279.0,280.0, We'll switch it to the other voice.
280.0,284.0," Hey guys, it's in a list of podcasts where you're nuts,"
284.0,287.0, you'd be moving from CGW to games for Windows.
287.0,292.0," Maybe truly for you to answer this question, but maybe after six issues under your belt,"
293.0,295.0, you can tell us how you think you're doing.
295.0,296.0, Is anything changed?
296.0,298.0, The magazine that you like?
298.0,299.0, Anything that you don't like?
299.0,301.0, I feel like I'm answering a question from Snuffle Lopikas.
301.0,302.0, Can I help you?
302.0,303.0, I can help you.
303.0,308.0," In a podcast that we said we're dividing to the reader, we not to spend all time making fun of them."
308.0,309.0," Okay, I'm just reading."
309.0,311.0, That's a nice question.
311.0,313.0," I told you the option, okay, you want my straight reading voice?"
313.0,314.0, Yes.
314.0,320.0," Hey guys, recently I went back and listening to the podcast where you announced that you would be moving from CGW to games for Windows."
320.0,324.0," Maybe too early for you to answer this question, but maybe after you have another six issues under your belt,"
324.0,327.0, you can tell us how you think you're doing.
327.0,330.0, Is anyone has anything changed in the magazine that you like?
330.0,331.0, Anything you don't like?
331.0,333.0, How's your new stand presence these days?
333.0,335.0," You guys seem worried that people with, I think you were selling out."
335.0,336.0, Have you?
336.0,339.0," So then, Darren, back to you in terms of, I was just, the connection,"
339.0,343.0," if you're wondering where it is is that we just got done, you know,"
343.0,346.0," ripping on, or reading one of our readers ripping on,"
346.0,350.0," Xbox live, it's genius or Windows achievements."
350.0,354.0," And so I think I was just thinking that says something about us like,"
354.0,356.0," I mean, we have this whole thing to talk about."
356.0,359.0, What is our relationship with Microsoft and how is it shaped?
359.0,360.0," Yeah, we are and all this stuff."
360.0,362.0," And I got comments on that too, but go ahead, Darren."
362.0,364.0," Well, I guess, well, I mean, it's kind of really,"
364.0,367.0," well, three topics really, I mean, individually like Tom had, like,"
367.0,371.0, especially specifically Xbox achievement points.
371.0,374.0," I mean, really there's so many different ways you can go."
374.0,376.0," So we're off with, like, just the larger picture."
376.0,380.0," Because it seems to be a Shanghai, you want to talk about what you think of achievements."
380.0,384.0," That was thinking, like, saying, well, in some, let it not be the case that,"
384.0,386.0," like, because, well, I mean, like, we are from, I mean,"
386.0,389.0," we've said this to, like, to we're blue in the face of bunch of times,"
389.0,391.0," how we, we are completely independent and like,"
391.0,393.0," and it's kind of refreshing in that, you know,"
393.0,395.0," Microsoft hasn't, like, turned the screws on us for, like,"
395.0,397.0," saying, you know, giving us crap for anything we say or do."
397.0,398.0, Right.
398.0,400.0," The fact that we're saying that reading that should say that, like,"
400.0,402.0, that's one thing that hasn't changed.
402.0,403.0, Right.
403.0,404.0," So, it's not there."
404.0,408.0," Like, Microsoft has been so good in that we haven't heard a single thing from them about,"
408.0,410.0, because you changed the message.
410.0,412.0," Could you, I mean, it's been so quiet."
412.0,413.0, It's so scary.
413.0,414.0, So good.
414.0,416.0," It's like, first of all, are they even reading it?"
416.0,417.0, Right.
417.0,420.0," Second, are they just so mad that they don't even know what to do?"
420.0,421.0," Like, we created a monster."
421.0,426.0," Or it doesn't matter because then when we flip and we say that we like something,"
426.0,428.0," it means everyone else that, you know,"
428.0,430.0," listening or something, it's like, hey, there's really something,"
430.0,432.0," maybe there's something to take a look at here,"
432.0,434.0," because aren't bullshit, you know, the bullshit."
434.0,437.0," I mean, hopefully, I mean, really, we're kidding,"
437.0,442.0," but hopefully it's actually that it's the best possible scenario that they're,"
442.0,444.0," they're reading it or listening to us here,"
444.0,448.0, here us being sort of having some dissension and not caring.
448.0,449.0, Right.
449.0,450.0, When that be great.
450.0,451.0, Yeah.
451.0,453.0," It's like, hey, what's it's not what's it going to do?"
453.0,456.0," I mean, I mean, I mean, I always operate from the under the assumption they wanted us,"
456.0,459.0, because we were such a vocal independent voice.
460.0,462.0," And now we just were kind of like pushing the brand,"
462.0,465.0, but we're also still kind of calling it as we see it all along.
465.0,467.0, We haven't changed anything really.
467.0,470.0," Because, you know, we do love games for Windows."
470.0,471.0, We'll be sorry.
471.0,472.0," And this is the only kind of,"
472.0,474.0, a little bit count the money we just got from saying that.
474.0,477.0," Another interesting thing is, is not only that we haven't heard"
477.0,479.0," for Microsoft about, you know, these sorts of things,"
479.0,481.0, but we haven't heard anything from readers.
481.0,483.0," You would think that you take, you know,"
483.0,486.0," and gamers in general, I think, want the slot,"
486.0,490.0," you want to accuse you of bias or being sold out or anything with,"
490.0,492.0," for any reason whatsoever, you know,"
492.0,495.0," every like, you know, when I would accept letters for, you know,"
495.0,497.0," each year or something, part of that's because there's more and more"
497.0,499.0," and platform and every other letter is like,"
499.0,501.0," you're by, so again, so any, no, you're by, so again,"
501.0,503.0," say, I spot, you're by, so again, you know,"
503.0,506.0," but for us, we didn't get any, and for having readers,"
506.0,508.0," some of them for years and years and years,"
508.0,510.0, and you do something like that and you flip it.
510.0,512.0, And there were skepticism beforehand.
512.0,514.0," Yeah, the hate came before for which."
514.0,515.0, And then we did it.
515.0,517.0," And no one said, you know what?"
517.0,518.0, You ask holes or foolish shit.
518.0,520.0, This is like a money hat magazine.
520.0,522.0," Right. You know, I mean, no one did that."
522.0,524.0, Right. So that's pretty cool.
524.0,526.0, I think it was really good about that.
526.0,527.0, Because we think it was pretty cool.
527.0,528.0, Like we came up swinging.
528.0,530.0," We didn't, we basically, we're just going to"
530.0,532.0," different code of paint on some of the stories,"
532.0,534.0," but otherwise, we've said the same things."
534.0,536.0, We haven't really changed our tune or anything.
536.0,538.0," I mean, I know, I wouldn't say I've gone out of my way"
538.0,540.0," to bash Microsoft products extra hard,"
540.0,542.0," but I mean, it's not like I've, you know, pulled a bunches."
542.0,546.0, I think I can honestly say that I like kind of forget that we're like some like a
546.0,548.0, quote unquote official magazine.
548.0,551.0," Like I'm just, because I've been here along a long, long time."
551.0,553.0," Right. And to me, it's just like the same magazine"
553.0,555.0, about what he's worked on.
555.0,557.0," Right. Like everyone's around like, oh, shit, we have that like official"
557.0,560.0," tag. But like, I don't even know what that means."
560.0,561.0, Exactly. Yeah.
561.0,563.0, Because a lot of people probably don't want you say that.
563.0,565.0, Maybe I'm not supposed to say it.
565.0,566.0, So it is on edit that out.
566.0,569.0, I know exactly what it means.
569.0,571.0, And I have a vision prior both prior to the change.
571.0,575.0," And post, you know, now talking with, you know, developers, PR people."
575.0,579.0," And they all say, so hey, how's it going? How's the, how's the transition"
579.0,583.0, and stuff? Yeah. And this was one reason why I wanted to bring this up
583.0,587.0," because yeah, it's like it reminds me. I was like, oh, yeah, we did just like"
587.0,591.0," like, I mean, if we were every month fighting like a huge army of people that"
591.0,595.0," were saying like, you guys like really messed up. I can't believe you did this"
595.0,599.0," or on the other hand, like we were hearing, okay, stay on message, you know,"
599.0,602.0, some kind of editorial influence or something. Yeah.
602.0,605.0," So it's like, that's really awesome."
605.0,609.0," It has, we're, you know, your Jeff year, what some people might have assumed"
609.0,613.0," would be lip service before the change was that our party line was, hey,"
613.0,616.0, we're getting all the benefits of associating ourselves with
616.0,619.0," Microsoft and having like enhanced presence on new stands,"
619.0,621.0, but they're not going to control our content.
621.0,624.0," And it's like, it's what you said. And it's what we got."
624.0,626.0, And that's really cool. But it's so surprising.
626.0,627.0, It was so smooth that you didn't really.
627.0,631.0," Well, I mean, that's why I felt it. And I think all you guys did two"
631.0,634.0," felt so confident about the change. I mean, when people were"
634.0,637.0," racking on us on the message boards or crying or whatever it was,"
637.0,641.0," I never felt any sort of, you know, I was very"
641.0,645.0," confident that they were just going to be wrong because, you know,"
645.0,649.0," you had faith in us, Jeff. I faith in us. Well, what we're"
649.0,653.0," going to do, right? I mean, seriously, if some kind of like hammer came down,"
653.0,656.0," I just, I honestly don't think we'd be here."
656.0,659.0, I wouldn't be here. Right. I would have just said screw it. Okay.
659.0,662.0," This wasn't the deal I made. Yeah, exactly. Now, but, you know,"
662.0,666.0," it just never, I never had any question that was going to be that way."
666.0,671.0," You know, another thing on this subject that I want to say is that"
671.0,674.0," I think it's important that we don't fall on the other thing where it's like,"
674.0,677.0," you're that, you know, I compared it today at lunch to the rich kid at school."
677.0,681.0, And everyone knows that kids dad is like a millionaire. So he's like a
682.0,685.0," little, he's like a little, he has an in the class, just improve that life."
685.0,688.0," It's just the proof that he's not, you know, the silver spoon kid."
688.0,690.0," And I don't think like, is here we are."
690.0,694.0," So I think, I think, selectively quoted us right on VISTA launch."
694.0,697.0," Yep. And the reason I only said, I stand by everything we said,"
697.0,699.0," set by also, it wasn't quoted. I also said,"
699.0,702.0, VISTA is a no-brainer once direct X 10 games are out.
702.0,704.0, And that's good. Yeah. We've all said that in the lesson.
704.0,707.0," But that was like, instead, that, all we got quoted one was like,"
707.0,710.0," hey, it's out. We're not getting it right. Right. That's very said."
710.0,713.0," It's like give us direct X 10 games to play with it. And yeah, we're all over."
713.0,716.0," You know, right. But I agree with you. But like for live achievements, it's like it's not,"
716.0,721.0," it's not like, oh, we got to go and rip on this stuff. It's like, I'm just consistent."
721.0,725.0," You know, I thought they were silly on Xbox. I really appreciate them."
725.0,730.0," And I think, yay, I'm totally for it because it's going to make more people pay attention"
730.0,733.0, to how often they've game on their PC and stuff like that.
733.0,736.0," So I'm all for that, but personally, you got to, I mean, I don't know."
736.0,738.0," I just, it's like, but that's just the same."
738.0,741.0," I can make some achievements in general. Yeah, not silly against a PC."
741.0,744.0," Yeah, they don't, it's just, it's just achievements in general."
744.0,747.0," It's that Homer Simpson bucks from like when they when the episode with a good,"
747.0,751.0," she has scratchy land. And they're like, you want to buy it? She has scratchy"
751.0,754.0, dollars. Their twice is fun. And then he goes into the parking.
754.0,756.0," It's like, no, it's scratchy dollars accepted here."
756.0,757.0, As whole.
757.0,763.0," They've got a whole big lot of, that's, but yeah, that's my point of achievement."
763.0,765.0," They're, what are you going to do with it? Well, the only thing,"
765.0,768.0," I mean, well, the thing is actually, I think, with achievement points on Xbox live,"
768.0,772.0," like for the console side, I think they're offering a prizes now if you get a,"
772.0,776.0," so it's like, it's like, it's like, it, like redemption thing where you play"
776.0,778.0, scheme. You get it to throw.
778.0,779.0, You get it to throw.
779.0,782.0," Yeah, why don't you like, can be a wallpaper."
782.0,784.0, A screen gun that's got to leak in it. You get a bottle like two squirts.
784.0,785.0, We got to refill it.
785.0,787.0, You're going to put up prices. Are they?
787.0,788.0," Oh, a bomb hit Jay Allard."
788.0,789.0, I don't know.
790.0,791.0, The thing with that.
791.0,795.0," Yeah, you buy and beat like 70 games, and you get a,"
795.0,796.0, will be cushioned.
796.0,798.0," Actually, I think you bet like, you have a free, like a free download of a game,"
798.0,800.0," or something. You know, stuff like that, like little things here and there."
800.0,803.0," A free download of a game now, really, that's pretty good."
803.0,804.0," Oh, that's pretty good."
804.0,805.0," So if, like, like, an arcade game."
805.0,808.0," Not a, a clock, I'm not sure of a specific, but I think it's like, you know,"
808.0,811.0," if you're, if you're, if you're, if you're, like, classic game or something,"
811.0,812.0," that's still cool, though."
812.0,813.0, Yeah.
813.0,814.0, But that is something.
814.0,817.0," But they need to apply something like that, an actual use for those"
817.0,818.24, for those achievement points.
818.24,819.52," I'm with you, Sean."
819.52,820.72, Like I think it's kind of cool
820.72,823.88," and it kind of lets you recognize getting a high score,"
823.88,826.04, but also being able to apply those points towards something.
826.04,827.12, That's what I said in a minute.
827.12,830.28, What I found in my experience with the achievements
830.28,832.96, was in a kind of cool way.
832.96,835.8, There were a couple games I played like Dead Rising
835.8,840.8, and Viva Pinata that I was playing them differently
840.8,842.16, because I was trying to unlock.
842.16,843.48," Yeah, that's certain achievements."
843.48,844.56," That's what I thought was,"
844.56,846.12, but I thought that was kind of cool.
846.12,847.24, So you're there who's the one
847.24,848.8, it's so damn successful.
848.8,851.76," I got to make myself and I actually like,"
851.76,856.52, I feel like it's a strange outside influence on game design
856.52,858.52," that will make me, wouldn't be there."
858.52,859.36, You're right.
859.36,861.5600000000001, Did they put these monkey faces in this simply
861.5600000000001,864.4," because I have to find 20 monkey faces for,"
864.4,865.24," yeah, you're right."
865.24,866.52," It is kind of an artificial thing,"
866.52,868.5600000000001," probably outside what the developers,"
868.5600000000001,873.8," well, they've done it in this game in the past"
873.8,875.52, before the achievement point system was in place.
875.52,876.92," I mean, they've always had like,"
876.92,879.92, look for the comic book page hidden somewhere around.
879.92,880.28," Yeah, right."
880.28,880.64, Right.
880.64,881.84," Well, I'm not like a bad idea."
881.84,883.04," What I like about it in the end,"
883.04,884.64," I see it when there's not really,"
884.64,886.16," well, they don't think that artificial,"
886.16,888.6, artificial inflates the life of the game.
888.6,890.3199999999999," Yeah, but like, why is that a bad thing?"
890.3199999999999,891.3199999999999, I don't care.
891.3199999999999,893.1999999999999," It's about my feelings when I play,"
893.1999999999999,895.1999999999999, I feel like I accomplished stuff.
895.1999999999999,898.0799999999999," And I feel like I want to keep looking, say,"
898.0799999999999,899.88, my laptop is just a bad game.
899.88,901.28, I have a game that's too.
901.28,902.16," I was playing, when I was playing,"
902.16,904.92," here's a war co-op, my friend."
904.92,907.56," And he was like, he could tell,"
907.56,909.28," like, as you pick up cog tags in that."
909.28,910.28, Yeah.
910.28,912.12," And there's a part where like the other,"
912.12,914.36, you need the co-op player to turn the flashlight
914.36,916.12, in the area where you can go get it.
916.12,917.9599999999999," And I was like, like, hey, you know,"
917.9599999999999,919.76," where can you put the, and he's just like,"
919.76,922.8399999999999," no, because all I do is bitch about it."
922.8399999999999,924.6," So he's like, I was just waiting for him,"
924.6,926.16," like, okay, I'll walk you over there with it."
926.16,927.6, And then just rip the flashlight off.
927.6,928.48, So the locus come down.
928.48,929.3199999999999," I mean, that nothing."
929.3199999999999,930.48, You wouldn't do it because he was trying to get you
930.48,931.6, to wien you off the attention.
931.6,933.48," Because he was just, or to get me to be consistent."
933.48,935.0," He's like, no, I don't want you to have that cog"
935.0,936.0, in a distance.
936.0,937.6," Once you grab that thing, you know, he's like,"
937.6,938.44, you preach it.
938.44,940.24," He's like, you ain't getting it."
940.24,941.24," So basically, you want to get it."
941.24,942.24, You can't get it.
942.24,943.08, You did work too.
943.08,944.64," Because I was like, hey, it's just right there."
944.64,945.76, He's already on the flashlight.
945.76,946.76, I could take two steps.
946.76,947.6, Why?
947.6,948.44, Why did you?
948.44,949.28, I did feel bad.
949.28,949.8000000000001, I didn't feel stupid afterwards.
949.8000000000001,950.76," I was like, I don't need that."
950.76,951.9200000000001, It's like picking up a penny.
951.9200000000001,954.0400000000001," And you think no one's looking and someone looks,"
954.0400000000001,954.88, you got it.
954.88,955.72, You got it.
955.72,957.36, With the 30S penny in your head.
957.36,958.76, So like fools look at you.
958.76,960.5600000000001," You like, drop back down again."
960.5600000000001,962.72," It also does, I thought it was a super door."
962.72,964.04, It pulls me out a bit.
964.04,965.76," Like, when you see, I'm talking"
965.76,966.6800000000001, really ex-box life here.
966.6800000000001,968.4, Because it's not obviously having played on the PC.
968.4,970.16," But right, when you see that, you know,"
970.16,972.24, the Xbox logo pop up in the movie screen
972.24,973.52, that has achieved an unlocked.
973.52,975.64," And then suddenly I'm like, oh, I'm,"
975.64,976.92," so to totally, I'm not a lobbyist."
976.92,978.24, I'm their target audience.
978.24,979.48," Every time I get one of those, I go,"
979.48,981.72," yeah, you want that thing."
981.72,982.8000000000001," I'm so, I'm so, I'm so, I'm so, I'm so,"
982.8000000000001,983.88," you want to be that shitty,"
983.88,986.16," you are, and Microsoft's the voice in the background,"
986.16,988.24," but, good boy, good boy."
988.24,991.76," And the guy who made the deal with Microsoft,"
991.76,992.88, so maybe so.
992.88,996.3199999999999," Your company Jeff, your business magazine, then."
996.3199999999999,998.6, Maybe I got in the case that's actually
998.6,1001.16, an CGW actually for your dog.
1001.16,1002.8, I think that's another problem with that.
1002.8,1005.8399999999999," When you made the deal, it's saying for your dog"
1005.8399999999999,1008.3199999999999, to not like crap on the carpet is the achievement.
1008.3199999999999,1010.04, And that's like a real achievement.
