start,end,text
1917.8200000000002,1924.14," Get a nasty. Yeah. No, that's not a fucking normal. No, it's like, I don't know."
1924.7,1929.8200000000002, You got to think about it. There's some humor in there. I think Martin Bashir was the whole thing
1929.82,1934.3799999999999," where Jack goes like, you know what? I'm going to use people are saying I'm fucked up. I'm going to tell"
1934.3799999999999,1939.34, him I'm not. And I'm going to bring this mark. But sure guy over to my my fun land. And he's going to make a video
1939.34,1945.1, that proves everyone that I really am a cool guy. So it's kind of like saying like come over here and prove that
1945.1,1949.5," I'm for the purpose of proving that I'm not as bad as you say, but ultimately finding out that I'm worse than"
1949.5,1956.7," any. Anyway, we can try to well sophisticated. It's too. Can't get it. You're operating"
1956.8600000000001,1961.66, higher level. Yeah. I'm sorry. I don't know about the video the videographer hired by Michael Jackson.
1962.7,1968.6200000000001, Martin Bashir that was epic when that came out. Was he the dude? That was that big special that like two
1968.6200000000001,1973.42," hours. Yeah, two are special and they went to never went. He was like going around through, you know,"
1973.42,1978.8600000000001," through Vegas like the Blasio. Oh, take this one and he was like, I had the Charlie Green"
1978.8600000000001,1983.74, Jack. And he was very defensive. Sure. It's Michael. Wasn't he? Just because you're lying touching a
1983.82,1990.86," boy's does not really mean you're a molester. No, no, Martin. I do. I do this with our children."
1990.86,1995.1, Because you love them. Don't you Michael? With his special children. Only his special
1995.9,2002.86," but I touched them too, Michael. Well, we have his special children. That was the one."
2002.86,2008.3," No, it was a big big day. I like why would you need me to talk. Exactly. He teaches children"
2008.3,2014.46," Ethan Greenpeace. Oh, oh, oh, oh, he didn't join. He's stuck in a giant robot and Vibrisard."
2014.46,2019.8999999999999, I dreamed that. Yeah. Yeah. Yeah. Yeah. He is. Yeah. Because that was one of the key events of the
2019.8999999999999,2027.18, 20 first century. Okay. Stribula giant captain. Leo. Okay. Let's real this back in. There's something
2027.18,2032.7, related to what our podcast wants to be. Yeah. We're in Mark Moonmark was the video game. We're
2033.02,2040.8600000000001, in our cage. We're talking about video games. Okay. Yeah. Tell your our cage join now.
2040.8600000000001,2046.7," Sean while we're at this extreme. Well, right. Okay. Get any more. Right. Right."
2046.7,2051.18, Without spoiling the detail because I did tell Ryan I gave Ryan the teaser at lunch.
2051.18,2054.3, Yeah. How did you feel about how did it make you feel right?
2055.02,2059.82," Oh, this is going to be the new. Wow. Okay. I can't wait for that. So this is said. Yeah."
2059.82,2063.42," Maybe I should say. I don't know. Every time I say I should save it, I go into it."
2064.2200000000003,2069.98," So I'm just going to do it. Oh, my god. I got a roll. All right. One time in my friend Cori and I mentioned"
2069.98,2075.42, this guy before in the context of this is the guy I left with this it's saying rivalry of fighting
2075.42,2081.5800000000004, games Street Fighter tech in Mortal Kombat virtual fighter later on Soul Calibur and he got on a
2081.5800000000004,2087.6600000000003, big run and Mortal Kombat and just was talking shit on me the whole time. And so in the past I that the guy
2087.74,2093.3399999999997," left it dark. I was like, all right then. Yeah. It's like got in my car and left it there."
2094.2999999999997,2099.1, Call your dad and have him come get you to your sister. So that was dick. That was like the one that
2099.1,2105.8199999999997, was why a couple years ago. Take maneuvers out from. But so this same guy we're on our way back to
2105.8199999999997,2111.8999999999996, that same arcade. This is where so many all the fun stuff happened. And he came to pick me up at my
2111.9,2119.1," dorm at, uh, and we're driving in the whole time. He's just tearing ass, you know, we're just driving"
2119.1,2123.1800000000003, and it's the kind where at first like I have the window rolled down and I have like my head hanging
2123.1800000000003,2127.7400000000002," out and you know, eventually how when someone's farting around you and you do the farts we're"
2127.7400000000002,2131.6600000000003," going to be involved in this so don't ask price. Oh, no, it's not what's farting around you and all"
2131.6600000000003,2137.1," of sudden it's like it's not funny anymore. Like you want to just punch him. Yeah, you know and"
2137.1,2141.9," then so it hit that point where I stopped laughing, you know and I was just like, you know,"
2141.9,2147.3399999999997," seriously like swearing out of the stuff and he was just choking, you know. I'm just like just spasmotically."
2147.74,2152.94," And then all of a sudden he stops laughing and then like about, you know, I'm trying to get the"
2152.94,2159.8199999999997," time lying down on this. It's really important. About 10 seconds later he goes, hey, I'm just going"
2159.8199999999997,2164.22, to drop you off at your parents because they lived like in between where my dorm was and in an arcade.
2164.2999999999997,2169.66, I remember I got I got to do this or that. I can't remember what he said. He had to do it immediately.
2169.66,2178.4599999999996," I do. I know what this is going. Corey, you shit your fucking pants. No, you're not dropping"
2178.4599999999996,2183.58, me off. You're going to my house. You're getting a grocery bag. You're putting your duty
2183.58,2188.62, drawers in them. You're throwing them in a trash and then you're going commander to the arcade because
2188.62,2193.8199999999997," you came all the way out here to get me. So okay, we go to the arcade that he did all this. I mean"
2193.82,2198.1400000000003, it was not enough. Just as I called we go the arcade and then so the the rad end of the story
2198.1400000000003,2203.6600000000003," is that and as soon as I called it, he was like, you can't tell Mike. You can't tell Mike. It was another"
2203.6600000000003,2210.78," friend in our clique. He was like, he was the town cryer even more so than I was. So I was supposed to"
2210.78,2215.98," tell him right now. Well, this is years later, this guy is care now. Like this is the"
2215.98,2221.98," care that he's now famous on the internet. Yeah, she had been his pants. So Mike is like, Mike's"
2222.06,2226.7," now an accomplished fine artist and it's funny because he sells his stuff at like, you know,"
2226.7,2231.82," Monterey and Carmel, you know, like not anymore. Sounds like that. Yeah. And immediately, so I told Mike"
2231.82,2237.26," and he drew up like about a six to eight panel comic book, um, comic story telling the whole, you know,"
2237.26,2241.9, retelling everything I just told and he water colored it and everything. It looked really nice.
2241.9,2246.3," And then, you know, weeks later in the context of all this hanging out, Mike passes it around to"
2246.3,2249.82," big group of us and it's like, yeah, you know, here's something that's just working on lately."
2249.98,2254.7000000000003, And then it gets to Corey. Corey looks immediately and understands what it happened. It just turns around
2254.7000000000003,2260.38," it and starts yelling, but it was, yeah. Wow. I think getting in the last of that one. No, we were"
2260.38,2265.02," all I think I did. I think it was again. Those are like a subsonic laugh from me. I just, I just think"
2265.02,2272.06," I don't think I want Corey visiting the GFW. I just have a, have a rack of depends ready to show up."
2272.06,2276.2200000000003," Yeah, you're right. This was probably a new low for us. I didn't think it could go any lower."
2276.22,2282.8599999999997," Yes, you might say. I think it can. I could tell one once he'd w fart story. If I'm,"
2282.8599999999997,2288.4599999999996," well, we're on the topic. And now is that we used to all eat lunch and the lunch room here at the"
2288.4599999999996,2293.5, Gloria's Zif Davis offices. We would all go for it for our various food and then we'd bring it back.
2293.5,2299.66, We'd also sit in the conference room and talk and often quite often there was a lot of burping going on
2299.66,2305.4199999999996," because they've Salvador who now works. Oh gosh, where does he work now? Intel Intel, you're right."
2305.5,2312.7000000000003," Hi, Dave. He used to burp quite a lot. He was a champion belt term. I mean, this guy would like,"
2312.7000000000003,2317.98," you know, he could shake the walls with these belges. And so people would try to compete with him,"
2317.98,2322.54, but there was no competing with Dave. And so we're all sitting around burping and at the time we had this
2322.54,2329.1800000000003, intern. We did not last a very long. We're all sitting there eating and burping. And this guy just
2329.18,2335.4199999999996," like, let's go a really loud fart. And so it's laughing and we're all like, dude, we're eating lunch."
2336.54,2342.22," But you know, and he's like, not it. No, no one heated that he laughed. But we were all mad."
2342.22,2346.8599999999997," And he's like, what? You guys are burping? We're like, it's not the same thing."
2346.8599999999997,2351.74, And what universe do you from? It depends. So it can be burps can be far worse than far to the
2351.74,2355.3399999999997, pens. I don't know. Not when you're eating lunch. That's the real topic of this episode.
2356.2200000000003,2360.6200000000003, Which is where? Which can be worse? Does this have to go in the in the iTunes right up? Yeah.
2360.6200000000003,2363.98," Yeah. Well, that's what we've got the cover on there. Save the board."
2363.98,2368.06," It's not Ryan. You think he worked? You know, I think he's natural. I think maybe he should"
2368.06,2372.1400000000003, just open a sexual poll. Okay. I'm going to bring this back to something a little more serious. Okay.
2372.1400000000003,2377.7400000000002, Because we've we've hit the skids here. Yeah. This is an article from kataku.com. And they were
2377.8199999999997,2383.3399999999997, quoting game developer magazine. The headline is developers Roland in Benjamin's
2384.22,2389.9799999999996, which I believe is slang for money. They are money. I believe you don't fall. Call now.
2389.9799999999996,2397.58," Benjamin's. Okay. Industry mega. That's so actually. Well, I was just realizing how I mean, I"
2397.58,2401.58," guess when a video game site used it, you know how played out it is. But think about how long it was that"
2401.58,2406.3799999999997," like the moment, puffy released. Oh, about the benchy means baby like that. Yeah."
2406.46,2411.1800000000003," Yeah. Yeah. Yeah. Yeah. I actually I was thinking that when I was in Los Angeles, that was back"
2411.1800000000003,2415.58, weekend. My friend heard his pants on the way to their cave. I was never seeing Benjamin's way back then.
2416.46,2421.7400000000002, I was in the suburbs of LA and two times this weekend. I heard middle-aged men and when I say
2421.7400000000002,2427.1," middle-aged, I mean even older than me. So there are probably, you know, late 40s or 50s. I heard these"
2427.1,2433.34," like balding middle-aged white guys. One guy said, my bad. And another guy said, I feel you."
2433.42,2437.58," That's like, okay, neither of these faces. I've ever seen one of it. I've seen."
2437.58,2444.6200000000003," I've seen a lot of stuff. Yes. I feel you. That was a bad pot. I'm zero. Oh, man. That kills me."
2445.1800000000003,2452.78," My bad. And then he punches it in dog. Okay. So that's Benjamin. So, let's see. Game developer"
2452.78,2457.82, magazine came up with an average annual income for various jobs in the U.S. Games industry.
2458.78,2468.54," In 2006, here are some of the salaries that were made job by job in the gaming industry."
2468.54,2475.1000000000004," Programmers were raking in an average of 80,886 dollars a year."
2475.98,2480.38," Artists 65,107 dollars. It's a lot of Todd McFarlane figures."
2481.02,2492.7000000000003," That is. Game designers 61,538. Production personnel 77,131 production personnel would be what?"
2492.7000000000003,2499.58," Producer's, I guess. I mean, they've already seen the designers and programmers."
2499.58,2504.62," That don't have a production personnel or the guest producer. Producer's, producer's, yes."
2504.8599999999997,2511.98," QA weighed down to 37,000. Is there any its quality? Right. Which, which there you go. That says"
2511.98,2518.46," lot right there. But no, it doesn't say how much they value. It says like how in demand the actual"
2518.46,2524.14," employees are. I mean, you don't need much of an education for QA. I mean, you do need education."
2524.14,2527.98," So, don't give me wrong. But you don't need the same education that the programmer knows. Exactly."
2527.98,2531.74," No, you don't. So, don't take that bad QA to a love you. But I'm just saying you don't. I'm"
2531.74,2535.9799999999996," clearly, if you had the same education as the programmer, you'd be programming. Probably be programming."
2535.9799999999996,2546.22," Right. No. Or we'd have better games. Audio, audio employees were averaging 69,935,000."
2546.9399999999996,2555.18," And rated highest ranked highest business and legal 95,596. So, programmers were second."
2555.2599999999998,2560.22," And he run down there. It was business and legal 95, programmers 80."
2560.22,2565.02," So, interesting designer that designed this on your low-f program. Well, yeah, what that first"
2565.02,2568.8599999999997," mechanism, I've heard that, but then also kind of said, well, they're the ones that require the least"
2568.8599999999997,2575.02," like visual training on that list. Like if you got like a designer next to a programmer, obviously"
2575.02,2578.54," the programmer has gone through a lot more schooling, specifically for programming, you know, that a designer"
2578.54,2583.1," would have gone through, specifically for design. Maybe I'm wrong there. Maybe people are going through"
2583.18,2587.8199999999997," ten years of design school, but I doubt it. It's still pretty good money for pretty much all those"
2588.7799999999997,2594.38," all those titles except for QA, which really is kind of an entry level job as a game tester."
2594.38,2597.1," Those are all, I'm sure, were those averages or were those like those were average."
2599.1,2603.18," And as we were talking before we came on air here, the sad truth is that"
2603.9,2609.66," for a place like California, where we're podcasting from those salaries actually aren't that high"
2609.66,2614.22, for the cost of living here. Right. Sadly. Like when when you read off the when I read the numbers on
2614.22,2618.22," that, I didn't say, well, they're not all one and then the Benjamin's, I don't know, the headline."
2618.22,2622.46, This could talk is not can't be based in San Francisco. I don't know why I could. Because you definitely
2622.46,2626.14," wouldn't be considered in 60,000 roll and anything. No, that's why I can't. One's been your"
2626.14,2630.8599999999997," apartment. Yeah, if you're rolling in pennies, I mean, when I mean for it to put it perspective,"
2630.8599999999997,2635.42," I mean, wherever the listeners are, I mean, like 300,000 here, we'll get you if you're lucky."
2635.5,2639.9," Like if you're, if you're in a real estate, this will get you like a condo, right?"
2640.62,2644.06," With one room. You're looking at it, at least. Yeah, that's your life. You're not even a good"
2644.06,2648.62," good one. Not even a good one. Not even a good one. No, I single bedroom in like a not even a good"
2648.62,2655.7400000000002," area. You're not going to get a house in the Bay Area, you know, and any anywhere close to San Francisco"
2655.7400000000002,2661.1800000000003," were Berkeley for under one and a half half a million at the point. Like I was looking at,"
2661.1800000000003,2664.94," I've actually been looking at this kind of stuff and like, yeah, you need at least a million for"
2664.94,2669.82," a decent house. It's kind of sad. Yeah. So it's, you know, you need a geographical distribution"
2669.82,2672.62," of where these jobs are. I mean, we assume a lot of them are in these like,"
2672.62,2677.02," they're more expensive metropolitan areas. Some we know North Carolina, right? I mean,"
2677.02,2680.62," exactly. Well, I don't know what the percentage break down is. So you guys, the trick is to get a"
2680.62,2684.06," job in the game industry. One of these areas where they'll cost a living hasn't jumped yet. I mean,"
2684.06,2688.78," but if I was making, you know, even the QA salary and Buffalo, New York where I'm from, like, I"
2688.78,2693.58," mean, like, yeah, right by a house. The great thing is that a lot of these game companies, especially the"
2693.66,2698.38," bigger ones, I mean, even for QA, they do a good job of taking care of their employees, you know,"
2698.38,2702.7," we go and visit these companies and they have really nice setups for a lot of them. I mean,"
2702.7,2706.94, that's because they expect them to work long hours. But I've been to plenty of companies where
2707.5,2713.34," excuse me, where they'll have like, in how chefs will make lunch for everybody all day. I mean,"
2713.34,2719.02," every day, that kind of thing or gyms right on premises. I mean, basically, so they never want"
2719.1,2723.5," to be a studio with a, with a develop. I mean, if I were to guess, if you were to take any one of these"
2723.5,2731.1," jobs and kind of find the equivalent at a non game place, like it was okay, okay, I'm a programmer"
2731.1,2736.78," for, you know, some Capcom studio. And oh, no, I'm a programmer for Oracle. I've been a Oracle guy."
2736.78,2741.02," We'd be making a lot more. Because I think it's a supply and demand. Well, hey, we can do that frankly"
2741.02,2749.9," with games, quote unquote, journalism. Can't we? You know, the average writer at a, or editor at a"
2749.9,2757.42, magazine likely to make more at a non gaming place than they are at gaming. I can speak from experience.
2758.7,2765.42," Especially, especially if you consider gaming journalism a subset or offshoot of tech journalism."
2766.38,2771.7400000000002, And it is supply and demand thing because writing in the games industry is way more sexy than
2771.7400000000002,2777.02," working at a database company. Yeah. I kind of think of us as sort of like one step below PE teacher,"
2777.02,2782.3," you know, they got the like those who can't do teach those who can't teach T to PE. I think those who"
2782.3,2786.54," can't teach PE. Yeah, review games for a lesson. I think that's kind of what I work. Yeah, well,"
2786.54,2792.54," the put in perspective, the, I think the drivers of Bart, the local Bay Area Rapid Transit System,"
2792.54,2798.62," like a little over 60 K a year. Really. Wow. Wow. And yet my trains late every day. Yes,"
2798.62,2803.1, just just something to think about. Can't my drivers and they don't even drive it. Do they?
2803.1,2806.46, They're pressing like this. Press there's one big boat. Go. I've seen it.
2808.94,2813.2599999999998, And they still make get that right. I don't know. It might be really hard. Maybe they have to like
2813.2599999999998,2818.14, dodge the house all the time. I don't even notice it. Need to play the Bart driver's seeming
2818.14,2826.22," to learn some respect. Yeah. Yeah. Turn that throttle up, throttle down. But what else do we have this week?"
2828.54,2834.2999999999997, We had the ball. We had to sign up. Big topic. What was the big topic? Big topic was the evolution of
2834.2999999999997,2839.98," a multiplayer gaming. Oh, yeah. And that or it was kind of for me, like when I brought it up, it was"
2839.98,2844.62, more of like just the way that we play games socially. Yeah. How that's changed over the years.
2845.58,2850.2999999999997," So second on, the social gaming experience. So you want me to know me to start in one phase"
2850.2999999999997,2855.3399999999997, and or do a quick quick through the years for me and then compare and contrast with your guys
2855.3399999999997,2861.66, experience. Yeah. I feel you. Okay. So what I was thinking was just interesting because it is all
2861.66,2867.66," about the Benjamin. I mean, I've always been, you know, who do you want to play games with other people"
2867.66,2873.18," whenever possible? Uh-huh. And you started off, um, you know, there's an arcade experience where"
2874.14,2880.06," that silent rivalry with people you don't know. Uh-huh. Jocke for elbow space, you know,"
2880.06,2883.66," fighting games. Even before that, like, you are kung fu, not your kung fu single player, but like"
2883.66,2888.06," a karate champ. The thing that you had to do is you had to slap down the quarter, put the quarter"
2888.06,2893.5," up as soon as the guy was flailing as if to say, yeah, you're done. Yeah. I got moving there or like"
2893.5,2897.8199999999997," or they wait for you. There's that other thing too. We're like, uh, they're hoping that you come in,"
2897.8199999999997,2901.4199999999996, like they're losing and they're like put your quarter and put your quarter in. But then you just like
2901.42,2904.86," wait and then they like die and then they got to put another quarter and they want to play you,"
2904.86,2910.54," you know, like that was a whole new year. But definitely some jungle law there. But so I mean,"
2910.54,2914.14," we had that sort of thing. But then also, I mean, when I was really, I know of course,"
2914.14,2917.9," we're playing, you know, straight multiple multiplayer games, you know, sports. It was made like on the"
2917.9,2923.98," tendos, you know, and Atari will Atari and combat sports and stuff like that. But I just always remember"
2923.98,2929.98," like, also playing single player games, but the taking turns with people and I didn't have any"
2930.06,2933.98," siblings that lived with, but even with friends. And all the way up through like, you know,"
2933.98,2938.38," super Metroid, Mel, your solid one that came out, resin evil when it first came out. And you take"
2938.38,2943.5, turns and you all kind of like watch one another and kind of hope that the other person dies. So you
2943.5,2947.58," can get your turn all right. But at the same time, you're like, or you just might be fatigued with this"
2947.58,2951.42," part and you don't want to do it, but you still want to like feel like you could treat me to the"
2951.42,2956.7," getting through it. So you never root for your friends. Oh, I would. So then we'd help. But then you"
2956.7,2960.8599999999997," get mad too. If like, there'd always be that one friend. And he'd want to like try the dumbest"
2960.8599999999997,2966.46," solutions to everything. And it was like the, the dude played Castlevania 2 for Nintendo. And that"
2966.46,2971.4199999999996," game actually is put together that way, but like, we're in different life. So, you know, it's it's"
2971.4199999999996,2975.18, clear to everyone else in the room that all you need to do is you've got like whatever the star shaped
2975.18,2980.3799999999997," key and you need to put it in the star shaped, you know, locked a door or whatever. But he wants,"
2980.3799999999997,2985.02," but no, he wants to go back and look in the sewer and see if he needs to get some kind of acid"
2985.18,2990.54," to cover it with and pass it through a few, you know, subsequent phases, but there's always that dude."
2992.38,2999.9," Where am I going with this? Yeah, yeah, and then like, I don't know, and then for me, then it just seemed like,"
2999.9,3006.14," I mean, the big, of course, the, the big street fire came to home units and stuff. And then that,"
3006.14,3009.74," you know, brought the competitive stuff back. And then that was around the same time that Doom"
3009.74,3013.5," was in the dorm rooms. So everyone's, you know, gathered around for that on land."
3015.34,3019.18," And, and then that was really cool. But then it just, it was perfect timing for me because like I always"
3019.18,3023.74, got the most enjoyment at least with someone else there to play and that's when like online start
3023.74,3033.34," taking off. So it's great and I got to do, got to do all that and uh, yeah, yeah, that I"
3033.34,3039.98," burnt it. And then, um, and then, um, and then it's just like now it's like it just seems like the"
3039.98,3043.74, great place for it to be going is that you have more and more co-op games and just like increased
3043.74,3047.8199999999997," emphasis on co-op. And I mean, I'm really glad when it's there, like in gear's of war, which is,"
3047.8199999999997,3053.3399999999997," you know, for being such a big, you know, prominent release and co-op having a huge part in that"
3054.14,3057.74," EAs army of two, which is coming out. Yeah, but it does have a lot of console, but"
3057.74,3062.54, but it's an area is coming for PC as well. But doesn't it piss you off that like you see so many
3062.54,3067.4199999999996," console games, even like online console games that have co-op and yet like the co-op on PC games,"
3067.4199999999996,3073.5," there's a few and far between comparison. But of course, that's the whole appeal of MMOs, right?"
3073.58,3077.66," Right. You don't really play. I'm sure on, but that is, that is the appeal because we're"
3077.66,3083.34," killing these monsters in a group with other people. But the only thing I'm saying is like, you know,"
