start,end,text
0.0,3.8000000000000003, This is the one up radio network and now GFW radio
5.5200000000000005,8.4, Hello and welcome to the GFW
8.88,10.88, Ryan podcast
10.88,18.92, The rest of the GFW staff is out seeing the new battlefield related game today and I don't play those damn shooters
18.92,20.68, So I figured I just
21.48,23.48, Why solo and
23.48,25.48, Give you some of the Ryan
25.72,29.880000000000003, On today's agenda I've got my latest e-phone line hijinks
29.880000000000003,34.2, Gonna talk about this week's issue of DC's comics 52
35.0,39.84, Going to tell you how to recreate the characters from the TV show heroes in city of heroes
40.88,48.36, We have a special furry corner and then we'll go over last week's episode of loss and a special loss
49.84,51.84, Oops
51.84,53.84," Actually, let's start off with loss"
55.559999999999995,57.559999999999995," Okay, I'm going"
58.559999999999995,62.559999999999995, This is GFW radio
62.559999999999995,67.84, This is the theme to the music of GFW radio
69.64,71.64, Hi
71.64,75.32, I don't know if I like this better than hello. I welcome I don't know
75.72,81.0, This is our theme song now though. I guess the fans of spoken you get me singing every week
82.52,84.03999999999999, Hi
84.12,86.12, We're here now
86.12,88.12, This is our podcast
88.12,89.12, We're here
89.12,94.72, All those people not just Ryan for other people on the forums who who want to see me talk more
95.12,98.60000000000001, See you don't really want to pat actually I would listen to that show
98.60000000000001,99.72, I totally listen to that
99.72,103.16000000000001," I thought that was a good lineup, but it's probably better than our own lineup than we have here"
103.16000000000001,108.2, The line show was pretty hot. I want to create the heroes cast and hear me to heroes me too
108.2,112.44000000000001, You would listen to a radio show about how to create the heroes cast and city of heroes
112.52,115.16, I would I be as awesome as like the Sidoku podcast
117.16,119.16, Link
119.16,122.92, Now we're getting on the second road now go to the second option
124.12,130.16," Yeah, save that one you are flying slow. It's good to know now though that we could all be gone"
130.6,132.6, You could handle this solo task
133.32,135.32, Let's just
137.32,142.92," Yeah, it's the week at Dead Sciences. Okay, so we're here. It's April 3rd"
144.12,146.12, 2007 and
147.16,149.16, How is everybody
149.16,153.32, It's pretty super if I the morning. I'm too uncomfortable to activate
153.32,155.07999999999998, I never ever have a problem
155.07999999999998,157.07999999999998, Like a matool
157.07999999999998,159.72, Red dog check it out. Long as gonna talk this week
160.28,162.68, That's what we chimed in we as red dog on these red dog
162.92,164.92, We introduce ourselves to do so
165.88,167.4," Yeah, that's good"
167.56,169.56, Who are you? I'm Jeff Green
169.88,175.4, I'm Ryan Scott. I'm Darren Gladstone Sean Elliott that's with two T's get it right or keep my name out your mouth son
175.8,177.0, God damn right
177.0,181.4, How many of us fill in you get on that one and a Sean Maloy that's S E A N
182.12,183.4, Right and he's S
183.4,184.36, It's W
184.36,188.2, There are people spawn your name on the boy dead was hooked on phonics and chances
188.76,195.32, I wish you some that sounds about right we used to have a third Sean on the staff there were three Sean's at one point
195.88,200.44," He now works for PC gamer. He does work for PC gamer. Yep. Yeah, good to see back in the biz"
200.44,205.72, But damn it now the assistant our director over there or associate our director. I don't know what they call their titles over there
205.72,207.72, But congrats to mr. Dalskid
208.28,211.79999999999998, He's a fine lad very it is good to see him back in the game biz
212.12,217.07999999999998, I don't know where he was he had some other kind of civilian job was a gross mistake
217.48000000000002,219.48000000000002, Corrected
220.12,223.4," Okay, so do we have stuff to talk about this week or is that it?"
223.72000000000003,225.96, We'll see you next week. Thank you
227.24,233.0," I have to run this thing God damn it. Okay, well we have all sorts of big news"
233.8,239.16000000000003, We're gonna talk a little bit about an announcement that was made in Vanguard for those who care about that
239.64000000000001,244.20000000000002, We've got an interesting topic on game game industry salaries
244.67999999999998,246.67999999999998, They got posted I think
246.67999999999998,250.51999999999998," Monday, huh? Well, is the see it's the game game developers magazine"
251.39999999999998,252.67999999999998, A port they do
252.67999999999998,257.88, Uh-huh so we have some interesting figures about that and why you should be in the game industry if you're not
258.52,262.91999999999996, Once you see these numbers you would definitely want to be in it
265.8,268.12, Like this the rest of the podcast
268.84,271.32, Some good news about the battle story galactica
271.64,274.52, That's our galactic game free online
276.2,282.36, So you can you know play as not even it's not it's not like it's more like a Sam right it's not a
282.76,286.52," I don't get the play as number six say right no, it's yeah, it's strictly"
287.08,289.08," Spaceblood yeah, okay"
290.12,297.08, And we got some other we got some other hot topics this week. I think Sean's gonna regal us with our cage story at some point
297.96,303.4," But I heard that's what I thought that's rumor has it that's the weird one street. Oh, but first is anybody playing anything"
303.4,309.56, I will start off. Mm-hmm. I'm just gonna talk. Hey Jeff. What do you think what are you playing glad you asked?
310.2,315.15999999999997, I'll tell you what I'm playing rest of you guys shut up. I tried to play stalker and I couldn't
316.2,320.2, I've got a 2.5 gigahertz machine one giga ram
321.0,325.24, 8800 video card and that was not good enough for stalker
325.88,331.47999999999996, You're right with the dynamic who lighting I mess with all that and it's still ran like but
333.0,335.0, That's post patch
335.0,339.96," Yes, pretty unpost patch. Oh, I actually I don't have your hair by the specific the patch came out and actually"
340.59999999999997,342.03999999999996, Negated game saves
342.03999999999996,346.52," Yeah, but since I couldn't play it in the first place. I had nothing to save with effect. You very much. Yeah"
346.59999999999997,353.64, It was just very stuttery. I couldn't I couldn't do it. In effect. It affected me deeply after I spent 10 hours playing and my game saved was destroyed
355.0,360.91999999999996," Really said he could start over and I'm holding off for now. Yeah, are they fixing that have they patched the patch? Do we know yet?"
361.71999999999997,364.12, Haven't heard anything yet. I actually been waiting
364.12,367.96," I've been trying to get hold my my contact over a THQ to find out what the deal is there, but"
369.15999999999997,373.64," Well, I don't have CNC yet and I'm still trying to finish infernal"
374.12,379.24, But I was hoping to get some stalker in and it would not happen because I don't have a good enough machine anymore
380.12,383.08, Something's not right. I think you need to mess with the settings a bit
383.47999999999996,388.44, So I just was talking to someone like I running and running well on a 70-800
389.15999999999997,397.32," Really, yeah, but maybe their process was better than mine or they are more ram than me. No, I don't have a gig around. Do you have the suck mode box checked?"
398.2,405.64," Do I forgot? Yeah, see you got to check the suck mode. Yeah, I was going through all that"
405.64,409.64," You know, I restarted my machine five times and it was definitely having one of those moments of"
410.28,413.56," Yeah, this is why PC gaming so great. Yeah, when I just"
414.28,416.6, I reviewed the last splinter so I had to buy
417.71999999999997,422.2, Another stick of ram for my home PC because I didn't have enough to run it. Yeah
423.15999999999997,427.88," Well, Shawn you were I mean you're the machine you're playing on the home is pretty budget right? Well, that's it. That's with the"
429.15999999999997,434.94," With the lighting turned it turned down at home, but on that you know on a radiant 90-100 card"
434.94,437.94, It runs fine really decent frame race
439.09999999999997,441.09999999999997," Well, we'll see"
441.74,444.21999999999997, Anybody else play anything else about that I'm done with me
445.41999999999996,451.32, Self-self-self-self- guilt see. I was apparently I really hate myself. I was playing tortilla tortilla tortuga two tiluras
452.2,453.68, or two good two treasures.
453.68,454.12, Yeah.
454.12,454.84, TTT.
454.84,455.44," Yeah, exactly."
455.44,457.8," Basically, imagine pirates ripped off."
457.8,459.32, And then they just kind of took basically someone
459.32,461.8," watched the pirates, the Caribbean marathon or something."
461.8,465.96," And they're like, they're so literally just hijacked the plot"
465.96,466.59999999999997, and the characters.
466.59999999999997,467.96," I mean, the captain."
467.96,469.56," We mean the gameplay of pirates,"
469.56,470.56," Sid Myers, pirates."
470.56,472.91999999999996," They try to lift some of the gameplay of Sid Myers, pirates,"
472.91999999999996,476.71999999999997," and the plot of pirates, the Caribbean."
476.71999999999997,477.56, OK.
477.56,479.56, So it's such a blatant rip off.
479.56,482.03999999999996, But does it have that it's the same gameplay as pirates?
482.04,483.96000000000004, Kind of like exploration.
483.96000000000004,485.96000000000004," And it's not so much about the exploration,"
485.96000000000004,488.08000000000004," at least what I've played so far, is all about like,"
488.08000000000004,490.12, it just leads you down this one path.
490.12,491.68," And you just, here's one."
491.68,492.92, Here's one mini game.
492.92,493.76000000000005, Here's a cutscene.
493.76000000000005,495.8, Here's another mini game.
495.8,497.68, They could just place it in the pirates' pirates instead.
497.68,499.28000000000003, That's exactly what I thought.
499.28000000000003,502.68," Because that game, even the remake, was classic."
502.68,503.68, That game was gold.
503.68,504.36, I love that game.
504.36,507.6," It did not get as much hype, I think, as it should have."
507.6,508.56," I mean, I thought I could."
508.56,509.92," I remember going like, I agree with that."
509.92,512.0," After about two hours of playing,"
512.0,513.76, I went back to playing pirates.
513.76,517.76," I mean, it made me realize how much I missed a good pirate game."
517.76,519.32, I still got that one on my laptop.
519.32,520.12, Yeah.
520.12,520.76, Yep.
520.76,521.84, I'm going to dig that one up.
521.84,523.24, Because that was a great game.
523.24,525.2, The only thing I couldn't quite dig at behind was the
525.2,527.04," courtly dancing part, but other than that,"
527.04,528.68, I liked the courtly design.
528.68,530.92, That was amused.
530.92,533.56, I didn't like the sneaking through town parts after all.
533.56,534.56," Oh, yeah."
534.56,537.36," That doesn't go to the, doesn't go to the one."
537.36,539.56," Actually, if it's only that they do try this in Tortuget,"
539.56,541.16," the one thing they try to do, it's kind of interesting,"
541.16,543.64," but they make it so like, lopsided."
543.64,545.4," When you do that sneaking around town thing,"
545.4,548.04, it's actually a click fest.
548.04,552.1999999999999," You're like, you know, having combat against the port guards"
552.1999999999999,553.28, and stuff.
553.28,555.68," But God forbid, you see, one actually sees you"
555.68,556.68, and I just gang up on you.
556.68,558.8399999999999," So you're fighting off the night, guys, at once,"
558.8399999999999,560.8, and you're dead inside of a minute.
560.8,561.76, That doesn't sound like fun.
561.76,562.6, Not really.
562.6,564.56, Did you find one of the two treasures or none of them?
564.56,566.72," I said, you know what, you keep the treasure going."
566.72,567.4, I'll be fine.
567.4,572.4," See, I'm just showing there, Sean Elliott."
573.1999999999999,574.36," I'll sound like a broken record,"
574.36,575.8, and then I'm playing ill too.
575.8,577.16," No, but at first I will."
577.16,578.9599999999999," And I'm playing ill too,"
578.9599999999999,581.72," storm of igniting 46, which came out recently."
581.72,582.72, And I had to say the whole name
582.72,584.56," because I've noticed quite a few people asking,"
584.56,587.12," what's that, flight sim, he's talking about?"
587.12,588.4399999999999," But I won't sound like a broken record,"
588.4399999999999,589.1999999999999," and then it was like,"
589.1999999999999,593.1999999999999, and then I'm passing through phases of appreciation for the game.
593.1999999999999,594.64," And I think I've gone through the whole,"
594.64,596.6," like I did the whole, okay,"
596.6,599.12, let's make fun of the rivet counting stuff
599.12,601.5600000000001," and make fun of just like how many knobs and dials are,"
601.5600000000001,603.4," and then moved into the phase of,"
603.4,604.5600000000001," I think for example, this weekend,"
604.5600000000001,607.48, I want to best buy a looking for rudder pedals.
607.48,608.32," Oh, wow."
608.32,610.24," So basically, that you're in the acceptance phase."
610.24,611.52," I mean, the acceptance phase."
611.52,614.2," And just like, and in addition,"
614.2,615.84," I wanted to find, so I'm still trying to track down"
615.84,618.8000000000001," a track I are, which is basically the latest version"
618.8000000000001,621.24," is you put a hat on, and it just,"
621.24,623.4," you know, the sensor, you put on top of your monitor,"
623.4,625.76," and it will gauge where, you know, where your head's looking."
625.76,627.56," Which is the thing that's so rad of being a hero,"
627.56,628.4, or a bad person.
628.4,629.24, I am so good.
629.24,630.08, I don't know.
630.08,630.92, I don't know.
630.92,631.96, Because it's a good feeling.
631.96,634.8," No, the whole thing with the head track and stuff,"
634.8,637.0," and this is, I think if you can appreciate this,"
637.0,638.28," if you don't even play a type of game,"
638.28,640.84," is that since you're moving your own,"
640.84,643.6," the equivalent of your own head independently of the cockpit,"
643.6,644.4," and that's not something,"
644.4,645.3199999999999," I mean, people that play battlefield"
645.3199999999999,647.3199999999999," get it to an extent where you hold down control,"
647.3199999999999,649.3199999999999," and you're able to mouse, look to the left of your,"
649.3199999999999,650.68," you know, out your window of your helicopter,"
650.68,652.2," or whatever, see where your door got,"
652.2,653.8," or in the black hoc same, you know."
653.8,656.4," But I mean, when you're in a big, you know,"
656.4,657.52," in a tight turn or something,"
657.52,659.28," and you look up through the top of the plane,"
659.28,661.7199999999999," which is the equivalent of looking sideways,"
661.7199999999999,662.92," and you're very,"
662.92,664.0799999999999," and one of your, you know,"
664.0799999999999,666.4, one of your physical senses is aware of the momentum
666.4,668.16," that your plane's traveling with, you know,"
668.16,669.7199999999999," where that's going, but you're also, you know,"
669.7199999999999,672.7199999999999," you do feel like, I mean, it's hard to pinpoint it,"
672.7199999999999,675.24," but the level of immersion is definitely something,"
675.24,676.76," I haven't had it a long time, you know,"
676.76,677.76," that feeling like when you go in,"
677.76,680.4," you play a really good, not a ride simulator,"
680.4,681.76," but like I'm really good, our K-game,"
681.76,683.76," that has some sort of gimmick implemented into,"
683.76,685.92," but you're like, this is actually cool."
685.92,688.36," I mean, it's kind of nerdy, and I've paid 75 cents for this,"
688.36,690.48," but it's working in a way where,"
690.48,691.8," as long as I quit being such, like,"
691.8,695.12," I don't know, a hard to play a jaded old gamer"
695.12,696.72," and just kind of come at this, like,"
696.72,698.08," in a way that maybe you're, I don't know,"
698.08,701.52," you're brother or whatever, it is just a cool feeling."
701.52,703.88, We know that also works with racing games too.
703.88,705.72," Yeah, it worked with all sorts of games."
705.72,707.96, And so how hard do you have to move your head
707.96,710.24, to make a very small amount?
710.24,712.3199999999999," And I've watched videos of it in use,"
712.32,714.72," like dog fighting videos of people winning,"
714.72,716.2," using it, of course, their promotional,"
716.2,718.12, I'm sure they were put on YouTube by the company.
718.12,720.6400000000001," But you could tell though, it's really smooth and fluid."
720.6400000000001,722.88," And so if I wanted to look all the way straight up,"
722.88,724.6400000000001, I'd probably just move a little bit.
724.6400000000001,726.5200000000001," Okay, so you're not like looking way up"
726.5200000000001,727.36, and then your eyes are rolling out.
727.36,729.72," Yeah, then you can't even keep your eyes on the screen."
729.72,730.88," But whether or not you use that,"
730.88,732.12," what I do with my controllers,"
732.12,734.7600000000001," I map that, I have the equivalent of a mouse knob"
734.7600000000001,737.36," from a laptop, you know, on my throttle,"
737.36,740.2," and I'm able to do it with that, and that works fine."
741.2,743.9200000000001, But don't you think if I was sitting across from you here
743.9200000000001,746.44," wearing a head, and I told you that I was"
746.44,749.0," any of it's gonna come in, playing World of Warcraft,"
749.0,751.84," and I had to head set on so that like when I get my spells,"
751.84,753.84," it's just pure like, I totally make it fun."
753.84,755.84," But here's the thing, like the guy,"
755.84,758.12," there's a certain amount of like, okay,"
758.12,760.6," special pleading, whatever, but these things"
760.6,762.0, I'm about to tell you are true.
762.0,764.24," Okay, the guy who made this all look mad at you."
764.24,765.48," So I was on the one-up show last night,"
765.48,767.9200000000001," everyone's telling us about all the,"
767.9200000000001,770.1600000000001," feel up to peanut farmer, whoever who made this game,"
770.16,772.88," you know, but I'm like, do you, this guy is a,"
774.0799999999999,777.92, he was part of the Soviet invasion of Afghanistan
777.92,780.36," back in the day, that's not, that's not pussy stuff."
780.36,781.68, I hope he's not bragging about it.
781.68,783.24," He's not, he's not, he's not, that was too cool"
783.24,784.0799999999999, when they did that.
784.0799999999999,785.12," No, he's definitely not bragging about it,"
785.12,786.56, and he's debating about the country.
786.56,787.6, He wouldn't even talk about it.
787.6,788.6, There is not a good guy right?
788.6,790.56," Because someone on his,"
791.76,795.12," someone on his team, I won't name posts on a forum,"
795.12,797.72," and they talk about just generally the philosophy of the game,"
797.72,799.9599999999999," whether or not, you know, they actually depict violence."
799.96,803.1600000000001," I mean, depict a gore, and if you know in the latest versions,"
803.1600000000001,804.24," when you are hit in your cockpit,"
804.24,806.4000000000001," there's no blood, your screen starts to go red,"
806.4000000000001,807.64," but that was a big thing, is that,"
807.64,812.9200000000001," oh, I want to know visual like depictions of gore or anything"
812.9200000000001,815.64," in this thing, and you doesn't even want to talk about that stuff."
815.64,817.1600000000001," That's why you probably know Moses,"
817.1600000000001,819.12," I mean, and I don't, they're not upset with me for saying this"
819.12,820.84," because I did find this in a forum, but no,"
820.84,822.84," so he definitely doesn't go around,"
822.84,824.76," I mean, in the same way, you know, that like,"
824.76,826.72," that you'd imagine, you don't go bragging about,"
826.72,828.5600000000001," about those, you know, that experience,"
828.56,831.76, but it shaped him.
831.76,832.5999999999999, I'm sure of that.
832.5999999999999,835.16," You know, clearly, well, the fact, in the negative sense"
835.16,837.3199999999999," that you don't have that kind of stuff in the game,"
837.3199999999999,841.04," but anyway, it's one of those notches on your belt,"
841.04,844.76," this is at least of all things, you're not the peanut farmer,"
844.76,845.5999999999999, whatever.
847.0,850.88," So back to the game, some of the cool stuff that we've been doing now"
850.88,852.8399999999999," is like, I played this with Matt Peckham,"
852.8399999999999,854.8399999999999, who's reviewing it for us this issue.
854.8399999999999,856.3199999999999," My friend, Rory, we're playing online,"
856.6,859.5200000000001," EGM's CRISPR Boyer is going to be joining us, too,"
859.5200000000001,862.6400000000001," in our little, little click of nerds."
862.6400000000001,864.6400000000001, He's going to be riding like an Amario plane
864.6400000000001,866.08," or something, so he feels comfortable there."
866.08,867.08, No.
867.08,869.12," But why am I just like,"
869.12,870.12, I'm already playing.
870.12,871.4000000000001," Brody's a little Mario plane,"
871.4000000000001,872.5600000000001, I'm not so boy.
872.5600000000001,874.72, That's all they play over there at EGM as Mario.
874.72,876.7600000000001, Maybe you can ride around in a giant mushroom.
876.7600000000001,878.72," But, like, some of the cool, like,"
878.72,881.08," a cool mission that we've been doing,"
881.08,884.8000000000001, which is ties into something else I want to say about the game.
885.24,886.64," And this is all, I'll say that first."
886.64,888.4," This is that when you hear about this kind of game,"
888.4,890.88," you're like, okay, there's no way this is accessible."
890.88,892.4399999999999, This is for a certain type of person.
892.4399999999999,894.3599999999999," You're already like, there's a category,"
894.3599999999999,895.3599999999999," whatever you're calling me,"
895.3599999999999,897.24, a person that plays this kind of game.
897.24,900.4," But I think the press has done a poor job in that,"
900.4,903.28," we talk, we do talk, like when I first came on and talked about it,"
903.28,906.4399999999999, we do talk about this sense of this insider's club.
906.4399999999999,908.04, If you have to be able to do this in this
908.04,909.68, in order to be part of this club.
909.68,911.8399999999999," But they're easy modes, you can turn all the stuff off."
911.8399999999999,914.68," If you want to make it so that there are no clouds,"
914.68,917.16," your bullets don't drop, you can't stall,"
917.16,920.0799999999999," there's no wind, you don't even have to take off."
920.0799999999999,922.12," These are all independence, which is you can click"
922.12,923.4799999999999," every single one of them, you can make it,"
923.4799999999999,925.88," so you don't feel G force, you can't pass out,"
925.88,927.92, you can't bleed every single thing.
927.92,930.2399999999999," And when you do that, the game becomes increasingly more"
930.2399999999999,933.76," archady, but it also means that you can go in."
933.76,936.64," And as you acclimate yourself to what's happening,"
936.64,938.5999999999999, create a lesson for yourself one at a time
938.5999999999999,940.5999999999999," by adding more and more, by clicking more and more,"
940.5999999999999,942.8," these things and saying, okay, now let's introduce this"
942.8,943.8, into this seminar.
943.9599999999999,946.7199999999999, It's ultimately end up at the point where
947.7199999999999,948.68, that you hear about.
948.68,951.0," But to think about this, that makes it different from other"
951.0,952.4399999999999," flight systems and combat flight systems,"
952.4399999999999,957.0," is that like, oh, it thinks that flying itself is really easy."
957.0,958.16, It's not a difficult thing.
958.16,960.92, And he actually argues that other sim creators go wrong
960.92,963.64," in that, just trying to say, I mean,"
963.64,966.56," wearing that complexity or that intricacy,"
966.56,969.0, like a badge of belonging or something.
969.0,971.56," And he says that, I mean, when it comes down to it,"
971.56,973.68," I mean, yes, planes have all these gauges and dials"
973.68,974.52, and stuff.
974.52,975.7199999999999, But the pilot's only looking at one of them
975.7199999999999,976.88, and it give time.
976.88,978.1999999999999," Well, I mean, it's the same way."
978.1999999999999,979.4, It's the fuels what they're looking at.
979.4,982.4799999999999," And if you go into a lectures, you see a million lit up gauges"
982.4799999999999,983.3199999999999, and stuff.
983.3199999999999,985.4399999999999," But you've driven a car, you know, you just like, hey,"
985.4399999999999,988.0," you know, maybe you need to look down there once in a while."
988.0,990.8, But it's a combat itself that gets intricate.
990.8,992.0, But it's also really rewarding.
992.0,995.3199999999999, So here's the thing that was taken back to the actual experience
995.3199999999999,996.9599999999999," that we did have is like, we're basically just playing"
996.9599999999999,998.5999999999999, these missions where it's just us
998.5999999999999,1001.1999999999999, in these experimental German jets.
