start,end,text
1001.1999999999999,1003.4399999999999," And they have high caliber cannons attached,"
1003.44,1004.96, but also these wire guided rockets.
1004.96,1006.8800000000001, Now I'm going to try to put this on hot.
1006.8800000000001,1008.36," And we're fighting and we're taking out like,"
1008.36,1010.08," you know, big squadron of B-29s."
1010.08,1010.6800000000001, But it's just cool.
1010.6800000000001,1013.08," I mean, you shoot your missile and then use your separate controller"
1013.08,1015.5200000000001, to like kind of steer the missile into them.
1015.5200000000001,1018.0," And I mean, unlike, you know, another game,"
1018.0,1019.8800000000001," like you're hitting these and parts are falling off,"
1019.8800000000001,1021.72, you could specifically see engines come off
1021.72,1024.3200000000002, or a wing comes off and the whole thing just tips over.
1024.3200000000002,1027.24," And you'll see, we end up, they'll start feathering the props"
1027.24,1028.44, and try to get the other turn to rest
1028.44,1031.1200000000001, of the engines on that side off and get the other ones up.
1031.1200000000001,1032.92, And it's just cool.
1033.28,1033.76, It's fun.
1033.76,1034.6000000000001, It's still like it.
1034.6000000000001,1035.44, And I found a new love.
1035.44,1037.8400000000001," No, it's interesting to listen to you go through this."
1037.8400000000001,1042.04," I mean, it's probably not that usual these days I would think."
1042.04,1043.96," To watch someone, you know,"
1043.96,1047.16, actually get into this particular genre now.
1047.16,1049.0," Yeah, it experienced the, you know,"
1049.0,1051.76, newbie through wanting to add features
1051.76,1053.96, until your an actual experience guy.
1053.96,1056.5600000000002," I mean, you're, you're getting into this right at the point"
1056.5600000000002,1058.16, where there's practically no games
1058.16,1059.3200000000002, and there's genre anymore.
1059.3200000000002,1061.3600000000001," Yeah, I mean, there are still,"
1061.3600000000001,1062.52," there are still quite a few,"
1062.52,1064.2," but it's just not, yeah, like you're saying,"
1064.2,1067.08," I mean, you've been working in this room for long enough to know"
1067.08,1068.76, that you used to be a cover story every month.
1068.76,1070.8," Yeah, we talked about that last week and the old days."
1070.8,1074.16," It was, I mean, to me, the barrier to entry is still"
1075.96,1077.36, the joystick.
1077.36,1078.2, Right.
1078.2,1080.32," And it is hard because they don't have those,"
1080.32,1081.16," well, they did."
1081.16,1085.08, I was happy to see that they had the Cytec X5 to at best by.
1085.08,1087.84, And the non-promodel is like around $100 or something.
1087.84,1089.32," That's still as prohibitive, you know,"
1089.32,1091.6399999999999," but for it to be an impulse by,"
1091.64,1094.4, they really do need to have like some cheap sticks that are available.
1094.4,1096.0800000000002," So you just wander in some place and you're like,"
1096.0800000000002,1096.88," okay, cool."
1096.88,1097.72, That's a bad practice.
1097.72,1098.72, That's a bad practice.
1098.72,1099.72," There used to be everywhere, right?"
1099.72,1100.72," Yeah, they used to be everywhere."
1100.72,1103.72," I mean, it was really not unusual back in the day"
1103.72,1106.0400000000002, for us all to have them on our desk.
1106.0400000000002,1108.1200000000001," You know, even if we weren't hard core,"
1108.1200000000001,1109.4," a quantum-quot, flight sometimes."
1109.4,1110.24, Right.
1110.24,1111.0400000000002," You just, you'd have to add them."
1111.0400000000002,1113.0, Because it was just part of your PC gaming setup.
1113.0,1113.96, And I got money.
1113.96,1115.5200000000002, I got the stick you had.
1115.5200000000002,1117.3200000000002, It was a legacy from that.
1117.3200000000002,1118.8000000000002," Because I remember when I was at EGM,"
1118.8000000000002,1120.3600000000001, they would always see him floating around.
1120.36,1122.8799999999999," Whenever someone would get laid off or move or something,"
1122.8799999999999,1124.24, there's a pile of crap.
1124.24,1125.3999999999999, They didn't want to take with them.
1125.3999999999999,1127.8, It would always have like a brand new expensive flight stick in it.
1127.8,1128.6399999999999, Yep.
1128.6399999999999,1129.56," And this is kind of like,"
1129.56,1131.24, the legacy where I finally got around to it.
1131.24,1134.56," But I do think, one, it's kind of like,"
1134.56,1135.7199999999998, you get older.
1135.7199999999998,1137.7199999999998," You go from a gamer and you go from playing,"
1139.08,1139.8799999999999, I don't know.
1139.8799999999999,1140.9199999999998," I mean, just, you go from,"
1140.9199999999998,1142.6399999999999," I mean, call the UDL of, I don't know."
1142.6399999999999,1143.56, It's hard to think of a thing.
1143.56,1144.56, But you just branch out.
1144.56,1146.24, And you want different sorts of games.
1146.24,1147.56," You know, you start playing stuff like rope"
1147.56,1150.28," with universalism and ill-to when,"
1150.28,1152.6399999999999," I mean, that seems kind of natural with me."
1152.6399999999999,1153.48, It seems cool.
1153.48,1155.6399999999999, But I do want to proselytize for it just because I think
1155.6399999999999,1158.12," a lot more people than would enjoy it,"
1158.12,1160.08, than probably realize they would.
1160.08,1162.76," I'm kind of curious, because you've been a aviation buff"
1162.76,1163.28, for a long time.
1163.28,1165.32," And I got, you know, especially well,"
1165.32,1167.1599999999999," our two plans, right?"
1167.1599999999999,1168.52," Did you try other stuff in the past,"
1168.52,1171.6799999999998," like, you know, secret weapon weapons at a lift offer?"
1171.6799999999998,1174.12," I mean, all the console stuff."
1174.12,1176.28, So I would play anytime there would be like some
1176.28,1177.52, of some skies or stuff.
1177.52,1178.36," Yeah, some of the stuff."
1178.36,1180.92," Crimson skies and then, you know, the really poor games"
1180.92,1182.56," and all that, you know, damn cool stuff,"
1182.56,1183.52, which I really don't like.
1183.52,1185.56," I mean, it's like right now Ace Combat 6 screens"
1185.56,1186.56," are going around and they look great,"
1186.56,1187.3999999999999, but it's the same thing.
1187.3999999999999,1189.04, It's the same story as every time.
1189.04,1190.6399999999999," I mean, it's just night and day."
1190.6399999999999,1191.92," I mean, you can't, I honestly now,"
1191.92,1194.96, that you can't have any kind of good flight game.
1194.96,1196.2," It doesn't give you independent, like,"
1196.2,1198.2, look movement within your cockpit.
1198.2,1199.24," Go ahead, it's different with jets"
1199.24,1202.2," because you have other means of tracking, tracking,"
1202.2,1204.04," you know, targets in the air."
1204.04,1206.24," But, I mean, that's a huge part of it."
1206.24,1208.08," I mean, just being able to keep your eye on,"
1208.08,1210.28," on who you're chasing and everything and instead of,"
1210.28,1212.4," it feels, the console wants to feel so,"
1212.4,1214.08, and cruise skies is a whole other story.
1214.08,1216.16," And what it did right in its own way,"
1216.16,1219.1200000000001," it captured the verticality of air combat, which was cool."
1219.1200000000001,1221.08," Because you could put in a quick move,"
1221.08,1222.84," push one analog stick down the other up,"
1222.84,1224.4," and then suddenly you're going straight up,"
1224.4,1225.8, reverse it and you're going straight down.
1225.8,1227.64," Well, that just started as a PC game."
1227.64,1228.28, Yeah. Right.
1228.28,1229.0, Foss on.
1229.0,1230.56," But the other ones, though,"
1230.56,1232.44, I feel as if you're just going in a circle
1232.44,1235.56," on a flat plane to me, like on a disc or something, you know."
1235.56,1237.32," And it just is so, I mean,"
1237.32,1239.6799999999998, it just misses the whole feeling of going upside down
1239.6799999999998,1242.52, and looking up and seeing basically just like the ground
1242.52,1244.84," beneath you, you know, and cloud passing by"
1244.84,1247.08," and maybe another jet zips down beneath you,"
1247.08,1249.6799999999998, and then you just kind of flip down out of that inverted.
1249.6799999999998,1251.84," Now, that's a point at which I quit every single flight"
1251.84,1253.08, to my ever try.
1253.08,1256.28," Yeah. I see that the sky below me,"
1256.28,1260.8799999999999," I'm just like, ah, when I crash and I load something easy."
1260.8799999999999,1262.08, So I could do them or something.
1262.08,1262.9199999999998, Yeah.
1262.9199999999998,1263.9199999999998, Chop left.
1264.24,1266.3200000000002, So I guess we're going to have to make a thread
1266.3200000000002,1267.1200000000001, forward on our forms.
1267.1200000000001,1269.5600000000002," So I got people PM and me like, hey, I hear about this"
1269.5600000000002,1272.92," and can I get in your click, but we'll ultimately get"
1272.92,1274.0800000000002, together some big posses.
1274.0800000000002,1276.92, We'll go hunt the B29s like a big.
1276.92,1278.64, How big can those squadrons get?
1278.64,1280.0800000000002, Like 100 players or something?
1280.0800000000002,1281.3600000000001," No, it's not quite as big as that."
1281.3600000000001,1282.1200000000001, It's 32.
1282.1200000000001,1283.6000000000001, I think it's the max and the server.
1283.6000000000001,1285.92, But that's quite a few planes.
1285.92,1287.3600000000001," Well, and if you want to hunt Merrillogs,"
1287.3600000000001,1289.24, just send me and Sean the lie.
1289.24,1289.72, That's right.
1289.72,1290.3200000000002, Yeah.
1290.3200000000002,1292.0, You got a pot of Merrillog to do that.
1292.0,1293.44," Yeah, it's a whole lot of stuff about that."
1293.44,1294.8," Maybe if you get enough support,"
1294.8,1297.3600000000001, there could be a flight sim pod guess.
1297.3600000000001,1297.56," Oh, okay."
1297.56,1298.3600000000001, This is high.
1298.3600000000001,1302.48, The plan is actually there probably is a more
1302.48,1304.24, than one flight sim pod guess at probably.
1304.24,1305.0800000000002, I'm sure.
1305.0800000000002,1305.64, And it'll be soon.
1305.64,1306.56, I was that.
1306.56,1309.52, Mine would be like the retarded version of it.
1309.52,1314.04, So next we're talking about CNC.
1314.04,1314.56, I hope.
1314.56,1315.76, I hope if our copy.
1315.76,1317.72," Should we get copies, right?"
1317.72,1320.44, I'm psyched for CNC three.
1320.44,1322.52, It's supposed to be good.
1322.6,1323.72," Oh, and also what's it called?"
1323.72,1324.32, Just came out.
1324.32,1326.32, I'm going to take going to go home and play tonight.
1326.32,1327.48, Found out about it last night.
1327.48,1328.08, It was too late.
1328.08,1333.96," But does it conflict, which is new mod from it's not necessarily"
1333.96,1336.44, the same crew that made desert combat because they became chaos
1336.44,1337.8, studios or make front lines.
1337.8,1338.96, But it was Darren.
1338.96,1340.4, You said that their hand picked.
1340.4,1340.6, Yeah.
1340.6,1342.6, Basically what happened was they kind of passed the baton onto
1342.6,1344.52," like the next gen of devs, you know,"
1344.52,1346.28, upcoming devs that wanted to work on this.
1346.28,1348.04," So they just kind of, they have the blessings of the chaos"
1348.04,1349.0, studios guys.
1349.0,1352.28, So this is now a major battlefield to base mod.
1352.28,1356.36," That among other things, it's not necessarily a total realism"
1356.36,1358.76," mod, but it adds any all kinds of weird stuff for,"
1358.76,1359.36, or not weird stuff.
1359.36,1361.6," But it adds things from, you know,"
1361.6,1364.08," scut missiles and other types of, you know,"
1364.08,1367.8," armored fighting vehicles to take, I think all missiles"
1367.8,1370.3999999999999," are back to just being down fire, which was a huge point"
1370.3999999999999,1372.52," because I mean, the lock on missiles took a lot out"
1372.52,1376.04, of the air combat and battlefield to a number of other things.
1376.04,1378.84," New maps, but classic maps that from desert combat"
1378.84,1379.48, that they've updated.
1379.48,1380.6, Nice.
1380.6,1382.48, So that was the mod I played the most.
1382.48,1383.8799999999999, I'm going to look forward to that mod.
1383.8799999999999,1386.7199999999998," I'm surprised because if you had a hard time with battlefield,"
1386.7199999999998,1390.04," that I mean, that's, you'd get this trashed in that game."
1390.04,1391.1999999999998, I believe it or not.
1391.1999999999998,1392.36, I was actually good about a few.
1392.36,1393.48, I had 1842.
1393.48,1393.84, Yeah.
1393.84,1394.52, It was us two.
1394.52,1396.6799999999998, I just didn't play enough to get the hang of it.
1396.6799999999998,1398.04, Huh.
1398.04,1399.8, So hopefully report back now.
1399.8,1402.1999999999998, So maybe now is actually a good transition for the battle
1402.1999999999998,1406.52, start to act together because that actually is a conversion of a sim
1406.52,1408.04, of a space sim.
1408.04,1410.0," It's a total conversion of free space, too."
1410.0,1411.0, Is that right?
1411.0,1412.0, That's exactly what it is.
1412.0,1415.88," A classic space sim from interplay, one of their last final"
1415.88,1416.88, great games.
1416.88,1417.88, Yeah.
1417.88,1419.44," I was going to say, actually, I didn't get into the flight sim"
1419.44,1422.52," as nearly as much as some, but I space sims were was that for me."
1422.52,1425.48," Like private tier, wing commander."
1425.48,1426.68, They're playing all those.
1426.68,1427.88, That was totally my thing.
1427.88,1428.88, X wing.
1428.88,1429.76, Show for sure.
1429.76,1429.88, Yeah.
1429.88,1431.68, All the X wing tie fighters stuff.
1431.68,1433.84," But anyway, so the battle start to act to a game."
1433.84,1435.36, It's actually called Beyond the Red Line.
1435.36,1439.84, And you can find it at www.gamehifinwardin.com.
1439.84,1440.84, slash BSG.
1440.84,1445.4399999999998," And it's basically, it's a totally free game since a free space"
1445.4399999999998,1446.6, two is now open source.
1446.6,1449.08, So that's a double for free as well.
1449.08,1451.08, And that is a bargain.
1451.08,1453.04," And that free free space, too."
1453.04,1454.48, I would go get that if I were you.
1454.48,1455.48, Totally.
1455.48,1458.08, And so basically it's a total conversion.
1458.08,1461.36," And it's still in the demo phase, but you can download it right now"
1461.36,1465.76, in place of multiplayer at a demo of the campaign that's going to go forward.
1465.76,1467.6, So can you play as both human and silent?
1467.6,1469.48, Or what's it to be over?
1470.1200000000001,1474.24," You know, as far as I know, you can do human for now."
1474.24,1475.24, Okay.
1475.24,1478.24," I can silence, but there's probably more to it in multiplayer."
1478.24,1480.4, Like obviously like silent versus human in multiplayer.
1480.4,1482.24," You still, none of us have played this yet."
1482.24,1483.24," Well, it happened."
1483.24,1486.1200000000001, I was actually downloading it last night in my computer crash.
1486.1200000000001,1487.52, So I have to reload it.
1487.52,1488.52, Awesome.
1488.52,1489.52," So no, right?"
1489.52,1490.52, So that'd be a big fat note.
1490.52,1492.24, I was wondering how different it is than free space.
1492.24,1493.24, Is it just new skins?
1493.24,1494.72," You know, I mean, is it like?"
1494.72,1497.1200000000001," Well, the thing is, free space was like an arcade shooter."
1497.1200000000001,1499.3600000000001," And apparently, you know, it wasn't like, you know, true."
1499.36,1501.12, It was like I was just in my own physics and all that stuff.
1501.12,1504.12, And just obviously it was based with zero gravity.
1504.12,1505.08, But they try.
1505.08,1508.7199999999998, They are apparently adding some more stuff to it.
1508.7199999999998,1511.4399999999998," I don't know much more than that right now, but it's, you know,"
1511.4399999999998,1512.6399999999999, hella prices right.
1512.6399999999999,1513.6399999999999, It's my free way.
1513.6399999999999,1514.6399999999999, Take a week.
1514.6399999999999,1515.6399999999999, So let me see it.
1515.6399999999999,1518.08, I'm just kind of reading off the about from the upside.
1518.08,1519.08, Sure.
1519.08,1520.08," Sure, go ahead."
1520.08,1521.08, They see.
1521.08,1522.08, So multiplayer features.
1522.08,1523.08," A death match, team death match."
1523.08,1524.08, King of the Hill.
1524.08,1525.08, Gauntlet missions.
1525.08,1526.7199999999998, And possibly co-op.
1526.72,1534.1200000000001," right now you can fly a Viper Mark 2, Viper Mark 7 and the Raptor. So anyone who's"
1534.1200000000001,1537.42," watched the current show not the 1970s one, that's the experience you're"
1537.42,1540.04, going. So I could be Starbuck. You could be Starbuck. You could be
1540.04,1543.16, character already be Starbuck. I might be. Can't be Scar though. I'd like to
1543.16,1550.3600000000001, dress like her. What? You can't be Scar. No. Okay. So maybe we'll actually try to
1550.3600000000001,1553.56, check that out and report back whether it's worth it or not. But definitely the
1553.56,1557.6," free space too is though. Yeah. Well, I'll I'll I'll know by tonight. I'm"
1557.6,1560.96, downloading it again. And you're right. Can't go wrong for free. You can.
1560.96,1565.2, I have a disagree. Because there's so many who can crash.
1565.2,1570.24," Head and leave down those mods. No, but I mean, it depends on how much hard"
1570.24,1571.9199999999998," drive you space for you. You'll get a mod. And you're like, okay, that"
1571.9199999999998,1575.24, definitely was not even worth bothering. It wasn't worth the effort to
1575.24,1579.76, download. I suppose. I so just didn't you download like doom maps by the
1580.08,1584.4," 1000s. I used to do that. The wads. That's yeah. Oh, God, that would be bad."
1584.4,1587.6, If you were in like a slow loading map and you get a map in the first thing
1587.6,1590.64," getting an in addition to hearing like, you know, crossing the clown sound by"
1590.64,1593.96, it's just it's just it's nothing but you look on the ground. There's like a
1593.96,1597.72, billion weapons every kind of weapon. Yeah. Yeah. You need some ammunition
1597.72,1601.2, for it. They do that in half life too. And they got the pulse rifle all
1601.2,1605.08," far, which we call the shrimp cannon. And it's just like it's instant death and"
1605.08,1608.32," ricochets around. As soon as you get in some, you're like, Oh, maybe this will be"
1608.32,1611.52, good. And that I'm thinking about how when they when that have like two
1611.52,1614.6, death match first came out. They're only like two maps. So you'd be eager
1614.6,1619.4399999999998," for anything new hoping there'd just be some capable map maker was quick, but"
1619.4399999999998,1623.6799999999998," no, I'm talking about it. It's goddamn shrimp cannon. The giant boss."
1626.24,1629.9199999999998," Well, they can't all be gold. There's a lot of good maps now. I just take"
1629.9199999999998,1632.84, it just took time sometimes you need the intentionally bad map that are
1632.84,1636.28," really appreciate how good. How good some mapping. But I have. Sorry, you need a"
1636.28,1640.32," baseline. Right. I mean, I remember once I intentionally designed a map where"
1640.32,1643.8799999999999," there was like, there's big pit in the middle and you drop in it. Like all"
1643.8799999999999,1646.48," the weapons and everything you want is there, which can't get back out of the"
1646.48,1650.44, hole. So you made that intentionally. I made that intentionally. I wasn't just
1650.44,1654.52, okay. I have a whole fixation with bad movies and just bad designs camp
1654.52,1659.08," back design. Exactly that. Yeah. You know, that's my story. I'm sticking to"
1659.08,1666.9199999999998," what's next. Mr. Malay, have you been playing anything besides"
1666.9199999999998,1670.84, while? Not really. Now really? No. Get here all about my walk talk and
1670.84,1673.28, legendary thread podcast. What up.com.
1673.28,1679.48, But nice play a little bit of bookworm adventures bookworm adventure.
1679.48,1682.6799999999998," Yeah. I've never done play a whole lot when it came out. So I finally said, okay,"
1682.6799999999998,1685.76, I enjoyed Peggle. Let me try this bookworm a little more. Gotta think a little more
1685.84,1689.04," with bookworm. Yeah. Quite at the Peggle level of, you know,"
1689.04,1692.32," draw coming out of your mouth while you're playing. Peggle is not, is not that"
1692.32,1696.8," way though. Like I've, that's something like a daily rotation still. Still doing. Yeah."
1696.8,1700.44," Yeah. But the more you play Peggle, the more you get into the strategy. In the"
1700.44,1705.04," more you, I mean, clearly we're not talking, you know, it's not playing pool or"
1705.04,1708.36," something. But you do see, you get to the point like I guarantee you play it"
1708.36,1712.08," for like a couple days. And instead of just saying, oh, this is probably good"
1712.08,1714.92, because I can imagine it's going to just generally be in this area and there are
1714.92,1718.4, a lot of pegs over here. Right. Like you at least visualize pretty clearly
1718.4,1722.64, past the first ricochet into the second one. Right. You start and then once you
1722.64,1727.4," once you do that, once you're third eye sees it coming and it does come"
1727.4,1731.48," that way, it's pretty, it's pretty gratified. Yep. It's not like learning to"
1731.48,1735.48, fly or like or like getting spelling. Yeah. I've only had you on it. You had one of
1735.48,1739.46," those headsets for. Yeah. For all, what's your big version of all?"
1739.46,1744.4," Peggle's your bookworm word. I don't know. I was, I found myself"
1744.4,1748.2," being annoyed by, I think I had like a really awesome word and I started spelling"
1748.2,1752.16, it and then nothing happened. Like it didn't know. It didn't
1752.16,1754.76, register. Sometimes it dictionary sucks on that thing. Yeah. I was very annoyed.
1754.76,1758.0," I was like, I have predictions. This is going to get this triptus. Wow. And then"
1758.0,1760.8000000000002," I got to send an angry letter. I don't know if it was, I don't know if it was"
1760.8000000000002,1763.92," was predictions. But it was some, some big word that I was pretty sure was both"
1763.92,1768.6000000000001," things. Maybe it wasn't. I was just like, hey, you should be able to update"
1768.6000000000001,1773.0800000000002, that dictionary too. Yeah. Yeah. That's cool. I like it. It's fun. It's fun getting
1773.08,1778.6399999999999, the Golden Flies and using it somehow. A word game. I still play it. I can do
1778.6399999999999,1783.8799999999999," it. It is. That's about it, though. All right. Should we take a break and"
1783.8799999999999,1789.4399999999998, come back with more news and stories and wackiness? I got a story until any
1789.4399999999998,1793.96, time to you. You got it. We'll come back with Sean's arcade story. We're right
1793.96,1803.76," there. Oh, hello. I didn't see there. But as long as you're here, let me tell"
1803.76,1808.28," you about EGM Live, the weekly podcast from the editors of Electronic Giving Monthly, along"
1808.28,1814.76," with the wonderful sounds of EGM Live comes action pack, a special guest, late-breaking"
1814.76,1819.2," news, fanboy baiting commentary behind the scenes tales of Office Tom Follery and"
1819.2,1824.44, should be a contest with fan tabulous prizes downloaded now at eGMlive.oneup.com or
1824.44,1828.72," subscribe to it through iTunes. You should invite as part of the one up radio network, tape"
1828.72,1832.64, and shit Davis offices and San Francisco. It is not actually live and contest prizes are
1832.64,1841.44," not guaranteed to be a fan tabulous. Hi, we're back. Maybe I may be Ryan can do his show again."
1841.44,1847.6200000000001," Why do that again? Ryan, what are we up to? Oh, wait, you're here. Oh, I know. You're"
1847.6999999999998,1853.5," back in. Bring his back in, Ryan. Yes, I'm still here. Okay, we're glad. You know,"
1853.5,1858.1799999999998," you get this for the not talking, but I think that I think they're wrong. I think those"
1858.1799999999998,1862.9399999999998, people who say like Ryan should visit kick Ryan off. He never says anything. They don't
1862.9399999999998,1866.9799999999998," know what it's like to be sitting here. You know, Ryan's kind of like the Greek carouser."
1866.9799999999998,1872.6599999999999," He sits here. He nods while we're talking. So smile. Right, we're saying something funny"
1872.6599999999999,1877.02, to someone's going to hate on everything. We're kind of like podcasts for Ryan here.
1877.02,1881.1," He sort of like, I'm not. I had today. I was reading people saying he talked over everyone."
1881.1,1888.94, Who you for me. You shot out Sean. There's a certain balance to all things. I like to say
1888.94,1895.26, one guy enough. You're pretty good. I'm looking dude. I say that in the most disparaging way.
1898.06,1903.66," So compared me to what would you say Bob Sagitt and Robin Williams, but without the name."
1903.74,1911.18, Ouch. Robin Williams. I told him maybe we could see through this misunderstanding if he
1911.18,1916.94," came in a visit meeting my never, it never landed with Martin Bashir. Damn."
