start,end,text
3083.34,3088.06," MMOs are distinct kind of like gameplay. Yeah. I mean, like if I want to get into a shooter with"
3088.06,3094.46," somebody or like a single player campaign of whatever shooters that's up next, be able to do that."
3094.46,3098.86," Yeah, you're right. It would be great if there was more of that on the PC and I don't get it either."
3098.86,3103.02, Why? I don't know. There's one get. One thing I haven't really gotten into on console
3103.1,3107.82," yet is co-op online. I will still do co-op like same room with the other person,"
3107.82,3111.34, which is why I was kind of disappointing when we were talking about crackdown a couple weeks ago and
3111.34,3116.14," someone said like, yeah, that's co-op, but not split screen. That was so great for me, is it?"
3116.14,3119.98," Had to co-op. Yeah. But I still want the like, doesn't split screen co-op,"
3119.98,3126.38," drive you nuts though? Yeah, really. I mean, it doesn't. Like I mean, I'm going back to golden. Yeah."
3126.38,3130.94," Well, like back in the college days, like we just used to sit around the TV, like golden"
3131.02,3134.46, I've been like for days. I know. I just played golden. I and I'd be so tempted to cheat all the time
3134.46,3137.82," because like they would be like these little windows. I'm like, check it out at the top right now."
3137.82,3142.46," Oh, that was part of the game. I know. It just tempted to cheat means you did cheat. Yeah, yeah. I did cheat."
3142.46,3147.34," That was very much part of it. Like knowing where the other people were, made it a very different game."
3148.06,3152.38," But yeah, I co-op great, but split screen co-op don't go away."
3154.14,3159.5," I'm like the opposite. Really? Is it's like, in fact, I think, you know, when my friends do come over,"
3160.46,3166.7, what happens is we won't play video games together because there would be we'd have more fun playing the games we want to play at home together.
3167.42,3172.94," You know, online. I still see it. I still get a lot of value out of the everyone's in the same room scenario."
3172.94,3178.14," And depends. The game's changed. Well, on a playing slow caliber, you know, right over a firefighter or something."
3178.14,3186.14, Right. I think you're not playing these points as ever are the ones I had at CGW with a group of people all in the same run playing a shooter.
3186.7799999999997,3192.46, The the same land game. It was it was mostly half-life one and different maps team portraits.
3195.3399999999997,3200.8599999999997, I think we would have had the same we would have had a lot of fun if we were all at our separate homes playing these maps.
3200.8599999999997,3204.8599999999997, But the fact that we are all in the same room yelling at each other and giving each other shit.
3204.8599999999997,3209.2599999999998, Yeah. Was at least half of what made it. I totally agree with that. I still would bring that back.
3209.2599999999998,3212.3799999999997, We need to like designate like blow the shit out of each other. It's carrying.
3212.46,3217.58," But it's interesting. I mean, we can have that experience because we all work together in a magazine, right about games."
3217.58,3223.98," Everyone has to go to a land party. Right. And you know, those are more popular in other countries."
3223.98,3228.46, Yeah. Have that kind of thing. Right. It's interesting that it hasn't translated here as well.
3228.46,3233.1800000000003," Because you wouldn't think that that would be so much fun. I think we do. I mean, we still do have."
3233.1800000000003,3237.98, We have a few cyber cafes. Yeah. Depending on where you go places where people go.
3237.98,3239.9, Right. So that's a niche.
3239.9,3243.82, But it's the same reason why our kids don't do aren't as big here. They aren't the parts of the world.
3243.82,3248.86," Because I mean, everyone's got a good computer at home or everyone's got a console or a nice home theater TV."
3248.86,3251.42, They want to sit in front of. We're all just at our own homes now.
3252.46,3257.1800000000003," I would totally like the social part of it. But it's just like, yeah, where, when and where. You know,"
3257.9,3263.02," I mean, I don't want to go to me on. I don't want to go play counter strike. One point six over at the cyber cafe."
3263.02,3266.2200000000003," You're right. No, I don't. I don't either. Right. So even though we don't like it."
3266.22,3269.4199999999996, I'm going to bust with actually. I'm going to go to a cyber cafe.
3269.4199999999996,3272.14, Yeah. I want to play with people I know like in my house.
3272.14,3277.8999999999996, Yeah. I think those like like those are my greatest memories playing multiplayer games.
3277.8999999999996,3280.4599999999996, It's like the college days when we put with seven other people.
3281.1,3285.5, And would set up a elaborate land system system play and rise to the triad or whatever.
3285.5,3289.66, Right. Rise to the triad. I remember that one. I was a fun land game.
3289.66,3291.66, I wish the Wii is bringing it back though.
3292.22,3294.3799999999997, Yep. That's the whole basis of the game.
3294.94,3297.6600000000003, Yeah. The Wii is the war people win the same room.
3297.6600000000003,3301.6600000000003, But you're going to say rise to try. I have this coming to a. That would be. Wow.
3302.46,3305.98, Yeah. Rise to the triad for the Wii. I don't know what that means. I have no idea. I just don't
3305.98,3310.94, I need to remind. I'm all for the for the co-op online. I know a lot more companies do it.
3310.94,3315.7400000000002," Yeah, I like it. I can crack down. I actually, I wouldn't have touched it. Had it not been for that"
3316.2200000000003,3320.86," option in that game. Really. I mean, that's what a track you can do. I was like the same reason for the"
3320.94,3325.02, very same reasons we would play back then together. It's like a cutscene comes on and we're both
3325.02,3329.82, making fun of it or like any I mean just the social experience of like commenting the whole time.
3329.82,3335.42," The peanut gallery. You know, I mean don't character lines and we're talking to make it fun of those"
3335.42,3341.58, or peat knows or like crack down. You go into you go from the equivalent of Mexico land to Russia land to
3341.58,3346.46," you know, China land it just making fun of like how like stereotypical and just the whole thing is."
3346.46,3350.3, I mean it's just it's so much more fun that way. I've been sitting there in my own and living room.
3350.38,3354.6200000000003," Like, you know, you can go use the computer hunt. I'm just going to be out here and then in the"
3354.6200000000003,3359.5800000000004," living room all you hear is like, hey, don't do that on my countryman. I mean, like whatever,"
3360.6200000000003,3367.42," you know, I mean that's cracked out the moment you started. It's like in your face there. Yeah."
3369.42,3377.6600000000003," All right, any of you? Well, any more? Did you ever have the phase where there's also back in college"
3377.66,3384.22," for like super Nintendo era, maybe yeah, I was playing Final Fantasy 3, which is Final Fantasy 6 and Japan."
3384.22,3391.02, Whatever. I would be playing it and everyone like maybe like eight people would want me to
3391.66,3395.8999999999996," want me to play it. They would like say, hey, can you play Final Fantasy 3 and I be like, oh, I don't want"
3395.8999999999996,3399.3399999999997," to play Final Fantasy 3, but all right. And then there would be like a bunch of people watching this"
3399.3399999999997,3404.7799999999997, freaking game. Just watching you play. Yeah. And they would do that with like graphic adventures. I think like the
3404.86,3409.02, dig we had a big audience that like I couldn't play unless certain people were there to watch.
3409.02,3415.1000000000004," Yeah, they all ran where they all stoned half of them. Yeah, that's what they said. That"
3415.1000000000004,3419.34," there were, yeah, totally. There was like super Metroid was that way. There's much people that"
3419.34,3424.2200000000003," like didn't want to play, but they all wanted to watch, you know, that that hasn't happened since then."
3424.2200000000003,3428.3," Very distinct year, maybe, or that was like the case. I'm just going to think what I've got"
3428.38,3432.7000000000003," built. You just put a lot of bomber man. I remember when I was in college, I think it was all about"
3432.7000000000003,3438.94," NHL. We used to have like huge huge tournaments. Never got into those. Yeah. Dude, you live,"
3438.94,3443.26, you lived like near Buffalo. Sega Genesis? It's like all about that's all about the snow and ice.
3443.6600000000003,3449.1800000000003," Yeah. That's why I'm not in Buffalo. The sameers man, come on. It was all Missile Command and Pinball"
3449.1800000000003,3455.02," for me and my generation down at the Yola and Archie. Yeah, I'm not the old Peter Rea. Yep."
3455.1,3461.42, Down at Silverball Archie and Berkeley. Yeah. I was a wee one getting my my fingers pinched in that
3461.42,3468.06, track ball. Remember it? It would do that. Oh yeah. I was a good guy. I was a good guy.
3468.06,3471.34," It's a show in the shirt on your phone. On your little command, that shit hurts. Yeah, that leaves"
3471.34,3475.42," like a scar. I think I still have one. Yeah, that was a tempest. The thing yet, the spin and"
3475.42,3480.22," tempest. Yeah, my hand used to get sore for the next time. I used to, yeah, that's why I got sore."
3480.22,3483.58, I used to play the shirt at that local piece of area and like I used to play the shirt at a
3483.58,3487.58," tempest at the local piece area. I have like that, but in crested layer like pizza grease."
3487.58,3491.8199999999997," Yeah, just sludge just around the dial and I'm like, tempest is one of those games. It's never"
3491.8199999999997,3497.74," converted well to any of the other, you know, every time one of these compilation packs come out"
3497.74,3502.2999999999997, for whatever console machine they got tempest on there. I'm not going to play tempest with a game pad.
3502.2999999999997,3506.54, Sorry. I need to totally knob singing. That's true. I remember the what was the one for the
3506.54,3513.74, Tart Jaguar. The version tempest. The tempest. The tempest. Okay. Yeah. That was a great game.
3513.74,3519.18," Tempest. Oh, yeah. That was returning to retro now. I was gaming. It was great. You better watch."
3519.18,3523.5, That was perfect. That was just like colored lines like spinning around. This is all
3523.5,3527.66, scarier. All the fancy 3D graphics. You should have done it all week. We've been getting emails
3528.22,3535.34, internally for they want us to go and tape some video segments for like what is it a show about game tap?
3536.3,3539.34," Yeah. And I was making fun of it. I was like, I don't want to do that because"
3540.1400000000003,3544.78," that's the equivalent of us being like, you know, in the time life, uh, music compilation commercial."
3544.78,3548.2200000000003," I mean, they get like, you could forget this band. Oh, and then they play a little field."
3548.2200000000003,3551.34, We united in.
3551.9,3556.46," And then they show some couple walking out of the beach. Oh, I remember when we play a main girl."
3556.46,3560.54," Like, yeah. So they basically want to turn into those people for video games."
3560.54,3563.02," I'm going to do on that right now. We already. Yes. Well, that's what the point is."
3563.02,3568.06, Yeah. We are. We're doing it. We stole the video. All my mind. Tempest. Final fantasy 3.
3568.06,3572.86," All here. I mean, the hot. You get these games, but uh, maybe this is for you, Jeff and your"
3572.86,3578.06," new, we found, uh, pitchman. Yeah. But like, I mean, this is the first time where you get all these"
3578.06,3583.66," games together in one place. I mean, before you use to track these down of an individual in eBay,"
3583.66,3588.94, so you're living it up with old game hardware systems. But now you're playing them all all together.
3589.58,3595.98, You're right. We should advertise for this. Why don't anywhere else? Game tap.
3596.54,3602.54," Okay. I got seven max to date. Wow. Actually, I hate to say, but there is one thing I'm appreciating"
3602.54,3609.26, because I could not get I. 76 to run in Windows lately. A classic. And I and it runs there.
3610.3,3614.14, So sorry. I hate to hate to hate to. Interesting. Classic game that I. 76.
3614.46,3621.3399999999997," Okay. What else we got? And now, hello. Yeah. Energy low here today."
3621.3399999999997,3624.3799999999997, That about GFW podcast. Five minutes.
3625.2599999999998,3629.66," Give me a minute. We can't do another five. We can't lie. Oh, minutes."
3629.66,3633.74," We're going to talk about it. We have a couple new. Yeah, we talk about the vanguard thing very"
3633.74,3639.58, quickly. I kind of hate the batch vanguard at this point in time. Little bit. A little bit like
3639.58,3644.14, kicking the retarded kid. Sorry. Not retarded. What do you mean we thought it?
3644.94,3654.22, Intimately able differently. Abel. It's slow. Slow learner. Flash. Only because we we gave a kind of
3654.22,3660.14," a harsh review. Which is a little sad. I was rooting for this game. You know, we had a"
3660.14,3665.66, depth Butler here in the studio quite a while ago. And we had a great conversation with him about
3665.74,3673.5," the game and the last review. Not so good. I will say however, MMOs. They can always, you know,"
3674.22,3679.3399999999997, this is this is the first time this game will evolve. We will keep looking at it. It could get better.
3680.06,3685.02," That said, they just announced a big change. That's not implemented yet, correct? It's a"
3685.02,3691.2599999999998," synonypid. It's a test. Yeah. Yeah. The fact they're even testing it is telling. Go ahead, Joe."
3691.5,3698.94," Right. As posted on vanguard's website, uh, uh, current changes are you will no longer leave a"
3698.94,3705.34," corpse behind when you die. Instead, you will drop an essence. You will no longer leave items."
3705.34,3710.6200000000003, So I'm not on your essence. As since this were a turn a large amount of experience upon retrieval.
3711.7400000000002,3719.1800000000003," So, um, in the amount of experience lost when you die has been decreased. Um, so, and that is all"
3719.2599999999998,3724.8599999999997, couched in the explanation that these changes are part of our ongoing plan to improve your experience
3724.8599999999997,3733.1, while playing vanguard. So the point is no more corpse runs or no more corpse runs. And the
3733.1,3738.2999999999997," symbolically big thing about that is of course, as the corpse runs were one of the big. I wouldn't say"
3738.2999999999997,3743.4199999999996," selling points. That's taking too far, but that was one of the kind of the big philosophical thing. Right."
3743.4199999999996,3748.8599999999997, It was kind of a statement by having a corpse run in an MMO at this point in time after
3748.94,3754.78, the release of wow that was saying we want our game to be more hardcore. Our game is not going to be
3754.78,3759.58," as easy as wow. If you're going to die, you're going to have to pay for it. And we think that"
3759.58,3765.42," gamers are going to like that because wow is too easy. If you're, if you think wow's too easy,"
3765.42,3769.98," if you're sick of wow, have we got the game for you? Well, vanguard's only been out now for"
3770.78,3777.34, a couple months. And they're now already backing off or they appear as if they are going to back off
3777.34,3783.42, with the with this announcement of one of those big points. So of course some message boards are
3783.42,3788.86, all aligned with this change and what it all means. And we're bringing up here for the same reason
3788.86,3798.6200000000003, because it does seem to point to that they are perhaps backing off that idea that maybe they're
3798.6200000000003,3806.46," saying, eh, okay, well, what we said about it being people wanting a harder game? Well, maybe they"
3806.54,3811.5," don't want it that quite that hard. And so it seems kind of like a big retreat to me,"
3812.94,3817.18," especially the early in the game to not stand by it. Well, do you think that it was a big"
3817.18,3820.78," feature in the first place? I mean, it's like saying, hey, you pay us 20 bucks a month. We'll kick you"
3820.78,3824.86," in the nuts. I'm not going to put a lot of people. I mean, yeah, that's well, it's for the response"
3824.86,3828.78," you're right. I'm from other people. Exactly. And that's what they're saying. Okay, well, I guess we're"
3828.78,3835.58," going to stop kicking you in the nuts. But which you're right, I mean, for a lot of us, including me,"
3835.66,3839.5," that's like a good thing. Oh, good. You're going to stop kicking me in the nuts. Maybe I'll play"
3839.5,3843.58," me out. Actually, I don't really like being kicked in the nuts. Right. It happened to me once in"
3843.58,3850.22, seventh grade and it hurt. So so maybe now I'll try your game. But it does. But then that brings up
3850.22,3854.46," the, you know, the issue is like, okay, well, are they just being more wow like now?"
3856.7799999999997,3861.34, Yeah. Yeah. And is there is an end does that then mean that there is no alternative to being
3861.34,3867.82," wow like can can you have an MMO that's harder? I have, then succeed. I think the financial"
3867.82,3872.54," realities just kind of the bottom line there is like, okay, hardcore is wonderful for the hard"
3872.54,3876.3," group people, but they're in enough of them. And it looks like most people aren't hard for enough"
3876.3,3880.1400000000003," to want to go to get their corpse every time. So, you're going to point out, even online."
3880.86,3885.9," Even online is pretty hard core, right? And how are they? Are they still growing, like, you know,"
3886.2200000000003,3891.82," they claim that they are. They're up over 160,000. All things that you're in."
3891.82,3896.7000000000003," Your causes on this podcast. Well, they also have, they're also an alternative to the fantasy"
3896.7000000000003,3899.9, and the whole thing. Because they're the gazillion of those things. So you also get the bonus of
3899.9,3904.62," that being spaceship MMO. Right. But there's a couple like, you know, alternate MMOs and not many"
3904.62,3909.26," of them have been a success like auto assault. It's a great example of what was pretty, it was pretty"
3909.26,3913.6600000000003," good. There's some, the fundamental flaws with it. Well, I think that's the most saline issue here"
3913.74,3919.74," is that, you know, if you're going to have a fantasy MMO that's the words and elves and whatever,"
3920.8599999999997,3925.58," you know, what are you going to do to differentiate yourself from, wow, well, in Vanguard's case,"
3925.58,3930.46, it's starting to make it harder. But now they're backing off the hardness part. So what is there
3930.46,3936.7," that? Harder and high fantasy MMOs are like, she'll act action figures. And I'm being"
3936.7799999999997,3941.58," more talkative. Certainly there's plenty of, plenty of Vanguard fans probably will come on and say,"
3941.58,3946.9399999999996," it's not just that there's a lot of good new features that wow, never had. And I get that, I do."
3946.9399999999996,3953.5," So you don't have to send many, no. But I do think that that it is, this is a significant change."
3954.22,3960.2999999999997, And I would like to see people come on our forum and defend this game to us.
3961.8999999999996,3965.18," They have a lot of good ideas. They do have, this game has a lot of good ideas."
3965.2599999999998,3969.66, And that's really on in it. That's the thing with it. It's always been like great idea.
3969.66,3973.98," Let's see it happen. And then, so that's the waiting."
3974.94,3978.46," I'm not giving up on it yet. No. Despite it. I'm a boes can change. That's one of the,"
3979.3399999999997,3983.1," if anything, that's what they do really well. Like Star Wars Galaxy, right?"
3983.1,3988.7799999999997," They complete. They completed that game. They said, okay, you're right. We didn't want to admit it"
3988.7799999999997,3992.7," at first. What do you mean, you're right? Our game sucks. We're going to take it all away."
3992.7,3996.62, And we're going to re-release it. And now here it is. And it sucks worse.
3996.62,4000.7," And you know, okay, maybe that didn't work. Well, they first showed that to us. We thought it was going to be good."
4000.7,4005.3399999999997," We did. Well, what, Galaxy? The second, the new Galaxy. Well, they rolled that out,"
4005.3399999999997,4008.7, like hastily without proper balance. Again. Yeah.
4008.7,4012.14," Yeah. Well, that's one of the greatest issues that we did in the year."
4012.14,4015.98," Mamo is whoops, too fast. Well, and of course, that was part of Vanguard's problem."
4015.98,4019.1, But are there any of the Mamo's that kind of made that total turnaround that had a
4019.1,4023.74," crap release. And then kind of rallied and came up with a good game afterwards. I mean,"
4023.74,4027.9," I think, and I could online my closet. That was the one that came to my mind. It had a very"
4027.9,4032.7799999999997," crap release. And I felt like it got better over time. And I was in, yeah, I gave up on it. Like,"
4032.7799999999997,4037.9," because I started playing that one right at the beginning. No, no, no, no. Never went back."
4037.9,4044.46," From what I've heard, again, you've online when it first came out was not very good in a lot of ways."
4045.42,4049.02," And certainly in the time life played, it's improved."
4049.02,4055.9," I think, you know, releasing a game. And this is so not even not even anything beyond"
4055.9,4060.78, the most dull sort of point. So I really shouldn't have to make it. But releasing a game when it's
4060.78,4067.9," not ready is such an incredibly short, short, cited dumb move. I mean, how do you ever get past"
4067.9,4074.3," that reputation that your game is not done and that it, you know, that it's not working?"
4074.3,4078.94," I mean, how would you like to work on a game? You know, if that's you for all those years."
4078.94,4084.54, And then instead of waiting that extra bit of time to make sure it's right to put it out and
4084.54,4088.78," have all have anybody says after all the work you did, boy, they really should have waited till that"
4088.78,4094.78," thing was done. And what a fucking waste. Right. But I guess what, I mean, I don't, I don't have the"
4094.86,4097.820000000001," insights here. I'm just, I want to hear that fly on the wall as they kind of, because I know that"
4097.820000000001,4102.780000000001," like Vanguard's been around for a long time and it's just a couple hands. So I guess what I'm wondering is,"
4102.780000000001,4106.62," you know, at what point did, you know, they, when was the first time we saw this game three,"
4106.62,4112.06, four years ago? That about right? That's about right. Yeah. Yeah.
4112.06,4115.820000000001," Yeah, years ago. Right. And I'm just like, in all that time, you wonder like, you know, at what"
4115.820000000001,4119.58," point that, you know, like when they finally, when Sony finally said, uh, screw it, you're shipping this"
4119.58,4123.900000000001," game, what did schedule say, oh, no, we need another two years. Well, I'm sure they probably did."
4124.86,4129.259999999999, I can't imagine. I wasn't there. This is complete speculating. Right. But I can't imagine anybody
4129.259999999999,4133.099999999999," was going like, yeah, let's put it out there. Well, Brad McQuay didn't even said like when it came"
4133.099999999999,4136.94," out, he's like, bringing just ran on the funding and we find out to reality is that we have to"
4136.94,4142.3," have to release this thing now. Right. He more said more or less said like, S. I mean, it's already,"
4142.3,4146.7, we're sorry. Yeah. I think he more or less did. And I'm sure they've been frantic to improve this
4146.7,4151.58," thing since. Right. Since large, but maybe this is part of it. Maybe they would have reached this"
4151.58,4156.22," conclusion before releasing it. Had they beta tested longer, had they been given the opportunity"
4156.22,4163.42," to beta test on this, right? Don't know. We don't know. Well, so we end on that high note,"
4164.22,4169.66," that we just don't know shit. Yeah. Great. How are you doing over there, Sean? The Sean's"
4169.66,4175.58, time to sounds like rockin' it was on music. The pop in his head. He's this in a red dog and
4175.58,4181.58," he's one of the what is listening to. Yeah. I feel you though. Yeah, dog. Okay. I think we're done."
4182.62,4189.26, Thanks for listening to the Ryan show all by GFW radio. Whatever the hell we talked about this week.
4190.46,4201.0199999999995," We'll be back next week with much, much more stuff. Wow. Okay. Well, we're gone. So I so"
4201.02,4207.5, energized. This has been a presentation of the One Up Radio Network for more shows. Visit
4207.5,4209.820000000001, podcast.oneup.com.
