start,end,text
0.0,7.24, What looks like daycare and operates like a payday loan office?
7.24,11.24, Who gets stupider with stickers than Grand Pappy and his label gun?
11.24,16.4, I'll paint you a picture in case it ain't clear.
16.4,21.64, At the Kia's could kid place the same damn game he's played since dad dropped him off.
21.64,25.76, He looks like he's got an old wee wee in his stomping feet flattened a lunchbox he left
25.76,26.76, on the floor.
27.28,32.6, At least eat the rainbow sprinkles off the rug rat shaped baloney burrito you little bastard.
32.6,38.2," They're starving in China, but my healer had better be level hell I looted about Thursday."
38.2,43.16, Center store I see a bargain bin sad is a long sale and shitty are besides.
43.16,46.08, If these untouchables were toys you'd have a domino.
46.08,49.44, The head of a doll in a quote unquote table for her.
49.44,54.72, Normally it's the plastic piece from a takeout pizza.
54.72,61.4, I spit sunflower seeds on the lot park a bugger on bugger man pre order bonuses your bitches and
61.4,61.72, then I hear it.
61.72,64.72, Hey.
64.72,67.72," Yeah, no, no."
67.72,72.72, Let me show you that slow mo since you might have missed it.
72.72,83.52, It's a conversation at the counter I think.
83.52,85.52, I'm out of time attacks to beat a boss.
85.52,89.52," Hey, leisure suit fucking larry I holler pipe the fuck down."
89.52,92.52, I'm trying to depreciate your inventory over here.
92.52,97.52, Quite the job since you've already trashed the joint scrounge and for elevates or some shit.
97.52,99.52, I mean even my house is more hygienic.
99.52,100.52, My house.
100.52,106.92, We're Taco Bell rappers team double duty as toilet paper and Christmas paper and acid paper and rolling
106.92,110.52, paper in it's a pre order paper Mario.
110.52,111.52," Oh, I get it."
111.52,116.52, Byngames is some serious baby adopted organ transplant.
116.52,120.52, Citizenship appliance space shuttle trip taken business.
120.52,125.52, Except in your case the Kmart across the street is blue light and baby's heart's speases
125.52,130.51999999999998, and a spaceship for 25 cents a fucking flight and no I don't need refund insurance for a disc that's
130.51999999999998,136.51999999999998, dangled from a moron's rear view mirror besides what a one more booger matter.
137.52,140.52, And that ain't all he wonders whether I've got you's games on me.
140.52,143.52, I checked the tobacco band a lear I'm not wearing in laugh.
143.52,147.52, I make more scratching a single post about air pockets compadry.
147.52,152.52, I'll zap your bow so full of them shit's your flow to way yelling Nick Doug DJ in.
152.52,156.52, Because that a challenge in reckons right.
156.52,157.52, So we lower the lights.
157.52,161.52, Lock the doors hang up the out to lunch sign to turn on Halo.
161.52,165.52," Hey, I can't help any no computers in this hots yet other than the Texas instrument."
165.52,169.52, This is instrument he calls a cash register.
169.52,172.52, I'm checking out his half of the screen and he says so.
172.52,177.52, Of course I am asshole I can see the dab of big brown nose nugget that center on his junk.
177.52,181.52, There's your crosshair maybe now you just might hit me.
181.52,182.52, Kill.
182.52,183.52, Checkular.
183.52,186.52, Clearly yank couldn't want to try Tetris or some such.
186.52,191.52, So I show a whiskey nerd to said vodka nerd across the river Don by spilling out
191.52,196.52, Hello well and new bin blocks with one hand while browsing the old blackberry with the other.
196.52,201.52, What comes next I should have for seeing that somehow failed to carry Oki Revolution.
201.52,205.52, YouTube meme in the making sure fire sack trigger.
205.52,207.52, You win I yell.
207.52,213.52, Or rather your diaper fell off in the playland ball pen and I'm bouncing before the skittles become woppers.
213.52,216.52, And the whole rainbow starts tasting like a training toilet.
216.52,219.52, I'm hardly a hero that's true.
219.52,223.52, However I do grab the kid from the kiosk and direct him to the door.
223.52,227.52, Go on get you saw a mid-trad you know the score.
227.52,230.52, This mother brain is about to blow.
230.52,231.52, I'll be right behind you.
231.52,233.52, Grazing your regrets burrito.
236.52,240.52, Hello and welcome to GFW Radio.
240.52,244.52," This is the podcast for May 30th, 2007."
244.52,247.52, And I'm so happy you were all here and we're actually doing this because it was all
247.52,250.52, all uh it was all nebulous until about an hour ago.
250.52,253.52, We had no idea if we were going to do it at all this week.
253.52,254.52, Them holidays.
254.52,255.52, Fracking holidays.
255.52,260.52, We're screwed by the Monday thing you know it's kind of our like red headed step
260.52,268.52, child legacy at the S GFW that where the ones we have to podcast on Monday and Monday ends up being the day when like shit happens like holidays.
268.52,270.52, Not the holidays are shit.
270.52,273.52, No they're wonderful they're wonderful they're great but they're so real up our schedule.
273.52,275.52, So you're going to go over the fourth now in order to podcast.
275.52,280.52, But we're here we're here and we're all here and all of us is as follows.
280.52,282.52, Brian Scott Darren Gladstone.
282.52,291.52, John Maloy and I guess Sean Elliott decided that he was quitting the podcast so no more Sean Elliott.
291.52,294.52, Thank God so now strike.
294.52,300.52, Yeah but now finally everybody also get a chance to talk.
300.52,305.52, It's all you and Ryan you and Sean are going to be carrying the wait this time.
305.52,308.52, Wait Sean is here.
308.52,309.52, Oh you hear that.
309.52,310.52, I'm here but he just stuck in.
310.52,313.52, I'm here to listen to Ryan and Sean.
313.52,315.52, What is this some sort of act you're doing.
315.52,317.52, I'm just carrying on carry on.
317.52,321.52, This is a kind of soldier on people on live Andy Kaufman routine.
321.52,323.52, I'm not going to be surprised.
323.52,325.52, I know you're nervous.
326.52,328.52, You're going to make me nervous if you're just staring.
328.52,331.52, You're already a one guy doing that in the podcast.
331.52,332.52, Great.
332.52,335.52, Pretty soon everyone's just going to be Ryan on the podcast.
335.52,337.52, Did you have to be starcastle just watch it?
337.52,339.52, I'll be talking.
339.52,342.52, Let's get going because we already have people outside the door.
342.52,344.52, Time is a text here.
344.52,345.52, We need to hurry up.
345.52,346.52, Yeah it's a crazy day.
346.52,347.52, We got people looking in here.
347.52,351.52, Probably any minute the fucking retronauts are going to be down here trying to get in.
351.52,352.52, And those DLTV guys.
352.52,353.52, We have to fight them off.
353.52,354.52, Yeah we're not even going.
354.52,356.52, So Jack what have we got to talk about today?
356.52,358.52," Oh, much you're prompting me."
358.52,360.52, We got a lot to talk about.
360.52,361.52, We have a lot to talk about.
361.52,362.52, We have so much to talk about.
362.52,364.52, We could be here for hours.
364.52,365.52, And we will be.
365.52,367.52, Maybe we'll just hijack the studio.
367.52,368.52, Let's go everybody else.
368.52,370.52, We'll just keep vamping until we actually have a.
370.52,376.52, Among the things we have to talk about are two important big huge
376.52,381.52," Microsoft releases this week, which we bring up because we are the official games"
381.52,382.52, that those magazine.
382.52,386.52, And we're here to do our best to promote Microsoft product whenever we can.
386.52,391.52, So we're more excited than ever to announce that finally Halo 2 is coming out on the PC.
391.52,392.52, Yay.
392.52,393.52, Woo.
393.52,394.52, Oh wait.
394.52,395.52, Holy crap.
395.52,397.52, Oh crap.
397.52,398.52, That was kind of better.
398.52,399.52, I can't talk.
399.52,400.52, I've been playing.
400.52,404.52, This is not my now playing but I've been playing nothing but Halo 3 beta
404.52,407.52, while I've been waiting for this PC to arrive.
407.52,410.52, I've been talking about six months now.
410.52,411.52, Yeah.
411.52,412.52," Well, the mystery PC."
412.52,415.52, There's one thing we're saying on that to end all Halo 3 talk.
415.52,417.52," Yeah, I'll that river in the past."
417.52,422.52, I talked about how people found the river in one of the maps while hauling just to be just phenomenal and gorgeous.
422.52,423.52, Yeah.
423.52,426.52, I figured out it's a conveyor belt with KY jelly.
426.52,427.52, You.
427.52,430.52, I have to figure that one out.
430.52,431.52, Look at it.
431.52,432.52, So it looks like too.
432.52,435.52, So my original analogy the game is pretty much holds up.
435.52,437.52, Now the game is clean for that.
437.52,438.52, This is all gel and out.
439.52,441.52, That'll make a good review quote.
441.52,443.52, I can bear about with KY jelly.
443.52,446.52, What is with these people who keep walking by and looking in here?
446.52,447.52, Go away.
447.52,448.52, We're podcasting.
448.52,449.52, We hate you.
449.52,451.52, Love Jeff.
451.52,453.52, Also shadow run.
453.52,454.52, About to come out any minute now.
454.52,457.52, Maybe we're actually a little more excited about that.
457.52,460.52," Yeah, I was being very cynical and so I casted about."
460.52,461.52," Halo, but shadow run."
461.52,462.52, Yeah.
462.52,463.52, I'm into.
463.52,465.52," If you times I have played it, I've had fun."
465.52,467.52," I mean, it's just a straight up multiplayer experience."
467.52,470.52," There's not, but there isn't anything else to it besides that."
470.52,471.52, At least it's a new game.
471.52,472.52, But that's yes.
472.52,473.52, I don't know.
473.52,474.52," I mean, like, I feel like that's it."
474.52,475.52," Like, I don't know."
475.52,477.52, I just want people to say that.
477.52,478.52, And I've said it over and over again.
478.52,480.52, Is that a straight up multiplayer experience.
480.52,481.52, It's no knock against any game.
481.52,482.52, Right.
482.52,484.52," To me, like, you know, here it comes again."
484.52,486.52, You hear me talk about it every week and you have for years.
486.52,487.52, Ball field too.
487.52,488.52, That's exactly.
488.52,490.52," I wouldn't even, you know, they put bots in it later on."
490.52,491.52, Who cares?
491.52,492.52, I didn't want to play that on a play multiplayer.
492.52,494.52," And that's like, I don't know."
494.52,495.52," I mean, that doesn't really say anything to me about it."
495.52,499.52," It's like the lack of total enthusiasm for the game is not well, for some people, I think,"
499.52,503.52, some ponder it's it's that there is no single player from the exact quality of the
503.52,504.52, multiplayer.
504.52,505.52, Right.
505.52,506.52, Right.
506.52,507.52, Right.
507.52,508.52, Right.
508.52,509.52, Right.
509.52,510.52, Right.
510.52,511.52, I wouldn't be excited about this.
511.52,513.52, If this was just straight up PC multiplayer shooter.
513.52,514.52, It's the cross platform stuff to me.
514.52,515.52, That's the industry.
515.52,516.52, Yeah.
516.52,519.52," But what, but there's really this is why we've been to the reason the reason you"
519.52,522.52," One is because there's something about the game itself, the multiplayer itself."
522.52,524.52, That's not that exciting to you for whatever reason that is.
524.52,526.52, I have to admit on the 360.
526.52,527.52, What it comes in.
527.52,529.52, If they if a big huge.
529.52,530.52, Yeah.
530.52,534.52," If a big huge box of shadow run shows up tomorrow, which by the way, it really should"
534.52,536.52, High Microsoft send us your games.
536.52,537.52, Hello Jeff.
537.52,538.52, Yeah.
538.52,539.52, I'm just going out there reading.
539.52,540.52, Wow.
540.52,541.52, This from the coming back.
541.52,542.52, His game is in stores tomorrow.
542.52,543.52, Yeah.
543.52,544.52, Yeah.
544.52,545.52, We don't get any special treatment.
545.52,546.52, We're still waiting.
546.52,547.52, Like early.
547.52,551.52, But if I get to if a box comes from me and there's a VISTA and a 360 version
551.52,552.52, in the middle.
552.52,553.52, Yeah.
553.52,556.52," Well, technically, kind of have to do you either have VISTA set up on a computer?"
556.52,557.52," No, I do not."
557.52,558.52," You say, way."
558.52,559.52," No, do I want to?"
559.52,560.52, Yeah.
560.52,563.52, So I'm the only person I ever made the only person on step that I actually has
563.52,564.52, VISTA.
564.52,567.52, That's because I'm getting new machine sent to me with VISTA on it at this point.
567.52,570.52," Hey, but don't let that influence your decision if you're listening out there."
570.52,572.52, Whether you should upgrade the VISTA or not.
572.52,575.52, That's because no one at the official magazine except for the tech guy actually has
575.52,577.52, Mr.
577.52,579.52, Don't don't do what we do.
579.52,580.52, Do what we say you should do.
580.52,582.52, Maybe we just hope you should upgrade the VISTA.
582.52,583.52, It can be a VISTA.
583.52,584.52, It can be a VISTA.
584.52,585.52, Maybe it will.
585.52,587.52, Maybe this will be a VISTA on the PC.
587.52,588.52, Maybe.
588.52,592.52," I know when I get a new PC, it will have VISTA on it and I will be happy."
592.52,593.52, I think.
593.52,596.52," I just don't want to upgrade my current machine because I don't want to break,"
596.52,600.52, which I said before and I got shit from tech guys on there.
600.52,602.52, I can't believe he said that.
602.52,604.52," Running a magazine, he doesn't even know how to."
604.52,607.52," You know, but that's just the way it is."
608.52,612.52, I don't have faith that things will go right.
612.52,614.52," Well, why would you install it?"
614.52,617.52," Or, Shadowrun and he was exactly."
617.52,618.52," Well, his idea good reason."
618.52,619.52, That's exactly.
619.52,621.52, So in crisis comes around then it's that.
621.52,622.52, Is it good reason?
622.52,623.52, Yeah.
623.52,624.52, Yeah.
624.52,626.52," Well, in the meantime, I guess also, I mean, like,"
626.52,630.52," you know, history kind of proves it like you kind of have to wait a couple months with the with the new OS."
630.52,635.52," I mean, you know, yeah, 98, 95, 98, XP."
635.52,637.52, I don't think I could tell service pack one.
637.52,638.52, Exactly.
638.52,639.52, And I was super happy with it.
639.52,640.52, What was it?
640.52,641.52," Dead, but I waited."
641.52,642.52, I'm still running 95.
642.52,650.52, I think that the real heart of the matters that people aren't finding the the game itself that compelling me.
650.52,651.52, Yeah.
651.52,659.52, We all played the original game as we know the franchise and stuff and we've had plenty of time to get used to the fact to get used to it and the function and leave with the fact that it's a multiplayer game.
659.52,660.52, Yeah.
660.52,661.52, But imagine if it was called whatever.
661.52,663.52, Imagine if it wasn't Shadowrun was called whatever.
663.52,664.52, That's playing this game.
664.52,666.52, It's just not so far my experience.
666.52,668.52, It's not like exciting enough.
668.52,669.52, It's not rewarding.
669.52,671.52, And what if it was called an engine gold?
671.52,672.52, Would you play it then?
672.52,673.52, I probably would.
673.52,674.52, I'd smoke it.
674.52,675.52, I don't know if I'd play it.
675.52,676.52, Seriously.
676.52,681.52, That's what we talk about an engine gold.
681.52,682.52, You brought it up.
682.52,683.52, I brought it up.
683.52,685.52, We're kind of an awkward segue.
685.52,692.52, An engine gold apparently is the name we think or the working name of the new Warren Spectre game.
693.52,699.52, That careful with the with putting the V on there though because we're not sure junction point studios which he formed some time ago.
699.52,704.52, My guess is that they're working they're working on and have been working on something else for some time.
704.52,705.52, Right.
705.52,706.52, I would be surprised if this is it.
706.52,707.52, Me too.
707.52,708.52, Not against it.
708.52,715.52, But it just seems because when you think the thing with Ninja Gold is it's based on a film that's being made by John who.
715.52,720.52, And when you think license games and film games and stuff you don't think Warren Spectre.
720.52,721.52, Yeah.
721.52,727.52, Like you think it's like this really like independent and you know I think it's fair to call him a visionary you know with what he's done.
727.52,729.52, And you just don't think.
729.52,734.52, It's kind of like the other guy that's now who's the guy that's working on an area 51 black site.
734.52,739.52, Oh Harvey Smith Harvey Smith that worked with him on you know some of the day of sex stuff is like it was like huh.
739.52,748.52, And you're wondering well maybe he's going to take and you know with everyone else it's working on it but just in fuse like a game with some cool ideas that you wouldn't expect from it.
748.52,753.52, The same thing that happened with Riddick that was one of the few cases where something went that happened right where to go into it.
753.52,757.52, Yeah like Riddick was better than the movie right in a way better.
757.52,758.52, But yeah it'll be interesting.
758.52,765.52, I was hoping to get some feedback from Warren and time for this taping but didn't happen but we can either put it on the forums or talk about next week.
765.52,773.52, But I asked him a few questions about you know his well for one to clarify is this the game that they've been working on a secret for for some time now.
773.52,787.52, And you know what other one of the things he cited it makes it in an interesting and worthwhile project him as the whole notion of the fusion of classical and contemporary culture sometimes and stuff because this basically a modern day ninja.
787.52,791.52, Which sounds like a funny way to justify my age of 2000.
791.52,794.52, I think you've got a good old.
794.52,799.52, Yeah that's like a little bit of a way to see what it's done with the deal is with this.
799.52,802.52, Yeah ask him how much an ounce costs.
803.52,807.52, Yeah this kind of like what do you say goes to go stock when it's written like that.
807.52,811.52, Yeah this would be a game for a little bit more expected to try it.
811.52,815.52, Like Michael Duda cough American minture production or some kind of stuff like that.
815.52,819.52, Wu Tang's a risous already announced he's doing the production for the soundtrack.
819.52,821.52, Yeah kid I'm kidding.
821.52,823.52, He did a lot of stuff and goes on.
823.52,825.52, He did go stocks yeah great movie.
825.52,826.52, Yeah.
826.52,828.52, We were doing a movie podcast that would be relevant.
828.52,831.52, Yeah so we had to go stock talk.
833.52,837.52, So ninja gold actual game or elaborate practical joke.
837.52,840.52, We'll find out where high quality weed.
840.52,842.52, We'll find out for next.
842.52,843.52, For the next year.
843.52,844.52, Radio doesn't have or no.
844.52,847.52, That's like that's the only is this the first game.
847.52,849.52, This is the dumbest joke ever I've set up.
849.52,853.52, First cover story of this game is going to appear on high times before it appears on
853.52,854.52, Game of War.
854.52,856.52, That's a little lamp.
856.52,857.52, What?
857.52,859.52, Well we'll edit that out.
859.52,860.52, Just stand by that joke.
861.52,863.52, You have to mark my words in years.
863.52,864.52, You will be laughing.
864.52,865.52, It was the joke.
865.52,867.52, Oh someone you like it is.
867.52,869.52, So we set it up as a joke.
869.52,870.52, Should have said that.
870.52,874.52, So I'm going to segue now into what you plan.
874.52,877.52, As we've talked about things we want to play like an engine gold.
877.52,879.52, I'll tell you what I have been playing.
879.52,882.52, I reinstalled for some wacky reason.
882.52,885.52, I reinstalled a rise of legends.
885.52,887.52, It actually wasn't a wacky reason.
887.52,889.52, It was because it was a starcraft.
889.52,894.52," It was a starcraft reason because on the originates podcast, which was about"
894.52,901.52, Starcraft garnered brought up rise of legends as an example of a modern RTS that had
901.52,905.52, the three different sides that were totally different from one another and still
905.52,908.52, maintained balance like Starcraft.
908.52,913.52, And I didn't actually give rise of legends a lot of time when it came out earlier.
913.52,916.52, I think just because it must have come out at a flood of other releases.
916.52,918.52, I think that's right when age of empires three came out.
918.52,925.52, But I just kind of pass it by even though I loved rise of nations and I have to say it is quite a great game.
925.52,926.52, Hello.
926.52,927.52, I agree with you.
927.52,929.52, You think it's better than right in Asians?
929.52,933.52," I think I do, but that's actually because I, I wouldn't say it's better."
933.52,941.52, I would say I prefer it because I tend to be more of a fantasy dark than a real life dark.
941.52,945.52," So which is why I prefer like heroes of might magic over, say,"
945.52,950.52," even though I totally bluff seven respects, but I tend to hear on the fantasy side of things."
950.52,952.52, But we did give this a good review.
952.52,953.52, Didn't we?
953.52,954.52," Yeah, you give it like a."
954.52,958.52," Okay, because otherwise I just back back and re-react in the non-review and show them like that."
958.52,960.52," Yeah, we give an editor's choice back in the day."
960.52,961.52, Yeah.
961.52,963.52, It's a great game.
963.52,964.52, It is a great game.
964.52,966.52, What's making it send out to you?
966.52,967.52," Well, there's that issue."
967.52,972.52," There's the issue of the balance of three different, very distinct races, which is hard to do."
972.52,974.52, All with their own play styles.
974.52,979.52," Also, the new sources and tech tree type stuff and the tech trees are completely different."
979.52,982.52," I mean, maybe not quite as there's nothing as radicals."
982.52,983.52, It's a zero.
983.52,987.52," No, this irg stand out is like the big differentiating point between like starcraft and air two,"
987.52,988.52, then right?
988.52,989.52," Yeah, led to me."
989.52,990.52, Mm-hmm.
990.52,993.52," Also, you know, this game is just reminding me like really how far."
993.52,997.52," I mean, playing, I played Starcraft for a long time right after the,"
997.52,999.52, Starcraft two and as we came out.
1000.52,1008.52," The going from that to this and jumping 10 years, you really could see how far the RTS is of come,"
1008.52,1013.52," which was more speaking to your point, Sean, a while ago, where you were saying that you felt like Starcraft."
1013.52,1016.52," Now, it was like kind of too limiting to you."
1016.52,1018.52, I was just doing that based on speculation.
1018.52,1021.52, A lot of it's from what I hear like talking to people that are.
1021.52,1022.52, But you're kind of riding playing on it.
1022.52,1028.52," And it was just, yeah, just to reiterate it was that you have a very rigid rock paper scissors."
1028.52,1034.52," And although that term is used all the time, whatever balance is being addressed and anything from a battlefield to an RTS."
1034.52,1039.52," In this case, they really mean it and that if they're, if you do something with your tech tree,"
1039.52,1043.52," that's the equivalent of scissors, someone's going to come out with a rock and it's definitely going to beat you."
1043.52,1045.52," And then you're going to lose because of that, right?"
1045.52,1053.52," Where's like in prior to recent patches, company heroes, especially a good example of a game that would,"
1053.52,1059.52," that would make that not be the case. You know, you essentially have the option to go and retain here with whatever you're doing."
1059.52,1065.52, And your tactics are always going to be more important than like if you made some strategic snafu in the beginning of the game.
1065.52,1068.52," And you're just going to pay for it, you know."
1068.52,1069.52," Yeah, I think right."
1069.52,1073.52," Although that does exist in company heroes too, based on like the territory that you decide to get."
1073.52,1077.52, You could definitely lose a multiplayer game because you didn't in the first minute of the game.
1077.52,1081.52," You didn't get secure, especially important building or something."
1082.52,1084.52, Right. So it start craft to me is like speed chess.
1084.52,1089.52," You know, it's just there's a very certain way you almost have to play it."
1089.52,1090.52, You trace.
1090.52,1092.52, Right. And every move is countered by another.
1092.52,1093.52, I'm just reiterating.
1093.52,1094.52, Yeah. So exactly.
1094.52,1096.52," And that's exactly what I've, what I've been told about it."
1096.52,1097.52, Yeah.
1097.52,1098.52, And it's awesome.
1098.52,1100.52," I mean, it's perfect for what that is."
1100.52,1108.52," But but rise of legends to me, it's, it's got the, the fast pace of RTS, but there's so many elements in there that are,"
1108.52,1116.52," are drawn from turn-based games and drawn from board games even that add like all this, just extra tactical thinking to it that I, that I really love."
1116.52,1121.52, You talking about the like the campaign and the world map thing or you talking even even in the game.
