start,end,text
2028.24,2031.24, there's only like three frames of it.
2031.24,2032.24, Exactly.
2032.24,2037.24," And it reminds me of, uh, like being an arcades in the day and, and going in and watching us play."
2037.24,2039.24," And the guys playing it would always be these big,"
2039.24,2040.24, fucking fat guys.
2040.24,2041.24, I know it.
2041.24,2043.24," And I know we've, I know we've ripped on fat people."
2043.24,2046.24," Or we've got, we've got, we've got a bad mail about it."
2046.24,2053.24," And I'm sorry if you're overweight and it's a problem, but I always just think going into the arcade and, and see guys,"
2053.24,2058.24," like, that is like two, why don't you guys try to be a bit just on our message board played about for those."
2058.24,2063.24," Like, I got so many, a few bad watches of people saying that like dude, I found three today after all."
2063.24,2066.24," Like, my whole school's playing this shit now."
2066.24,2067.24, I'm indicated.
2067.24,2068.24, Right.
2068.24,2072.24," I'm just saying that it used to bother me to go into the arcade and see guys like three in the afternoon,"
2072.24,2075.24, playing like a one-on-one arcade basketball game.
2075.24,2078.24," And, you know, they could stand the lose about 150 pounds each."
2078.24,2082.24," And it's like, go outside and play some real basketball for fuck's sake."
2082.24,2085.24, There's just one thing I could ever say.
2085.24,2088.24, Don't play a video game people.
2088.24,2089.24, Yeah.
2089.24,2091.24," Oh, yeah. I run a video game magazine. I'm sorry."
2091.24,2094.24, Don't play real sports by games.
2094.24,2096.24, Go larp play well.
2096.24,2098.24, Yeah.
2098.24,2101.24," I know, just here's how many places that could go that you don't want it to."
2101.24,2102.24," I guess, right?"
2102.24,2104.24, I guess it would be at the front run at the front run.
2104.24,2105.24, You're right.
2105.24,2106.24, Yeah.
2106.24,2107.24, Play it.
2107.24,2110.24," But there's just something about that, especially when they're like trash."
2110.24,2111.24, I dunked all over your ass.
2111.24,2114.24," I mean, it's like you're saying they couldn't dunk in real life."
2114.24,2117.24," Oh, no, no, no, they're too fat because they don't exercise because they're playing games."
2117.24,2120.24," So, as it's a video game, I wouldn't say it."
2120.24,2124.24," You couldn't beat the Zergob Dawn Armada in real life, you know what I mean?"
2124.24,2125.24, I could.
2125.24,2127.24, I'm ready for them.
2127.24,2129.24, I have my 10-fold hat ready.
2129.24,2132.24," No, but like, I remember like back in, like, just double jubbles specifically."
2132.24,2137.24," I remember like, I went to my local, like the local pizza place and like, they had a double drum machine all set up there."
2137.24,2140.24," And this dude, every day after school he'd be there, like,"
2141.24,2145.24," he's fad dripping over like the, the pan all these like the rolls."
2145.24,2149.24," The roll's going to come in and he'd master the dunk on people and he'd just go,"
2149.24,2152.24," Oh, oh, like you see like, just,"
2152.24,2154.24," Wow, something like a wild boss."
2154.24,2157.24," He was totally like, he was totally, he was totally jabba."
2157.24,2158.24, Oh yeah.
2158.24,2161.24," Oh man, but he was so proud of himself with his like,"
2161.24,2166.24," So for that game, my whole thing is like, if you took like a really, you know, well done,"
2167.24,2170.24," basketball existing, you know, like, he a basketball game and NBA or something."
2170.24,2172.24, And then you added all that other stuff.
2172.24,2173.24, It's gonna be a huge fun.
2173.24,2177.24," But I mean, if, if, if, if, if the game itself just is, is really rudimentary."
2177.24,2179.24," Yeah, but maybe it's a good basketball."
2179.24,2183.24," It's kind of, I think it's, it's NBA street, but it's got more like an RPG depth to it."
2183.24,2186.24," So it's, it's interesting in that respect."
2186.24,2188.24," And, uh, what, I mean, would,"
2188.24,2191.24," are people willing to pay for that, like on, you know,"
2191.24,2193.24, on a paper item basis?
2193.24,2194.24, I don't know.
2194.24,2195.24, That's a pretty bold statement.
2195.24,2200.24," No, no, no, that it's like, that it's got, that's just like NBA street level of play."
2200.24,2202.24," What, so what else can you buy?"
2202.24,2203.24, Just clothes or whatever.
2203.24,2206.24," Well, no, so you're also paying for skills, too, like, you like, do like,"
2206.24,2211.24," special jokes and, can you, like, you know, earn your skills through regular play?"
2211.24,2212.24," Yeah, I did it a slower rate."
2212.24,2213.24, Okay.
2213.24,2217.24," Uh, I play that, uh, about street home court for 360 play that."
2217.24,2218.24," You love the game, right?"
2218.24,2219.24, It's pretty fun.
2219.24,2220.24, Yeah.
2220.24,2221.24, Other weapons in this one on my game.
2221.24,2222.24, You can't.
2222.24,2223.24, Sadly no.
2223.24,2224.24, No.
2225.24,2227.24," No, just can't have weapons with their D."
2227.24,2229.24," They don't actually want to, like,"
2229.24,2230.24, it doesn't really annoy me about it.
2230.24,2232.24," And then, like, this is almost like unforgivable."
2232.24,2234.24," Like, you can't, there's no game path."
2234.24,2236.24," I can't, I can't, I can't, I can't hook it at game path."
2236.24,2237.24, So you're using your keyboard to play a basketball game.
2237.24,2238.24, It seems kind of stupid.
2238.24,2240.24," Well, Darren, you're playing a PC game."
2240.24,2241.24, I know.
2241.24,2243.24," Yeah, but you forget it."
2243.24,2245.24, But how many times did play a bit?
2245.24,2247.24," And a day, a days of high heat baseball."
2247.24,2248.24, Everyone used the game pad.
2248.24,2249.24, True.
2249.24,2250.24, I was messing with you.
2250.24,2251.24, I know.
2251.24,2253.24, You never played much sports games.
2253.24,2254.24, I don't know.
2254.24,2255.24, Mutant League footballs about things.
2255.24,2256.24, Mutant League.
2256.24,2257.24, Did you ever play?
2257.24,2259.24, Can you ever play a bunch out?
2259.24,2260.24, A bunch out of the code.
2260.24,2261.24, Here it is.
2261.24,2262.24, What's a sports game?
2262.24,2264.24, And ice hockey and Mario golf.
2264.24,2265.24, Mario golf.
2265.24,2266.24, Mario golf.
2266.24,2267.24, Yeah.
2267.24,2268.24," Oh, it does."
2268.24,2269.24, The Netflix.
2269.24,2270.24," Actually, that counts more than RPG."
2270.24,2272.24," You're going to make me mad, though, right?"
2272.24,2274.24," There's that whole click of kids that, uh,"
2274.24,2276.24, they won't touch any sports games.
2276.24,2280.24, But then they find out like you can unlock Mario or Princess Peach and it or something.
2280.24,2281.24, Suddenly they care.
2281.24,2284.24," They totally, it's like their favorite shit in the world."
2284.24,2285.24, You know what I'm saying?
2285.24,2287.24," You saw every time it happens with like, it's a sports game."
2287.24,2288.24, It's a sports game.
2288.24,2289.24, It's a sports game.
2289.24,2290.24, Yeah.
2290.24,2291.24," You're like, if people are like, oh, great."
2291.24,2292.24, What is there for this system?
2292.24,2296.24," Just a bunch of like, fucking sports games and, you know, and brain dead shooters."
2296.24,2299.24," And then like as soon as they announce the same game, but you can unlock Mario."
2299.24,2302.24," And when they're like, oh, God, this is incredible."
2302.24,2304.24," I don't want you to be that person, man."
2304.24,2307.24," Oh, I don't play golf, but oh, you don't play Mario golf."
2307.24,2309.24, I'll be that.
2309.24,2310.24, I'll be that.
2310.24,2311.24, I'm that person.
2311.24,2313.24, Or you might all be that person.
2313.24,2314.24, So I'll do that.
2314.24,2317.24, That doesn't sound so bad.
2317.24,2319.24," I played two Mario golf socks, actually."
2319.24,2321.24, I try to play Tiger Woods and Mario golf.
2321.24,2323.24," No, it's nice and I'll track."
2323.24,2325.24," No, it's just like, you just want to hit it."
2325.24,2328.24," You don't have to bank a ball of a flower, so I'm flowering."
2328.24,2331.24," I mean, at least something that I like the envelope stuff and the whole, you know,"
2331.24,2334.24," it's essentially descended from, you know, the Golden Tea Track Ball type."
2334.24,2337.24, They only tell my play it is when we have a group of people.
2337.24,2340.24, So I kind of want something that doesn't feel high maintenance.
2340.24,2343.24, And I don't even know if Tiger Woods is high maintenance.
2343.24,2344.24, I don't even touch it.
2344.24,2348.24, Mario golf appeals to the crowd of random people walking in the house.
2348.24,2351.24," Although I will say it could be, it could be better on we."
2351.24,2352.24, That's the new thing.
2352.24,2354.24, It's like that would be so much better on we.
2354.24,2355.24, Yeah.
2355.24,2357.24, That would be so much better on Ninja Gold.
2357.24,2360.24," You know, you know, Ninja Gold is a little better on that."
2360.24,2361.24, That would be the size.
2361.24,2363.24, Be better on Ninja Gold.
2363.24,2364.24, Yeah.
2364.24,2365.24, Okay.
2365.24,2366.24, Take a break.
2366.24,2367.24," Where we take, okay."
2367.24,2368.24, Before we take a break.
2368.24,2371.24," We got, we're going to go out and style here."
2371.24,2372.24," No, we're real quick."
2372.24,2375.24," We got this, uh, we get this email."
2375.24,2376.24," Oh, that thing."
2376.24,2377.24, Oh yeah.
2377.24,2379.24, And really go out and see if it was awesome.
2379.24,2383.24," It was in the face of me because, okay, this subject, well, it was amazing first because it was like,"
2383.24,2386.24," in a whiskey nerd skit, like three weeks ago or whatever,"
2386.24,2390.24," I had him basically chilling doing like, you know,"
2390.24,2393.24, grill a marketing on message boards for food stuff.
2393.24,2396.24, Like air pockets and pockets and shit.
2396.24,2400.24, And then all of a sudden I get this email and the subject line is next gen food for next
2400.24,2401.24, gen gamers.
2401.24,2403.24, It was like holy shit.
2403.24,2406.24," Like my alternate ego, like somehow emailed me."
2406.24,2408.24, Did you think with a joke at first or not?
2408.24,2409.24, I thought it was a joke.
2409.24,2410.24, Yeah.
2410.24,2411.24," I was like, okay."
2411.24,2412.24, I totally got the same thing on the photos of Joe.
2412.24,2413.24, Then I opened it and here's what I got.
2413.24,2416.24," And I'm, okay, by the way, my name is not Rory, but it says,"
2416.24,2417.24," Hi, Rory."
2417.24,2418.24, There's a fan of computer gaming worlds.
2418.24,2419.24, Also notice that.
2419.24,2421.24, You're getting a name and wrong magazine.
2421.24,2422.24, Great.
2422.24,2426.24, I'm happy to offer you some quality feel for your late night sessions.
2426.24,2429.24, I represent Carl's junior in Harvey's new spicy buff.
2429.24,2430.24," Oh, chicken sandwich."
2430.24,2432.24," I thought we were not, I thought we're going to blanket."
2432.24,2433.24," Oh, it was the blanket."
2433.24,2434.24," Oh, well, that's fine."
2434.24,2436.24, Because now we can turn it back on them.
2436.24,2440.24," Like, notice they don't represent Carl's junior and hearty's."
2440.24,2443.24, But they specifically represent a spicy buff low chicken sandwich.
2443.24,2444.24, Yeah.
2444.24,2445.24, That really made me laugh.
2446.24,2450.24," I told you I wanted us to write back and say, like, we like your idea,"
2450.24,2453.24, but we'd rather talk to a representative for one of your other standards.
2453.24,2456.24," So, yeah."
2456.24,2458.24," Personally, I like your curly fries."
2458.24,2461.24, Can I support the sweet things that you're trying to say?
2461.24,2469.24," So then they go on to say, and I'll skip the spill about when they're trying to convince me why this is the taste of the shit that I've never eaten."
2469.24,2473.24," Since you're in the games, you might like to play with our lunch invite widget."
2473.24,2480.24, You can make a lunch date with Ashley Hartman and you can train her to lick a lollipop to the robot or take the elevator.
2480.24,2484.24, Send an invite to your friend or use it to remind your coworker that they still low you'll meal.
2484.24,2489.24," Either way, you get a dollar off coupon at the end and you'll get to see a gorgeous girl that you're bidding."
2489.24,2492.24," Of course, if you're off email, blood else, you probably used to it."
2492.24,2497.24," Now, at that point, I was thinking to a spam where they just inserted like some name."
2497.24,2500.24, They just inserted like they got the name of the magazine right.
2500.24,2505.24," But then it's like, at least took the time to say like the blood else shit. That threw me."
2505.24,2508.24," I was like, someone right. This shit just for me."
2508.24,2514.24," You know, but then I was like, no, I'm sure EGM got one and it just said like inserted like a large craft for blood offer, whatever."
2514.24,2522.24," You know, but, but, but, but so you have this widget is basically there's like this chick that wants to put on her."
2522.24,2525.24," For one like on my website, yeah, let me do that for you."
2525.24,2530.24," We put a widget of Ashley, what's her department, linking Lolly Pop on my website."
2530.24,2533.24, That I don't have.
2533.24,2536.24," But it's like, what the fuck, why would you want to do that?"
2536.24,2545.24," And then anyway, she says, either link, either link will make you a lunch date with Ashley, no clicking required, no extra clicking required."
2545.24,2550.24," And Ashley might not actually show up, but you can still get fired up over that extra dollar in your wallet."
2550.24,2552.24, What the hell? So she may not even show up?
2553.24,2557.24, What does that know on my spot? How did they even apply she even made?
2557.24,2562.24," Okay, that's just, I don't know, that's the bulk of it, but I just thought that was pretty sad."
2562.24,2571.24," It kind of reminds me of like if anyone uses like instant messengers now, a various sorts of MSN is particularly, and Yahoo are particularly offensive that they're the shit's called Winks."
2571.24,2573.24, That's a hot thing.
2573.24,2580.24," And it's like, when you, you know how there's the tradition of smiley and stuff, because you can't just type, hey, I'm smiling and have it say the same."
2580.24,2597.24," So then you got a picture of smiling fool. But now with Winks, there's like when you, when you can't possibly find a way to say like dodge trucks are sturdy, you hit this button and it changes the background and all of a sudden a big dodge truck and flash goes by that phrase often come to your mind."
2597.24,2603.24," It's a death like how mom, I'm talking to you and I love you and I know it's just mother's day, but check it."
2603.24,2608.24," And then it's just like, even crystal light because I believe in me."
2609.24,2613.24," So while you've got like five pro, pro as you, you're sponsored by dodge."
2613.24,2617.24, That's like those why I'm in fireman. So I was showing you.
2617.24,2619.24," Yeah, the, like what is the shit?"
2619.24,2622.24," Yeah, the messenger you can like load a background that's like, you know, just got toilet."
2622.24,2624.24," Yeah, that's all over the place."
2624.24,2625.24, But I know about them.
2625.24,2627.24, Why I download them to piss people off.
2627.24,2628.24, Right.
2628.24,2630.24, But it's like maybe that was maybe on the butt of their joke.
2630.24,2633.24," Maybe they're like, there's no one who's ever going to send this to someone seriously."
2633.24,2635.24, It doesn't matter whether they think they're being ironic or not.
2635.24,2637.24, They're still advertising our bullshit stuff.
2637.24,2646.24," And so it's like my little avatar off like a some foot, what did I football do like run it back and forth like the corny is flash you've ever seen and just like, but you're right or movie."
2646.24,2650.24, She's flying on the jokes on you man. You're doing their PR for them.
2650.24,2651.24, Right.
2651.24,2653.24, Just like we just did for what's her face.
2653.24,2654.24, So actually Hartman here.
2654.24,2656.24, I got the last day with Ashley.
2656.24,2658.24, So I'm also for next week.
2658.24,2662.24," I'm not going to mention a name, but like as I'm looking at the woman who we sent out this email."
2662.24,2664.24," Yeah, I'm wondering if like she wakes up the morning."
2664.24,2665.24, Looks in the mirror goes.
2665.24,2666.24, I got to do this again.
2666.24,2668.24," Yeah, that's like, how do you feel about that?"
2668.24,2673.24, At least this person you had the decency to say they were representing the sandwich and not pretend that they were.
2673.24,2675.24, I'm a spicy wing sandwich.
2675.24,2676.24, I don't represent it.
2676.24,2685.24," Yeah, I wonder if she's like, and I want to, where do you think she is on the, that's from the latter of PR apps is it like other people aspiring to represent the buffalo chicken sandwich?"
2685.24,2688.24," You know, like there's other girls on the office going like that bitch."
2688.24,2689.24, And then we got to come to the exit.
2689.24,2692.24, I can't believe she got the buffalo chicken sandwich.
2692.24,2694.24, I was so sure to be me.
2694.24,2695.24, They represent the line of sandwiches.
2695.24,2699.24," Yeah, maybe that that that you start out at Filaeo Fish."
2699.24,2702.24, Like bottom of like the shit fish.
2702.24,2704.24," Yeah, shit with you."
2704.24,2706.24," Like, let's call in if I just work a little harder."
2706.24,2708.24, I can get the buffalo chicken sandwich.
2708.24,2710.24, Jellys of the wap are guys like I isn't it to do anything.
2710.24,2711.24, Right.
2711.24,2713.24, To sell themselves those wapers.
2713.24,2717.24," If she's listening to me back now for my reward, you can keep the dollar off keep on."
2717.24,2720.24, Just just tell me how you felt when you typed that out.
2720.24,2725.24, How much you sold crumbled every day with every letter sure of.
2725.24,2728.24, I felt a lot of money going to my bank account.
2728.24,2729.24," Yeah, no kid."
2729.24,2731.24, He's probably making more than ass of jokes on ass.
2731.24,2733.24," Yeah, but she's getting paid in buffalo wings."
2733.24,2734.24, Let's go take a break.
2734.24,2735.24, That's still sounds alright.
2735.24,2738.24," Okay, we'll be back soon."
2738.24,2741.24," Three, two, one, here the best."
2741.24,2743.24, Alright.
2743.24,2749.24," Listen to EGM Live, the weekly podcast for electronic gaming monthly."
2749.24,2757.24, We're available every Monday for download at EGMlive.1up.com or podcast.1up.com or the iTunes music store.
2757.24,2760.24, Sweet the legs.
2760.24,2761.24, Sweet the legs.
2761.24,2763.24, Are you ready to play?
2763.24,2769.24, You can vote to bring the 2007 Midnight Gaming Championship tournament to your city and prove you've got what it takes.
2769.24,2773.24, The baddest gaming tournament in the US is carrying up for another year.
2773.24,2778.24, Visit Midnight Gaming Championship.com for details and make your voice heard.
2778.24,2779.24, Game on.
2809.24,2812.24, I'd Ralphie went nerdcourt.
2812.24,2815.24, He's a bit angry now this to these days.
2815.24,2819.24," Yeah, he's the least for a few weeks and he comes back angry and rapping."
2819.24,2820.24, He's got some gold.
2820.24,2823.24, He got some gold fronts too and no doubt.
2823.24,2826.24," Good to have you back, Ralphie."
2826.24,2828.24, I'll stay away so long.
2828.24,2831.24, So one thing that we wanted to talk about.
2831.24,2832.24," Yes, sir."
2832.24,2837.24, We continually bring up griefing and goofballing.
2837.24,2838.24," Yeah, causing trouble."
2838.24,2840.24, Maybe I'm in online games.
2840.24,2841.24, We do.
2841.24,2845.74," And a couple weeks ago, you know, when it last talked about it, I very, it was a joke when I said it."
2845.74,2858.24," But I said that in one of the rings online, the ability to go and do some social engineering might make the game worthwhile because collecting the five, you know, cheap, health and stuff alone isn't incentive enough to play the game."
2858.24,2866.24," It was a joke, but I was serious to the extent that I do think that the social engineering and things that people will do or just the stuff that just kind of have"
2866.24,2871.24, happened to emerge in those games is often more entertaining than the missions that they give you.
2871.24,2884.24," And even if you don't believe in goofballing and messing around, I think you'll agree that sometimes when even you shine or playing world of aircraft, you're having a much better time talking with your guildmates as you're sort of like casually clicking on monsters."
2884.24,2885.24," No, yeah, totally."
2885.24,2893.24," It is a completely technical and at this point in time, a cliche term almost of emergent gameplay."
2893.24,2894.24, Right.
2894.24,2895.24, The game makers call it.
2895.24,2901.24," So a few things surprised me, one of the captain of Calester on the forums which are now gone."
2901.24,2906.24," We've been, you know, merged into one Uber form now, but he said that,"
2906.24,2916.24, Sean and others on GFW are always talking about trying to elevate games to the level of film and supporting griefing is not the way to do this.
2916.24,2923.24," When Roger Ebert sees a film he hates, he writes a critical review pointing out the film's flaws and then goes on to see it goes on to something he likes more."
2923.24,2928.24, He does not go to the theater and ruin the film for people who might not like or who might like you.
2928.24,2934.24," So, as you seem beyond value of the dolls, immediately, I mean, the whole thing there was like,"
2934.24,2936.24," I mean, and everyone else could chime in."
2936.24,2939.24," If you do it, you can speak from a position of the military."
2939.24,2945.24," If you don't, if you're Ryan, if you turn dot hate this stuff, although I know secretly you cause a mayhem in Ultima."
2945.24,2946.24," Oh, yeah."
2946.24,2952.24," But the whole thing there is like, what an inappropriate analogy for one to say that like the experience of,"
2952.24,2962.24," of watching a movie is like an MMO and then instead of of us doing something in that environment is basically the same of like being a obnoxious and talking on our cell phone and other movies,"
2962.24,2972.24," because rather than people that were sitting there and watching this passive experience unfold with everyone else in the game, we're all principal agents, we're actors in this thing together."
2972.24,2981.24," And part of the very draw of that genre is our presence there, because if you strip that away, you've got essentially a very, very dull and repetitive RPG."
2981.24,2986.24," Right, it would be more like if you went to somebody's house while they were playing a single player game."
2986.24,2987.24," Yeah, sure."
2987.24,2990.24, But you should exactly sat on their couch and given them shit.
2990.24,3005.24," And so a few things that I wanted to say, like, first is that when we say grieving, so there's no misconception, it's not like we're just kicking sand in the face of the scrawny and it's not like we're going and we're using hacks and we're just team killing you and stuff like that."
3005.24,3018.24," Like some of the examples I gave, you know, before we're staging fake contest and stuff and they turn out of tricks or like, you know, recently and I did get on alerted the rings online, one thing we did is the usual, the game's got voice chat."
3018.24,3034.24," We get someone in it and you make up this whole spiel and like example, you know, it's telling the guy that, you know, I'm a serious that I'm the leader, this is my chance to be the leader and I want all transmissions to be concluded with over and I got, you know, I get this guy like going along."
3034.24,3044.24," And then I told, you know, like our characters are Ralphie and Dar Down, we retain we're like kind of brothers of what would be a PC way of saying of dubious mental capacity."
3044.24,3047.24," And so, so you know, like in red apolite."
3047.24,3063.24," And I'm just telling the stories about, yeah, you know, it's like, you know, tell them, yeah, I haven't read the books because grandma won't let us, but she says we're allowed to play the because they're satanic and I, you know, say like, is it true that, you know, if you read the books sometimes you wake up at night and you'll have a devil on your chest and it makes it hard for you to breathe."
3063.24,3079.24," And it all this isn't a messed up voice. And then the guy's like going along is like, you know, pretty much, and then I tell him, it's like, you know, we're allowed to play this game because we're allowed only if we roll play because grandma won't just use our imaginations."
3079.24,3092.24," And a lot of games don't take imagination. You know, grandma has imagination too because great on on her car on her car. There's a sticker that says in case a rapture, this vehicle will be on man."
3092.24,3097.24, So sometimes she'll just start squirving around to make people think that it's already the rapture.
3097.24,3105.24," So like, we'll just be talking just going off and off like that shit with this guy, you know, and all of a sudden, I mean, to me, that's radically different for one."
3105.24,3113.24," In that case, that guy can be grief no more than he wants to. All he needs to do is kick out of the fellowship or click mute or any of these things."
