start,end,text
2125.1,2127.1," Otherwise, you'd build a blow through him in 30 minutes."
2127.1,2128.1," Oh, old games are like that."
2128.1,2129.1, Yeah.
2129.1,2130.1, He hated you.
2130.1,2133.1," And actually, they do put a couple of little new kind of cheats on there."
2133.1,2137.1," There's this little like twinkly, glowy butterfly thing."
2137.1,2140.1," The sort of like tells you where to go, which is sort of annoying."
2140.1,2141.1, It's called Navi.
2141.1,2142.1, It goes.
2142.1,2143.1, Hey.
2143.1,2144.1, It's a little bit like that.
2144.1,2145.1, Yeah.
2145.1,2146.1, Look at.
2146.1,2147.1, Look at.
2147.1,2149.1, It's way.
2149.1,2150.1, Yeah.
2150.1,2153.1, The last fight is also changed.
2153.1,2154.1," Oh, yeah."
2154.1,2155.1, Yeah.
2155.1,2157.1, The combat feels a little harder to me this time.
2157.1,2162.1, That my imagination seems like there's more moves now than there were.
2162.1,2164.1," Oh, you should avoid the combat."
2164.1,2165.1, As a void the combat.
2165.1,2166.1, You can use the guy.
2166.1,2171.1," You can use a move where like if you carry the dudes, sort of,"
2171.1,2175.1," if you're like right next to him, you can switch positions with him."
2175.1,2176.1," Oh, okay."
2176.1,2177.1," So, and then run to the side."
2177.1,2179.1," As proven in flash 2016,"
2179.1,2182.1, the third installment sometimes simply running.
2182.1,2184.1, And he's waiting for a superior stopping to fight.
2184.1,2185.1, Quint a Bible verse there.
2185.1,2187.1, You run very fast.
2187.1,2189.1, Flash 2016.
2189.1,2190.1, You call you two.
2190.1,2193.1, And then there's Pac-Man.
2193.1,2195.1, And then there's Pac-Man.
2195.1,2196.1, I don't really want to go on it.
2196.1,2198.1, Then there's the backman.
2198.1,2199.1, But I'm so freaking out.
2199.1,2200.1, I'm there with you now.
2200.1,2206.1, Last night was the first time in days that I went to bed before 1 a.m.
2207.1,2208.1, Because of Pac-Man.
2208.1,2211.1, Pac-Man has been keeping me up until the wee hours.
2211.1,2213.1," I understand Jeff, don't worry."
2213.1,2214.1, I don't know what it is.
2214.1,2216.1, I can't take it.
2216.1,2217.1, It's awesome.
2217.1,2220.1, It's something about the shortness of the game.
2220.1,2222.1, The five minute championship mode.
2222.1,2225.1, Plus the fact that you can see all your friend scores.
2225.1,2226.1, That's the big thing.
2226.1,2227.1, Yeah.
2227.1,2230.1, And because like you can see exactly how to be perfect in it.
2230.1,2232.1," So like you just strive for that every time you're like,"
2232.1,2233.1," oh, crap."
2233.1,2234.1, I screwed that up.
2235.1,2236.1, I'm saying I got a little bit of a allergy.
2236.1,2237.1, And it's time for that.
2237.1,2238.1, And I just got to corner that little better.
2238.1,2242.1, And you make that one mistake and you just want to start all over.
2242.1,2244.1, Pac-Man.
2244.1,2245.1, Awesome.
2245.1,2246.1, The awesome Pac-Man.
2246.1,2248.1, I need to get it.
2248.1,2249.1, I need to get it.
2249.1,2250.1, I need to get it.
2250.1,2251.1, There's also that.
2251.1,2252.1, What was it?
2252.1,2254.1, The motion right simulator that I didn't play.
2254.1,2256.1, But I watched your mom playing.
2256.1,2258.1, Basically.
2258.1,2261.1, That was the tall arcade.
2261.1,2263.1, They had like a ride simulator.
2263.1,2268.46, sloping bed that you basically lay back on and you hold on and there are two in tandem and then you watch the movie of the roller coaster
2268.46,2274.06," I've seen this thing. Yeah, you could choose between like the hell ride roller coaster like you know the clown roller coaster"
2274.06,2283.98, Whatever you want but when I saw when I saw on this thing was like a couple for like you know a gross weight of I don't I don't know
2285.46,2290.8199999999997," What did I guess last time a quarter of a ton? No, no, that would be each so half ton right. Yeah"
2290.82,2292.82, You have to have to find a half ton
2293.78,2300.0800000000004, But when this thing when this bad dad started kicking like the woman and she was in head to toe purple and wearing
2300.7000000000003,2305.76, Birkin stock so it was just that firming the theory that like kicking you know like
2305.94,2311.7000000000003, Bacon bread foot stuff with the whole ride. I was just like it was amazing because it reminded me of
2312.42,2314.9," Hell a water bed in an earthquake, but"
2315.9,2322.2000000000003," My can it was too dark in there to take a picture, but there's this there's another game that is good enough to call now playing"
2322.2000000000003,2326.86, And it's basically a roulette wheel with five slots on it and a rubber ball that goes round and
2327.7400000000002,2331.62, Here I took a little sample of what this thing sounds like as
2332.3,2334.3, I'm just gonna play it as
2334.6600000000003,2339.12, As the balls and rotation and then it evades the sound file will end when the ball stops
2340.94,2342.94, Here we go
2344.9,2346.9, Oh
2350.7000000000003,2354.84," So you can tell it's pretty catchy right there. No, right for it. Wait for it"
2361.3,2367.6, And at that point you win 50 75 100 100 tickets
2367.6,2369.6, Um
2373.6,2378.36," Well, no, if you bet on blue if you bet on you just shit out a lot, but you play small two bets"
2378.36,2383.08, So many smart persons looking at this thing. You like all right. I'm gonna bet on every color
2383.4,2389.62," So that way I win every time yeah, but yeah, but but then you know the long story short"
2389.62,2392.7, I don't want you to take it's in a basically got me a
2393.4,2395.4, Not so many tipsy rules
2397.6,2402.48," Yes, that's a story. At least you have to tell you rolls better than achievement points. That's true"
2404.92,2408.88," You can't eat a team points. Yeah, I never liked to see rolls though"
2409.48,2412.06," I didn't you know, I just start giving the tickets away to kids"
2412.06,2414.4," They get all excited. Yeah, they get psyched if you do that"
2414.52,2419.74," They do the kids like oh yeah, because today the class like a wippy cushion or like Chinese finger cups"
2419.74,2424.16, You know all that shit that they're there that comes from a you know whatever the sweatshops
2424.16,2429.48, It's like stuff still fun for the water snakes water we need one super ball last hours
2429.48,2434.8799999999997, We still get into the water. All that red until it bounces over their neighbors. They did have I almost got it
2434.8799999999997,2439.3199999999997, But I decided not to for 600 tickets they had a toilet with a dancing piece of shit in it
2443.56,2448.7, And it basically you know you could choose between a baby blue or a pink toilet and it was tempting
2448.7,2452.16, I saw 600 tickets just like the grand prize no
2452.16,2457.3999999999996," No, they had a wee there and at first I was so dumb. I knew I knew this shit was a scam because like I"
2457.68,2461.8199999999997, Actually stopped and did it double-taken. I was like I I'm gonna play. I'm gonna play
2461.8199999999997,2465.96," You know thinking I'm gonna like keep playing that roulette shit for a week that look it was 70,000"
2466.64,2468.64, How much money would you have?
2468.64,2470.64, The math on that like yeah
2470.64,2476.14," So 70,000 tickets for the Wii and 600 for the dancing yeah, and then keep in mind that roulette game is about as"
2476.14,2481.7799999999997," Genesis they get in those shit holes. I mean most of them you'll be lucky, you know, ski ball or something get yourself five tickets per"
2482.5,2483.5, game
2483.5,2486.5," Yeah, yeah, but this thing got cool that dancing"
2487.18,2493.1, Dancing turd and a toilet turd would be I should have got it just for you know some of those things that it would go well
2493.1,2495.1, And crispens office or your office or something
2495.66,2497.66, You shit hoarders
2497.66,2499.66, You've been regretting it ever since
2499.66,2504.7, You think about it every day. You can always go back shit go back on trial go back on top. Yeah
2505.18,2508.22, It's that Lake Tahoe Harry's or Harvey's casino
2509.58,2514.8599999999997," Paris yeah, or whatever the hell is it's a clip watch with a hands go backwards"
2518.7799999999997,2521.9399999999996," All right, are we ready for a we ready for a break? Oh"
2522.7,2528.58, She go on. It's already on a quick hero. Okay. Do that. Okay. We'll do that. We'll take a break and we'll be back for another half an hour
2528.58,2530.58, The web of madness. Okay
2531.98,2537.38, Just jump right into this as usual here of the web is someone heroic that we find on the web
2538.1,2542.18, And they're always found on message boards this one goes by the name of tales
2542.58,2548.74, Calls himself a legendary Yoshi and in his post. Do you have an imaginary friend the answers?
2551.06,2557.46, Well everything started a few days ago when I was sleeping and then something was next to me
2557.94,2562.78, So I opened my eyes and I look at the left of my mattress to see who is there
2562.78,2564.78, There it was
2564.78,2567.5, Tales was there sleeping right next to me
2568.18,2578.62," Then you woke up and say hey, what you want me alone don't talk to me because I'm extremely pissed off because Eggman said me to nowhere here"
2579.82,2581.82, Then I interrupt very sad
2582.26,2586.46, Hey tales I know how you fell because I know you a lot
2586.46,2591.42, But can please help you stop talking like that because I know you are not like that
2592.3,2601.98," Then you replied will just turn around and leave me alone and get put then I interrupt. Hey, you know what fine take the whole benefit if you want you are not tales"
2602.54,2604.54, tells us not like you
2607.94,2611.5, Then it was quiet for five minutes in then he said
2612.06,2617.66, I'm sorry can you come here? I don't like to sleep alone. Please forgive me
2618.3,2622.46," Yes, I'm friendly in nice and I'm the tales that you know"
2623.98,2628.38, Okay fine then I went back to my mattress and sleep with my hero tales
2629.02,2632.38, Then when I was about to sleep he gave me a big hug
2632.7,2634.3, They miss everyone
2634.3,2640.7," I hope Sonic and the others are okay, but for now I'm gonna stay and live with you. Is that okay, Dale said"
2641.58,2645.42," Didn't make a gesture with my head saying yes, then"
2646.54,2648.54, We went back to sleep hugging each other
2649.42,2656.3," He wrapped me with this two tales because my covers were so dirty, so I have nothing to cover me on night until today"
2656.3,2658.3, I still live with tales
2658.3,2663.18," No one can see him or near him, so when I want to talk to him my god side and talk"
2663.18,2667.9, He knew everything you know about me and now have a new friend to talk and say
2668.38,2671.34," I don't know all this happened, but I'm really happy"
2674.7000000000003,2676.94," Take us out, thing is not break I need a drink"
2678.54,2680.54," Okay, we'll be back"
2697.9,2701.1, Great new gaming experiences every time you play oh
2703.1,2705.6600000000003, We're back. I thought you were gonna beatbox
2707.5,2709.5, I did did you hear
2711.26,2713.26, Man
2713.26,2718.54, Before we're done to to to ask people to decide the winner of that of your
2718.54,2720.7000000000003, Yeah intro beatbox contest right
2720.94,2725.34," The rap battles we can't talk about yourself eight bit mail. Okay, so"
2726.3,2729.6600000000003, Last week on nice last week on a
2730.06,2735.9, Cataku they posted a good name for actually now Cataku just linked to it it came from my right at the end came from
2736.54,2738.54, Gigahom or home
2738.54,2741.1800000000003, dot com posted a list of the top 10
2742.1400000000003,2747.6600000000003, MMOs according to them based on active users or sub and or subscribers
2749.9,2755.02, Should I read the list or you want to take it right? I don't know what are we gonna do it all right and and
2755.9,2758.78, Pay careful attention to the terminology use here
2759.9,2764.06, Number one roll of warcraft no surprise eight point five million subscribers
2764.94,2769.7400000000002, Number two have oh hotel at 7.5 million active users
2770.86,2777.1800000000003, Number three is ruined scape five million active users number four is club penguin four million active users
2777.5,2780.2999999999997, It's our hot yeah number five webkins
2781.02,2783.02, 3.8 million
2783.02,2785.02, I just read a hero the well
2787.74,2790.7, Number six is guy online two million active users
2791.5,2798.22, Number seven guild wars two million active users eight is yohoho puzzle pirates one point five million active users
2799.18,2801.18, Number nine. I guess is a
2801.18,2807.98," Combination of lineage one and two one million subscribers and 10 is second life 500,000 active users"
2809.3399999999997,2814.54, Every one of those games with the exception of world of warcraft and the lineage games have some sort of free component
2815.3399999999997,2819.98, So what you're saying that significant that's well of course you have all these many
2819.98,2827.74, Divactive users it's free. I want to read off the list again between world of warcraft and guild wars numbers two three four five six
2828.3799999999997,2829.74, two through six
2829.8199999999997,2831.4199999999996, Howbo hotel
2831.4199999999996,2833.58, Roon scape club penguin
2833.8199999999997,2835.8199999999997, Webkins and guy online
2836.62,2841.4599999999996," So yeah, we fucking heard of any of those I have why I heard of web of Roon scape"
2841.4599999999996,2843.02, Roon scape taxi hunter on
2843.02,2845.02, I've referred to howbo hotel
2845.02,2847.1," Yeah, or even context before because I was saying like"
2847.66,2851.8199999999997, Something now for more than skin squad will go in like just mess the hell out of it
2852.14,2856.8599999999997, Howbo hotels is number two at 7.5 million the next line phenomenal
2856.86,2860.2200000000003," Yeah, I can't read the next one is and all these are basically the same well"
2860.46,2867.42, Well excluding Roon scape but like webkins is like another is basically howbo hotel with pets right and they're basically all
2867.9,2872.54, Just public you know social social spaces where you walk around and you decorate your room
2874.6200000000003,2879.58, The kind of shit that kids kids so geeked out for net stupid animal crossing game really right
2879.58,2885.7400000000002," Yeah, I was surprised not to see Neil pets on here frankly because Neil pets was one of the one of the original"
2886.2999999999997,2892.22," In the end of course it's just vastly multiplayer, but like what the way that they're organized is so that they're constantly"
2892.7799999999997,2894.7799999999997, You're you're constantly accruing
2895.3399999999997,2900.3799999999997," Just like additional cotton costs for everything you do you know, so it's like hey you want to go do this puzzle"
2900.3799999999997,2904.7, You want to go into the pool to talk people then like boom that gateway get charged another opinion
2904.7,2909.5," Incremental see you want to get you know a new hat for your dog and boom when it's like, you know"
2909.5,2914.62, Hey mom mom give your credit card one time only just a register and that's not gonna charge you
2914.62,2917.66," That's just so you're in here, which of course, you know, that's how like second life works"
2917.66,2922.54, But then these kids start clicking all this shit and it's like boom boom boom when you inevitably have that talk
2922.54,2924.62, You know where you're like you get your
2925.1,2927.58," Get your credit card statement back. Yeah, and you see like"
2927.9,2931.58, $600 hop a hotel and you're like first you then you go first
2932.7799999999997,2934.7799999999997, Your spouse yeah
2936.7799999999997,2940.8199999999997, See that slut again and then after you you get divorced years later
2940.8199999999997,2944.38, You fight out that it was your kid like basically and it was
2944.62,2950.54, Even more scary is because I mean that's the big worry about these games is that you're basically just like predator havens
2950.54,2954.06," You know right, so I daughter hanging out at hobo hotels sweet teo"
2954.06,2957.1, Tell it's actually reminds me remember a week or two ago
2957.58,2960.14, When we all went out to lunch and we went to that new
2960.7,2964.22," Lunch place or it was new to me. I guess it's been there for six years, but I'm not sure"
2964.22,2968.94," I don't ever notice anything. That's called working girls cafe. Well, I put that on my"
2969.8199999999997,2971.8199999999997, My charge card and
2971.82,2977.26," Yeah, I'm a few days ago my wife like yeah because uh hey Jeff there's this charge"
2978.1400000000003,2980.86, On the credit card statement for working girls
2982.3,2986.54, What is that about and you like half a second house like oh fuck
2988.1400000000003,2989.98, You're trying to remember what an idea
2989.98,2991.82, What did I do that website?
2991.82,2995.42, It's gonna remember God is a sandwich place. So I'm so I'm so clear
2995.82,2998.78," Okay, I didn't know what you could actually get for eight dollars, but"
3000.46,3001.7400000000002, Nice
3001.8199999999997,3003.8199999999997," Yeah, coupon"
3003.8199999999997,3005.8199999999997, Actually it was salami that's what I got
3007.1,3013.74," I run I owe okay, so uh so this does clearly pop you right? Yeah, you know, I do find the list to be a little"
3014.4599999999996,3019.74, Dubious if I may say I mean I believe that all these things have as many subscribers as they're saying
3020.06,3024.8599999999997, But you probably need to separate list where it's actually just like games that are about
3025.8999999999996,3028.9399999999996," No, you a list cater to you like ignore the facts"
3028.94,3030.94, That's caterer list to like jacriines desires
3032.14,3034.14," Yes, I"
3034.14,3039.1, Well paid subscribers are like you know users that actually have to like drop money on like a monthly fee
3039.1,3041.5," Sure, sure that would be a more yeah, that's a fair one"
3041.5,3043.34, Because this is gonna apples and oranges in a way
3043.5,3045.5, Guy online is a forum
3045.5,3047.9," Well, right exactly and webkins"
3047.9,3052.3, I mean that thing is like you buy after buy a plush toy a store and then register the thing
3052.3,3054.54, And then then you get the new plus toy also
3054.54,3058.62, That website I guess I did we watch the video damn that thing was like I've frickin
3058.62,3062.7799999999997, Assad trip but put that page put that in your browser and then do the tour click the tour
3062.7799999999997,3066.8599999999997," Yeah, it's like these horrible like day glow colors with these like creepy stuff"
3066.8599999999997,3069.2599999999998, Animals are freaking me out. It was like watching tell the talk
3069.2599999999998,3074.94, What it's like if you give that simply by watching it your kid might accidentally cost you another like seven or hundred
3074.94,3078.2999999999997, $800 just so by doing their own thing
3078.2999999999997,3080.2999999999997, I think I'm also gonna be in my nightmares tonight
3080.8599999999997,3085.9," Yeah, I'm surprised what you're your parent. I mean you're you're beyond the years of worrying about that"
3085.98,3088.2999999999997," Yeah, you know, but like just seems I don't know"
3088.62,3091.66, Sarah it seems like you wouldn't want your kid going in these things
3091.66,3097.58," Well, she was in Neo pets and then she was in Disney's Tune Town for a while which are both versions of these things"
3097.58,3101.98, How how closely supervised are they well? They're very closely supervised. They're actually pretty
3102.7799999999997,3104.7799999999997, They all do a great job of
3105.5,3111.1, Making it really impossible for your kid to be talked to less that date like camera crew
3112.06,3117.74," Yeah, no, I mean obviously I mean all kidding aside that stuff is is crucially important"
3117.8199999999997,3124.8599999999997," Yeah, they really have that kind of that there's no way anybody can yeah like there's no chat function"
3125.02,3125.8199999999997," Right, you know"
3125.8199999999997,3131.5, It's interesting. I was almost just because you have to I mean you have to have a GM and any any kind of like MMO
3131.5,3136.4599999999996, But it seems like in that you have to have so much supervision that that along would would necessitate you're having the
3136.62,3141.3399999999997, To charge or either that or just load it up with advertising which is I think is how it works. I bet you
3141.9799999999996,3145.58, Those things are just it's the typical channel one stuff about you know
3145.74,3150.86, You have channel one in schools where basically a school if the school's gonna get like uniforms for their football TV or something
3150.86,3155.18, They have to agree to like show why this channel one shit and it's increasingly just a bunch of you know
3155.34,3158.86, Advertisements and some such so I'm just guessing that that you know
3159.5,3161.5, It's a guest but the other other
3161.5,3162.86, other kid
3162.86,3164.22, Web
3164.22,3165.5, That's the problem
3165.5,3168.54, I had and hollow a tower just like loaded up with
3169.2599999999998,3173.02," Right, adds everywhere and I mean and certainly the fact the second life is on this list"
3173.74,3175.74," Yeah, that's the whole list in the question"
3176.22,3180.22, What that's that's not a game that means that I don't know consistency present
3181.1,3183.1, So it's your definition of game
3184.38,3185.58, I don't know
3185.58,3187.58, Not that
3187.58,3188.86, Not second life right
3189.74,3190.78, Okay
3190.78,3196.54, We have anything else this week my my oh god this sucks my mic just keeps going in and out really when I turn
3196.54,3199.66," Yeah, yeah, yeah, yeah, yeah, yeah, yeah, yeah, sure it is I if I hold up the cord"
3200.38,3202.38, It's just a right angle
3202.38,3205.82, You get still hear me really maybe not I don't know we can hear you
3206.46,3211.02," I can hear you all right, I'll just pinch this cord. I think it's just your return is busted"
3212.86,3216.1400000000003, You can't have to be a little creative editing here with the shit
3216.1400000000003,3221.1," No, we could talk people need to know maybe if people I can't work under these conditions"
3221.1,3225.1, You piece of shit do we said like no more burping? I know but we're not recording
3225.5,3228.94, This is going in this is how we do it we air we're like the no stops
3229.02,3232.14, We're the we don't some kind of monster metallic inversion of podcasts
3232.14,3237.58," Well, we're taking my burp out and that yeah, but no I'm staying but uh, no, but people here"
3238.2200000000003,3244.2200000000003, How sad our samples maybe those send us in some you know like some cans to recycle there I go cutting out again
3244.54,3251.7400000000002," Okay, so said hizer if you want to send us some new headphones we could use them that's true. Thanks guys. I didn't ask for my most advice for cans to recycle or"
3252.94,3258.2200000000003," I don't know anything I'll put on eBay new equipment is theoretically on the way. Yeah, yeah"
3258.4599999999996,3263.4199999999996, Check me out. I heard that one before now I'm striking like a a Vogue pose hold my head set together
3265.02,3269.98," All right keep talking all right, so how about this new id this new id technology?"
3270.3799999999997,3276.3799999999997, How about that let's talk about id tech five shall we why can this shall we let's riff on that
3278.14,3280.14, John Carmack
3281.2599999999998,3287.3399999999997, Let's just try to learn where did rocket ship pilot camp right head geek over at
3288.54,3296.3799999999997, Unveiled their new their new technology their new engine and they did it significantly at the apple world wide developers conference
3297.8199999999997,3300.54, Which was a week ago last Monday and
3303.5,3308.62, Whatever we want to say about the id tech actually I don't think any of us have seen it running except on the YouTube video
3308.62,3313.66," Yeah, yeah, so the video we're gonna get a personal demo up at E3 in"
3314.14,3316.14, The lie but for now
3316.54,3318.54, We just have that to go on
3318.54,3324.22, But that that was that was put in the broader context of of apple supposedly
3324.94,3326.62, Getting back into gaming
3326.62,3332.3799999999997, It also you know EAs announcement that they will be bringing about the 2021-42 as well as command and conquer and
3333.8199999999997,3336.14, A few other their prominent games right
3336.14,3342.62, The Mac or but the thing is they aren't actually like rewriting the code or anything like that basically they're inserting something called cider X
3343.2599999999998,3348.22, Which is basically a little wrapper that basically quartz over the PC code into
3349.42,3350.7799999999997, Mac
3350.7799999999997,3354.8599999999997," Oh, yeah, once once they went Intel it I think theoretically became way easier to do that"
3356.06,3358.06, So the question is
3358.06,3360.46, One does this matter does anyone care
3361.5,3364.14, That EA is doing this or that and that it showed this
3365.1,3368.8599999999997, So they're new technology on a Mac first and
3369.18,3373.58, Two is apple orderly getting into gaming again and if they are does that matter?
3374.14,3379.18," Well, I think well actually a part of that conference was that Carmack was saying that it's not I mean"
3379.18,3382.2999999999997, They kind of did that with with Mac to put a point but like
