start,end,text
3383.1,3388.3799999999997, Carmack said there that it's gonna it's gonna it's gonna make coding easier for games to come to every platform
3388.3799999999997,3391.58," If he wasn't saying specifically like oh, we're just doing this for the Mac right"
3392.06,3393.02, So I mean
3393.02,3398.22, It tech five game whatever the heck it is could conceivably come up on every platform at the same time
3398.86,3405.34," Yeah, it's just it's not like hey, you know, we're it's next game exclusively and Mac but just the the greater question of if"
3405.66,3408.38, We'll see more and more games available on Mac and and clearly
3408.7,3413.98, You know Blizzard does that and everything and it's is but just we'll we see up a point where
3414.62,3417.9, There is an increasingly large contingent of of
3418.2200000000003,3422.46," Gamers on Mac, you know, and then we get to the problem of what do you call them, you know"
3422.46,3425.26," We're not PC gamers, but they're playing exactly the same game"
3425.26,3427.9, You know what I can't come in games for Windows as we sure
3428.94,3430.94, And we won't be covering them
3432.2200000000003,3437.98, For me became almost a mood point once they let you do a mood on a Mac so like oh on a
3438.54,3443.02, Because if you're gonna buy a Mac the reason isn't because of the games obviously you're really into
3443.5,3445.7400000000002, graphic design you're really into us 10 or you're right to
3446.3799999999997,3447.74, The ability or whatever
3447.74,3452.7799999999997, The funny thing is back in the day that's why you bought an apple to play the games. I mean that's why I have a back way back in the day
3452.7799999999997,3455.58," But that's long on yeah, but you know what I think that"
3456.7799999999997,3461.5, The big question is let's say if I do get battle field 2142 running on the machine and they need this side
3461.5,3465.8199999999997, RX app to get the PC game running on a Mac if it affects the performance at all
3465.8199999999997,3467.4199999999996, I'd be kind of interested to see what it does
3467.5,3473.22," But other than that I mean this whole one else was basically yeah, you know the type of Steve jobs is being like the PT bar in of technology"
3473.2999999999997,3476.74," Showing off, you know, everything stuff that can be done right now"
3477.8599999999997,3483.58, So it's kind of like a bigger deal than it really is but the chip Jeff your perspective out. I was interested to find because you know
3484.1,3486.1, You're you're definitely not
3486.1,3489.7799999999997, Just I mean even though you are a spokesman for for games windows and stuff
3489.7799999999997,3493.62, You're definitely not just to type to pass off the competition just because
3494.58,3498.7799999999997, Or or a competitive platform and the fact that all of us here like you know we gave on
3498.78,3503.1800000000003," On consoles on hand-hills on anything that's got games, you know, but"
3503.42,3506.7400000000002, It was interesting here your perspective is someone who'd been in the business for a long time
3506.7400000000002,3512.9, But also someone that worked specifically with Max and on platform and then and you were like historically
3512.9,3516.5400000000004, There's some stuff you should know about before you get all excited or jumped to conclusions
3516.5400000000004,3522.86," Well, well, my feeling was and yeah, I thank you for actually putting that disclaimer and because because it could be read that way"
3522.86,3524.86, I'm not hating on it because I
3525.42,3530.1, Cuz I'm cuz our magazine is now a little hitting with Microsoft. I should say actually I
3530.58,3537.1200000000003, used to be a big maclover actually we have a two max in our house. I love to death my iPod
3537.94,3539.94, reproducing this podcast
3541.06,3543.06," Well, we actually"
3543.06,3547.78," Design our magazine on unmacks, so we all have I have a mac and my desk along with my PC"
3548.06,3552.38," So you know, let's just say that to get that out of the way, but"
3553.1800000000003,3555.1800000000003," Yeah, prior to working at"
3555.82,3558.54, What used to be called computer gaming world. I worked at a
3559.3,3567.34," Mac week magazine, which is a nat de funct mac and touch business magazine, so that was actually serious work before all this stuff and"
3569.2200000000003,3575.76," Over the years, you know as Darren implied boy the sand is really kind of goofing on goofy here"
3575.76,3580.5," It's probably me rustling because I have to keep manipulating this wire. Okay, so here"
3581.02,3583.86," Anything else find and work matters, but that's fine"
3583.86,3585.86, All right
3585.86,3587.86, they
3587.86,3591.74, Apple historically like every every couple of years or few years or whatever
3591.86,3595.82, They make some big pronouncement about how this now we're gonna take game serious
3595.82,3603.42," We realize the audience is out there, you know, and we're you know, and the apple the the mac is the best platform by far for a game"
3603.42,3609.7," So we're gonna show you why and then you know, and they've done that even they've even come around to CGW and in the past"
3609.7,3616.54," Not since we've been GFW, but you know, we would have meetings where apple would come in and sort of prove to us how how this time"
3616.54,3619.7799999999997," They meant it and then you know you never hear from again, right?"
3620.18,3625.5," What's it probably good this is and that's sort of yeah, that's what I think it's gonna happen here and that's just based on"
3626.2599999999998,3628.74, It's not to be overly cynical. It's just that I think
3629.62,3634.3399999999997, That they don't actually really they historically have not ever really given a shit about games
3634.3399999999997,3638.02, You really do have to go all the way back to the apple to to find them
3638.74,3644.34, Really having cared about it. I think during the crucial time that the mac and tosh was developing
3644.74,3649.98, When it was the mac plus and then all the others that they really were had this kind of like a
3650.38,3655.14, Hit brother sort of like please take a seriously where a business machine really?
3655.14,3662.9, We're not just a toy right and you know when they were seriously competing for market share against the PC at the time
3663.46,3670.1, Before kind of just essentially giving that up and being happy with the graphic artist market and
3670.9,3676.1800000000003," And that kind of stuff in video editing so and at that time, you know"
3676.82,3679.46, Even at Mac Week we used to go to them and we used to
3680.34,3686.94, We used to talk to them about gaming and they would really poo it. I mean to the point where like they wouldn't even want us to like
3687.26,3691.2200000000003, We weren't just sitting stories about how like even way back then in those days
3692.18,3697.58, games a lot of game development with being done on Macs for PC games
3697.58,3701.22, These would be games that would not actually be appearing on the Mac itself
3701.22,3708.02, But they're being developed that way and we would want to do stories on that in the magazine and they would try to get us to not do those stories
3708.2599999999998,3713.4199999999996," They were like well, you know, your your readers are more interested in the Mac as a business application"
3713.4199999999996,3715.4199999999996, They don't really need to know about this kind of stuff
3715.58,3716.58, So
3716.74,3725.58," Granted that was you know a long time ago now, but still it has forever tainted me to to really believing that they're actually gonna get behind it"
3725.58,3728.58, I mean in them and really the basic fact now is like who
3729.22,3731.2999999999997, Seriously who would buy a Mac to play games?
3731.2999999999997,3737.14," Yeah, no at this point like this point. They're gonna get into games in any way shape or form like their desktop platform"
3737.14,3741.02," It's not where to do it and we have most of their stuff is close case, right?"
3741.82,3743.82, Believe in that and like I
3744.3,3748.78, Would think they would try to do something more like with the iPod early iPhone or something
3748.78,3753.74," They can't help or yeah, I'm able to sense to me right maybe this is just like a step in the hey"
3753.74,3758.62," We're doing games then later they'll unveil something. Well, I mean those lines. I'm not against them doing games"
3758.62,3763.04," I to be honest with you. Well, no, I'm not either. I'm not saying don't do the more to the party the better"
3763.04,3767.1," I'm right I agree that they're not serious. Yeah, I don't know"
3767.1,3771.06, Totally because they had John Carmack there to say hey cross platform
3771.06,3776.06," Yeah, if I'm mistaken actually done that before I mean they've actually had Carmack specifically there before showing off like"
3776.1,3779.8199999999997, Doom three tech back in the day when it'd be surprised. They certainly I mean this is what they do
3779.8199999999997,3784.18," They they have this kind of press conference, you know every so often where they like show this time"
3784.18,3792.18, They mean it and then they never do I mean I'm I'm really glad that there's certain publishers like like Blizzard who put their stuff on the Mac anyway
3792.18,3795.18, I mean certainly I don't I wouldn't want to deny
3796.14,3806.64," Mac gamers of chance to play games, but but I think like holding out hope that Apple really is going to be supporting you and giving you what you want is a pipe dream"
3806.64,3810.02, So you don't think in a couple years are gonna be changing our name to games for OS 10
3812.2599999999998,3814.2599999999998, GFO S10
3814.2599999999998,3816.2599999999998, Where what that was a nice ring the physics
3816.66,3818.8199999999997, We're not against the idea Apple
3819.22,3824.4199999999996," Right games for iPod. Yeah, I mean similar to you before I came here like a"
3824.42,3830.02, Maybe a year ago I was at Mac addict right or the year and a half. I don't think games and Apple even came up once
3830.02,3832.82, We had like a page on gaming in our magazine and it was all
3833.38,3835.7400000000002, We were scrambling to fill it with like as you take home
3837.2200000000003,3839.2200000000003, Kind of like us now. Yeah
3840.98,3842.98," All right, so that enough of Apple"
3843.7400000000002,3853.34," Yeah, that'll do it. It's good to me. There's unfortunately there's not too much to say about it tech five and it's you know outside of the Apple announcement"
3853.34,3854.7000000000003, I mean we showed the demo that they
3855.58,3860.6600000000003," Said that they had assembled quickly, you know, and that it would it would run better with a little more time"
3860.6600000000003,3865.82, And it certainly looked good. I mean there were complaints online that it was more of the old Chris go factor
3866.26,3870.6200000000003, That that you got out of a lot of stuff using it's in just kind of myself in that
3870.6200000000003,3876.98, What around or just you know the the slippery shininess everything and and some some people
3876.98,3883.66, This one I mean you look at the YouTube comments and you know they're they're complaining about you know that they're noticing performance issues in that
3883.66,3885.66," You know, it's like oh god"
3885.66,3894.06," But the cool point the point of the the matters something that that car makes been saying, you know and to us even in our last few times we've interviewed him is that"
3895.34,3898.06," Thanks Jeff, you and your glasses while I talk yeah, that's you"
3898.78,3901.14, Your glasses please continue doing yeah
3901.14,3909.1," I'm not going anymore, but but that that now with this new technology to artists have the ability to go and basically have I mean entirely unique"
3910.02,3916.8199999999997, Game worlds in that rather than tiling assets it's basically the mega texture your idea taken to an even greater degree
3916.8199999999997,3923.56, So that you have you know in a 20 how many you know what did he say how many gigs of information wasn't that little demo they showed
3924.48,3933.22," This in the convenience extraordinary amount and and but I mean it was surprisingly low though for the lack of repetition in it, you know"
3933.22,3942.64," It's basically the old make texture thing written again, but with you know that carries over to interior environments everything you know every single prop and object in the world"
3943.7999999999997,3949.68," You could just you know manipulate artists communicate it in any way, you know here see she's fitting and it's not going to be"
3950.24,3952.8799999999997, crushing you know your memory budget or whatever
3953.96,3955.96, So that's the fun part of it
3955.96,3957.96, So anybody can see that
3958.52,3963.8999999999996, video you could just Google yeah car Mac and the in tech five it tech five yeah
3964.16,3966.3999999999996, They're not Google sorry just do a search on
3968.44,3970.44, Right
3970.44,3973.64, We can wait up if I told you it could render the flash TV series in real time
3974.52,3978.6," No, you like that you like that. I'm not just a Ryan kind of looks like John Carmac"
3979.16,3982.62, What people on the forums that's why he grew the beer said that
3984.6,3986.1, I don't know maybe a little bit
3989.1,3991.7, Who did look like last week Gordon Freeman that's right
3993.04,3997.58, I know what a broad brush your paint with there. You're like let's go. Let's go glasses
3997.8399999999997,3999.8399999999997, You sky glasses
4000.36,4002.36, He's got glasses
4002.36,4004.36, In these guy glass
4004.36,4006.36, Also a guy to go to the odonel
4008.6,4011.44, It's true so Darren you want to
4012.04,4017.4, Bring your contest to you. Okay. Let's let's end this contest and so I wasn't around last week to it
4017.4,4022.16, Please no more entries no more. We are tell it tell people quickly give what the contest was okay
4022.16,4023.44, basically
4023.44,4029.08, There's the the magical writing of was Keith R. A decandito and he put together
4029.08,4030.7599999999998, He had written the
4030.7599999999998,4034.7999999999997," Commanding Conquer, Tiberium Wars novelization of the of the game in book form"
4035.6400000000003,4038.6000000000004," Yeah, which were your fans, huh? Which were huge fans of and"
4039.88,4044.1800000000003, We put a contest out there said the best the best examples of fan fiction
4044.1800000000003,4050.1200000000003, We need to throw them a copy of the book because I got a bunch of copies sent me at the office and I can't get rid of them
4050.1200000000003,4054.0800000000004, They just keep they keep reappearing on my desk even like that's a go homing
4054.6000000000004,4055.88, beacon and that thing
4055.88,4057.52, So
4057.52,4059.52, Luke Smith hot sis
4059.6,4063.5, By far wrote the font like the one that cracked us up. You have like that username to you
4063.5,4065.6," Yeah, I know"
4065.6,4067.6," No, it's with scone like"
4067.6,4069.6," You know, it's like you know Scott's out sis"
4070.56,4072.56, Friends got hot sis
4073.2,4081.14, Let's you make an all-de-count do so. I can't I honestly like I don't have the the voice craft talents to put this to do this
4081.8,4085.04, Entry justice. You want to give it a shot shown? I'll try because there's that red line of
4085.04,4088.04, Exactly. There's like the second line it is like is just the winner by the way
4088.04,4093.2799999999997," This is the winner with the winner of the CNC fan fiction, but it has but I might be able to actually scratch up extra copies"
4093.2799999999997,4094.2799999999997, So there will be other winners
4094.2799999999997,4100.08, I mean if I could if that actually one copy of this thing I can eventually say that this is probably not the winner that EA would have picked
4100.56,4102.56, Probably not
4102.56,4107.68," Just safe bet. Okay, um, I'll spare the voice. I'll just read it with thin enthusiasm"
4108.8,4113.24," I can well I can do that. Okay, well, there's more we can there's plenty of reading to go. Oh no, that will"
4113.24,4115.24, I don't like
4115.24,4122.639999999999, There's this eggplant colored M2 Bradley vehicle is he sinks into the purple bean bag and grass the 14 inch purple
4122.639999999999,4123.84, Dildo shifter
4123.84,4129.32, He reflects on the nuclear nuclear devastation. He's about to unleash and the cowardly GDI
4130.04,4133.5599999999995, His little love gimp from the night before settles in on a matching bag
4134.24,4140.12, She's not overly attractive or ugly the kind of girl who gets more dates than women on the extreme ends of the beauty spectrum
4140.76,4144.54, She removes the snuffle off of his costume and stairs blankly out when we go
4145.24,4149.08, Wondering if Kane will call again after he drops her off at grandma's
4149.72,4153.92, Kane ignoring her continues to plot his evil as they barreled down the old laughing road
4154.88,4160.08, He shifts into fourth gear and briefly feels a niche in the neather region should have covered his soldier
4160.08,4165.5599999999995, He muses soon everything will be flames and his purple furry toy will be engulfed in the inferno
4165.88,4170.56, His hand squeezes the shifter a little tighter in a smart crosses his diabolical face
4172.4400000000005,4174.4400000000005, So wow
4174.4400000000005,4177.4400000000005, We're declaring that a winner and let it be known
4178.04,4184.64, This is the first that any of us have read past the second line. I think it was like the stick shifter image that like that they kind of made it
4185.4800000000005,4188.900000000001," Yes, so here's some more if there may be some choice lines from the other ones that you"
4189.56,4195.280000000001, That made them stand out. Okay. Well from let me see there is problems some of these dudes got so they win do it
4195.28,4197.28, They wrote us damn nobles
4198.28,4203.28," Yeah, these guys, yeah, we were asked for I was hoping for like a paragraph or two from people and some guys just got went way off the deep in"
4204.04,4205.04, So
4205.04,4210.32, Some of them it's like they just happened to have like the letter that like they sent to panhouse and that they got rejected to the panhouse
4211.32,4213.32, We're on the couple words
4213.32,4218.5599999999995, No thanks dude and then it turned into the most creative flame wherever when like guys are like using the the the the
4218.5599999999995,4223.5199999999995, Fanfiction forum is a way to like insult each other. Yeah. That never happens on the internet. I know
4224.4800000000005,4227.4800000000005," Okay, so just let me see a choice bit from a cheat zero"
4228.400000000001,4233.080000000001, Basically he was kind of like recreating a life of a guy who works inside one of the factories that build scorpions and shit
4233.080000000001,4235.68, Very creative which I thought was actually a pretty good go
4236.240000000001,4242.4800000000005," Yeah, let me see he will he's in there. He'll work sharply with your life for came as he takes a moment to realize"
4242.4800000000005,4247.0, It's his alarm clock looks over his floppy wife who still asleep spooning her cat instead of him
4247.120000000001,4251.400000000001, He ponders the the status of his relationship and the thought of the direction of the marriage of her
4251.4,4255.36, I was saying at least he shrugs it off of the huge cup of travel cup of coffee and sets off on his commute
4255.759999999999,4258.639999999999, He walks into the office in the factory hangs his coat looks at his inbox
4259.0,4261.32, It's almost to the ceiling of scorpions and requests
4261.5199999999995,4264.839999999999, There there are some days when he just wants to walk outside and the screen with the guy in the sky
4264.839999999999,4269.4, Why can't you make anything else you fucking noob this guy like you need a novel
4269.4,4272.36, He's definitely gonna be a winner cuz like this guy. I
4273.2,4278.5199999999995," Think he would like let me just say I think he would he'd enjoy the novel. Yeah, yeah, it's kind of an eye for detail"
4278.52,4282.900000000001," I liked that last line there. He was like talking to you the gamer. Yeah, very clever"
4282.900000000001,4284.1, Very meta very good
4284.1,4291.4400000000005," So I kind of like kind of like that. Okay, so all right, you know what that that's actually that's a series of like like Luke Smith's hot sis or you win"
4291.4400000000005,4294.820000000001, I think the other points for that's too and again cheap zero
4294.820000000001,4300.0," He wins yeah, that seemed like that was actually legit idea on that one so okay. We have two winners"
4300.0,4303.160000000001," Yeah, two winners graduations to both of you you both get books"
4304.360000000001,4305.72, Yeah
4305.72,4308.92, We had a good congratulations. You can you can march through your hometown with that book with pride
4310.64,4314.280000000001, No doubt no doubt no doubt you'll be contacted we're
4315.88,4317.88," Done yeah, so"
4318.360000000001,4322.76, Ryan killed it man. I'm gonna blame it on you this time of the people can get mad if they didn't want to show you
4322.76,4327.240000000001," You're sitting there like sleeping yeah, man. It makes me step in makes me want to get out of here"
4328.52,4332.26, Maybe we should then and I thought it's because you're like you're drawing the cord around your neck right now
4332.26,4335.62, That's that part sucks to that's it fucking buzz
4335.62,4341.22, We need to picture this you don't got a camera phone on our son cuz we can go out this Jeff you wanted to comment
4341.860000000001,4345.3, Here's one of those red moments where you are like patrolling craigslist
4345.3,4347.62, You don't need to try to explain what you were doing on there
4347.9400000000005,4353.92, But and then you aim me something you found and this is called
4355.3,4357.62, 12 the dudes that play video games
4358.0199999999995,4362.0599999999995, Thanks a big thank you. It wish you'd like you buy more games for you all
4362.0599999999995,4369.54, Here's why you're love for the Xbox Nintendo has got me more pussy than looks charm or money could ever get me
4370.099999999999,4372.099999999999, Well you tap your controllers
4372.099999999999,4376.58, I'm tapping your girl while you scream with joy at the TV screen
4376.98,4385.0199999999995, Your girl is screaming what thanks to seeing my pillow my headboard my couch my shower my life. I love it
4385.9800000000005,4391.5, My only advice you will is the barboard video games and keeping noron your other manly duties
4392.06,4394.06, PS
4394.06,4396.06, video games
4397.06,4402.620000000001," So I love that guy that do's yes, he's a real winner posting on Craigslist with that"
4402.620000000001,4407.0," Yeah, totally he's reaching his target market ignoring your manly duties. That's the second time. Let's come up"
4407.0,4409.1," Well, he burned legendary thread Karen got that"
4409.1,4414.9400000000005," You know about ignoring her womanly duties. You're right. Whoa, so we're all ignoring our our"
4415.58,4419.820000000001, Jett Belladoodle duties by playing video games interesting
4421.620000000001,4426.34, And what what the hell pissed him out what is this in the first place? I mean can we like try to make up for a moment
4426.34,4430.860000000001," Yeah, what about the date you for to go to for one to Google Craigslist"
4430.860000000001,4433.02," Yeah, if you can explain that part of two"
4433.540000000001,4441.02, The fucking post on Craigslist and then three to post that you hate that people play video games or but but then to turn it around
4441.02,4443.740000000001," I say no, I really like it because it means I get to tap your mom"
4443.740000000001,4447.900000000001," You know, like you know, I got to say like if that was me as like you know"
4448.3,4453.9800000000005, Surfer a douche of the web whatever his name is I wouldn't tell people my tactic fucking you like people keep knowing it
4453.9800000000005,4455.9800000000005, Right keep a trolling
4455.9800000000005,4458.46, Tails is totally wasn't gonna be friends with him anymore
4459.26,4461.26, It's probably like it's probably one of those
4461.820000000001,4465.820000000001, Those what is it you know in our nerd hierarchy where you write yourself in your own eroticism?
4465.820000000001,4471.18," There's probably a variation on that but where you like put it in a public form, but you presented as as fact rather than fiction"
4471.74,4474.780000000001, Like that could just be an injury in his like master Victoria
4475.66,4483.14," It's probably the somebody's playing video games all day. Yeah, he imagines. This is what you said that the Craigslist is for from inside second life"
4484.860000000001,4487.26, Where he was banging like a reindeer something
4487.34,4494.38," You the whole thing next no, so and you found that in on Craigslist in the in the rants and raids"
4494.38,4496.38, It the occasional counters
4498.22,4500.22, Me
4500.860000000001,4505.02," Yeah, I was seeing if anybody answered my ad oh so before we go"
4508.3,4511.1," I'm just like oh yeah, whatever all because I know that"
4512.3,4514.860000000001," Okay, by the way do we have a cricket sound effect on the other side?"
4517.26,4519.26, Doesn't make me feel right
4519.26,4521.26, You're being a bad boy
4522.14,4524.14," No, go on let's talk about your ad"
4524.14,4528.3," Okay, now that I killed it. That's all right. Okay, so before I got I wanted to"
4528.7,4530.7, costume to give a shout out to
4531.74,4533.74, Neo Gaff forums
4534.54,4535.26, poster
