start,end,text
1164.1,1165.1, It was.
1165.1,1166.1, The show's over now.
1166.1,1168.1, It was incredibly sharp and fast.
1168.1,1169.1, It was written by this one.
1169.1,1174.1, Multi-bathes one writer Amy Sherman Paladino who actually cut her teeth on Roseanne back
1174.1,1175.1, in the day.
1175.1,1176.1, She and her husband.
1176.1,1180.1, They basically shepherd the show for years and years.
1180.1,1187.1, And it had very much had the pace of like a scubaal comedy of the 30s where everybody
1187.1,1193.1, is talking super fast and the cultural references were flying left and right and you would
1193.1,1195.1, have to listen multiple times to get it all.
1195.1,1197.1," But anyway, the point is just like Sim City."
1197.1,1198.1, Just like Sim City.
1198.1,1199.1, Yeah.
1199.1,1200.1, This is why this is our elephant.
1200.1,1201.1, The point is so pretending.
1201.1,1202.1, She did this.
1202.1,1203.1, I know you're not.
1203.1,1208.1," The point for those listening, the point is they did the show for six seasons on and it was"
1208.1,1209.1, basically their show.
1209.1,1210.1, And then it was a contract dispute.
1210.1,1212.1, An Amy Sherman Paladino left.
1212.1,1213.1," She said, screw it."
1213.1,1214.1, I created the show.
1214.1,1215.1, It's my show.
1215.1,1216.1, But I'm out.
1216.1,1217.1, I'm not doing it anymore.
1217.1,1219.1, But the show stayed on the air for one more year.
1219.1,1221.1, And so you had this whole year.
1221.1,1227.1," A fan's going like, oh my god, the show so should have died because the whole town is gone because"
1227.1,1228.1, there's a different writer now.
1228.1,1233.1, New writers came in and they tried to keep the Gilmour girls thing going to mistake that whole
1233.1,1234.1, thing.
1234.1,1239.1, But everybody like me who sadly I've seen every single episode of every season could really tell the
1239.1,1241.1, difference in the tenor of the dialogue.
1241.1,1244.1," And we were I was among the people going like, why didn't they cancel this last"
1244.1,1245.1, year?
1245.1,1247.1, We're already never talked this way.
1247.1,1251.1," How could she, she would never be her boyfriend last year?"
1251.1,1253.1, That didn't video that.
1253.1,1259.1," So, you know, that was an example of a franchise that was taken away from its original"
1259.1,1262.1, people and it got fucked up.
1262.1,1263.1, And now it's canceled.
1263.1,1264.1, And I'm happy.
1264.1,1268.1," It's like, okay, now we can pretend that that episode of Gilmour girls never existed."
1268.1,1271.1," I thought you're going to bring this back and say, but it turned out to be awesome anyway"
1271.1,1272.1, in a different way.
1272.1,1273.1," No, actually it's okay."
1273.1,1275.1," Yeah, no, so that's okay."
1275.1,1276.1, So thanks.
1276.1,1279.1," And there just, maybe it works both ways then, is what we're saying."
1279.1,1280.1, Right.
1280.1,1284.1, I have no idea honestly which category some cities societies will fall into.
1284.1,1285.1, Right.
1285.1,1287.1, But there are plenty of examples that go either way.
1287.1,1290.1," Video games and movies, Congress TV, whatever you need."
1290.1,1292.1, So let's give an example of where it worked.
1292.1,1293.1, To counter my deal.
1293.1,1294.1, Here's my deal mark.
1294.1,1295.1, Limitation Empire.
1295.1,1296.1," Go, go, give me a answer."
1296.1,1297.1, That part of Strix back.
1297.1,1298.1, Fuck you.
1298.1,1299.1, Yeah.
1299.1,1300.1, Yeah.
1300.1,1301.1, There you go.
1301.1,1302.1, Bam.
1303.1,1308.1," DC recently announced that there, there are current flashbacks."
1308.1,1309.1," Oh, no, no, no, no."
1309.1,1313.1, That is waiting for this is being canceled as of this week's issues.
1313.1,1314.1, Thank God.
1314.1,1319.1," And they are going back to the original series and the original numbering, which ended at two thirty."
1319.1,1321.1, How does it had us to flash not work?
1321.1,1323.1, All the dead dude does is run fast.
1323.1,1324.1, How do you fuck that up?
1324.1,1325.1," They, they screwed it up."
1325.1,1328.1," In the new, in the new flash, he ran slow."
1328.1,1329.1, Hey moonwalks.
1329.1,1330.1, It was the first time.
1330.1,1336.1," The best flash story ever was actually written for, for the quick silver character that's"
1336.1,1338.1, Marvel's rip off of them.
1338.1,1343.1, And this is basically like if you take a character that can go and we'll let you go back
1343.1,1344.1, on rabbit.
1344.1,1349.1," You take a character that basically moves that rapidly and you take an extended, you know,"
1349.1,1353.1," with that sort of thinking typical of like a mark malar or something, but this was a Peter"
1353.1,1354.1, David's story I'm referring to.
1354.1,1357.1," You say, what would it be like to be this person?"
1357.1,1362.1," And so there's this, he, the whole episode ends up going to his, uh, his like therapist or something and"
1362.1,1365.1," bitching about how, what a horrible, you know,"
1365.1,1368.1," mazantra piste is because you know how we get pissed off, weighten and lines and stuff."
1368.1,1371.1," I mean, his whole world is basically waiting at the DMV."
1371.1,1373.1," Missed a throw up, did you mean to say?"
1373.1,1374.1," Yeah, yeah, I stand there."
1374.1,1375.1," I said, you stuck, got stuck."
1375.1,1376.1, I got stuck there.
1376.1,1377.1, Okay.
1377.1,1378.1, All right.
1378.1,1379.1, Or whatever.
1379.1,1380.1, I'm sure you could tell.
1380.1,1383.1," But so, but it was, I mean, his, he was just this miserable wretch because everyone was,"
1383.1,1387.1," the slowest piece of shit like, you know, like D.W."
1387.1,1391.1," Geo, not John Wall Geriatric or whatever, you know, and every aspect of his life."
1391.1,1394.1," And anyway, but can't he just slow down when he wants to?"
1394.1,1395.1, He doesn't have to always be super fast.
1395.1,1401.1," No, but because if your mind is able to handle the, to, to function at that capacity of let"
1401.1,1406.1," you move that rapidly throughout the world, it stands to reason that it's going to be that that"
1406.1,1408.1," quick in, in every other aspect too."
1408.1,1409.1, True.
1409.1,1412.1," That was the assumption that the, that the, that the writer took."
1412.1,1416.1," But yeah, he, he, he could like, he would read books and like, you know, I split second."
1416.1,1419.1," Like, yeah, that's got to do that all the time."
1419.1,1420.1, Yeah.
1420.1,1421.1," So that's, that is the curse."
1421.1,1424.1," And that was, it was funny because so many curses of flesh."
1424.1,1425.1, That's the last story.
1425.1,1426.1, Wasn't told in the flash.
1426.1,1428.1, And then like the best superman story.
1428.1,1429.1, It wasn't told for Superman.
1429.1,1433.1," It was the, the Samaritan in, after the city, which quicks,"
1433.1,1434.1, that was awesome.
1434.1,1436.1, Since I dropped that is that you have the same thing.
1436.1,1439.1," And you know that if you sleep for a moment or go on top,"
1439.1,1442.1," you're going to tap, let us lean or whatever that like you could have saved, you know,"
1442.1,1443.1, that's number rules.
1443.1,1444.1, Right.
1444.1,1445.1, That's right.
1445.1,1446.1, The Samaritan could like never rest.
1446.1,1447.1, Yeah.
1447.1,1448.1, I remember that story.
1448.1,1449.1, Okay.
1449.1,1451.1," So Ryan, so Ryan has to tell you last."
1451.1,1452.1, Bring it back.
1452.1,1453.1, Bring it back.
1453.1,1454.1, All right.
1454.1,1455.1, So anyway.
1455.1,1456.1, Sorry.
1456.1,1460.1, So this new horrible flash series is cancelled and they're
1460.1,1464.1, referting to the original series numbering with Mark Wade back on the book.
1464.1,1465.1," Ah, good."
1465.1,1466.1," Mark, wait."
1466.1,1467.1, Okay.
1467.1,1468.1," But how did they fuck up the flash, seriously?"
1468.1,1474.1," They introduced a new, well, they, they, they, they put a new character in the role."
1474.1,1476.1, And he didn't really work that well.
1476.1,1478.1, You mean a whole brand new flash?
1478.1,1483.1," Well, they promoted kids flash into the, that's the full fucking problem with all of DC's"
1483.1,1484.1, comics.
1484.1,1486.1, There's like six billion versions of every character.
1486.1,1487.1, This was why.
1487.1,1488.1," No, like you know, the flash."
1488.1,1489.1, How many of you are there?
1489.1,1491.1, There's like a billion different.
1491.1,1493.1, There's like kid versions in the same Superman.
1493.1,1494.1, There's a goddamn dog in the cape.
1494.1,1497.1," Girls, ripped of this women who can't just have Batman,"
1497.1,1500.1," you have to have Batman, you have to have Batman, you have to have Batman."
1500.1,1501.1, You have to have Batman.
1501.1,1504.1, Do you see comics is fucking trash?
1504.1,1505.1, There you do.
1505.1,1506.1, Batman.
1506.1,1508.1, All the marbled into member right.
1508.1,1511.1," I was pointing out there was like a girl Wolverine or whatever, like a pale."
1511.1,1512.1, Lace.
1512.1,1513.1, Yeah.
1513.1,1517.1," The spider girl, they did the web with what was girl Wolverine called."
1517.1,1518.1, It was like he was called.
1518.1,1520.1, Like a no X32 or 23 years.
1520.1,1521.1, There's a lot of that.
1521.1,1522.1, That's what I'm saying.
1522.1,1524.1," Wait, what, who's a, who's a, who's a, who's a."
1524.1,1526.1, Green lantern right now.
1526.1,1528.1," The green of well, the main green lantern."
1528.1,1529.1, Who is it?
1529.1,1530.1, It's a house.
1530.1,1531.1," Back to hell, George."
1531.1,1532.1," Oh, it's him again."
1532.1,1533.1, Yeah.
1533.1,1534.1, Awesome.
1534.1,1537.1," So basically, I left comic books for like 10 years and nothing is fucking happened."
1537.1,1541.1," Well, that was another similar thing where they, everyone hated the, like, green lantern before."
1541.1,1542.1, Bring it all back.
1542.1,1543.1, Bring it all back.
1543.1,1544.1, Right.
1544.1,1546.1, I wasn't never coming back because he was like dead forever.
1546.1,1548.1," Well, they figured out how to undy."
1548.1,1549.1, Yeah.
1549.1,1550.1, They never do it.
1550.1,1551.1, What are we talking about?
1551.1,1552.1," No, you're not open."
1552.1,1553.1, This is totally the meander cast.
1553.1,1555.1, I don't even think that's all right.
1555.1,1558.1," Yeah, we get, we're, we're, we're, we're talking about El Sim City."
1558.1,1562.1," I was saying I'm, I'm hoping that this sort of carries across like when when you were"
1562.1,1566.1," I watch Cherokee's don't give a shit about what you do, but I don't really give a shit about"
1566.1,1567.1, Star Trek.
1567.1,1568.1, Although I know that they do some really good stuff.
1568.1,1569.1, I don't know shit about Star Trek.
1569.1,1570.1, But put that on me.
1570.1,1571.1, You can watch it.
1571.1,1574.1, And it's still an interesting window into that you can laugh it.
1574.1,1578.1," So if someone's laughing at our expense and saying like, it hasn't turned our show."
1578.1,1580.1, I can fest to watching seven seasons of Gilmour Girls.
1580.1,1581.1, That's true.
1581.1,1587.1," And you don't have a Captain Pike Gold cart, whatever, man."
1587.1,1589.1," I, I blame my wife and kid."
1589.1,1591.1, I only watch it with them.
1591.1,1592.1, It's okay.
1592.1,1593.1, So.
1593.1,1601.1," Some city societies is like the flash, which is like Empire Strikes Back."
1601.1,1602.1, Let's bring it home.
1602.1,1603.1, Did you make it?
1603.1,1605.1, It's either even more girls or Empire Strikes Back.
1605.1,1606.1, We don't know.
1606.1,1607.1, We'll find out right.
1607.1,1608.1," Any, any fine words?"
1608.1,1609.1," Oh, my."
1609.1,1610.1, I know.
1610.1,1611.1, Okay.
1611.1,1612.1, Here's a random.
1612.1,1616.1, This is what happens when we try to redo a conversation we had last week.
1616.1,1617.1, So let's not even try that again.
1617.1,1622.1," Since we're rampant, I got like probably the fastest now playing ever."
1622.1,1623.1," No, I'm like, go for it."
1623.1,1624.1, Okay.
1624.1,1626.1, I was going to avoid this because I'm playing Battlefield 2 again.
1626.1,1630.1," I'm also playing World and Conflict very heavily, but I'm not going to talk about it now because"
1630.1,1631.1, to pimped the one up show.
1631.1,1636.1," I just don't want it to be, you know, where people watch that and listen to us or like,"
1636.1,1639.1," hey, that motherfucker said the same thing, you know, four days ago."
1639.1,1640.1, Right.
1640.1,1644.1," So, but Battlefield 2, the best part of my week in a sitting there in a, oh, God, and I really"
1644.1,1646.1, just say that the best part of my week in.
1646.1,1651.1," So I guess we'll have the time to sit there and in, well, she's gone for two months."
1651.1,1655.1," Well, just, you know, her family with her family, but trying to get you in trouble."
1655.1,1656.1," So, no, but that explains why."
1656.1,1659.1," I'm going to be doing some serious, you got another brief time now."
1659.1,1660.1, Currently.
1660.1,1664.1," But we're sitting there playing the map, Moshter City and all the audio were on the"
1664.1,1667.1," the mid east coalition side, and all the audio is in Arabic."
1667.1,1668.1," So, we just keep hearing."
1668.1,1669.1, Duntanyan.
1669.1,1670.1, Duntanyan.
1670.1,1675.1," And I heard it enough because the commander keeps, it means something has to do with something"
1675.1,1680.1," when you cite a, you know, spotted sniper spotted or whatever, if she spotted."
1680.1,1682.1," And he just kept saying it and I like, in my head, I'm hearing it."
1682.1,1684.1," I'm like, Duntanyan."
1684.1,1690.1," So, all of a sudden, like, in team speakers, like, doing tan, duntan, duntanyan, duntanyan,"
1690.1,1693.1," duntanyan, duntanyan, duntanyan."
1693.1,1697.1," And then, like, so after her, he had talked, it was like, duntanyan, duntanyan."
1697.1,1701.1," And then, like, we're just doing this for like about an hour."
1701.1,1705.1," And then, one of us, like, that's how, that's how little a little bit like, he"
1705.1,1707.1, grew school song to me.
1707.1,1708.1, Dianna.
1708.1,1709.1, Trying to throw that right.
1709.1,1712.1, I didn't close her behind Cox being on the spot of that.
1712.1,1716.1," Dianna, I could've busted into Dianna now."
1716.1,1718.1," So, here's some Dianna."
1718.1,1719.1, Dianna.
1719.1,1722.1," I can't do it, but I just can't do it."
1722.1,1723.1," Yeah, I, sorry."
1723.1,1724.1, All right.
1724.1,1726.1," That was a speed, speed, now playing."
1726.1,1730.1," But, as anybody, while we're at it, as anybody else been playing anything."
1730.1,1731.1, Yes.
1731.1,1732.1, There's a flat stone.
1732.1,1733.1," What have you been, guys?"
1733.1,1734.1, Okay.
1734.1,1737.1," So, ever, ever on the, on the indie beat, I found a game called"
1737.1,1740.1," crayon physics, which you can find at clunygames.com."
1740.1,1741.1, Has been George?
1741.1,1742.1, Sadly now.
1742.1,1743.1, Okay.
1743.1,1745.1, K-L-O-O-N-I-G-A-M-U-S.
1745.1,1748.1," So, this guy, he actually has, he does a really cool job."
1748.1,1754.1," Every month or so, he has a, he publishes a game that he puts together in, like, a week."
1754.1,1758.1, And he has a lot of different creative things he's done over the past couple months.
1758.1,1763.1," And this one, basically, you, the art style, it's like you're working on a piece of construction paper or something."
1763.1,1769.1," And you have to get a, a little red ball from one end to the other of the, one part of the screen to the other."
1769.1,1771.1," In order to do that, you actually draw objects on screen."
1771.1,1774.1," So, you're actually creating physical objects that appear in the world."
1774.1,1776.1," So, you want to, you draw a rectangle."
1776.1,1779.1, If you draw a big rectangle that adds weight to it and drops on a beam.
1779.1,1781.1," And you want, basically, it's, it's, it's kind of like,"
1781.1,1785.1," It's kind of like a Google run a little, oh, a scene like a rub Goldberg line, right?"
1785.1,1787.1," It's kind of, you know, kind of, yeah."
1787.1,1791.1," So, basically, the thing is, like, you're basically creating all the things the environment on the fly and it's just, you know,"
1791.1,1792.1," It's the same kind of kinds of this line, right?"
1792.1,1793.1, Or that kind of stuff.
1793.1,1797.1," That's totally cool though, if it's just drawing something and having it, like, do something, yes,"
1797.1,1798.1, and they'd be a physical character.
1798.1,1801.1," Is all the pieces out there will, will tell us."
1801.1,1803.1, It's like Harold and the purple crayon a little bit.
1803.1,1804.1, Is that Harold?
1804.1,1805.1," Wait, is this, what?"
1805.1,1806.1," Here's the, what?"
1806.1,1809.1," That's different, assignment in the land of chalk drawings, right?"
1809.1,1810.1," Yeah, yeah."
1810.1,1811.1, Yeah.
1811.1,1812.1, I don't know what that is.
1812.1,1813.1," No, I do remember that."
1813.1,1816.1," Because I, oh, you know, my name is Simon, then the name is Draw Come True."
1816.1,1817.1," Yeah, yeah."
1817.1,1818.1," Yeah, because I always, I still had that song enough."
1818.1,1822.1," I was like, after a while, I was wondering if that shit was like my imaginary friend,"
1822.1,1823.1," or if that was really, that was real."
1823.1,1824.1, That was real.
1824.1,1827.1," You know, my name is Simon."
1827.1,1829.1," I was like, oh, I'm true."
1829.1,1830.1, Yeah.
1830.1,1833.1," It was like, I was like, I was like, I was like a segment for, like,"
1833.1,1835.1," like, Captain King of Rewords and Krabs."
1835.1,1838.1," It was on PBS, I remember it was like, with the letter people and there was,"
1838.1,1839.1," Bill X-Combin, a literature company."
1839.1,1842.1, Bill Cosby had some magic kind of crayon too.
1842.1,1843.1," Oh, yeah, picture pages."
1843.1,1844.1," Oh, those also."
1844.1,1845.1, That's the fun with picture pages.
1845.1,1848.1," What's the hard work you brought to you, I'm your, your kids."
1848.1,1853.1," You guys, well, you all don't have to remember the thing where you got the thing that you put it on your TV screen"
1853.1,1854.1, and then you drew.
1854.1,1855.1, You had to start the show.
1855.1,1860.1, I think you remembered because you had a daughter who was young enough to wanted at the time.
1860.1,1861.1," Probably, right?"
1861.1,1862.1, What?
1862.1,1863.1, I don't know what that is.
1863.1,1864.1, What?
1864.1,1866.1," You had a daughter, okay, as in offspring."
1866.1,1867.1, Yes.
1867.1,1868.1, You still have her.
1868.1,1872.1," And at the time, that that, she was on the TV screen."
1872.1,1873.1, She was at the age of the age.
1873.1,1874.1," No, no, no, no."
1874.1,1875.1, Watch what you want to say.
1875.1,1876.1, I was a kid.
1876.1,1877.1," Daddy, I want to."
1877.1,1878.1," No, when I was a kid."
1878.1,1879.1, Okay.
1879.1,1880.1, This is back.
1880.1,1881.1, I can't remember.
1881.1,1885.1," There's any, like, you know, 40 is listeners out there."
1885.1,1889.1, You remember the name of this TV show where you put this thing on top of your screen.
1889.1,1890.1, It's a screen paper.
1890.1,1891.1, That's right.
1891.1,1893.1, It was like a Vince parent thing and you would draw.
1893.1,1894.1," Yeah, what's saying?"
1894.1,1896.1," Okay, kids, now draw a big circle on the screen."
1896.1,1899.1, I used to do that on my own because paper would stick because of the static.
1899.1,1901.1," That was, it's your pages."
1901.1,1902.1, Really?
1902.1,1903.1, It worked like the same way.
1903.1,1907.1," It was like, cellophane just kind of like, yeah, except, you know, occasionally the dumb"
1907.1,1909.1, kid at home wouldn't actually have the same.
1909.1,1911.1, They were supposed to buy and they would just draw.
1911.1,1912.1, Right.
1912.1,1914.1, She wanted pretty quick that.
1914.1,1915.1, Was it for you that dumb kid?
1915.1,1916.1," Yeah, I was."
1916.1,1917.1, What?
1917.1,1918.1, What?
1918.1,1919.1, What?
1919.1,1920.1, What?
1920.1,1921.1, What?
1921.1,1922.1, What?
1922.1,1923.1, What?
1924.1,1925.1, Lips.
1925.1,1926.1, Coffee grounds.
1926.1,1927.1, Mommy?
1927.1,1928.1," Yeah, I used my brother's lipstick."
1928.1,1929.1," Pull, pull, go."
1929.1,1931.1, My brother's lipstick.
1931.1,1935.1," Well, that's from like, you know, America's funniest videos."
1935.1,1937.1, There's always the video.
1937.1,1940.1, The disaster scene where the parent takes a tour of their house.
1940.1,1944.1," And then it always like concludes with like a shot of the kid covered in either, you know,"
1944.1,1948.1," house paint, lipstick or there's like moms, maxi pads are all over the wall."
1948.1,1950.1, And the kids like airplane stickers.
1950.1,1954.1," They're like, or the DVD players follow up me, or whatever."
1954.1,1955.1, Right.
1955.1,1959.1," Or the dog did it, you know, like the whole house isn't shreds."
1959.1,1960.1, Just like Sim City.
1960.1,1962.1, Just like crayon physics.
1962.1,1968.1," So hey, it's rumored that the cast of GFW is considering putting together a podcast about PC games."
1968.1,1969.1, Really?
1969.1,1970.1, That's a vision.
1970.1,1972.1, That's the on topic podcast.
1972.1,1974.1, We do that every Friday.
1974.1,1977.1, We played that joke and everyone was like asking for it.
1977.1,1979.1, Where's the podcast about the PC games?
1979.1,1980.1, The joke.
1980.1,1983.1," You know, actually there's a podcast about like off topic stuff."
1983.1,1984.1, I see there you go.
1984.1,1985.1, You see the blues just go.
1985.1,1988.1, I get the ideas you're doing on purpose.
1988.1,1989.1, I don't know.
1989.1,1990.1, I have the irony levels.
1990.1,1991.1, I know.
1991.1,1992.1, I really love those two things.
1992.1,1993.1, Yeah.
1993.1,1994.1, I can't work my way out of that one.
1994.1,1995.1, That's how I do it.
1995.1,1997.1, I honestly have no idea what we were talking about.
1997.1,1998.1, I don't either.
1998.1,1999.1, Why do you play?
1999.1,2004.1," We got a game that's very, that they reminded us of all these dumb drawing things."
2004.1,2005.1, I think winky dink.
2005.1,2006.1, That's what it was.
2006.1,2007.1, Stop.
2007.1,2008.1, That was the name of the show.
2008.1,2009.1, The next thing we're going to be drinking.
2009.1,2010.1, Drinking.
2010.1,2011.1, We did.
2011.1,2012.1, We did.
2012.1,2013.1, We did.
2013.1,2014.1, We did.
2014.1,2015.1, We did.
2015.1,2016.1, We did.
2016.1,2017.1, We can firm.
2017.1,2018.1, That's my turn.
2018.1,2020.1, Confirm with me out there that the show was caught winky dink.
2020.1,2021.1, Okay.
2021.1,2023.1, Is anybody else playing anything other than Pacman on the Xbox library?
2023.1,2024.1, I was playing.
2024.1,2027.1," Well, this is a console game, but it has ties to the PC."
2027.1,2029.1, I was playing Prince of Persia classic.
2029.1,2030.1, Oh.
2030.1,2032.1, Me too.
2032.1,2034.1, Which it's on Xbox library.
2034.1,2035.1, Totally faithful.
2035.1,2036.1, Yep.
2037.1,2039.1, It's a remake of the original Prince of Persia.
2039.1,2040.1, Looks good.
2040.1,2041.1," It looks awesome, right?"
2041.1,2042.1, It does look really good.
2042.1,2046.1, I want now it's time for out of this world and flashback classic.
2046.1,2047.1, Hardcore of the game.
2047.1,2048.1, I agree to.
2048.1,2049.1, Yeah.
2049.1,2050.1, That level of ant.
2050.1,2052.1," I mean, is it animate that smoothly, too?"
2052.1,2053.1, Yes.
2053.1,2054.1, For all the.
2054.1,2056.1, That was all wrote a scope back in the right.
2056.1,2057.1, Right.
2057.1,2058.1, So do they do the equivalent of that?
2058.1,2059.1," I mean, now they all like they're not wrote."
2059.1,2060.1," Scoping is a 3D, right?"
2060.1,2063.1," It's it's presented as 2D, but it's 3D graphic."
2063.1,2064.1, 3D on a 2D.
2064.1,2065.1, And it's still.
2065.1,2068.1, But you and you still character from the new games that bad Prince.
2068.1,2069.1, They use that.
2069.1,2070.1, Yeah.
2070.1,2071.1, He doesn't play that guy.
2071.1,2072.1, Cool.
2072.1,2074.1," But do they still obsess over the animation, although it's clearly not"
2074.1,2075.1," Rota scope, or they still."
2075.1,2077.1, Does it have that degree of fluidity?
2077.1,2079.1," Where everything is, you know, this just really just."
2079.1,2080.1, I think it was really.
2080.1,2082.1, I'm sweeping in just room.
2082.1,2083.1, It looks the same to me.
2083.1,2086.1," Not the same, but it looks fluid in that way."
2086.1,2087.1, Yeah.
2087.1,2090.1," It's still a great game, but the thing that struck me this weekend when I was playing."
2090.1,2093.1," It was like, I guess I just forgot how unforgiving."
2093.1,2095.1, And Prince of Persia is as a game.
2095.1,2098.1," I mean, you do get the kind of the warning if you're getting to the edge."
2098.1,2099.1, You get that.
2099.1,2100.1, Whoa.
2100.1,2101.1, Sort of thing.
2101.1,2107.1," But there are just I slipped and fell into, you know, down eight flights and smashed my body."
2107.1,2111.1," I don't know how many times just from, you know, one little slip of the control."
2111.1,2114.1, Does it start you the very beginning of the level once you do that?
2114.1,2115.1," Well, there are check points."
2115.1,2116.1, Yeah.
2116.1,2117.1, There's checkpoints.
2117.1,2118.1," But you lose a life, you know."
2118.1,2119.1," I mean, you lose."
2119.1,2120.1, It counts against your time.
2120.1,2121.1," Oh, and against your time."
2121.1,2122.1, Yeah.
2122.1,2124.1, It's a lot of old games.
2124.1,2125.1, I would like that though.
