start,end,text
0.0,7.44, Hello and welcome to the June 4th edition of Jeff W. radio. Jeff Green is away for the
7.44,14.24, game. He's enabled to host this podcast. So I'm doing it in this place. And I'm joined
14.24,23.04, by in the following order for my hands. God Robert Ashley. Sean Elliott. Sean
23.04,28.16," Moli. And today's show is going to be short and I don't even because Jeff's not with us,"
28.16,33.92, but because we just got done taping another segment on Don and War 2 that's going up on Friday.
33.92,38.0, So rather than look at it is just getting a single short show on Thursday. I think it
38.0,42.239999999999995," is a two-part show where you get to hear it Thursday. Yeah, right. I assemble it later on your own."
42.239999999999995,49.2," It's like a project. With that, I want to jump right into a thank you to a listener. We have this"
49.2,55.68000000000001, thing where we like to receive candy from parts of the world outside the universe. And yeah.
55.68000000000001,61.120000000000005," Or in this case within the United States as long as it's Puerto Rico. So we get alert and says,"
61.120000000000005,66.4," Jeff W. Thanks to Mr. Bush. I have 600 bucks to spend on candy and I live in Puerto Rico,"
66.4,70.72, which is neither a state of the union. Still he gave me cash. Here's some candy for me.
72.72,76.64, He didn't leave his name. He left his Xbox Game of Teg. I don't know if he wants me to read that.
76.64,83.76, So I'll just say it without the whole thing. We'll calm seal. So thanks so much. The candy was awesome.
83.76,86.88, I'll talk about that real quick in a minute. But then he also adds PS. I got some Puerto
86.88,92.72, Reek and Run with Ryan's name on it. He'll be talking like Al Pacino in no time. Sorry for not
92.72,98.4," buying GFW magazine. We don't get the magazine here but I love the podcast. So yeah, thanks for the"
98.4,105.44, candy. Puerto Rico candy is different. It's a lot more natural than the gummies and the sour stuff
105.52,110.32, for mouse wear. It's just like there's never more than two ingredients and one greens always sugar.
110.32,116.8," So it's like he's coconut bars really good. It's coconut sugar. Yeah, there's like sweet potato balls,"
116.8,122.32," sweet potato, I sugar. Oh, wait, wait. What was the sweet potato aspect? Was it like a sweet potato,"
122.32,127.84, like cooked like a mash kind of thing? And they were just like these like balls. They actually
127.84,133.52, looked like little turds almost. That's appetizing. That's true. Kind of very appetizing.
133.60000000000002,139.44," Herpilished turds. Yeah. It those were good. I read. I read some sesame, you know, some"
139.44,144.88, some sesame seed glued together with some sugar and that was good. The one that got a little
144.88,151.44, funky was there were these um how to describe it. It was like a construction construction paper
152.08,157.68, cone cups. In the way that you'd make like yourself a paper drinking cup or gummy in school for the
157.68,162.16000000000003, hell of it for water and it you can get like all one drink for the bottom falls out. So imagine
162.16,166.48, one of those and that's your candy wrapper and it's just it was just corn and sugar in it.
166.48,172.64," But when you eat it, it tastes like sawdust or something. It's like eating cat litter in that the moment"
173.68,178.48, drops in your mouth. It's like you the red glass of water. 600 bombs or something. Like you just
178.48,186.88," have no no saliva or anything. And wait, what was the consistency? Like I said imagine, yeah,"
186.88,191.68," it was powder. So imagine like concrete mix, cat litter or sawdust. Any kind of thing like that"
191.68,195.36, that will soak up that will quickly soak up. It's like eating like raw metamusel.
197.36,202.0, The doubt is to keep coming back like any of the work and it was bad and then I tried to give it.
202.0,206.88," I tried to give it to people around and no offense man. And if sealed, this is your favorite candy"
206.88,211.52, Puerto Rico no offense. I'm guessing you probably just get like stickers and stuff though and you got this for
212.4,216.0," quality. Yeah, for the knock. It's not wicked. It's not wicked. But if you like it, no offense."
216.0,218.88, These flies to next time. You're supposed to put it in water.
218.88,223.92," Yeah, that's the thing that's struck. Think about candy is you can like it or you can't."
223.92,227.92," I mean, yeah, that's where you gave me one of those and you're like, try this is good."
228.48,232.16, That's when you know not to. I tried to give it to everyone in the office and every time I'd
232.16,235.51999999999998," go up to someone they would like you like no thanks. I'll be like, why? No, like,"
235.51999999999998,241.2, maybe because you have a fucking reputation. That was going to buy your shit eating green on my face.
241.2,244.64," Well, this is the last time you went around the office given away good candy."
244.79999999999998,248.64," You know, dude, you're just really good candy that I'm totally not going to eat myself."
248.64,254.72, I didn't. I ate it in front of people and from a Scottish sharky and I got him to try like half a little bit.
254.72,259.2," But even that most people just wouldn't even do it. Anthony dried some and I was like, dude,"
259.2,264.15999999999997," your tongue is not going to turn black. Your mouth's not going to burn. Like, whether it's not you're not going to get diarrhea."
264.15999999999997,268.64, Just do it. They wouldn't do it. This is the presentation. Like if you should have brought one here.
268.64,274.24, I would try it. I would have tried it on the show. If you had invited people to come into your office and just had an
274.24,278.32," array of candies, a bit of people would have tried it. But if you walk up specifically with one candy,"
278.32,284.72," like, hey, I tried some unwrap to candy. Like, before the more sincere you are with something like"
284.72,292.96000000000004," random, the more I know that you're not really sincere. So it's a trick. Thanks for the candy and"
292.96000000000004,299.2," keep sending it to us. And so let's, we got a lot to talk about. Jeff, would say, obviously."
300.15999999999997,304.15999999999997, I want to start talking about the games who played in Robert. I know you played Trials 2.
304.15999999999997,310.47999999999996," Yeah, as a vibe. Just came out of Steam. Eight dollars. Trials 2. And it's a fitting name."
310.47999999999996,314.71999999999997, It's as fitting in names. And it's the most like accurately named game probably.
314.71999999999997,318.96, It sounds like a little bit of a risk by the title. I would guess it is just like a pure game.
318.96,328.8," Oh, yeah. It's, well, I mean, basically. It's a, it's a motorcycle sort of stunt platforming game."
328.88,333.92, Sort of all physics based. Imagine pitching this as you describe it. Yeah. It's 2D.
333.92,339.2," Basically, although you can go into it. But it's three graphics, three different graphics. Yeah."
339.84000000000003,346.40000000000003," But yeah, it's sort of you, you've got a sort of a trial bike motorcycle. And they set up all"
346.40000000000003,351.92, these different courses of ramps and all kinds of obstacles and stuff. And the game wants you
351.92,360.08000000000004," to use this pretty, you know, serious physics to get across these obstacles. And yeah. And I,"
360.08000000000004,364.8," you know, I downloaded, before it was on Steam, I downloaded the trial version because I remember reading"
364.8,370.0," it in a trial trial. Yeah, exactly. Because the rock paper shotgun was, I had a mega hard"
370.0,374.8, hard on for it. And I tried to thing well back. And I liked it. But I didn't download it. And then
374.8,380.56," so it came on Steam. And I, and I obsessively got into the game. This is what happens."
380.64,386.24," Nearly, nearly entirely because I'm such a glutton for punishment. It's really, it's like,"
386.24,390.4," you know, like unplossed. Ryan's thing for like collecting stuff. Like, you know, you,"
390.4,394.48," you had to get your achievements. Like, I'm like that when it comes to like, finishing, you know,"
394.48,400.0," like, you know, your achievements and team fortress. Oh, yeah. I'm like that except I'm compulsive"
400.0,406.48, about completing something that is retardedly difficult. And the game encourages it because
406.48,411.6, it can sort of let you reset at any point in these race tracks there. The is a little like
411.6,417.04," check points that when you cross them, you can reset back there and try the same jump over and over and"
417.04,424.24," over again. And I, I mean, I just succeed in the smallest increments possible and feel okay about it,"
424.24,429.6," too, right? So say if if a single course, like, and it says again, the whole thing is viewed from the"
429.6,434.08000000000004," side. It's 3D engine, but you're only able to, you can, you can, this is called front loading a"
434.08,437.76," back loading, I believe, in motorcycle terms, I'm probably, probably, I know loading is involved in"
437.76,441.59999999999997," it, but you basically lean forward or just your weight to the back of the bike. Those are options."
443.44,446.64," And when you're in the air, of course, that will control, like if you're, you know, your bikes"
446.64,450.88, going to tumble forward or backwards and then acceleration and breaking. And you basically just go
450.88,456.56," from the left of the screen, eventually to the right, but across the number of like, just grueling"
457.12,461.12, challenges where you might have to jump something. And there's no way you're going to just basically
461.2,464.88, hit a ramp and land on something else. What's going to happen is that you'll get your front wheel.
464.88,470.56," If you're angled enough back, your front wheel will hit the, uh, the top of the, the next landing platform."
470.56,474.8, And you're back wheel will kind of be down on the side. And you'll have to use the momentum of that
474.8,480.48," to haul itself up over the ledge onto the next thing later on. There's like, it's saying loop"
480.48,484.88," the loops and when you come out of them, you need to be crouched down so that as you pass through."
484.88,488.8," So say, say, you do a loop and you pass through the exit tunnel, your head's going to get taken off."
488.8,492.8," If you don't duck down. Yeah. So you think that you're like, okay, that's cool. And then like something"
492.8,497.12, always goes wrong. But although that level that you're talking about is probably my favorite level
497.12,502.0," in the game that I've played. I think you're talking about, uh, don't, or where's the ground. I think"
502.0,505.84000000000003, it's one of the medium levels. Yeah. And I actually played that one like five times because it got to the
505.84000000000003,511.2, point where I could actually just get the all the way through that ever stop it. Yeah. And if it was really fun.
511.2,517.2," Like that is, it has a really cool jumps and stuff. But part of like the, the hard time I had with"
517.2,522.88," the game, when I first started, aside from the fact that the tutorial is like to use the shitty"
522.88,529.5200000000001," pun, like the difficulty ramps up. Oh, but like the tutorial, like absolutely does not understand"
529.5200000000001,533.6, the purpose of a tutorial to ease someone into something and a challenge that's going to
533.6,538.5600000000001," come increasingly, you know, difficult. And it throws you at stuff. And I was ready to uninstall"
538.5600000000001,544.5600000000001," after giving up on like one of the later tutorial parts. Yeah. And but later on though, when"
544.56,549.28," when you hit it, like, okay, I get this. Here's a bike. And here's this crazy corkscrew thing. It kind of"
549.28,554.4," looks, it kind of reminds me a little bit of, uh, what's the flash game that's now coming to consoles"
554.4,558.64," where you're on a little bit. Line right. Line right. Yeah. And like, maybe it's just about fluidly"
558.64,563.92," finding some path through here. But then it does have this, you know, in the tutorial thing,"
563.92,569.52," you can watch a demonstration run. And when you do it, it will not only show the bike navigating"
569.52,574.0799999999999," it, but it will have the keys illuminate on the screen and let you know exactly when they're"
574.1600000000001,578.0, leaning forward by how much when they're like hitting the brakes when they're going back. And you
578.0,583.12," watch it. And it was just this really interrupted ride, whereas always punctuated by full stops."
583.12,588.4000000000001," Like you hit a jump, boom, hit the brakes stop, adjust, prepare yourself. Go to the next one."
588.4000000000001,592.88," Yeah. And and I was like, okay, that's a different way of looking at it. And then when I started"
592.88,598.4000000000001," to play it, yeah, like there were times when, because for the most part, I'll never do more than like"
598.4000000000001,602.8000000000001, hit two or three checkpoints at a time without having to try and try again. When you do
602.8,607.8399999999999," what you're like, okay, that's good. But most of the time, I mean, God, I think you could try,"
607.8399999999999,614.16," it'll keep track of your temps. I try like 80 times to make a single, to navigate a single little"
614.16,617.92, jump on it. And you get to the point where you know you become frustrated instead of even thinking
617.92,623.28," anymore, you're just like going at it full speed and to see what happens. Maybe you could brute force"
623.28,629.28," it and just get you through. And it's a really good game, well, it's a, it's not a good game"
629.28,632.0," for, but if it's a kind of game, if you're going to play it, I believe you should play it in"
632.0,636.08, ventrilo when you're talking to other people because it's like the fact it's something to
636.08,639.52," do in the background. You know, I don't think it should command like the entirety of your attention."
639.52,643.52," It's like when you're on the phone with someone and you got a pen or if you're doing like right now,"
643.52,647.44," you're playing with chords and stuff. But like it's, if you're doing on on your phone, but"
647.44,651.52," controlling. You should play it while you're listening, you have to be ready. Yeah. Yeah. I think that"
651.52,656.72, will be perfect. Load it up right now. I'll give you a minute. So this game sounds like a
656.72,663.36, site bike with hardener. It's not like a site bike at all. But it is sort of in that like it is.
663.36,669.0400000000001, Go like a bike ramp. Did have a really rude inventory kind of a momentum thing going on. And this
669.0400000000001,674.5600000000001, game is all about like what you're doing with your momentum and with your springs and your bike
674.5600000000001,681.36," and stuff. And like I found it, you were talking about using the keys after, after the first few"
681.36,686.64," levels, I plugged in my Xbox controller and found it to be easier that really."
686.72,692.56," Yeah. Yeah. Then try the keys. But it seemed really vintage. Then like a lot of times,"
692.56,699.1999999999999," just like tap tap can. I mean, and but like the analog stick is nice enough for that. And so"
699.1999999999999,704.4," something about it, just I don't know. Like I maybe it's just because I'm still such a console gamer,"
704.4,710.08, but I found it to be just more intuitive than using my right hand on the on the arrow keys.
710.1600000000001,712.0," Oh, you didn't use WST."
717.0400000000001,722.8000000000001," You are a console gamer. The other if not for the fact that it throws the physics angle on it,"
722.8000000000001,727.6," and it's both. And it's sometimes it's fun. Like when you crash, your guy becomes like just"
727.6,736.24," just epileptic mess of, yeah, you know, twitching and the bike goes flying across the the warehouse"
736.24,740.5600000000001," citron, which I meant to say, like so we're playing. It's not going to be funny. Now I'm repeating it,"
740.5600000000001,744.8," but as we're, you know, the reason to play in the vending is as we're all doing it in screaming, like,"
744.8,750.16," fuck, our shut up. Oh, I did it. And it all sounded like fuck, fuck, fuck, fuck, fuck yeah, fuck."
752.16,755.92, I just pointed out that the whole thing set in the same warehouse that one of the people who
755.92,760.08, is invented with me were where his mom filled all of her porno's.
760.4000000000001,766.08," Oh, because the whole thing is in the warehouse. But so it weren't for the physics. I can almost"
766.08,771.12, abstract the game and say it's not to me like excited bike because it almost could be anything.
771.12,777.12," It's really just this, it's really a puzzle game. And it has to me so much in common with like when"
777.12,780.96," you go to those novelty shops in the mall, they'll sell games and like expensive pool tables,"
780.96,785.76, but then they'll also have like a guardian knot that you could buy basically spend the rest of
785.76,791.28," your month trying to untie like it's supposed to be fun or like a peg board, you know, a ball"
791.28,796.08, onto the on a maze board or something like that or all those puzzles where you know if you take
796.08,800.88," it apart, you're never going to get it back together. Yeah. Sometimes it approached that and where"
800.88,805.36," you just give up or like, you know, like again, where you just when you get to the point with"
805.36,809.04," Rubik's Cube where you're like, fuck it and you just take it apart and put it back to the back"
809.04,814.24," to kill your game. But there is something about that time to try to do. I mean, I like,"
814.48,818.48, I have a love hate relationship with those kinds of games. It's like that game in plus that I
818.48,824.96," talked about, you know, like where it's just these really brutal games that that expect a kind of"
824.96,832.24," precision from you and in order to get it, you just have to try again and again and again and"
832.24,838.5600000000001," perfect your technique and there's nothing that you're ever going to fucking do with that technique,"
838.5600000000001,842.64," but play this video. Right. It's not like you're learning anything helpful, but something about"
842.72,848.96," the process is satisfying to me, even though it's a totally pointless. Yeah. Now, I have this game"
848.96,855.12," got to the point where I literally did have to uninstall it. I have a question. Like, it sounds like"
855.12,859.76," it's evil, but how evil is it? Does it like if you do succeed? Does it say good job, but you only"
859.76,863.52," got a silver medal because you could have done that in like six less moves or something. Well,"
863.52,870.24, we're back. You see your performance in the context of everyone else's. So you get to find out that
870.24,875.76," you after spending, you know, 40 minutes going through a single level that had you never"
875.76,879.76," fucked up, would've taken you like two minutes? Right. Because when you wish to do it, you're never"
879.76,885.04," fine. Yeah. Yeah. 7,000, 100 hits. Wow. So it's pretty, it's pretty bad. Because when you"
885.04,888.96," mention those like little peckboard puzzles or whatever, like yeah, you can solve it, but then"
888.96,894.72, all of the always print on it. You can solve this in a 11 move. Yeah. It's like try a shit. Yeah.
894.8000000000001,900.4," There's something good in that and that you can, you can play other people's ghost runs as you're"
900.4,904.32," going. And I was trying to get us to do that. Like, Rory and I, we're all in the same thing. And it"
904.32,909.44, became this race of like who could get through these things faster. And we'd always get stuck on the exact
909.44,914.5600000000001," same parts, you know, where he like, I'm still there, I'm still there. So it's like, I did it and"
914.5600000000001,920.72," I'm like, how? Fuck you. I know, fuck you. I'm on the next level. Yeah. Just do that. But yeah,"
920.72,925.6800000000001," those can get for me to require the, the competitor, the friend competitor, even like,"
925.6800000000001,929.28, Pac-Man Championship edition. Yeah. The only thing that kept me going was knowing I wasn't
929.28,933.44," number one on my friend leader board. I'm like, oh shit, he just beat me. So I got to play it and"
933.44,937.6800000000001, obsessed over it again. Yeah. Until like top that score. And then you have like an imaginary
937.6800000000001,943.28, rivalry. Yeah. Like beating Greg Ford's score. And he was my highest player on the Pac-Man.
943.28,947.44," Right. Then you, then you, I wanted it like, sin him to know it'd be in like, check the scoreboard"
947.5200000000001,951.7600000000001," bitch. But I don't think. Like, it's the, then you feel like you're done. Yeah. It's totally"
951.7600000000001,955.84," arbitrary because like, yeah, it's great for the score. I realize it might make sure I'm still at the"
955.84,960.0, top. Yeah. I don't know. I think you should try them because when you say it's an excellent game for
960.0,965.5200000000001," that. Oh, yeah. Sort of mentality. Yeah. Sure. And I think it is a fun game. I think what it needs."
965.5200000000001,970.4000000000001," And I think that there, that these exist, can you make a, can you make your own levels and can't"
970.4000000000001,975.6," you get user-created levels in that game? That I'm not sure of that makes. Because I would, I know you"
975.6800000000001,983.28," can, there are way too many like that they give you like 10, 12 levels that are of the difficulty"
983.28,988.88, that it's like challenging and interesting and satisfying. But then it goes immediately in. So it's
988.88,995.76," just nuclear Armageddon. And this is the thing. The people who made it, are they such savants"
995.76,1001.76," that it's beyond their comprehension that, that other people are going to get so frustrated with this."
1001.76,1006.24," That again, when I asked you about it in email, like, hey, someone else played this week,"
1006.24,1010.56, you talk about it. You made this comment about it. It's like kicking yourself on the balls.
1010.56,1015.28, But I didn't want to say anything. It's like doing it to kick yourself in the balls. Yeah.
1015.28,1020.3199999999999," Yeah. And when you shut it off, though, there's no like, you know, when you watch a movie or"
1020.3199999999999,1024.72," something and you kind of, or when you finish a book, you close the book, you have that sense of"
1024.72,1029.6," satisfaction. You walk out of the theater. Like this, you turn it off in a rage. And I'd say,"
1029.6799999999998,1034.32," most of the time, you contemplate on installing it, which is like a final violence you can do that never"
1034.32,1038.48," happens. You're like, oh, I don't finish reading the comment book and rip it in half. When you're"
1038.48,1044.8," done doing it. But so this game, temptation is always there to like not only close it, but to get it off"
1044.8,1049.9199999999998," to remove all traces of it. I love that about steam though because you can do that in a, you know,"
1049.9199999999998,1054.1599999999999," yeah, it's not really. You can always take it back, you know, but you can't."
1054.16,1062.0, To lead the lead local content. I saw a video on YouTube of a dude who sent these comics that
1062.0,1068.72," you didn't like back to DC. Thank you, showed me that. Like this one sucks like stuffing it in"
1068.72,1072.3200000000002, the box. Stay where it's like a letter and everything. That's cool. It's like the
1072.3200000000002,1078.24, anniversary of the discount tire commercial where the lady like throws the tire through the window.
1078.24,1085.52," Thank you, Stam and Connick's bag. He throws he shuts him in like their mail slot."
1085.52,1089.6," Yeah, make sure he bangs it if he doesn't know he's a great. But I think I think you can make"
1089.6,1096.16," levels in that game because I think I might be wrong about that. If you can't, then they definitely"
1096.16,1100.8, need to let you. That's a feature I just never use because no one ever seems to have the right
1101.52,1106.4," system for finding and sorting and filtering those things out. Yeah. They just need, if they're"
1106.4,1109.68," going to do that, they need like a really well, they should just have leaderboard string like"
1109.68,1115.92, most popular down like something like that. So I don't want to make levels. I just want to play
1115.92,1120.88," to feature I never use. Like if people, yeah, I mean, if like if you have some sort of quality"
1120.88,1124.5600000000002," filter, I guess this is kind of a slacken because this is one of the things that we could do,"
1124.5600000000002,1129.0400000000002," you know, I mean, we could like put together or talk about. And I think what some of them"
1129.0400000000002,1135.0400000000002, should definitely do is like you're saying make them so easy that the fun is is in just a continuous
1135.12,1141.36," run under insane conditions where you're never like, oh my God, how do I do this? Where you"
1141.36,1146.0, stop them stare at the screen and think how do I get from here to hit it? It kind of reminds me
1146.0,1150.6399999999999, of another thing. It's like the tradition of the concussion maps and team fortress classic.
1150.6399999999999,1155.76, They're mods where you basically just took and made them for medics and scout to both had concussion
