start,end,text
1155.76,1161.04, grenades and find ways for them to go through the most insane platforming circumstances that people
1161.12,1166.0," could conceive of. But I don't when you're thinking like okay, you throw a grenade down and you just jump"
1166.0,1172.3999999999999, up to a platform like they got so far beyond what what anyone could imagine that that has that's not
1172.3999999999999,1176.72, familiar with that asian actually played the things that it kind of reminds me of a game for that kind of
1176.72,1182.48," person. But eight dollars again, I think that it's not it's something that it's worth trying and seeing"
1182.48,1188.72," if that's the kind of if it's the game for you, you know, yeah, I mean, because because yeah, every minute"
1188.72,1192.88," when I came in, I was like this gave you that was thinking like this is this guy be the"
1192.88,1199.44," worst shit I ever played. Ten minutes later, I'm like I kind of like this. It's all based on that"
1199.44,1205.04," match the kiss that the fourth of I did it. I didn't do it. Yeah, and then Eli Porter again at the end"
1205.04,1212.08, of the level. The best night. I did it. Now I love the game a lot better if that's what happened when
1212.08,1217.84," you finish the when you finish the level if you like Porter. It needs more. It does give you fireworks,"
1217.84,1224.1599999999999," but it needs more like pego like you it needs oh to joy. Yeah, really big fan for like pego's like tell"
1224.1599999999999,1232.6399999999999," you you work for the opposite because it's really I mean, yeah, they're really difficult levels."
1232.6399999999999,1237.6799999999998," But if you fuck around long enough, you're going to get it. It's an act like when you do that you've"
1237.6799999999998,1243.1999999999998," attained like fucking enlightenment. That's something like that. The highest level. You man,"
1243.2,1248.72," if that is brilliant game. Yeah, but I can get down with that. Like again, that rewards you more than"
1248.72,1252.56, you deserve. It's like flipping a coin and then getting that for hitting tails or something.
1252.56,1257.44," I was like yeah, like they so when it needs a pego mod, where it throws up like full bright"
1257.44,1265.04," starships. No bell awards and like, okay, stuff on the screen in addition to the fireworks."
1267.04,1272.32, So you're granted access to heaven. What's one of the game that tells me that I'm a really good
1272.3999999999999,1277.9199999999998," person and I'm smart and good looking people like you. Like an affidination game. You know,"
1277.9199999999998,1281.9199999999998, like you just you get a headshot and then like people to start calling out of the woodworks to
1281.9199999999998,1288.1599999999999, congratulate you and and like tell you stories about how they knew that that you were going to be great.
1288.72,1292.32," Think of their games like that, right? I mean, their half-life like that half, you know,"
1292.32,1296.8799999999999," like half life two, you're going around every time you run into someone from the resistance. They're like,"
1296.96,1302.64," holy crap, are you Gordon Freeman? Yeah, you know, it's like totally ridiculous."
1302.64,1306.5600000000002," Hey, let's try to do that to some extent, you know, with like, yeah, that's domestic heat."
1307.5200000000002,1312.4," But I mean, they're I think they're getting a lot more literally do it in that like every little"
1312.4,1317.68," thing you do. They want you to know that, you know, yeah. Well, I mean, that's sort of what"
1317.68,1322.5600000000002," satisfying actually is about is just, you know, it's like the God of War thing. Like you don't"
1322.6399999999999,1328.08, have to make it like an ninja guide and precise as long as you make it seem like by hitting these
1328.08,1332.96," buttons, you are literally carrying someone's limbs off. Right. And yeah, giving you the most"
1332.96,1338.6399999999999," satisfying possible feedback. And it also borrowed part of, part of God of War, borrowed the whole"
1338.6399999999999,1344.08," like evolution or de-evolution of combos and games too, you know, or you stepped to work for it."
1344.08,1348.24," Then you got to the point where like Killer Instinct was really like, you had to, you had to"
1348.24,1352.32, input the equivalent of like a seven hit combo and Street Fighter or less and you'd somehow get
1352.32,1357.52," a idea. And now that gets to the point where these games, it's like all accounts is all the"
1357.52,1361.9199999999998," combo meters. It's how many times you fucking press the X button, the sense the time you turn the"
1361.9199999999998,1367.12," game on, you know. Yeah. But that's like another way of telling you, hey, you're doing good, man."
1367.12,1371.2, Yeah. You can't forget it. You bought it. Look at that. You just tore that guy apart.
1371.2,1377.4399999999998," Just you're the chief. I did that ninja guide too. Like you could surprisingly, that of all games"
1377.44,1383.1200000000001," where you know, uh, in a gaki, the producer is like, you know, this is a fighting game,"
1383.1200000000001,1387.52," tell the informs, this and stuff. I was able to just mash a guy with the same button,"
1387.52,1391.52," you get 100 and I got an achievement and all this stuff. It's like, wow. Yeah. I mean, like,"
1391.52,1396.16," definitely cry for you would use your solar, or whatever they were called, and I came to unlock"
1396.16,1400.4," basically, you know, level one of the kind of what XXX, then then you went unlock XXXXXX,"
1400.96,1405.76, you even mock XXXXXXXX. Yeah. That sounds almost as bad as dinosaur years.
1406.08,1410.4," Well, I mean, I don't know. People that think that like, uh, the achievements and games should"
1410.4,1415.84," be won through like seriously hardcore play or a little warped. It's like, you're not really doing"
1415.84,1421.52, anything when you beat Ninja Giden to the hardest mode besides ruining your life.
1422.72,1426.56, All right. True. You are not doing anything. Read a fucking book.
1426.56,1429.6," You had to be careful that you don't review like game for anyone, because then all the, the,"
1429.6,1430.72," the, the, the, the, the, the, the, the, the, the, the, the, the, the, the, the, the, the, the, the, the, the, the, the,"
1430.8,1435.3600000000001," review game. See, dude. He's just busy. You know, could handle it. Yeah. Whatever."
1435.3600000000001,1442.48," You're nice to move. I got that. What else are we playing here? Oh, I, I'm boring. I was, I actually went"
1442.48,1448.4," back to GTA 4 and tried to put it down to that. So enough, GTA 4 to talk for a entire lifetime."
1448.4,1453.04," If we don't, I mean, I know Conan's and come up. Yeah. I got Star Clear Sky, which we're free to talk"
1453.04,1458.8," about. Oh, good. And, but it, I mean, I haven't been playing. Sort of, I've been playing."
1458.8799999999999,1463.28," Right. I'm talking about, like, it's like, I'm talking about, like, it's like, I'm talking about, like,"
1463.28,1468.6399999999999," go Indiana Jones. Yeah. Tell us about in the, that's got to be definitely along the lines of, like,"
1468.6399999999999,1473.04," a game that, because all this, oh, that make a Star Wars games are all about, like, way to go."
1473.04,1477.04, That's why. Yeah. Yeah. Yeah. Yeah. Absolutely nothing. Yeah. That's what that is. Those
1477.04,1482.56," teams are, wake cool. You go in play. So it is, like, the indie is the Indiana Jones game is as cool as this."
1483.28,1485.52, It's like exactly the same. It's yeah.
1486.48,1492.08," It's like though, except you're Indiana Jones and not, not Luke Skywalker. I admire this"
1492.08,1499.36," games for allowing you to progress in them, no matter how impossibly Drunk you are. Like, you"
1499.36,1505.76," cannot be, you can't like, you know, your mind cannot be altered to the point that you would not be"
1505.76,1510.08," able to be Lego Star Wars. Our cake games worked that way, but it just was about how much"
1510.08,1514.08," I'm, I'm, many quarters you had. Yeah. But you could be, you could conceivable be as, as Drunk"
1514.08,1518.96," is, you could, in the Hill stand. That's maybe leaning on the cabinet to maintain."
1518.96,1522.24, You got it. You got it. You could still do it. You guys still go to the right.
1522.24,1526.8799999999999," But you just, you're frigging certainly in you. I guess that's true. Yeah. That was totally a game where"
1526.8799999999999,1532.08," Star Wars were, um, this would have bugged me in any other game, like the force powers you have"
1532.08,1536.0," were you allowed, were you press a button to stack up Lego's in a way that lets you access"
1536.0,1539.6799999999998," a new area? Any other game I would have been like, how come I don't, how come they just don't,"
1539.6799999999998,1543.4399999999998," like, lay the legos out and say, try to stack up something you can climb. This one, they just, like,"
1543.52,1547.76," press X, it builds into a steering wheel. So what, and that was okay for me for you. Yeah, yeah, yeah,"
1547.76,1552.4," because it's freaking Lego Star Wars. There's about Lego Indiana Jones right? How is it, like,"
1552.4,1557.92," utilizing sort of the Lego brand? How is it leveraging the Lego brand? No, how, how is it using"
1557.92,1563.6000000000001," the, how is it using the Lego theme? Because unlike some of the other Lego games that I've looked"
1563.6000000000001,1568.4," at screen, that I've looked at screens for, show you how it forms that. I've looked at screen,"
1568.4,1575.8400000000001, whole world of Lego games. This one I'll see natural environments with Lego components and
1575.8400000000001,1580.24," it and stuff. Like, it's like your plan, Lego's in the grass or something. Right. It's, I mean,"
1580.24,1584.88," like, it's like, Lego Star Wars, like the whole world. I don't say I haven't played Lego Star"
1584.88,1590.16," Wars so, so like, break it down for me, like Robert made me break down the world of Warhammer"
1590.16,1597.52," 40 times. Like, the whole world, it's not, it's not all, it's a Lego world. I mean, there's objects"
1597.6,1602.8," made out of Legos. Like, you know, you, you, you got this hub area that's the university where"
1602.8,1608.16," Indiana Jones teaches. And that? Can you teach a class? You can't, you can go,"
1608.16,1613.68," punch out some people walking around the school. You just do that. But, you know, like, there's a"
1613.68,1618.8799999999999," library, there's bookshows, there's normal look and bookshows. So, yeah, so people in the"
1618.8799999999999,1624.4," man made artifacts are, I mean, there's some Lego like plant and stuff laying around, but it's mainly"
1624.48,1629.3600000000001," just the character. The characters are done in the Lego style, right? I mean,"
1629.3600000000001,1633.92," that's really, in those games. In those games, they're made of Legos matter in this, though."
1633.92,1639.68," I mean, in the way that you're, you're talking about composing things from the Legos and the"
1639.68,1643.68," Empire. Which don't do Star Wars. Yeah. You, I mean, the game doesn't for you. Oh, I see."
1643.68,1648.16," I mean, there's, it does seem like you see little stuff in the cutscenes, but like,"
1649.6000000000001,1654.3200000000002," you know, in the scene and Raiders of the Lost Ark where the big German mechanic"
1654.32,1663.36," gets his face, whatever happens to it with the propeller. There's a scene like, there's a cutscene"
1663.36,1667.36, like that. It shows like that happening and then you'll see like his Lego body running around and
1667.36,1671.2, then his head bouncing around and depending on the way. You can show extreme violence without
1671.2,1675.2, actually having a Lego. Nothing like a good decapitation joke with Legos.
1675.2,1682.32," Yeah. So, they have, you know, like the Boulder rolling down the tempo, but the"
1682.3999999999999,1687.2, Boulder's made out of Legos. They do. Exactly. I've seen that screen up. That is the first thing
1687.2,1693.12," they came to mind. Yeah. The Boulder's made out of Legos. Yeah. So, is it like, I mean, it's all"
1693.12,1698.8," us. I'm kind of disappointed. Like, if it's not really using the Lego stuff on a on a structural"
1698.8,1703.4399999999998," or game play level, I mean, if it's using them, you know, for gags and for the visual element,"
1703.4399999999998,1709.4399999999998," what kind of game is it? Is it, is it just your typical, you know, action platformer type thing where"
1709.52,1716.96, you go through the environment? It is. A lot of the challenge lies in sort of the puzzles.
1716.96,1722.4," You know, figuring out how to open the door to this next area. Yeah. Which involves stacking"
1722.4,1727.68," up Legos, like you said, same thing except you're not using the force. How are you stacking them"
1727.68,1735.1200000000001," just? Just a manual. I mean, there was a thing about, I mean, like the Star Wars game wasn't"
1735.1999999999998,1740.3999999999999, so much like Legos and forms what you did with it. It was that the Legos created the
1740.3999999999999,1746.8, lightness to it. Yeah. It was like a very non-serious world. Yeah. There were no consequences. It's
1746.8,1751.6799999999998, it's not. Yeah. It's just sort of. It could be to big playground. Yeah. There was a lot of
1751.6799999999998,1755.9199999999998, elasticity like there I think. It's wildish. Yeah. Thanks for turning into other things just because
1755.9199999999998,1760.3999999999999," they could. And it's not like you had necessarily, you were more watching this happen than directly"
1760.4,1767.52, a fact how it happened. But the lies and pigs are made a Lego movie. Maybe it's all about branding.
1767.52,1772.72," They can't afford the license. People don't like it. Dane's the judge. Because net double, the auto"
1772.72,1776.96, cell folks are those ones who have the Lego universe license because that sounds like what they're
1776.96,1781.92," trying to do. They're making an MMO out of Legos, which at first you're like, what? Then"
1782.8000000000002,1787.92, if you think about it and what you're talking about with like what you really can do with Legos
1787.92,1792.64," and that's, you know, build whatever the freak you want. Yeah. That could be really fun."
1792.64,1796.0," I'm fine with like, well, Legos. I can't say that with the Lego brand. Oh, yeah."
1796.0,1801.1200000000001," So what if you take an MMO and it's got like elements of Gary's mod and also, you know,"
1801.1200000000001,1805.52, little big planet because of it because of the way that the Lego stuff works. Then they can get
1805.52,1810.96," the what are the advanced, what are Legos for like for like for honor role students called"
1810.96,1816.48," you get like batteries. Oh, right. You got like why would it about the Lego monster? Yeah. I've"
1816.56,1821.28, been tempted to buy this for because you can build like robots and then that's like its own programming
1821.28,1825.3600000000001," language so you can program your robots AI and all this stuff. Well, it's weird because Lego is"
1825.3600000000001,1830.96," themselves over the years. From what I remember Legos being as a kid, like Lego is now our a lot more"
1830.96,1835.44," about like we give you a blueprint to build this very specific thing. Yeah. Whereas when you're a kid,"
1835.44,1840.56," it's like, here's a bunch of freaking Lego. I don't just build what you want, kid. I never got like,"
1840.56,1845.28," yeah, the box sets they have now. If you go out of toys or us or whatever. I mean, I would specialize"
1845.36,1849.44," components, but the mindstorms thing definitely is not about I mean, they'll give you some things you"
1849.44,1854.24," can build, but it's it's a lot more open and people do build a lot of weird stuff with it. Did the"
1854.24,1859.84, Legos themselves change or people just less like get out than like we were because I know it was
1859.84,1864.8799999999999, the same. I never saw like I never got Legos in a box. Like I got like a bag of Legos sometimes
1864.8799999999999,1870.48," there'd be do flow blocks there and a link a lot. I'm sure you can still get that. I mean, the Lego"
1870.48,1875.04," store or maybe what you make like there's no I mean, go to Lego store and fucking come and"
1875.04,1879.92, this back there's bats of these areas like I need I need a handful of green ones that have two
1879.92,1884.48," connectors. So you just can buy them in bulk Legoelibians, but yeah. And like if you do go to"
1884.48,1889.28, toys or else they don't have the variety kit anymore. And I'm assuming kids don't think kids are
1889.28,1893.6, so creatively deployed maybe they are. That they wouldn't construct their own things out of their
1893.6,1898.1599999999999," multiple Indiana Jones sets that they've been given over various birthdays. I mean, yeah, I just"
1898.1599999999999,1902.32, still have that ability once you have a few of them. I definitely got stuff that was specific when
1902.32,1908.56, I was a kid. I remember I got like a castle place. I got like a castle thing that was very
1908.56,1913.6," specific, but then I would use parts of it to make like spaceships and stuff. Yeah, it didn't work."
1913.6,1917.76," It was like, but it was like it did make cool walls because the castle walls were these"
1917.76,1922.3999999999999," like specific pieces that fit together and had windows. And so this made to make a castle, but you"
1922.3999999999999,1926.96," could go to stuff with it. Yeah, I always made like the most ridiculous looking things, because I just"
1926.96,1933.52, didn't have any care about the aesthetics of like the colors. Yeah. So I was not going to bother to
1933.52,1941.44, like try to match colors up. And so everything I made looked like total junk shop like bright.
1941.44,1946.32," I think she made some beautiful light gray genuishes. Yeah, actually I never had a light bright."
1946.32,1950.32, Really? I wanted more than that. Well that's like how many houses light brights burned down.
1950.32,1956.8, Light bright for you. A younger listeners is basically like a plastic little cabinet with the
1957.44,1962.16, light bulb in the middle. Pretty hot light bulb. And then like a grid you put a black piece of paper
1962.16,1966.24, over that and seal the whole thing up and there's this grid with holes for pegs and you put
1966.24,1970.4, colored pegs in and it punches through the black paper and then illuminates the lighted peg.
1971.1200000000001,1974.8," Yeah, but in most cases it was like, yeah, you're saying you just stick a bunch of sheet in there and"
1974.8,1981.68," I know that was fun. I see a lot of bands can we do it? Yep. All right, like as stage comes up."
1982.48,1988.88," Yeah. Oh, the Lagos Lagos or we're a big part of growing up for me. I always went to the"
1988.88,1993.2, state fair of taxes and went to the Lego competition and looked at the things that people
1993.2,1998.64, made with Lagos and wish that I could like make my own like giant thing. People would make like
1998.64,2003.52, cities or they'd make the Millennium Falcon or something you know before they had the cans of
2003.52,2008.72, price. Yeah. Like giant scenes where you know you had people still do this today but you know where
2008.8,2014.0, it's like a thousand dollars with the Lagos or something you know every every poor kid coming through
2014.0,2019.3600000000001," there's like, oh, I wish I could take that apart Lego win and they've got entire cityscapes and stuff."
2019.3600000000001,2025.44," Yeah, yeah, instructions of Paris and New York. So Ryan and me and anything else on any other thoughts on"
2027.3600000000001,2036.08," it's pretty fun. Pretty fun. Good mindless fun. Yeah, that's how I would character. No context"
2036.56,2042.8, anything. Yes. It's good to have that teach your children. Nothing they don't already know.
2042.8,2048.4, Okay. That's true. So we saw Robert you played some you're still playing stalker right?
2048.4,2054.08," Yeah, sir. I'm sort of held up at the moment. They came by with they being Jesse Game World"
2054.08,2059.12, came by with the stalker clear sky which is kind of like a prequel. Well it is a prequel.
2059.12,2062.08, I don't know why I said kind of. I got to go guys and I'll feel right.
2063.04,2066.72," Well, so yeah, they keep by with the prequel and it's uh"
2068.08,2072.64," first of all, it's just visually arresting. I mean, this is what they showed us. They turn it on and they're like,"
2072.64,2077.2799999999997," before they even explain anything, they just kind of like loaded up, walk around this town,"
2077.7599999999998,2083.2799999999997, speed up the movement of the sun across the sky so that you see the dynamic shadows and stuff and
2083.84,2089.84," win going through. Doesn't make that though. I know. And so you're like, well, you got your way"
2089.92,2093.04," because the first thing I'm talking about is that yes, it looks better than stalker, which I thought was a"
2093.04,2099.6000000000004," pretty good looking and highly atmospheric game. But um, it was kind of a weird demonstration."
2099.6000000000004,2103.6000000000004," It was there's some language barrier there just asking, well, what are you showing us? What are"
2103.6000000000004,2110.32," like the consequences of this? Why are you doing this? Um, one thing that did sort of, I was"
2110.32,2114.4," able to, you know, make sense of immediately when they showed us this, there's this marsh level."
2115.12,2119.12," And of course, inspired by, uh, I think it's the Pripate marsh, it's not to come to you"
2119.12,2124.48," can be used with Pripate out, but there's the large, you know, bunch of, you know, marshy terrain"
2124.96,2129.36, and Ukraine. And it looks like images of that from what I've seen. The interesting thing about
2129.36,2133.2000000000003," is that when you're going to make an environment stalker, let me back up as a first person shooter,"
2134.7200000000003,2142.88," made in from a Kiev studio. And so it's set in the Chernobyl vicinity, the Chernobyl reactor,"
2142.96,2148.88," takes place in this, you know, alternate world where, uh, the reactor didn't just melt down, but"
2148.88,2152.96," it caused all sorts of supernatural stuff. And instead of it ever being, you know, handled in any"
2152.96,2158.1600000000003," way, shape or form, it kind of becomes like a Russian madmax now, lying area. So you're in these"
2158.1600000000003,2162.08," marshes and in the party showing, and it's pretty cool because you most people wouldn't think to make"
2162.08,2169.92," an FPS level in such a, like, absolutely flat environment. Usually you want elevation changes in"
2170.0,2174.64, stuff. And here you have a horizon that's almost perfectly flat. It's only broken up by whatever
2174.64,2179.44," trees and tall grass, you know, a sedgent stuff you see. And as you're going through that, this is"
2179.44,2184.8," interesting because you don't know what's going to come out of the bushes, like immediately in front"
2184.8,2190.32," of you, some mutated board could rush out. You might walk into what they, what are they, they're just"
2190.32,2196.96," anomalies, right? Some sort of, you know, supernatural or, or extra scientific anomaly, where you locate"
2197.04,2201.52," these with various, you know, meters and stuff that you have in the game now. And you, you upgrade them."
2201.52,2205.28," You might have, like, a budget thing that just kind of, like, beeps as you're in the area, you might"
2205.28,2210.56," have, like, the equivalent of a, the trick-out GPS that tells you almost precisely where it's at,"
2210.56,2215.28," what its magnitude is, what, what the nature of the anomaly is, or you just kind of, like, go around"
2215.28,2220.48," raw dog with a handful of, like, bolts and screws and thrown around. And when they blow up or get sucked"
2220.48,2224.8," up into a vortex, you know, this is a dangerous area. So as you was going through here, I was like,"
2224.8,2229.04, this is interesting. How is this going to work? It was immediately cool because I had never seen
2230.4,2234.6400000000003," this sort of environment in a game. But then when he climbs up into this tower, it's like,"
2234.6400000000003,2239.52," oh, it's really like a sort of like a, a hedger-o-made maze or something, you know, like a"
2239.52,2244.48," labrant in the castle where it's not until you, you have some ability to get up above where you're"
2244.48,2247.76," at, and you look at the lay in the land, and it's just massive, and you're able to say, ah,"
2248.6400000000003,2252.8," this is, this is basically the path I need to take, and you have to mentally map what you're"
2252.88,2256.48," going to do to get out of this place. There's like a little bit of a board crossing,"
2256.48,2262.7200000000003," some maybe it's, you know, like a quick sand type area here, something like, and then, and then"
2262.7200000000003,2268.4," climb back down and say, now I got to translate that view I just had into my experience of going"
2268.4,2272.8," through the stick grass with this, like really moving her eyes and stuff. That's pretty cool."
2272.8,2277.52," So, wait, I mean, is there any indication when you're playing that, like, you were the player,"
2277.52,2281.76," should really look down there, because I think most people would be inclined upon climbing a tower"
2281.84,2286.8," and saying, if you would not to like take it at the, take it at the value of, like, a map,"
